imdbId,plot,cast,crew,director,countries,languages,production_companies
94721,"Adam and Barbara are a normal couple...who happen to be dead. They have given their precious time to decorate their house and make it their own, but unfortunately a family is moving in, and not quietly. Adam and Barbara try to scare them out, but end up becoming the main attraction to the money making family. They call upon Beetlejuice to help, but Beetlejuice has more in mind than just helping.","['Alec Baldwin', 'Geena Davis', 'Annie McEnroe', 'Maurice Page', 'Hugo Stanger']","['Chrissy Bocchino', 'Kevin Carlson', 'Luba Dmytryk', 'Pablo Ferro', 'Ira Friedlander']",['Tim Burton'],['United States'],['English'],['The Geffen Company']
40746,"Brandon and Philip are two young men who share a New York City apartment. They consider themselves intellectually superior to their friend David Kentley, and as a consequence, decide to murder him. Together they strangle David with a rope and placing the body in an old chest, they proceed to hold a small party. The guests include David's father, his fiancée Janet, and their old schoolteacher Rupert, from whom they mistakenly took their ideas. As Brandon becomes increasingly more daring, Rupert begins to suspect.","['Dick Hogan', 'John Dall', 'Farley Granger', 'Edith Evanson', 'Douglas Dick']","['Robert Brower', 'The Three Suns', 'Dinsmore Alter']",['Alfred Hitchcock'],['United States'],['English'],"['Warner Bros.', 'Transatlantic Pictures']"
74512,"The medium Madam Blanche Tyler is engaged by the elderly millionaire Julia Rainbird who believes she is a spiritualist. After a séance, Blanche discovers that Julia is tormented by her past, when she forced her sister and unmarried mother Harriet to deliver her baby for adoption to avoid a family scandal. Julia promises the small fortune of ten thousand-dollars to Blanche if she finds her nephew and heir of her fortune using her physic powers. Blanche and her boyfriend George Lumley, who is an unemployed actor working as cab driver, investigate the whereabouts of Julia's nephew. Meanwhile, the greedy jeweler Arthur Adamson kidnaps wealthy people with his girlfriend Fran and requests diamonds for the ransom. When George's investigations conclude that Arthur Adamson might be the heir of Julia Rainbird, the reckless Blanche gets in trouble with the kidnappers.","['Karen Black', 'Bruce Dern', 'Barbara Harris', 'William Devane', 'Ed Lauter']","['Tom Greene', 'Peggy Robertson', 'Sue Gauthier', 'Chuck House', 'Charles Lippincott']",['Alfred Hitchcock'],['United States'],['English'],"['Universal Pictures', 'Alfred J. Hitchcock Productions']"
68611,"London is terrorized by a vicious sex killer known as The Necktie Murderer. Following the brutal slaying of his ex-wife, down-on-his-luck Richard Blaney is suspected by the police of being the killer. He goes on the run, determined to prove his innocence.","['Jon Finch', 'Barry Foster', 'Barbara Leigh-Hunt', 'Anna Massey', 'Alec McCowen']","['Beryl Harvey', 'Peggy Robertson', 'Ron Allday', 'Dan Slater']",['Alfred Hitchcock'],['United Kingdom'],['English'],['Alfred J. Hitchcock Productions']
65112,"A high ranking Russian official defects to the U.S., where he is interviewed by U.S. Agent Michael Nordstrom. The defector reveals that a French spy ring codenamed ""Topaz"" has been passing N.A.T.O. secrets to the Russians. Michael calls in his French friend and counterpart Andre Devereaux to expose the spies.","['Frederick Stafford', 'Dany Robin', 'John Vernon', 'Karin Dor', 'Michel Piccoli']","['Odette Ferry', 'J.P. Mathieu', 'Hal Mohr', 'Peggy Robertson', 'Orin Borsten']",['Alfred Hitchcock'],['United States'],"['English', 'Spanish', 'French', 'Russian']",['Alfred J. Hitchcock Productions']
61107,"Professor Michael Armstrong (Paul Newman) is heading to Copenhagen, Denmark to attend a physics conference accompanied by his assistant and fiancée Sarah Sherman (Dame Julie Andrews). Once arrived however, Michael informs her that he may be staying for awhile and she should return home. She follows him and realizes he's actually heading to East Germany, behind the Iron Curtain. She follows him there and is shocked when he announces that he's defecting to the East after the U.S. government cancelled his research project. In fact, Michael is there to obtain information from a renowned East German scientist. Once the information is obtained, he and Sarah now have to make their way back to the West.","['Paul Newman', 'Julie Andrews', 'Lila Kedrova', 'Hansjörg Felmy', 'Tamara Toumanova']","['Peggy Robertson', 'Eva Sampson']",['Alfred Hitchcock'],['United States'],"['English', 'German', 'Swedish', 'Norwegian', 'Danish', 'French']",['Alfred J. Hitchcock Productions']
58329,"Marnie Edgar is a habitual liar and a thief who gets jobs as a secretary and after a few months robs the firms in question, usually of several thousand dollars. When she gets a job at Rutland's, she also catches the eye of the handsome owner, Mark Rutland. He prevents her from stealing and running off, as is her usual pattern, but also forces her to marry him. Their honeymoon is a disaster and she cannot stand to have a man touch her, and on their return home, Mark has a private detective look into her past. When he has the details of what happened in her childhood to make her what she is, he arranges a confrontation with her mother realizing that reliving the terrible events that occurred in her childhood and bringing out those repressed memories is the only way to save her.","['Tippi Hedren', 'Martin Gabel', 'Sean Connery', 'Louise Latham', 'Diane Baker']",['Peggy Robertson'],['Alfred Hitchcock'],['United States'],['English'],['Alfred J. Hitchcock Productions']
51207,"Christopher Emanuel Balestrero, ""Manny"" to his friends, is a string bassist, a devoted husband and father, and a practicing Catholic. His eighty-five dollar a week gig playing in the jazz combo at the Stork Club is barely enough to make ends meet. The Balestreros' lives will become a little more difficult with the major dental bills his wife Rose will be incurring. As such, Manny decides to see if he can borrow off of Rose's life insurance policy. But when he enters the insurance office, he is identified by some of the clerks as the man that held up the office twice a few months earlier. Manny cooperates with the police, as he has nothing to hide. Manny learns that he is a suspect in not only those hold-ups, but a series of other hold-ups in the same Jackson Heights neighborhood in New York City where they live. The more that Manny cooperates, the more guilty he appears to the police. With the help of Frank O'Connor, the attorney that they hire, they try to prove Manny's innocence. Regardless of if they manage to prove Manny's innocence or find the actual hold-up man, the situation may cause irreparable damage on the Balestreros.","['Henry Fonda', 'Vera Miles', 'Anthony Quayle', 'Harold J. Stone', 'Charles Cooper']","['George Groves', ""Frank D. O'Connor""]",['Alfred Hitchcock'],['United States'],"['English', 'Italian', 'Spanish']",['Warner Bros.']
49470,"While attending a medical conference in Paris, American physician Dr. Ben McKenna, his wife, retired musical theater actress and singer Jo McKenna née Conway, and their adolescent son Hank McKenna decide to take a side trip to among other places Marrekesh, French Morocco. With a knife plunged into his back, Frenchman Louis Bernard, who the family met earlier in their bus ride into Marrakesh and who is now masquerading as an Arab, approaches Ben, cryptically whispering into Ben's ears that there will be an attempted assassination in London of a statesman, this news whispered just before Bernard dies. Ben is reluctant to provide any information of this news to the authorities because concurrently Hank is kidnapped by British couple, Edward and Lucy Drayton, who also befriended the McKennas in Marrakesh and who probably have taken Hank out of the country back to England. Whoever the unknown people the Draytons are working for have threatened to kill Hank if Ben divulges any information told to him by Bernard. With what little information they have on hand, Ben and Jo head to London to try and thwart the assassination attempt and more importantly find an alive and safe Hank. Scotland Yard is aware of some pieces to the puzzle, including the fact that Bernard was a French secret service agent and that there will be an assassination attempt on someone. They and the McKennas will have to work together as they hit a diplomatic roadblock, one that may be overcome with a special Jo Conway song.","['James Stewart', 'Doris Day', 'Brenda de Banzie', 'Bernard Miles', 'Ralph Truman']","['Abdelhaq Chraibi', 'Connie Willis', 'Catherine Barton', 'Art Sarno']",['Alfred Hitchcock'],['United States'],"['English', 'Arabic', 'French']","['Paramount Pictures', 'Filwite Productions']"
48750,"There is a dead well-dressed man in a meadow clearing in the hills above a small Vermont town. Captain Albert Wiles, who stumbles across the body and finds by the man's identification that his name is Harry Worp, believes he accidentally shot Harry dead while he was hunting rabbits. Captain Wiles wants to hide the body as he feels it is an easier way to deal with the situation than tell the authorities. While Captain Wiles is in the adjacent forest, he sees other people stumble across Harry, most of whom don't seem to know him or care or notice that he's dead. One person who does see Captain Wiles there is spinster Ivy Gravely, who vows to keep the Captain's secret about Harry. Captain Wiles also secretly sees a young single mother, Jennifer Rogers, who is the one person who does seem to know Harry and seems happy that he's dead. Later, another person who stumbles across both Harry and Captain Wiles is struggling artist Sam Marlowe, to whom Captain Wiles tells the entire story of what he has seen thus far. Over the course of the day, several revelations come to light that question if Captain Wiles actually killed Harry. Sam, Mrs. Rogers, Captain Wiles and Miss Gravely's individual and collective actions in the matter of Harry take into account friendship, self-preservation, the path of least resistance, love and a lot of realizations about what their past actions will mean. Their work may all be for naught if Deputy Sheriff Calvin Wiggs, the closest thing to law enforcement in their town, finds out about Harry.","['Edmund Gwenn', 'John Forsythe', 'Mildred Natwick', 'Mildred Dunnock', 'Jerry Mathers']","['P. Guare', 'William Lord', 'Saul Steinberg']",['Alfred Hitchcock'],['United States'],['English'],['Alfred J. Hitchcock Productions']
45897,"Otto Keller and his wife Alma work as caretaker and housekeeper at a Catholic church in Québec City, Québec. While robbing a house where he sometimes works as a gardener, Otto is caught and kills the owner. Racked with guilt, he heads back to the church where Father Michael Logan is working late. Otto confesses his crime, but when the police begin to suspect Father Logan, he cannot reveal what he has been told in the confession.","['Montgomery Clift', 'Anne Baxter', 'Karl Malden', 'Brian Aherne', 'O.E. Hasse']","['Barbara Keon', 'Paul LaCouline', 'Marvin Margulies', 'Victor Peers', 'Oliver Tangvay']",['Alfred Hitchcock'],['United States'],"['English', 'French', 'Italian', 'German']",['Warner Bros.']
44079,"Bruno Antony thinks he has the perfect plot to rid himself of his hated father, and when he meets tennis player Guy Haines on a train he thinks he's found the partner he needs to pull it off. His plan is relatively simple: Two strangers each agree to kill someone the other person wants gone. For example, Guy could kill his father and he could get rid of Guy's wife Miriam, freeing him to marry Anne Morton, the beautiful daughter of a U.S. Senator. Guy dismisses it all out of hand, but Bruno goes ahead with his half of the ""bargain"" and disposes of Miriam. When Guy balks, Bruno makes it clear that he will plant evidence to implicate Guy in her murder if he doesn't get rid of his father. Guy had also made some unfortunate statements about Miriam after she had refused to divorce him. It all leads the police to believe Guy is responsible for the murder, forcing him to deal with Bruno's mad ravings.","['Farley Granger', 'Ruth Roman', 'Robert Walker', 'Leo G. Carroll', 'Patricia Hitchcock']","['Barbara Keon', 'Jack Cushingham']",['Alfred Hitchcock'],['United States'],"['English', 'French']",['Warner Bros.']
42994,"Jonathan Cooper is wanted by the police who suspect him of killing his lover's husband. His besotted friend Eve Gill offers to hide him and Jonathan explains to her that his real lover, actress Charlotte Inwood is the real murderer. Eve decides to investigate for herself, but when she meets the detective in charge of the case, she truly falls in love.","['Jane Wyman', 'Marlene Dietrich', 'Michael Wilding', 'Richard Todd', 'Alastair Sim']","['Leslie Frewin', 'Hugh Samson']",['Alfred Hitchcock'],['United Kingdom'],['English'],['Warner Bros.']
120577,"An anthology film retelling the story of the famous Studio 54, a hot disco hangout for the social elite of New York. The movie follows several characters at once, some of whom are in desperate straits and on the verge of crashing.","['Ryan Phillippe', 'Salma Hayek', 'Neve Campbell', 'Mike Myers', 'Sela Ward']","['Sophie Addie', 'Alexis Arnold', 'Oriana J. Bielawski', 'Kimberley Bradley', 'Emma Chasin']",['Mark Christopher'],['United States'],['English'],"['Dollface', 'FilmColony', 'Miramax', 'Redeemable Features']"
119346,"A newlywed develops a strange lump on his neck that gives him the ability to transform people or objects at will. His wife is very upset. Meanwhile, the CEO of Smilecorp learns of this man and his ability and sees a way to achieve world domination if only the man can be taken alive.","['Charis Michelsen', 'Tom Larson', 'Richard Spore', 'Chris Cooke', 'Ruth Ray']",[''],['Bill Plympton'],['United States'],['English'],['Italtoons Corporation']
123324,"In the mid-1980s, three women (each with an attorney) arrive at the office of New York entertainment manager Morris Levy. One is a singer from Los Angeles, formerly of the Platters; one is a petty thief from Philadelphia; one teaches high school in a small Georgia town. Each claims to be the widow of long-dead doo-wop singer-songwriter Frankie Lyman, and each wants years of royalties due to his estate, money Levy has never shared. During an ensuing civil trial, flashbacks tell the story of each one's life with Lyman, a boyish, high-pitched, dynamic performer, lost to heroin. Slowly, the three widows come together and establish their own bond.","['Halle Berry', 'Vivica A. Fox', 'Lela Rochon', 'Larenz Tate', 'Paul Mazursky']","['Jackie Bazan', 'James Borrego', 'Royce T. Brown', 'Cassandra Butcher', 'Russell Clark']",['Gregory Nava'],['United States'],['English'],"['Rhino Films', 'Warner Bros.']"
96446,"A baby girl is discovered in a river by Ranon and Mims, the children of Willow Ufgood, a dwarf farmer and magician and the baby girl is taken into the care of Willow's family. But when a terrifying dog-like creature attacks Willow's village, whilst tracking down the baby. Willow consults the village council and the wizard The High Aldwin. The High Aldwin gives Willow a task and Willow leaves the village and embarks on the task to give the baby girl to a responsible person. But Willow soon learns the baby is Elora Danan, the baby girl destined to bring about the downfall of the evil sorceress Queen Bavmorda. Joined by his allies: swordsman Madmartigan, sorceress Fin Raziel and the Brownies Franjean and Rool, Willow takes it upon himself to protect Elora from Queen Bavmorda, who intends to kill Elora and prevent Elora from fulfilling her destiny. And Willow and his allies are pursued by Queen Bavmorda's daughter Sorsha and the evil commander of Queen Bavmorda's army General Kael, whom are searching for Elora and bring her back to Queen Bavmorda's castle, where Queen Bavmorda bids to kill Elora in a ritual and prevent the prophecy of her downfall.","['Val Kilmer', 'Joanne Whalley', 'Warwick Davis', 'Jean Marsh', 'Patricia Hayes']","['John Algar', 'David Balfour', 'David Berglas', 'Ian Bryce', 'Bundy Chanock']",['Ron Howard'],['United States'],['English'],"['Metro-Goldwyn-Mayer (MGM)', 'Lucasfilm', 'Imagine Entertainment']"
94226,"After building an empire with bootleg alcohol, legendary crime boss Al Capone rules Chicago with an iron fist. Though Prohibition Agent Eliot Ness attempts to take Capone down, even his best efforts fail due to widespread corruption within the Windy City's police force. Recruiting an elite group of lawmen who won't be swayed by bribes or fear, including Irish-American cop Jimmy Malone, Ness renews his determination to bring Capone to justice.","['Kevin Costner', 'Sean Connery', 'Charles Martin Smith', 'Andy Garcia', 'Robert De Niro']","['Cyd Adams', 'Elinor Bardach', 'Matthew Benjamin', 'Robert F. Byrnes', 'Maria Teresa Corridoni']",['Brian De Palma'],['United States'],['English'],['Paramount Pictures']
120654,"Mitch and Sam have to come up with $50,000 and fast! The only problem is neither one can hold down a job. Mitch finds a way to money by exploiting the only talents the two have, by opening a ""Revenge For Hire"" business.","['Norm MacDonald', 'Jack Warden', 'Artie Lange', 'Traylor Howard', 'Don Rickles']","['Tina Barr', 'Amy Brown', 'Mark Bukator', 'Jessica Chavez', 'Jane Conway']",['Bob Saget'],"['Canada', 'United States']",['English'],"['Metro-Goldwyn-Mayer (MGM)', 'Robert Simonds Productions', 'Brillstein-Grey Entertainment']"
120724,"A Hong Kong fashion designer (Jean Claude Van Damme, if you can believe that billing) who had previously been involved in knock offs of major label merchandise, such as ""Pumma"" running shoes, attempts to go straight with the help of his new partner (Rob Schneider), who is secretly an undercover CIA agent involved in an investigation of the black market. Their main product, jeans, is involved in the knock offs, which brings a representative (Lela Rochon) of the American company to investigate. Paul Sorvino also appears as the head of the CIA operation in Hong Kong. However, just as Schneider is not as he initially seems, everyone in the film switches roles by film's end.","['Jean-Claude Van Damme', 'Rob Schneider', 'Lela Rochon', 'Paul Sorvino', 'Carman Lee']","['Jerome Butler', 'Don Carmody', 'Glen Chin', 'Daniel Frisch', 'Sai Hung Fung']",['Hark Tsui'],"['Aruba', 'Hong Kong', 'United States']","['English', 'Cantonese']","['Knock Films A.V.V.', 'MDP Worldwide', 'Film Workshop', ""Val D'Oro""]"
119125,"In 1838, lovely governess Elisabeth agrees to bear a child of anonymous English landowner, and he will in return pay her father's debt. At birth she, as agreed, gives up the child. Seven years later she is hired as governess to a girl on a remote Sussex estate. The father of the girl, Charles Godwin, turns out to be that anonymous landowner. So Elisabeth has to be her own daughter's governess, and she can't reveal the secret of her tie with little Louisa.","['Sophie Marceau', 'Stephen Dillane', 'Dominique Belcourt', 'Kevin Anderson', 'Lia Williams']","['Alex Boden', 'Marilyn Clarke', 'Jane Gibson', 'Christopher Gunning', 'Nicki Gunning']",['William Nicholson'],"['United Kingdom', 'United States']","['English', 'French']","['Carnival Film & Television', 'Hollywood Pictures', 'Wind Dancer Productions']"
39694,"Following a short investigation, the London Police charge Maddalena Paradine with the poisoning murder of her older, blind husband, retired Colonel Richard Paradine, who was dependent on her and others to manage in his life due to his physical disability. She is up front about being a woman with a past, she only becoming wealthy and thus glamorous because of the marriage. Her personal solicitor Sir Simon Flaquer refers the case to his colleague Tony Keane. In spending time with Mrs. Paradise in prison, Tony is immediately attracted to her, that attraction which morphs into obsession. As such, Tony does whatever he can to clear her of the charges, either in mounting a defense of suicide, assisted or not, or that someone else killed him, the most likely candidate being the Colonel's trusted valet, Andre Latour, with who Tony initially believes Mrs. Paradise was having an affair. In the process, Tony may be blinded to the evidence as it presents itself. Who can see what is going on is Tony's wife Gay Keane, who not only believes their marriage has been a perfect one up to this point, but that he truly does believe his obsession with Mrs. Paradine being love, which Gay herself does not believe it to be. Gay can only stand by and hope for a specific verdict in the case so that Tony can return to her wholeheartedly without the specter of Mrs. Paradine hanging over their marriage.","['Gregory Peck', 'Ann Todd', 'Charles Laughton', 'Charles Coburn', 'Ethel Barrymore']","['Lydia Schiller', 'David O. Selznick', 'Alfred W. Burt', 'Elsie Foulstone', 'Paul MacNamara']",['Alfred Hitchcock'],['United States'],['English'],"['Selznick International Pictures', 'Vanguard Films']"
37017,"In the Atlantic during WW II, a ship and a German U-boat are involved in battle, and both are sunk. The survivors - from a variety of backgrounds -gather in one of the life boats. Trouble begins when they pull a man out of the water who turns out to be from the U-boa","['Tallulah Bankhead', 'William Bendix', 'Walter Slezak', 'Mary Anderson', 'John Hodiak']","['Thomas Fitzsimmons', 'Alfred Hitchcock', 'Queenie Leonard', 'Eugen Sharin']",['Alfred Hitchcock'],['United States'],"['English', 'German', 'French']",['Twentieth Century Fox']
36342,"Charlotte ""Charlie"" Newton is bored with her quiet life at home with her parents and younger sister. She wishes something exciting would happen and knows exactly what they need: a visit from her sophisticated, much-traveled Uncle Charlie Oakley, her mother's younger brother. Imagine her delight when, out of the blue, they receive a telegram from Uncle Charlie announcing that he is coming to visit them for awhile. Charlie Oakley creates quite a stir and charms the ladies' club, as well as the bank President where his brother-in-law works. Young Charlie begins to notice odd behavior on his part, such as cutting out a story in the local paper about a man who marries and then murders rich widows. When two strangers appear asking questions about him, she begins to imagine the worst about her beloved Uncle Charlie.","['Teresa Wright', 'Joseph Cotten', 'Macdonald Carey', 'Henry Travers', 'Patricia Collinge']",[''],['Alfred Hitchcock'],['United States'],['English'],['Universal Pictures']
35279,"Los Angeles aircraft worker Barry Kane evades arrest after he is unjustly accused of sabotage. Following leads, he travels across the country to New York City trying to clear his name by exposing a gang of fascist-supporting saboteurs led by apparently respectable Charles Tobin. Along the way, he involves Pat Martin, eventually preventing another major act of sabotage. They finally catch up with Frank Fry, the man who actually committed the act of sabotage at the aircraft factory.","['Priscilla Lane', 'Robert Cummings', 'Otto Kruger', 'Alan Baxter', 'Clem Bevans']",['David O. Selznick'],['Alfred Hitchcock'],['United States'],['English'],"['Frank Lloyd Productions', 'Universal Pictures']"
33922,"New York sophisticates David Smith and Ann Smith née Krausheimer have been lovingly and passionately married for three years, or so they believed. They are told individually that due to a technicality - an unresolved municipal and state jurisdictional issue at the time of their supposed marriage - their wedding was not legal, and as such they are not really married. Despite David saying earlier in the day that if he had to do his life all over again that he would not have married her (even though he loves her), it is Ann that decides not to marry David this second time around due to an action, or in reality inaction, by David in reaction to the news of their marriage being invalid. While Ann goes about her life as a supposedly single woman (which includes calling herself Ann Krausheimer), David does whatever he can to win Ann back. But winning Ann's hand may be difficult as part of Ann's new life is dating other men. One of those other men and the most serious is David's best friend and business partner, Jefferson Custer. Ann and Jeff's relationship quickly gets to the point where Jeff introduces her to his visiting parents, with whom Ann and Jeff are going on a skiing vacation to Lake Placid. David hopes to exploit that vacation in order to win Ann back.","['Carole Lombard', 'Robert Montgomery', 'Gene Raymond', 'Jack Carson', 'Philip Merivale']","['Tommy Garland', 'Betty Hall', 'Bob Marlow']",['Alfred Hitchcock'],['United States'],['English'],['RKO Radio Pictures']
34248,"Johnnie Aysgarth is a handsome gambler who seems to live by borrowing money from friends. He meets shy Lina McLaidlaw on a train while trying to travel in a first-class car with a third-class ticket. He begins to court Lina, and before long, they are married. It is only after the honeymoon that she discovers his true character, and she starts to become suspicious when Johnnie's friend and business partner, Beaky, is mysteriously killed.","['Cary Grant', 'Joan Fontaine', 'Cedric Hardwicke', 'Nigel Bruce', 'May Whitty']","['S. Barret McCormick', 'Mal Merrihugh', 'N. Russell']",['Alfred Hitchcock'],['United States'],['English'],['RKO Radio Pictures']
