imdbId,plot,cast,crew,director,countries,languages,production_companies
101969,"The intertwined stories of a group of Angelenos are told, the stories largely a lament of Los Angeles being a city not their own, if it ever was. The stories are also split largely by the Black/white race divide. Centered on the Black side is Simon, a widowed tow-truck driver with a deaf daughter away at college. Simon has an understanding of the gang violence that surrounds his neighborhood, especially as his teenage nephew Otis--Simon's single-mother sister Deborah's eldest offspring--is part of a gang, believing that he must in order to survive in the short-term, regardless of the consequences. Centered on the white side is Mack, an immigration lawyer who acts largely on impulse only thinking of the implications of his actions after the fact, if at all. He also has an unconscious need to be liked. An example of this is something he does for Jane, a friend of his paralegal Dee, only seconds after he first meets her. Dee understands his actions but doesn't like them. Mack's wife Claire is at a crossroads in life; their 15-year-old son Roberto needs his parents less and less. What Claire sees as a sign to renew her life is only the most visible issue in a long line of issues that demonstrate the unspoken problems in their marriage. The one person whose story is told that is somewhat outside of this lament is Mack's best friend Davis, a successful producer whose movies, as per his want, must have the ""money shot"" of the proverbial and literal head exploding in whatever violent action.","['Danny Glover', 'Kevin Kline', 'Steve Martin', 'Mary McDonnell', 'Mary-Louise Parker']","['Malek Abdul-Mansour', 'Todd J. Adelman', 'Ruth Auerbach', 'Jeffrey Bacon', 'Paul Bode']",['Lawrence Kasdan'],['United States'],"['English', 'Spanish']",['Twentieth Century Fox']
99697,"In a dark and nasty textile factory close to a cemetery and infested of rats, many workers are missing. When the corrupt manager Warwick is forced by a sanitary agent to hire the exterminator Tucker Cleveland, he asks Tucker to use less poison than necessary to reduce the costs. Meanwhile, the drifter John Hall applies for a job and accepts the position of operator of a textile machine in the graveyard shift. What they do not know is that there is a huge creature is in the underground of the mill threatening the workers.","['David Andrews', 'Kelly Wolf', 'Stephen Macht', 'Andrew Divoff', 'Vic Polizos']","['David Allsberry', 'Earl Boyd', 'Bundy Chanock', 'Caleb Clark', 'Letty Gray']",['Ralph S. Singleton'],"['United States', 'Japan']",['English'],"['Paramount Pictures', 'Sugar Entertainment Ltd.', 'JVC Entertainment Networks', 'Graveyard Productions']"
86066,"It is 1965, and Tulsa, Oklahoma is divided in two along social lines. The youths of each side form gangs in line with these two camps: the working class Greasers and the wealthier South Side gang, the Socs. The two sides use any opportunity to niggle each other and whenever they meet, there is friction. Then one night, a gang of Socs attack two Greasers with a knife. This sets off a chain of events.","['C. Thomas Howell', 'Matt Dillon', 'Ralph Macchio', 'Patrick Swayze', 'Rob Lowe']","['Mitchell Amundsen', 'Jeff Block', 'Francis Ford Coppola', 'Roman Coppola', 'Loolee DeLeon']",['Francis Ford Coppola'],"['United States', 'France']",['English'],"['Zoetrope Studios', 'AMLF']"
87469,"Indiana Jones teams up with a nightclub singer named Wilhelmina ""Willie"" Scott and a twelve-year-old Chinese boy named Short Round. They end up in a small distressed village in India, where the people believe that evil spirits have taken all their children away after a sacred precious stone was stolen. They also discover the great mysterious terror surrounding a booby-trapped temple known as the Temple of Doom. Thuggee is beginning to attempt to rise once more, believing that with the power of all five Sankara stones they can rule the world. It's all up to Indiana to put an end to the Thuggee campaign, rescue the lost children, win the girl and conquer the Temple of Doom.","['Harrison Ford', 'Kate Capshaw', 'Ke Huy Quan', 'Amrish Puri', 'Roshan Seth']","['Charles Argirov', 'Kate Barker', 'Jane Bay', 'Annie Berardini', 'Arthur Carroll']",['Steven Spielberg'],['United States'],"['English', 'Sinhala', 'Hindi']","['Paramount Pictures', 'Lucasfilm']"
77869,"A young Hobbit known as Frodo has been thrown on an amazing adventure, when he is appointed the job of destroying the One Ring, which was created by the Dark Lord Sauron. He is assigned with three warriors including Gandelf, Aragorn, and Boromir. But it's not going to be an easy journey for the Fellowship of the Ring, on the ultimate quest to rid the Middle-earth of all evil.","['Christopher Guard', 'William Squire', 'Michael Scholes', 'John Hurt', 'Simon Chandler']","['Mark Bakshi', 'Leah Bernstein', 'Lynne Betner', 'Martin Cohen', 'Christine Danzo']",['Ralph Bakshi'],"['United States', 'United Kingdom', 'Spain']","['English', 'Sindarin']","['Fantasy Films', 'Bakshi Productions', 'Saul Zaentz Film Productions']"
87803,"Longing for freedom, the lowly bureaucrat of the Ministry of Truth, Winston Smith, summons up the courage to write down his unspoken desires in his little secret diary. Serving silently at the pleasure of the grim, autocratic hyper-state of Oceania, Smith knows that the English Socialist Party's supreme leader, the omnipotent Big Brother, watches his every move, condemning the already terrified people into a life of slavery. Under those dire circumstances--as the totalitarian government's suffocating stranglehold tightens more and more--Julia, another equally seditious party member, crosses paths with Winston, and a dangerous clandestine affair begins. Now, there's no turning back, and, sooner or later, the illicit couple will have to pay for its hideous crimes against the dictatorial state. What makes a good citizen?","['John Hurt', 'Richard Burton', 'Suzanna Hamilton', 'Cyril Cusack', 'Gregor Fisher']","['Beryl Brown', 'Lynne Buckley', 'Simon Cellan Jones', 'Paul Collard', 'David Corke']",['Michael Radford'],['United Kingdom'],['English'],"['Virgin', 'Umbrella-Rosenblum Films Production', 'Virgin Benelux', 'Virgin Schallplatten']"
85407,"Johnny Smith wakes from a coma due to a car accident, only to find he has lost five years of his life, and yet gained psychic powers. Foreseeing the future appears to be a 'gift' at first, but ends up causing problems...","['Christopher Walken', 'Brooke Adams', 'Tom Skerritt', 'Herbert Lom', 'Anthony Zerbe']","['Andreas Blackwell', 'Randi Chernov', 'Jesse Cohoon', 'Richard Cosgrave', 'Dino De Laurentiis']",['David Cronenberg'],"['United States', 'Canada']","['English', 'Polish', 'Russian']","['Dino De Laurentiis Company', 'Lorimar Film Entertainment']"
91499,"When Earth passes through the tail of Rea-M rogue comet, the machines come to life and start to kill mankind. A group of survivors is under siege from fierce trucks at the Dixie Boy truck stop gas station and they have to fight to survive.","['Emilio Estevez', 'Pat Hingle', 'Laura Harrington', 'Yeardley Smith', 'John Short']","['Roberto Croci', 'Cindy J. Gray', 'Chip Hackler', 'Angela Heald', 'Michael Klastorin']",['Stephen King'],['United States'],['English'],['De Laurentiis Entertainment Group']
107665,"Castle Rock, New England, is a nice place to live and grow and Sheriff Alan Pangborn moves from the big city to the town expecting a quiet life. When Leland Gaunt opens the store Needful Things, he seems to have the object of desire for each dweller. He charges small amounts to the things but requests a practical joke for each of them against another inhabitant. Soon hell breaks loose in town with deaths, violence and riot and Sheriff Pangborn discovers that Leland Gaunt is the devil himself. Further, Gaunt is manipulating the population like puppets exploring the weakness and greed of each person.","['Max von Sydow', 'Ed Harris', 'Bonnie Bedelia', 'Amanda Plummer', 'J.T. Walsh']","['Tony Angellotti', 'Matt Bilski', 'Heather Boyd', 'Alison Cannon', 'Marian Ciolfitto']",['Fraser C. Heston'],"['United States', 'Canada']",['English'],"['Castle Rock Entertainment', 'New Line Cinema']"
85382,"Donna Trenton is a frustrated suburban housewife whose life is in turmoil after her husband learns about her having an affair. Brett Camber is a young boy whose only companion is a Saint-Bernard named ""Cujo"", who in turn is bitten by a rabid bat. Whilst Vic, Donna's husband is away on business, and thinking over his marital troubles, Donna and her 5-year-old son Tad take her Pinto to Brett Cambers' dad's car shop... the car fails, and ""Cujo"" is very, very sick...","['Dee Wallace', 'Danny Pintauro', 'Daniel Hugh Kelly', 'Christopher Stone', 'Ed Lauter']","['Pat Borri', 'Celia Cadena', 'Glen Garner', 'Desmond Giffen', 'Mamie Goldstein']",['Lewis Teague'],['United States'],['English'],"['Sunn Classic Pictures', 'TAFT Entertainment Pictures']"
87050,"A boy preacher named Isaac goes to Gatlin, Nebraska and gets all the children to murder every adult in town. A young couple on a road trip stop in Gatlin to report a murder and seek help, but the town seems deserted. They are soon trapped in Gatlin with little chance of getting out alive.","['Peter Horton', 'Linda Hamilton', 'R.G. Armstrong', 'John Franklin', 'Courtney Gains']","['Jill Basey', 'Michelle Bourque', 'Craig Caton', 'Jeffrey Chernov', 'Joel Conkey']",['Fritz Kiersch'],['United States'],['English'],"['Hal Roach Studios', 'New World Pictures', 'Angeles Entertainment Group', 'Inverness Productions', 'Gatlin Productions', 'Cinema Group Ventures', 'Cinema Group', 'Planet Productions']"
96787,"Charlie B. Barkin (Burt Reynolds), a rascally German Shepherd with a shady past, breaks out of a New Orleans dog pound with the help of his faithful friend Itchy (Dom De Luise), a nervously hyperactive dachshund. He then makes tracks to reunite with his gambling casino partner Carface Malone (Vic Tayback), a shifty pitbull who has planned a dastardly, and potentially deadly, double cross. Suddenly, Charlie finds himself at the Pearly Gates, face to face with the Heavenly Whippet (Melba Moore). Charlie weasels his way back to earth and reunites with Itchy. He plots his revenge against Carface and, along the way, acquires help from a little girl named Anne-Marie (who can talk to animals). After a series of fiendish schemes, close scrapes and unexpected adventures, both Charlie and Anne Marie find their lives at stake. Only one can be saved and the outcome is in Charlie's paws...","['Loni Anderson', 'Judith Barsi', 'Earleen Carey', 'Candy Devine', 'Dom DeLuise']","['Eithne Agnew', 'Owen Binchy', 'Helene Blitz', 'Karl Bredendieck', 'Fiona Byrne-Morris']",['Don Bluth'],"['Ireland', 'United Kingdom', 'United States']",['English'],"['Goldcrest Films International', 'Don Bluth Productions', 'Sullivan Bluth Studios']"
101272,The Addams Family steps out of Charles Addams' cartoons. They live with all of the trappings of the macabre (including a detached hand for a servant) and are quite wealthy. Added to this mix is a crooked accountant and his loan shark and a plot to slip the shark's son into the family as their long-lost Uncle Fester. Can the false Fester find his way into the vault before he is discovered?,"['Anjelica Huston', 'Raul Julia', 'Christopher Lloyd', 'Dan Hedaya', 'Elizabeth Wilson']","['Joe M. Aguilar', 'Peter Anastos', 'Vanessa G. Bardliving', 'B.H. Barry', 'Douglas R. Boyle']",['Barry Sonnenfeld'],['United States'],"['English', 'Italian', 'French']","['Orion Pictures', 'Paramount Pictures', 'Scott Rudin Productions']"
120631,"Andy Tennant directed this Cinderella variant. The Brothers Grimm arrive at the home of a wealthy Grande Dame (Jeanne Moreau) who speaks of the many legends surrounding the fable of the cinder girl before telling the ""true"" story of her ancestor. In flashback, the story then focuses on eight-year-old Danielle, daughter of a wealthy widower, a 16th-century landowner. After returning to France with his new wife Rodmilla (Anjelica Huston) and her two daughters, he dies of a heart attack. Ten years later, Danielle (Drew Barrymore) is now treated as a servant by the trio. Fortunately, she has an encounter with Prince Henry (Dougray Scott), who is fleeing an arranged marriage. Later, when Danielle poses as a Lady, the Prince takes an interest in her. Inventor-artist Leonardo Da Vinci (Patrick Godfrey), accepting the French court's patronage, offers advice to Prince Henry on matters of the heart.","['Drew Barrymore', 'Anjelica Huston', 'Dougray Scott', 'Patrick Godfrey', 'Megan Dodds']","['Sophie Aude', 'Alan Billam', 'Kevin Richard Buxbaum', 'Annie Combs', 'Graeme Crowther']",['Andy Tennant'],['United States'],['English'],['Twentieth Century Fox']
120832,"Ricky Santoro is a flamboyant and corrupt Atlantic City cop with a dream: become so well connected that he can become mayor. In lieu of that, he'll settle for keeping his comfortable lifestyle. On the night of the heavyweight boxing championship, Rick becomes mixed up in the assassination of the Secretary of Defense, an assassination involving his best friend. Becoming the investigating officer in the case, Rick soon uncovers a conspiracy to kill the Secretary and a mysterious woman in white. The conspiracy was shocking, but not half as shocking as the identity of its mastermind.","['Nicolas Cage', 'Gary Sinise', 'John Heard', 'Carla Gugino', 'Stan Shaw']","['Patrick Bensimmon', 'Andrew Campbell', 'Glenn Cannon', 'Jennifer Cossetto', 'Tara Ann Culp']",['Brian De Palma'],['United States'],['English'],"['Paramount Pictures', 'DeBart', 'Touchstone Pictures']"
120813,"Two untalented singers are mistaken for a pair of major league safe crackers in Providence, Rhode Island. The two are pressed into service by the local hoodlums and quickly find themselves in conflict with their professional colleagues. Romantic interest is added by the daughter of the underworld leader who won't date the men she knows are gangsters.","['Sam Rockwell', 'Steve Zahn', 'Michael Lerner', 'Paul Giamatti', 'Michael Schmidt']","['Anna Abrahams', 'Olly Blackburn', 'René Brar', 'John Breglio', 'Patrick Carone']",['John Hamburg'],['United States'],['English'],"['Andell Entertainment', 'Blue Guitar Films']"
80388,"Atlantic City is a place where people go to realize their dreams, the promise of the future manifested by the demolition of the old crumbling buildings to be replaced by new hotels and casinos. Someone who recently came to Atlantic City for that promise is native Moose Javian (Saskatchewan) Sally Matthews, who currently works as a waitress at a hotel oyster bar, but who is training to be a black jack croupier and wants to be more cultured, such as learning French, in order to work at the casinos in Monte Carlo. Another dreamer who came to Atlantic City decades ago is Lou Pascal, who has long worked as a numbers runner and who claims to have been a cellmate and thus implied confidante of Bugsy Siegel. Although Lou still dresses to the standard to which he is accustomed, his dream long died as he only works penny ante stuff for Fred, most of his current income from being the kept man of widowed recluse, Grace Pinza. Grace too came to Atlantic City to fulfill her dreams - most specifically to participate in a Betty Grable lookalike contest - and ended up staying, marrying a player named Cookie Pinza. Sally, Lou and Grace all live in the same soon to be demolished apartment building - Sally and Lou who are next door neighbors - although Sally knows neither of her neighbors. Lou, however, secretly spies Sally through their respective apartment windows as she goes through a daily ritual. The dreams of this collective are potentially affected - largely dashed or reawakened - with the arrival into Atlantic City of Dave Matthews, Sally's estranged, deadbeat husband, and his very pregnant new ageist girlfriend Chrissie, who happens to be Sally's younger sister. It is the unknown to Sally that Dave and Chrissie bring with them that affects those dreams, namely a large cache of cocaine stolen from criminal sources.","['Burt Lancaster', 'Susan Sarandon', 'Kate Reid', 'Michel Piccoli', 'Hollis McLaren']","['Patrick Burns', 'Jill De Wolfe', 'Pierre Guevremont', 'Leonard Luizzi', 'Vincent Malle']",['Louis Malle'],"['France', 'Canada']","['English', 'French']","['International Cinema Corporation (ICC)', 'Selta Films', 'Canadian Film Development Corporation (CFDC)', 'Cine-Neighbor', 'Selta Films', 'Famous Players Limited', 'New Japan Pro-Wrestling Co']"
77711,"After having neglected her children for many years, world famous pianist Charlotte visits her daughter Eva in her home. To her surprise she finds her other daughter, Helena, there as well. Helena is mentally disabled, and Eva has taken Helena out of the institution where their mother had placed her. The tension between Charlotte and Eva only builds up slowly, until a nightly conversation releases all the things they have wanted to tell each other.","['Ingrid Bergman', 'Liv Ullmann', 'Lena Nyman', 'Halvar Björk', 'Marianne Aminoff']","['Knut Andersen', 'Bo Andersson', 'Jon Arvesen', 'Jo Banoun', 'Daniel Bergman']",['Ingmar Bergman'],"['West Germany', 'United Kingdom']","['Swedish', 'English']","['Persona Film', 'Suede Film', 'Incorporated Television Company']"
61184,"George (Richard Burton) and Martha (Dame Elizabeth Taylor) are a middle-aged married couple, whose charged relationship is defined by vitriolic verbal battles, which underlies what seems like an emotional dependence upon each other. This verbal abuse is fueled by an excessive consumption of alcohol. George being an associate history professor in a New Carthage university where Martha's father is the President adds an extra dimension to their relationship. Late one Saturday evening after a faculty mixer, Martha invites Nick (George Segal) and Honey (Sandy Dennis), an ambitious young biology professor new to the university and his mousy wife, over for a nightcap. As the evening progresses, Nick and Honey, plied with more alcohol, get caught up in George and Martha's games of needing to hurt each other and everyone around them. The ultimate abuse comes in the form of talk of George and Martha's unseen sixteen-year-old son, whose birthday is the following day.","['Elizabeth Taylor', 'Richard Burton', 'George Segal', 'Sandy Dennis', 'Agnes Flanagan']","['Richard Barr', 'Doane Harrison', 'Hal W. Polaire', 'Clinton Wilder', 'Wayne Fitzgerald']",['Mike Nichols'],['United States'],"['English', 'Latin', 'Spanish']","['Warner Bros.', 'Chenault Productions']"
92513,"Chris Parker agrees to babysit after her boyfriend, Mike Todwell, stands her up. Expecting a dull evening, she settles down with three kids for a night of TV...and boredom. But when her frantic friend, Brenda, calls and pleads to be rescued from the bus station in downtown Chicago, the evening soon explodes into an endless whirl of hair raising adventures. Chris and the kids leave their safe suburban surroundings and head for the heart of the big city, never imagining how terrifyingly funny their expedition will become.","['Elisabeth Shue', 'Maia Brewton', 'Keith Coogan', 'Anthony Rapp', 'Calvin Levels']","['Randi Chernov', 'Janet Damp', 'Monica Devereux', 'Prudence Emery', 'Ann Green']",['Chris Columbus'],['United States'],['English'],"['Touchstone Pictures', 'Silver Screen Partners III']"
90305,"Two unpopular teenagers, Gary Wallace and Wyatt Donnelly, fail at all attempts to be accepted by their peers. Their desperation to be liked leads them to ""create"" a woman via their computer. Their living, breathing creation is a gorgeous woman, Lisa, whose purpose is to boost their confidence level by putting them into situations which require them to act like men. On their road to becoming accepted, they encounter many hilarious obstacles, which gives the movie an overall sense of silliness.","['Anthony Michael Hall', 'Kelly LeBrock', 'Ilan Mitchell-Smith', 'Bill Paxton', 'Suzanne Snyder']","['Rafe Blasi', 'Jerry Evans', 'Ron Filbert', 'Willie Kupahu', 'Ron Payne']",['John Hughes'],['United States'],['English'],['Universal Pictures']
61584,"Dr. John Dolittle lives in a small English village where he specializes in caring for and verbally communicating with animals. When Dr. Dolittle is unjustly sent to an insane asylum for freeing a lovesick seal from captivity, his animals and two closest human friends, Matthew Mugg and Tommy Stubbins, liberate him. Afterward, they join Emma Fairfax and set out by boat to find a famed and elusive creature: the Great Pink Sea Snail.","['Rex Harrison', 'Samantha Eggar', 'Anthony Newley', 'Richard Attenborough', 'Peter Bull']","['Don Record', 'Hubert Wells', 'Ralph Helfer', 'Ralph M. Leo', 'Herbert Ross']",['Richard Fleischer'],['United States'],['English'],"['APJAC Productions', 'Twentieth Century Fox']"
57372,"Nerd. Milquetoast. Klutz. These are just three of the many undesirable words that can be used to describe Professor Julius Kelp. But all that changes when the chemistry expert invents a potion that transforms him into a suave, sexy chick magnet, whom Julius aptly names Buddy Love. Unfortunately, there's one side effect: Buddy can't control when he'll change back into Julius, an event that always happens at inopportune times. How will Julius/Buddy resolve his Jekyll-and-Hyde dilemma?","['Jerry Lewis', 'Stella Stevens', 'Del Moore', 'Kathleen Freeman', 'Med Flory']","['Marshall Katz', 'Marvin Weldon']",['Jerry Lewis'],['United States'],['English'],"['Paramount Pictures', 'Jerry Lewis Films']"
70016,"Based on the beloved children's novel by E.B. White, this is the story of a pig named Wilbur who was born a runt. John Arable decides to kill him for dinner food but his daughter, Fern, begs him to let him live. On greater maturity, he is sold to Fern's uncle, Homer Zuckerman, in whose barnyard he's left yearning for friendship, but is snubbed by the other animals. He is scared of the end of the season, because he knows that come that time, he will end up on the dinner table. He hatches a plan with Charlotte, a gentle and wise gray spider that lives above his pen, to ensure that this will never happen.","['Debbie Reynolds', 'Paul Lynde', 'Henry Gibson', 'Rex Allen', 'Martha Scott']","['Alex Lovy', 'Lewis Marshall', 'Frank Paiker', 'Robert Schaefer']",['Charles Nichols'],['United States'],['English'],"['Hanna-Barbera Productions', 'Sagittarius Productions', 'Paramount Pictures']"
78480,"Based upon Richard Adam's novel of the same title, this animated feature delves into the surprisingly violent world of a warren of rabbits as they seek to establish a new colony free of tyranny and human intervention.","['John Hurt', 'Richard Briers', 'Michael Graham Cox', 'John Bennett', 'Ralph Richardson']","['Philip Alton', 'Marilyn Barham', 'Ron Garrett', 'Jo Gregory', 'Linda Gregory']",['Martin Rosen'],['United Kingdom'],['English'],"['Nepenthe Productions', 'Watership Productions', 'Embassy Pictures', 'Goldcrest Films International']"
84649,"Mrs. Brisby, a widowed mouse, lives in a cinder block with her children on the Fitzgibbon farm. She is preparing to move her family out of the field they live in as plowing time approaches, but her son Timothy has fallen ill, and moving him could prove fatal. Mrs. Brisby visits The Great Owl, a wise creature who advises her to visit a mysterious group of rats who live beneath a rose bush on the farm. She visits the rats and meets Nicodemus, the wise, mystical leader of the rats, and Justin, a friendly rat who immediately becomes attached to Mrs. Brisby. While there, she learns that her late husband, Mr. Jonathon Brisby, along with the rats, was a part of a series of experiments at a place known only as N.I.M.H. (revealed earlier in the story as the National Institute of Mental Health). The experiments performed on the mice and rats there boosted their intelligence, allowing them to read without being taught and to understand things such as complex mechanics and electricity. The rats and Mr. Brisby escaped from N.I.M.H. and came to live on the Fitzgibbon farm. The rats created a home for themselves under Mrs. Fitzgibbon's rose bush, creating an elaborate habitation of beautiful chambers, elevators, and Christmas lights. However, the rats are unhappy in their dependence on the humans, who they are stealing electricity from, and have concocted a plan to leave the farm and live independently. Because of her husband's prior relationship with the rats, they agree to help Mrs. Brisby move her home out of the path of the plow. However, the evil Jenner and his unwilling accomplice Sullivan, who wish to remain beneath the rose bush, plot to kill Nicodemus during the move.","['Derek Jacobi', 'Elizabeth Hartman', 'Arthur Malet', 'Dom DeLuise', 'Hermione Baddeley']","['Diana Adams', 'G. Thomas Baker', 'Stephan Barnes', 'Bob Chevalier', 'Kimberley Coy']",['Don Bluth'],['United States'],['English'],"['Aurora', 'Don Bluth Productions', 'Mrs. Brisby Ltd.']"
