imdbId,plot,cast,crew,director,countries,languages,production_companies
98105,"After the high-speed adventure in Police Academy 5: Assignment: Miami Beach (1988), a spate of robberies in the stylish Wilson Heights district terrorises the city. Then, to make matters worse, when the trio of cat-burglars manages to pull off a daring heist right under the nose of Captain Harris, it is up to Commandant Lassard and a band of loyal graduates from the original Police Academy (1984) to stop the wave of thefts. Now, as a mole is leaking valuable information, only a well-organised undercover operation can expose the mysterious ""Mastermind"", the one behind the gang's crime spree. Can Lassard's finest crack the case of the Wilson Heights Gang?","['Bubba Smith', 'David Graf', 'Michael Winslow', 'Leslie Easterbrook', 'Marion Ramsey']","['Nancy E. Barr', 'Howard Brandy', 'Mark Plunkett', 'Sasha Maslansky', 'Phil Proctor']",['Peter Bonerz'],['United States'],['English'],['Warner Bros.']
120595,"After Babe's great victory in the shepherding contest, Farmer Arthur Hoggett turns down all offers to make money with his pig's talents. But when he gets hurt severely in the well, his wife has to take up farming. She does her best but cannot meet the bank's requirements, which results in the necessity of getting back to Babe. Soon, Esme Hoggett is sitting in a plane headed for ""the"" city. There, Babe unwillingly causes deep trouble. He has to stay with Mrs. Hoggett in the only hotel in town that accepts pets. Friendly neighbours send officials who catch all animals from the hotel: Cats, dogs, chimpanzees and many others. Babe, who managed to stay free, decides to help his new friends and gets unexpected help - not only by Ferdinand, who flew all the way to the city.","['Magda Szubanski', 'James Cromwell', 'Mary Stein', 'Mickey Rooney', 'Elizabeth Daily']","['Megan Abel', 'Christopher Aber', 'Lorelle Adamson', 'David Allsberry', 'Leslie Andrews']",['George Miller'],"['Australia', 'United States']",['English'],['Kennedy Miller Productions']
119304,"Hamburger joint waitress Sally Jackson is pregnant. When Beatrice, the wife of the father, finds out about his infidelity, she sends her sons from a previous marriage, military pilots Angus and Dorian Montier, to scare the living daylights out of him. Their gunship does such a good job, without hitting him, that he dies from a heart attack. Worrying about radio interference that night, they investigate who might have heard too much within the fairly empty reception perimeter, and soon discover only Sally could, still ignorant about her affair with his step-dad Henry. Dorian takes a job there to be sure, but soon falls for her himself, while mother-obsessed moron Angus would do anything to anyone for her honor...","['Drew Barrymore', ""Catherine O'Hara"", 'Luke Wilson', 'Jake Busey', 'Shelley Duvall']","['Alexis Arnold', 'Alison Bayer', 'Ivan Bigley', 'Jonathan Capra', 'Amy Carr']",['Dean Parisot'],['United States'],['English'],"['Baltimore Pictures', 'Home Fries Productions Inc.', 'Kasdan Pictures', 'Warner Bros.']"
165494,"Jerry Springer stars as more or less himself, the host of a raunchy, controversial and popular Los Angeles talk show which features everyday people with problems and who frequently vent their problems on the air. A new group of guests are flown in for one show who include white trailer trash from Sarasota FL; Connie, whose current husband has cheated on her with her nymphomaniac teenage daughter, Angel, for which Connie has gotten revenge by having sex with Angel's fiance; and from Detroit, black trash Starletta, whose boyfriend, Damone, has slept with all of her girlfriends. Soon the paths of all of these parties cross which leads to more sex, arguments, physical violence, and Jerry sweating out just another day.","['Jerry Springer', 'Jaime Pressly', 'William McNamara', 'Molly Hagan', 'John Capodice']","['Marlene Albertson', 'Greg Barnes', 'Craig Borden', 'Linda Brown', 'Chris Downey']",['Neil Abramson'],['United States'],['English'],"['Artisan Entertainment', 'Motion Picture Corporation of America', 'Rugolo Entertainment', 'The Kushner-Locke Company']"
124198,"A group of friends head to Las Vegas for a bachelor party.. only things go wrong and a woman is killed. Soon, the bodies are piling up and the friends find themselves turning against one another as the coverup builds.","['Jon Favreau', 'Leland Orser', 'Cameron Diaz', 'Christian Slater', 'Rob Brownstein']","['Sally Allen', 'Edward Argüelles', 'Ryan Beveridge', 'Tracey V. Black', 'Dale Brandenburg']",['Peter Berg'],['United States'],['English'],"['Initial Entertainment Group (IEG)', 'Interscope Communications', 'Ballpark Productions Partnership', 'VBT Productions']"
119248,"Francesco and Marta are husband and wife running a small design company in Rome. When Francesco's long forgotten Aunt Anita dies in Istanbul, he travels there to look after the sale of the hamam (one of a few traditional Turkish baths left) he inherited. There he meets the family running the hamam, gets attracted to a member of it and the whole Turkish atmosphere and decides not to sell the hamam..","['Alessandro Gassmann', ""Francesca d'Aloja"", 'Carlo Cecchi', 'Halil Ergün', 'Serif Sezer']","['Marina Angeli', 'Rosa Carta', ""Alessandra D'Alessio"", 'Tuncay Degis', 'Vanessa Ferrero']",['Ferzan Özpetek'],"['Italy', 'Turkey', 'Spain']","['Italian', 'Turkish', 'French']","['Sorpasso Film', 'Promete Film', 'Asbrell Productions']"
155975,"Marion Crane steals a lot of cash from a man whom her boss is in business with. On the way to see her boyfriend, she stops off by an old motel, run by the odd Norman Bates. She is murdered in the shower. Her sister, boyfriend, and a private investigator try to find out where she is, while we learn more about Norman Bates.","['Vince Vaughn', 'Anne Heche', 'Julianne Moore', 'Viggo Mortensen', 'William H. Macy']","['Guy Adan', 'Sherif Ahmed', 'Ben Alexander', 'Cathy Andrade', 'Elaine Bass']",['Gus Van Sant'],['United States'],['English'],"['Universal Pictures', 'Imagine Entertainment']"
147004,"The pathetically shy LV lives the life of a recluse listening to her late father's old records in her room and in the process driving her abusive, loud-mouthed mother, Mari Hoff, to distraction. At night, however, when her father's ghost visits, LV sings the songs of the great divas such as Judy Garland, Marilyn Monroe, and Dame Shirley Bassey. One evening, LV is overheard by one of her mother's loathsome boyfriends, the disastrous dead-end talent scout Ray Say, who recognizes her innate talent and realizes this is his last big chance for the glittering prizes. Gambling everything, Ray Say forces LV to appear at a local run-down, seedy nightclub run by Mr. Boo. As preparations for the big event proceed apace LV meets the equally shy Billy, a pigeon-racing telephone engineer and they form a tentative, gentle friendship. The big night finally arrives and everything is in readiness, the band, the club, and even a big agent from London, but what about LV?","['Brenda Blethyn', 'Jane Horrocks', 'Ewan McGregor', 'Philip Jackson', 'Annette Badland']","['Grenville Bartlett', 'Isabel Begg', 'Wendy Broom', 'Sue Carreck', 'Rachel Coward']",['Mark Herman'],['United Kingdom'],['English'],"['Miramax', 'Scala Productions']"
120324,"Three diverse characters, for the most part intellectually challenged, find a deserted plane with a bag full of millions of dollars inside. They devise a simple plan to keep the money if no-one claims it. Ofcourse, nothing turns out simple...","['Bill Paxton', 'Bridget Fonda', 'Billy Bob Thornton', 'Brent Briscoe', 'Jack Walsh']","['Matt Adler', 'Shad Allen', 'Wendy Altman-Cohen', 'Paul Asplund', 'Dawn Barkan']",['Sam Raimi'],"['United Kingdom', 'Germany', 'France', 'United States', 'Japan']",['English'],"['British Broadcasting Corporation', 'H2L Media Group', 'Mutual Film Company', 'Paramount Pictures', 'Savoy Pictures', 'Tele München Fernseh Produktionsgesellschaft', 'Toho Company', 'Towa Video', 'Union Générale Cinématographique']"
141109,"Jack Frost is a singer who's on the road most of the time so he can't spend a lot of time with his son, Charlie, although they love each other very much. When Jack is killed in a car accident, Charlie becomes a very sad boy, until...Jack returns as a snowman. Now they can do all the things they've missed when he was human, but what will people think when they see Charlie talking to a snowman and what will happen when the weather gets warmer?","['Michael Keaton', 'Kelly Preston', 'Joseph Cross', 'Mark Addy', 'Andrew Lawrence']","['Debra Leilani Bakeman', 'Barbara Bass', 'Lisa Marie Boiko', 'Kayce Brown', 'Hardy Bullock']",['Troy Miller'],['United States'],['English'],"['Warner Bros.', 'Azoff Entertainment', 'The Canton Company']"
120844,"While on a mission to observe the peaceful Ba'ku race, Lieutenant Commander Data suddenly behaves as if having to fear for his existence. The immortal Ba'ku, whose planet offers regenerative radiation, and therefore incredible lifespans, live in harmony with nature and reject advanced technology. Their planet and their culture is secretly researched by the Federation associated with an alien race called the Son'a. But the Son'a intend to abduct the Ba'ku in order to take the planet for themselves and for the Starfleet officials who all would like to regenerate their bodies. But they did not think of the loyalty of Captain Jean-Luc Picard and the crew of the U.S.S. Enterprise NCC-1701-E to the Prime Directive.","['Patrick Stewart', 'Jonathan Frakes', 'Brent Spiner', 'LeVar Burton', 'Michael Dorn']","['Samuel F. Arroyo', 'Ted Bayard', 'Ben Betts', 'Michael Bilog', 'André Bormanis']",['Jonathan Frakes'],['United States'],['English'],"['Paramount Pictures', 'Digital Image Associates']"
120794,"Centuries ago in Ancient Egypt, Pharaoh Seti ordered all the male Hebrew babies to be executed. A desperate mother decides to let God guide her newborn son instead of execution. Found by the Queen, the baby is named Moses and brought up as a Prince of Egypt and a brother to the Pharaoh's son Rameses II. As time passes, the two brothers are separated as Moses discovers his true heritage as a Hebrew and defies the Egyptian way of life. After escaping from the city, Moses finds that he is called by God to lead his people out of Egypt as His messenger. Unfortunately, Rameses II now rules over the Hebrews with an iron fist, and it will take all of Moses' strength and God's miracles to change the world.","['Val Kilmer', 'Ralph Fiennes', 'Michelle Pfeiffer', 'Sandra Bullock', 'Jeff Goldblum']","['David Ackerman', 'Silva Andreasian', 'Robert Aragon', 'Sergio Armendariz', 'Nathan Barr']",['Brenda Chapman'],"['United States', 'Canada']","['English', 'Hebrew']","['DreamWorks Animation', 'Dreamworks Pictures']"
128445,"Max Fischer is a precocious 15-year-old whose reason for living is his attendance at Rushmore, a private school where he's not doing well in any of his classes, but where he's the king of extracurricular activities - from being in the beekeeping society to writing and producing plays, there's very little after school he doesn't do. His life begins to change, however, when he finds out he's on academic probation, and when he stumbles into love with Miss Cross, a pretty teacher of the elementary school at Rushmore. Added to the mix is his friendship with Herman Blume, wealthy industrialist and father to boys who attend the school, and who also finds himself attracted to Miss Cross. Max's fate becomes inextricably tied to this odd love triangle, and how he sets about resolving it is the story in the film.","['Jason Schwartzman', 'Bill Murray', 'Olivia Williams', 'Seymour Cassel', 'Brian Cox']","['Carrie Albers', 'Monica Allen', 'Linda Brattain', 'Ted Broden', 'Cecilia Cardwell']",['Wes Anderson'],['United States'],"['English', 'Spanish', 'Latin', 'French']","['Touchstone Pictures', 'American Empirical Pictures']"
138097,"William Shakespeare (Joseph Fiennes) is a known but struggling poet, playwright, and actor, who not only has sold his next play to both Philip Henslowe (Geoffrey Rush) and Richard Burbage (Martin Clunes), but now faces a far more difficult problem: he is bereft of ideas and has yet to begin writing. He is in search of his muse, the woman who will inspire him but all attempts fail him until he meets the beautiful Viola De Lesseps (Gwyneth Paltrow). She loves the theatre and would like nothing more than to take to the stage, but is forbidden from doing so as only men can be actors. She is also a great admirer of Shakespeare's works. Dressing as a man, and going by the name of ""Thomas Kent"", she auditions and is ideal for a part in his next play. Shakespeare soon sees through her disguise and they begin a love affair, one they know cannot end happily for them as he is already married and she has been promised to the dour Lord Wessex (Colin Firth). As the company rehearses his new play, William and Viola's love is transferred to the written page leading to the masterpiece that is Romeo and Juliet.","['Geoffrey Rush', 'Tom Wilkinson', ""Steven O'Donnell"", 'Tim McMullan', 'Joseph Fiennes']","['Colette Appleby', 'Sean Barrett', 'Liz Barron', 'Barbara Berkery', 'Debbie Brodie']",['John Madden'],"['United States', 'United Kingdom']",['English'],"['Universal Pictures', 'Miramax', 'The Bedford Falls Company']"
87688,"Father Tim Farley, who presides over St. Francis Church, is arguably the most popular priest within the diocese led by Monsignor Thomas Burke, Father Farley's popularity as witnessed by the size and enthusiasm of the congregation at his church services. Many see Monsignor Burke as autocratic, he having a very narrow and traditionally conservative view of the church in addition. Father Farley often socializes with Monsignor Burke, the two most recently having gone on vacation together to Yugoslavia, but Father Farley sees this socializing more as a professional obligation than a true want, Father Farley who will tell what he considers little white lies to get out of many of those social commitments. Father Farley will tell those little white lies in more circumstances to achieve his desired end, those lies of which his devoted, loyal and devout housekeeper Margaret refuses to be a part. Although not having much to do with the diocese's seminary, Father Farley plea bargains with the Monsignor to ordain seminarian Mark Dolson as a deacon, the Monsignor's condition being only if he is to be the deacon at St. Francis for a one month probation period. The Monsignor's original want not to ordain Mark is because Mark often openly challenges what church elders tell him, the Monsignor feeling that Mark not having the temperament not only to be a deacon but more importantly a priest. Although Father Farley had seen Mark's challenges first hand and thus sees him as much as a pain in the neck as most of those at the seminary do, he came to Mark's defense in this matter if only in not agreeing with the Monsignor's open and closed judgment of Mark, the judgment solely because Mark often disagreed with his views. In spending time with Mark, Father Farley finds that Mark doesn't have a filter between his thoughts/emotions and what comes out of his mouth, in turn the congregation as a collective not having the best initial opinion of him. A series of events leads to a specific incident placing Mark's position in the church at risk. As such, Father Farley has to make a decision about how far he is willing to go to defend Mark at the risk of his own personal and professional standing. In the process, Father Farley may have to examine his own many imperfections as a priest and a human being.","['Jack Lemmon', 'Zeljko Ivanek', 'Charles Durning', 'Louise Latham', 'Alice Hirson']","['Joseph Battaglia', 'Kathleen Long', 'Ira S. Rosenstein', 'L.J. Van Cleave']",['Glenn Jordan'],['United States'],['English'],"['David Foster Productions', 'Jalem Productions', 'Operation Cork', 'Turman-Foster Company']"
39628,"At the Macy's Thanksgiving Day Parade, the actor playing Santa Claus is discovered to be drunk by a whiskered old man. Doris Walker, the no nonsense special events director, persuades him to take his place. He proves to be a sensation and is quickly recruited to play Santa at the main store. While he is successful, Doris learns that he calls himself Kris Kringle and he claims to be the actual Santa Claus. Despite reassurances by his doctor that he is harmless, Doris still has misgivings, especially when she has cynically trained herself, and especially her six-year-old daughter, Susan, to reject all notions of belief and fantasy. And yet, people, especially Susan, begin to notice there is something special about Kris and his determination to advance the true spirit of Christmas among the rampant commercialism around him and succeeding in improbable ways. When a raucous conflict with the store's cruelly incompetent therapist, Granville Sawyer, erupts, he finds himself held at Bellevue where, in despair, he deliberately fails a mental examination to ensure his commitment. All seems lost until Doris' neighbor, Fred Gailey, reassures him of his worth and agrees to represent him in the fight to secure his release. To achieve that, Fred arranges a formal hearing in which he argues that Kris is sane because he is in fact Santa Claus. What ensues is a bizarre hearing in which people's beliefs are reexamined and put to the test, but even so, it's going to take a miracle for Kris to win.","[""Maureen O'Hara"", 'John Payne', 'Edmund Gwenn', 'Gene Lockhart', 'Natalie Wood']","['John C. Eagan', 'Dirk Van H. Labberton', 'May E. Romm']",['George Seaton'],['United States'],"['English', 'Dutch']",['Twentieth Century Fox']
89961,"This is the story of a master toymaker who discovers a magical kingdom of elves in the North Pole and becomes Santa Claus. But when his eager-to-please elf, Patch, leaves for the big streets of New York City, he becomes mixed up with a dastardly toy tycoon's plan to take over Christmas. And so begins his adventure to rescue Patch and to save Christmas for all the children of the world.","['Dudley Moore', 'John Lithgow', 'David Huddleston', 'Burgess Meredith', 'Judy Cornwell']","['Gordon Arnell', 'Trudy Balen', 'Elaine Burt', 'Pauline Coutelenq', 'Jane Dixie']",['Jeannot Szwarc'],"['United Kingdom', 'United States']",['English'],"['GGG', 'Major Studio Partners', 'Calash Corporation N.V.', 'Lloyds TSB Business', 'Lunar Finance', 'Robert Fleming Leasing Limited', 'Santa Claus Ltd.', 'Snowglen Securities', 'St. Michael Finance Limited']"
98115,"Jessica, the daughter of an impoverished farmer, still believes in Santa Claus. So when she comes across a reindeer with an injured leg, it makes perfect sense to her to assume that it is Prancer, who had fallen from a Christmas display in town. She hides him in her barn and feeds him cookies, until she can return him to Santa. Her father finds him and decides to sell him to the butcher, not for venison chops, but as an advertising display.","['Sam Elliott', 'Cloris Leachman', 'Rutanya Alda', 'Abe Vigoda', 'Michael Constantine']","['Patricia J. Amaral', 'Bobby Baldwin', 'Joseph Bogadanovic Jr.', 'Ronda Carr', 'William Estep']",['John D. Hancock'],"['United States', 'Canada']",['English'],"['Cineplex Odeon Films', 'Nelson Entertainment', 'Nelson Entertainment', 'Raffaella Productions']"
89767,A gold mining camp in the California foothills is besieged by a neighboring landowner intent on stealing their claims. A preacher (Clint Eastwood) rides into camp and uses all of his powers of persuasion to convince the landowner to give up his attacks on the miners.,"['Clint Eastwood', 'Michael Moriarty', 'Carrie Snodgress', 'Chris Penn', 'Richard Dysart']","['Marco Barla', 'Paul A. Calabria', 'Jay K. Fishburn', 'Judie Hoyt', 'Linda Sony Kinney']",['Clint Eastwood'],['United States'],['English'],"['Polyphony Digital', 'The Malpaso Company']"
89880,"Only a few years after the all-out guerrilla war in First Blood (1982), John Rambo's former commanding officer, Colonel Sam Trautman, pulls him out of jail, only to send him back to a place he swore never to return: the impenetrable jungles of Vietnam. Entrusted with the dangerous task of collecting evidence that American POWs are still being held captive, Rambo agrees to infiltrate the unknown zone, and before long, he finds himself double-crossed, marooned behind the enemy lines. Once, John fought for his country. Now, the government has left him for dead in a Soviet-infested land. Can Rambo fulfil his suicide mission? Will he deliver his lethal justice?","['Sylvester Stallone', 'Richard Crenna', 'Charles Napier', 'Steven Berkoff', 'Julia Nickson']","['Teri Abastado', 'Frank Batt', 'John Campbell', 'Mario Cisneros', 'Franco Columbu']",['George P. Cosmatos'],"['United States', 'Mexico']","['English', 'Vietnamese', 'Russian']","['Estudios Churubusco Azteca S.A.', 'Anabasis N.V.']"
83944,"John J. Rambo is a former United States Special Forces soldier who fought in Vietnam and won the Congressional Medal of Honor, but his time in Vietnam still haunts him. As he came to Hope, Washington to visit a friend, he was guided out of town by the Sheriff William Teasel who insults Rambo, but what Teasel does not know that his insult angered Rambo to the point where Rambo became violent and was arrested. As he was at the county jail being cleaned, he escapes and goes on a rampage through the forest to try to escape from the sheriffs who want to kill him. Then, as Rambo's commanding officer, Colonel Samuel Trautman tries to save both the Sheriff's department and Rambo before the situation gets out of hand.","['Sylvester Stallone', 'Richard Crenna', 'Brian Dennehy', 'Bill McKinney', 'Jack Starrett']","['Lorraine Baird', 'Lesley Beale', 'Jean Bereziuk', 'Jan Campbell', 'Charlie Davidson']",['Ted Kotcheff'],['United States'],['English'],"['Anabasis N.V.', ""Cinema '84"", 'Elcajo Productions']"
95956,"Weary of the horrors of war, the expert in guerrilla tactics, John Rambo, has settled in exotic Thailand since the suicide rescue mission in Rambo: First Blood Part II (1985). However, John will return to action, when his grizzled mentor, Colonel Sam Trautman, gets trapped behind the enemy lines in Soviet-infested Afghanistan, after a botched attempt to aid the remaining rebel pockets. Now, there's no turning back--and as each minute counts--John must act fast before it's too late. Once more, the government will deny John's existence if the men of the ruthless Soviet Colonel, Zaysen, capture him. But, John shows no mercy, and, this time, he fights for his friend. Can Rambo save the only man who ever stood by him?","['Sylvester Stallone', 'Richard Crenna', 'Marc de Jonge', 'Kurtwood Smith', 'Spyros Fokas']","['Zafi Arieli', 'Charles Bella', 'Delia Circelli', 'Gary Compton', 'Jim Davidson']",['Peter MacDonald'],['United States'],"['English', 'Russian']",['Carolco Pictures']
89370,"This is the sequel to ""Romancing the Stone"" where Jack and Joan have their yacht and easy life, but are gradually getting bored with each other and this way of life. Joan accepts an invitation to go to some middle eastern country as a guest of the sheik, but there she is abducted and finds her- self involved with the ""jewel"". Jack decides to rescue her with his new partner Ralph. They all go from one adventure to another... What is the story of this ""jewel""?","['Michael Douglas', 'Kathleen Turner', 'Danny DeVito', 'Spyros Fokas', 'Avner Eisenberg']","['Mark Birmingham', 'Teresa Brett', 'Peter DePalma', 'Renee Featherstone', 'Jim Franklyn']",['Lewis Teague'],['United States'],"['English', 'Arabic']","['SLM Production Group', 'Stone Group Pictures', 'Twentieth Century Fox']"
88011,"Joan Wilder, a mousy romance novelist, receives a treasure map in the mail from her recently murdered brother-in-law. Meanwhile, her sister Elaine is kidnapped in Colombia and the two criminals responsible demand that she travel to Colombia to exchange the map for her sister. Joan does, and quickly becomes lost in the jungle after being waylayed by Zolo, a vicious and corrupt Colombian cop who will stop at nothing to obtain the map. There, she meets an irreverent soldier-of-fortune named Jack Colton who agrees to bring her back to civilization. Together, they embark upon an adventure that could be straight out of Joan's novels.","['Michael Douglas', 'Kathleen Turner', 'Danny DeVito', 'Zack Norman', 'Alfonso Arau']","['Beth Anthony', 'Reneé Armalin', 'Robert Blue', 'Dr. Crypton', 'Peter DePalma']",['Robert Zemeckis'],"['United States', 'Mexico']","['English', 'Spanish', 'French']","['Twentieth Century Fox', 'El Corazon Producciones S.A.', 'Nina Saxon Film Design', 'SLM Production Group']"
88933,"A group of aliens return to earth to retrieve cocoons containing the people they'd left behind from an earlier trip. These cocoons had been resting at the bottom of the ocean. Once retrieved, they stored these recovered cocoons in the swimming pool of a house they'd rented in a small Florida town. Their mission is hampered by a number of elderly people from a nearby retirement community who had been secretly using the pool, and who discover unusual powers from within these cocoons.","['Don Ameche', 'Wilford Brimley', 'Hume Cronyn', 'Brian Dennehy', 'Jack Gilford']","['Rick Baker', 'James Steven Claridge', 'Susan Cornell', 'Thane Cornell', 'Al Ebner']",['Ron Howard'],['United States'],['English'],"['Twentieth Century Fox', 'Zanuck/Brown Productions', 'SLM Production Group', 'St. Petersburg Clearwater Film Commission']"
