imdbId,plot,cast,crew,director,countries,languages,production_companies
124102,"In a teen chat room, Genevieve Gage, the teenager daughter of detective Mike Gage is invited to a blind date by the cool Capt Howdy. The guy is indeed a pierced a schizophrenic sick and sadistic maniac, and he kidnaps Genevieve and her friend Tiana Moore. He submits the girls and other adolescents to tortures. When the body of Tiana is found, Mike hunts Capt Howdy and puts him in jail first and then he is sent to a mental institution. Four years later, Capt Howdy is considered rehabilitated and released from the asylum, against the will of the local population. After an incident, Capt Howdy abducts Genevieve again, and Mike promises to kill him.","['Kevin Gage', 'Elizabeth Peña', 'Brett Harrelson', 'Robert Englund', 'Linda Cardellini']","['Keith Alexander', 'Liz Augustine', 'Leonard John Bruno', 'Andrea F. Cannistraci', 'Elaine Diamond']",['John Pieplow'],['United States'],['English'],"['Shooting Gallery', 'Snider Than Thou Productions Inc.']"
63462,"Down-on-his-luck theatrical producer Max Bialystock is forced to romance rich old ladies to finance his efforts. When timid accountant Leo Bloom reviews Max's accounting books, the two hit upon a way to make a fortune by producing a sure-fire flop. The play which is to be their gold mine? ""Springtime for Hitler.""","['Zero Mostel', 'Gene Wilder', 'Dick Shawn', 'Kenneth Mars', 'Estelle Winwood']","['Robert Buchman', 'Elinor Bunin', 'Alan Johnson', 'Joseph E. Levine', 'Connie Schoenberg']",['Mel Brooks'],['United States'],"['English', 'German']","['Crossbow Productions', 'Springtime Productions', 'U-M Productions']"
82517,"From the dawn of man to the distant future, mankind's evolution (or lack thereof) is traced. Often ridiculous but never serious, we learn the truth behind the Roman Emperor, we learn what really happened at the Last Supper, the circumstances that surrounded the French Revolution, how to test eunuchs, and what kind of shoes the Spanish Inquisitor wore.","['Mel Brooks', 'Dom DeLuise', 'Madeline Kahn', 'Harvey Korman', 'Cloris Leachman']","['Randy Auerbach', 'Penny Daniels', 'Alan Johnson', 'K. Lenna Katich', 'Lillian Michelson']",['Mel Brooks'],['United States'],"['English', 'Latin', 'French']",['Brooksfilms']
104952,"Bill Gambini and Stanley Rothenstein are two friends from New York University who just received scholarships to UCLA. They decide to drive through the South. Once they arrive in Alabama, they stop at a local convenience store to pick up a few snacks. But, no sooner than they leave the store, they are arrested. They had thought that they were arrested for shoplifting, but they were arrested for murder and robbery. Worse, they are facing execution for this crime. Bill and Stan do not have enough money for a lawyer, so the good news is that Bill has a lawyer in his family, his cousin, Vincent Laguardia Gambini. The bad news is that Vinny is an inexperienced lawyer who has not been at a trial. So, Vinny has to defend his clients and battle an uncompromising judge, some tough locals, and even his fiancée, Mona Lisa Vito, who just does not know when to shut up, to prove his clients' innocence. But he will soon realize that he is going to need help.","['Joe Pesci', 'Ralph Macchio', 'Marisa Tomei', 'Mitchell Whitfield', 'Fred Gwynne']","['James Brandon', 'Randi Chernov', 'Michael Day', 'Tina Elfstrand', 'Jon Fitzgerald']",['Jonathan Lynn'],['United States'],['English'],"['Twentieth Century Fox', 'Peter V. Miller Investment Corp.', 'Dale Launer Production']"
73440,"Five days in the Nashville country and gospel music scene, filled with stars, wannabe stars, and other hangers-on - individual stories of this small group intertwined - provides a commentary on American society. The stars include: good ol' boy Haven Hamilton, whose patriotic songs leading up to the American bicentennial belie his controlling and ruthless nature; Barbara Jean, the country music darling who is just returning to Nashville and performing following recovery from a fire-related injury which may have taken more of an emotional toll than a physical one; and good looking and charismatic Tom Frank, one-third of the successful group Bill, Mary, and Tom, he who is trying to go solo, which masks his need to not be solo in his personal life as he emotionally abuses woman after woman in love with him, including Mary who is married to Bill. The wannabe stars include: Albuquerque, whose real name is Winifred, who is trying to run away from her husband Star in he not approving of her career choice; and Sueleen Gay, a waitress who will do anything to make it big in music despite being told directly that she has no singing talent. Tying their stories together are: Opal, a supposed reporter for the BBC who is working on a documentary and is searching for whatever angle she can; John Triplette, a Yankee in town to organize political fundraisers, including a country music outdoor concert, for third party (the Replacement Party) presidential candidate, populist Hal Phillip Walker, who has the potential to take just enough votes to affect the election; and Martha, who has renamed herself L.A. Jones, who is in town to visit her hospitalized ailing aunt, but who instead decides to be a groupie to any country music star she can find.","['David Arkin', 'Barbara Baxley', 'Ned Beatty', 'Karen Black', 'Ronee Blakley']","['Stephen Altman', 'Jac Cashin', 'Elaine Di Bello Bradish', 'Angel Dominguez', 'Mark Eggenweiler']",['Robert Altman'],['United States'],['English'],"['ABC Entertainment', 'American Broadcasting Company', 'Paramount Pictures']"
139615,"Slam tells the story of Ray Joshua, an original, gifted young MC trapped in a war-zone housing project known as Dodge City. Unable to find a job, Ray copes with the despair and poverty of his neighborhood by using his wits and verbal talent.","['Saul Williams', 'Sonja Sohn', 'Bonz Malone', 'Lawrence Wilson', 'Beau Sia']","['Jackie Bazan', 'Rachel P. Goldstein', 'Robert Leaver', 'Jennifer R. Meagher', 'Lisa West']",['Marc Levin'],['United States'],['English'],['Off Line Entertainment Group']
120701,"Ricky Hayman, right hand of Good Buy Shopping Network's owner John McBainbridge, is responsible for over two years of very bad sales numbers. He gets a last chance. Accidentally, he and Kate Newell nearly run over G with his car and decide to take him with them. What they never could guess was that G really is the one good man around. Being on the search for enlightenment, G offers his help generously to save Ricky's job. His natural, uncontrollable behaviour soon gets Ricky into really big trouble, but the sales numbers now go up for the first time in months...","['Eddie Murphy', 'Jeff Goldblum', 'Kelly Preston', 'Robert Loggia', 'Jon Cryer']","['Josué D. Aguilar', 'Oscar Aguirre', 'Kurt Bauccio', 'Louis Berger', 'Alice Biddle']",['Stephen Herek'],['United States'],['English'],"['Touchstone Pictures', 'Caravan Pictures', 'Eddie Murphy Productions', 'Roger Birnbaum Productions']"
122642,"['A detective tries to remain loyal to his partner, and his best friend - a mobster.']","['Stephen Baldwin', 'Chris Penn', 'Gina Gershon', 'Michael McGlone', 'Christopher Bregman']","['Leon Adair Jr.', 'Keith Adams', 'Drazen Baric', 'Nina Boyd', 'Natalie Brahan']",['Bruno Barreto'],['United States'],['English'],['Patriot Pictures']
119670,"This tells the story of a strong friendship between a young boy with Morquio's syndrome and an older boy who is always bullied because of his size. Adapted from the novel, Freak the Mighty, the film explores a building of trust and friendship. Kevin, an intelligent guy helps out Maxwell to improve his reading skills. In return, Kevin wants Maxwell to take him out places since he is not allowed out unauthorized. Being the social outcasts of the town, Kevin and Maxwell come to realize that they are similar to each other and accept that they are ""freaks"" and nothing will stop them.","['Harry Dean Stanton', 'Gena Rowlands', 'Elden Henson', 'Douglas Bisset', 'Joe Perrino']","['Wendell Adkins', 'Liz Amsden', 'Amanda Ansorge', 'Donna L. Bascom', 'Glennis Bastien']",['Peter Chelsom'],['United States'],['English'],"['Chaos Productions', 'Jane Startz Productions', 'Miramax', 'Scholastic Productions']"
86837,"In this sequel to 2001: A Space Odyssey (1968), a joint American-Soviet expedition is sent to Jupiter to discover what went wrong with the U.S.S. Discovery against a backdrop of growing global tensions. Amongst the mysteries the expedition must explain, are the appearance of a huge black monolith in Jupiter's orbit and the fate of H.A.L.; the Discovery's A.I. computer. Based on the novel by Arthur C. Clarke.","['Roy Scheider', 'John Lithgow', 'Helen Mirren', 'Bob Balaban', 'Keir Dullea']","['Barbara Allen', 'Katharine Ann Curtiss', 'Elliot Fischoff', 'Steven Jongeward', 'Don Levy']",['Peter Hyams'],['United States'],"['English', 'Russian']",['Metro-Goldwyn-Mayer']
90830,"Having taught at the best institutions in the country aside from other more eclectic jobs, James Leeds, with progressive methods, has just started teaching at a school for the deaf on an island off the New England coast, where he is assigned primarily to a speech class for the upper grades. At the school, he quickly notices the young cleaning woman, who he learns is twenty-five year old Sarah Norman and who, deaf herself, was once a student there and has been there since the age of five. He can see that she is bright, headstrong and angry, on top of which she doesn't speak, the latter issues a result of a troubled home life, her mother, her only touchstone to family, who she has purposefully not seen in eight years. As he is able to get through to most of his students to feel more and more comfortable in speaking for a more holistic life, Jim, with the reluctant blessing of the school's superintendent Dr. Curtis Franklin, who has always and still considers Sarah a proverbial pain in the you-know-where, tries to get Sarah to learn how to speak so that she can reach her full potential beyond being a cleaning woman, which he will further learn is a choice if only as it allows her to live her life somewhat in solitude in her silence and anger. Although unable to break through to her on the speaking side of the equation, he is able to break through on a more humanistic level as they end up falling for each other eventually embark on a relationship. The question then becomes if there is the possibility of a long term future for them, especially in being able to bridge their many divides - not only the divide between the world of the hearing and the deaf - and in Sarah never having had a sense of who she truly is as a complete human being and not just the deaf girl who may now see what Jim is doing as solely his latest ""project"".","['William Hurt', 'Marlee Matlin', 'Piper Laurie', 'Philip Bosco', 'Allison Gompf']","['Alan R. Barwiolek', 'Bryan Blanford', 'Stanley Brossette', 'Jan A. Campbell', 'Eve Cantor']",['Randa Haines'],['United States'],"['English', 'American Sign Language']",['Paramount Pictures']
80678,"In Victorian London, Dr. Frederick Treves with the London Hospital comes across a circus sideshow attraction run by a man named Bytes called ""The Elephant Man"". In actuality, the creature on display is indeed a man, twenty-one-year-old Joseph ""John"" Merrick, who has several physical deformities, including an oversized and disfigured skull, and an oversized and disfigured right shoulder. Brutish Bytes, his ""owner"", only wants whatever he can get economically by presenting Merrick as a freak. Treves manages to bring Merrick under his care at the hospital, not without several of its own obstacles, including being questioned by those in authority since Merrick cannot be cured. Treves initially believes Bytes' assertion that mute Merrick is an imbecile, but ultimately learns that Merrick can speak and is a well-read and articulate man. As news of Merrick hits the London newspapers, he becomes a celebrated curiosity amongst London's upper class, including with Mrs. Kendal, a famed actress. Despite treated much more humanely, the question becomes whether Treves' actions are a further exploitation of Merrick. And as Merrick becomes more famous, others try to get their two-cents worth from who still remains a curiosity and a freak to most, including to Bytes, who has since lost his meal ticket.","['Anthony Hopkins', 'John Hurt', 'Anne Bancroft', 'John Gielgud', 'Wendy Hiller']","['Randy Auerbach', 'Loretta Ordewer', 'John Trehy', 'Ellen Adolph', 'John William Ault']",['David Lynch'],"['United States', 'United Kingdom']","['English', 'French']",['Brooksfilms']
120603,"Haunted by so many painful and well-hidden secrets, former slave Sethe is bent on finding freedom for the sake of her children. Out of the blue, as Sethe struggles to grapple with her troubled past in her humble home somewhere in post-Civil-War Cincinnati, Paul D, an old familiar from the Kentucky farm euphemistically called Sweet Home, re-enters Sethe's life, eager to lend her a hand. Then a stranger arrives in the shape of a mysterious young woman, giving rise to a series of repressed memories. But who is she? Can Paul D help Sethe reinvent herself?","['Yada Beener', 'Emil Pinnock', 'Calen Johnson', 'Oprah Winfrey', 'Beah Richards']","['Aboudja', 'Neda Armian', 'William D. Arrowood', 'Brian Atkins', 'Gage Averill']",['Jonathan Demme'],['United States'],"['English', 'Haitian Creole']","['Harpo Films', 'Clinica Estetico', 'Touchstone Pictures']"
144120,"Tiffany Valentine, a former lover and accomplice of serial killer Charles Lee Ray, bribes a police officer into giving her the dismembered parts of a children's doll-which Ray's soul inhabited-from an evidence locker before murdering him. Believing that Ray's soul still inhabits the doll, Tiffany stitches and staples Chucky back together and reenacts the voodoo ritual which had instilled Ray's soul inside the doll ten years prior.","['Jennifer Tilly', 'Brad Dourif', 'Katherine Heigl', 'Nick Stabile', 'Alexis Arquette']","['Tony Acosta Jr.', ""John 'Frenchie' Berger"", 'Evan Brainard', 'Stephen Brathwaite', 'Brendan Bresnahan']",['Ronny Yu'],"['United States', 'Canada']",['English'],"['Universal Pictures', 'Midwinter Productions Inc.']"
120791,"Sisters Sally Owens (Sandra Bullock) and Gillian Owens (Nicole Kidman) have a special bond with each other despite being different in personality and outlook. Having grown up with their spinster Aunt Frances (Stockard Channing) and Aunt Jet (Dianne Wiest) in the long time Owens family house on an island off the coast of Massachusetts following the death of their father and then their mother, they are the latest in a long line of witches. Rumors of the Owens women being witches have existed for generations in the small close-minded town in which they live, despite there being no hard evidence. The Owens women are also under a curse that any man with who they fall in love is doomed. With this experience, extroverted Gillian decides to leave the island to live life to the fullest, in the process, falling for Jimmy Angelov (Goran Visnjic), a Bulgarian who grew up near Transylvania. More introspective Sally, who has sworn off the use of magic except in its most practical sense, has taken measures not to fall in love because of the curse, but ends up falling for and marrying Michael (Mark Feuerstein), a local merchant, the two who end up having two daughters of their own. The curse works its way into Gillian's and Sally's lives in different ways. The outcomes of the curse on their collective lives become more complicated with the arrival into town of Tuscon Police Detective Gary Hallet (Aidan Quinn), whose arrival is not by accident and involves more than just his stated professional purpose.","['Sandra Bullock', 'Nicole Kidman', 'Stockard Channing', 'Dianne Wiest', 'Goran Visnjic']","['Julie Adams', 'Stephen Alesch', 'Amanda Brand', 'Keri Bruno', 'Andrea Doven']",['Griffin Dunne'],['United States'],['English'],"['DiNovi Pictures', 'Fortis Films', 'Stargate Studios', 'Village Roadshow Pictures', 'Warner Bros.']"
147612,"A woman breaks up with her boyfriend; he thinks it's because he's fat. A man is unable to tell her next-door neighbor that he finds her sexually attractive. An old couple wants to split up, but they don't want to get a divorce. A therapist masturbates to teen magazines. An 11-year-old kid is insecure about the fact that he hasn't masturbated yet. Office workers try to recall the face of a coworker who recently died. A woman is sure that she has everything she could ever want. The lives of these individuals intertwine as they go about their lives in their own unique ways, engaging in acts which society as a whole might find disturbing in a desperate search for human connection.","['Jane Adams', 'Jon Lovitz', 'Philip Seymour Hoffman', 'Dylan Baker', 'Lara Flynn Boyle']","['Ethan Adelman', 'Marco Ajello', 'Monique Alderman', 'Anna Beckman', 'Nadia Benamara']",['Todd Solondz'],['United States'],"['English', 'Russian']","['Good Machine', 'Killer Films']"
118636,"Neighborhood boy Todd Bowden (Brad Renfro) discovers that an old man living on his block named Arthur Denker (Sir Ian Mackellan) is a Nazi war criminal. Bowden confronts Denker and offers him a deal: Bowden will not go to the authorities if Denker tells him stories of the concentration camps in World War II. Denker agrees and Bowden starts visiting him regularly. The more stories Bowden hears, the more it affects his personality.","['Brad Renfro', 'Ian McKellen', 'Joshua Jackson', 'Mickey Cottrell', 'Michael Reid MacKay']","['Rick Benattar', 'Craig Conover', 'Robin Cross', 'Ethel Edwards', 'Maureen Estes']",['Bryan Singer'],"['United States', 'France', 'Canada']","['English', 'German']","['Phoenix Pictures', 'Bad Hat Harry Productions', 'Canal+ Droits Audiovisuels']"
120789,"David Wagner is a kid whose mind is stuck in the 1950s. He's addicted to a classic 50's sitcom television show called ""Pleasantville"". Pleasantville is a simple place, a place where all of its citizens are swell and simple-minded folks, a place where the word ""violence"", and life outside of Pleasantville, is unbeknownst to its inhabitants; things are perfect down in Pleasantville. One evening, the life of David and his obnoxious sister Jennifer take a bizarre turn when an eccentric repairman hand them a supposed magical remote. After a quarrel between the siblings, they inexplicably zap themselves into the world of ""Pleasantville"". Now, David and Jennifer must adjust to a 50s lifestyle of repressed desires and considerably different societal values while trying to find their way home.","['William H. Macy', 'Joan Allen', 'Natalie Ramsey', 'Kevin Connors', 'Jeff Daniels']","['Kela Boyd-Grigoryan', 'Randy Bristow', 'Aaron Bryson', 'Raymond Bulinski', 'Kathleen Clements']",['Gary Ross'],['United States'],['English'],"['New Line Cinema', 'Larger Than Life Productions']"
120157,"In a futuristic society, some people are selected at birth to become soldiers, and trained in such a manner that they become inhuman killing machines. One of the most successful and older of these soldiers (Russell) is pitted against a new breed of soldiers, and after the confrontation is believed to be dead. His body is left behind in a semi-abandoned colonial planet, where everything is peaceful, and he is taught about the other aspects of life. But eventually he has to fight the new breed of soldiers again, this time to defend his new home.","['Kurt Russell', 'Jason Scott Lee', 'Jason Isaacs', 'Connie Nielsen', 'Sean Pertwee']","['Kimberly Aguirre', 'Scott M. Anderson', 'Toni Atterbury', 'Ruth Auerbach', 'Jared Chandler']",['Paul W.S. Anderson'],"['United States', 'United Kingdom']",['English'],"['Warner Bros.', 'Morgan Creek Entertainment', 'Jerry Weintraub Productions', 'Impact Pictures', 'Morgan Creek Productions']"
150230,"Affectionate portrait of Tim ""Speed"" Levitch, a tour guide for Manhattan's Gray Line double-decker buses. He talks fast, is in love with the city, and dispenses historical facts, architectural analysis, and philosophical musings in equal measures. He's reflective and funny about cruising: he loves it, got in it to meet women, and he'd quit work if he could. His personal life is disclosed in small doses: he takes home $200 a week for 20 hours work, home is his suitcase and wherever he can flop, he's been arrested for going out on the roof tops of skyscrapers to see his city; he stands between the towers of the World Trade Center, spins until he's dizzy, then looks up.","[""Timothy 'Speed' Levitch""]","['Lilah Friedland', 'Yael Goldman', 'Jim Lovaglio']",['Bennett Miller'],['United States'],['English'],['Charter Films Inc.']
118799,"In 1930s Italy, a carefree Jewish waiter-turned-bookseller named Guido starts a fairy tale life by courting and marrying a lovely woman teacher named Dora. Guido and Dora have a son named Joshua and live happily together until the forced deportation of the town's Jewish population in cattle cars. Dora, while not required to be deported, volunteers to leave with her family, and they are all forced to live in a concentration camp. In an attempt to hold his family together and help his son survive the horrors of a concentration camp, Guido imagines that the Holocaust is a game and that the grand prize for winning is a tank.","['Roberto Benigni', 'Nicoletta Braschi', 'Giorgio Cantarini', 'Giustino Durano', 'Sergio Bini Bustric']","['Marco Albertini', 'Ettore Balducci', 'Roberto Benigni', 'Carles Berot', 'Ilaria Borrelli']",['Roberto Benigni'],['Italy'],"['Italian', 'German', 'English']","['Melampo Cinematografica', 'Cecchi Gori Group Tiger Cinematografica']"
124819,"Joe Young was a simple young man trying to spread the word of the Book of Mormon when he picked the wrong house to preach at! The owner, a porn director named Maxxx Orbison, tells his henchmen to kill the guy at the door who interrupted their scene, but Joe fights off the guards with great skill, which impresses Maxxx so much that he offers Joe the lead role in the movie he's making at the moment: Orgazmo, which is about a sex superhero who fights crime with his Orgazmorator, and ChodaBoy, his sidekick. Joe, against his beliefs, takes the job so that he can pay for the wedding he plans for himself and his fiancée, whom he doesn't tell about his risqué new acting job. However, when the movie becomes an amazing hit just about everywhere and he finds out that Ben (ChodaBoy) has created a real Orgazmorator, Joe is in some serious hot water!","['Trey Parker', 'Dian Bachar', 'Robyn Lynne Raab', 'Michael Dean Jacobs', 'Ron Jeremy']","['Peter Atherton', 'Mary Childers', 'André Devantier', 'Judd Finkelstein', 'Trent Hara']",['Trey Parker'],"['United States', 'Japan']",['English'],"['Kuzui Enterprises.', 'MDP Worldwide', 'Avenging Conscience', 'Orgazmo Inc.']"
100740,"This is really three shorter movies, bound together by a fourth tale in which the other three stories are read. The first segment features an animated mummy stalking selected student victims; the second tale tells the story of a ""cat from Hell"" who cannot be killed and leaves a trail of victims behind it; the third story is about a man who witnesses a bizarre killing and promises never to tell what he saw, and the ""in-between"" bit is the story of a woman preparing to cook her newspaper boy for supper.","['Debbie Harry', 'David Forrester', 'Matthew Lawrence', 'Christian Slater', 'Robert Sedgwick']","['Lisa Alkofer', 'Mechelle Chojecki', 'Louise Chu', 'Dennis Davidson', 'Jeffrey De La Rosa']",['John Harrison'],['United States'],['English'],"['Paramount Pictures', 'Laurel Productions', 'Darkside Movie']"
120877,"A bunch of vampire hunters aided by the Vatican are asked to hunt down a master vampire and his goons of vampires who are ripping and tearing humans apart. While the leader of the vampire hunter does the slaying and takes orders from the Vatican as his parents were killed by vampires and he was raised by the Church, the Church has an agenda of their own regarding a centuries-old cross from falling into the hands of the master vampire.","['James Woods', 'Daniel Baldwin', 'Sheryl Lee', 'Thomas Ian Griffith', 'Maximilian Schell']","['Doug Acton', 'James Alesna', 'Wendy Altman-Cohen', 'Cathy Andrade', 'Tarin Bennett']",['John Carpenter'],"['United States', 'Japan']","['English', 'Latin']","['Largo Entertainment', 'JVC Entertainment Networks', 'Storm King Productions', 'Spooky Tooth Productions']"
120586,"Derek Vineyard is paroled after serving 3 years in prison for brutally killing two black men who tried to break into/steal his truck. Through his brother's, Danny Vineyard, narration, we learn that before going to prison, Derek was a skinhead and the leader of a violent white supremacist gang that committed acts of racial crime throughout L.A. and his actions greatly influenced Danny. Reformed and fresh out of prison, Derek severs contact with the gang and becomes determined to keep Danny from going down the same violent path as he did.","['Edward Norton', 'Edward Furlong', ""Beverly D'Angelo"", 'Jennifer Lien', 'Ethan Suplee']","['George Alonso', 'Matt Baird', 'Peter Barnett', 'Lisa Behlendorf', 'Paul Belenardo']",['Tony Kaye'],['United States'],['English'],"['New Line Cinema', 'Savoy Pictures', 'The Turman-Morrissey Company']"
