imdbId,plot,cast,crew,director,countries,languages,production_companies
71569,"Sinbad and his crew intercept a homunculus carrying a golden tablet. Koura, the creator of the homunculus and practitioner of evil magic, wants the tablet back and pursues Sinbad. Meanwhile Sinbad meets the Vizier who has another part of the interlocking golden map, and they mount a quest across the seas to solve the riddle of the map, accompanied by a slave girl with a mysterious tattoo of an eye on her palm. They encounter strange beasts, tempests, and the dark interference of Koura along the way.","['John Phillip Law', 'Caroline Munro', 'Tom Baker', 'Douglas Wilmer', 'Martin Shaw']","['Colin Arthur', 'Andrew Donally']",['Gordon Hessler'],"['United Kingdom', 'United States']","['English', 'Arabic']",['Ameran Films']
99800,"Young Kid has been invited to a party at his friend Play's house. But after a fight at school, Kid's father grounds him. None the less, Kid sneaks out when his father falls asleep. But Kid doesn't know that three of the thugs at school have decided to give him a lesson in behaviour...","['Christopher Reid', 'Robin Harris', 'Christopher Martin', 'Martin Lawrence', 'Tisha Campbell']","['Tisha Campbell', 'Oliver Crumes Jr.', 'Alicia Daigre', 'Althea Daigre', 'Steve Goldsmith']",['Reginald Hudlin'],['United States'],['English'],"['Jackson/McHenry Company,The', 'New Line Cinema', 'The Hudlin Brothers']"
102065,"[""When Kid's college money is stolen by a crooked music promoter, Play's solution is to stage the 'mutha' of all pajama parties. Starring Kid 'n Play and Martin Lawrence.""]","['Christopher Reid', 'Christopher Martin', 'Martin Lawrence', 'Bowlegged Lou', 'Paul Anthony']","['Selby Barrett', 'Brandon Bates', 'Michèle Boissière Armstrong', 'Bobby Broome', 'Bundy Chanock']",['George Jackson'],['United States'],['English'],"['Jackson/McHenry Company,The', 'New Line Cinema', 'The Hudlin Brothers']"
38718,"In the tradition of FANTASIA, MAKE MINE MUSIC is a glorious collection of musically charged animated shorts featuring such fun-filled favorites as ""Peter And The Wolf,"" narrated by the beloved voice behind Winnie The Pooh. In addition, you'll enjoy such classic cartoon hits as ""Casey At The Bat,"" ""The Whale Who Wanted To Sing At The Met,"" and ""Johnnie Fedora And Alice Bluebonnet,"" the whimsical adventure of two hats who fall in love in a department store window. Every member of your family will have a favorite in this musical medley of fun and fantasy from Disney.","['Nelson Eddy', 'Dinah Shore', 'Laverne Andrews', 'Maxene Andrews', 'Patty Andrews']","['Walt Disney', 'Elaine Bowie', 'Dolores Koch', 'Dorris Pugsley', 'Eva Jane Sinclair']",['Robert Cormack'],['United States'],['English'],['Walt Disney Animation Studios']
40580,"Segments: ""Once Upon a Wintertime,"" two lovers rescued from an icy river by friendly animals; ""Bumble Boogie,"" bee beset by musical instruments and symbols come to life; ""Johnny Appleseed,"" story of the legendary pioneer tree-planter; ""Trees,"" mood piece set to musical treatment of Joyce Kilmer's poem; ""Little Toot,"" story of a heroic little tugboat who saves an ocean liner; ""Blame it on the Samba,"" Donald Duck and Jose Carioca have the blues blown away at a Latin cafe; ""Pecos Bill,"" story of the legendary cowpoke, his trusty mount Widowmaker and his sweetheart Slue Foot Sue.","['Roy Rogers', 'Trigger', 'Dennis Day', 'Laverne Andrews', 'Maxene Andrews']","['Robert Brower', 'Carl Carmer', 'Walt Disney', 'Morgan Padelford', 'Jack Cutting']",['Clyde Geronimi'],['United States'],['English'],['Walt Disney Animation Studios']
93608,"Sharing a mutual fascination for the dead and the macabre, Berlin misfits Betty and Robert are about to broaden their horizons when Rob takes a job as a cleaner at an aftermath clean-up agency. Now, nothing can stop them. And as the obsessed new employee gradually amasses a rich and grotesque collection of severed limbs and human organs right under everyone's noses, the couple's dreams will finally come true when Rob brings home an unexpected gift to impress his girlfriend: a putrid cadaver that's hers to keep. However, as one thing leads to another and Betty grows increasingly fond of her silent decomposing companion, the question arises. Can Robert handle this bizarre ménage à trois?","['Bernd Daktari Lorenz', 'Beatrice Manowski', 'Harald Lundt', 'Collosseo', 'Henri Boeck']","['Fritz Fuchs', 'Manfred O. Jelinski', 'Patricia Leipold', 'Tino Peikert']",['Jörg Buttgereit'],['West Germany'],['German'],['Jelinski & Buttgereit']
42897,"Astronauts (Lloyd Bridges, Osa Massen, John Emery, Noah Beery, Jr., and Hugh O'Brien) blast off to explore the moon. Because of craft malfunction and some fuel calculations, they end up landing on Mars. On Mars, evidence of a once powerful civilization is found. The scientists determine that an atomic war destroyed most of the Martians (who surprisingly look like humans). Those that survived reverted to a caveman-like existence.","['Lloyd Bridges', 'Osa Massen', 'John Emery', 'Noah Beery Jr.', ""Hugh O'Brian""]","['Robert L. Lippert', 'Clarence Marks', 'Michael Minor']",['Kurt Neumann'],['United States'],['English'],['Lippert Pictures']
70679,"John Shaft is persuaded by threats of physical force, the promise of money, and the lure of a pretty tutor, to assume the identity of a native-speaking itinerant worker in Africa. His job is to help break a racket that is smuggling immigrants into Europe then exploiting them. But the villains have heard that he is on his way.","['Richard Roundtree', 'Frank Finlay', 'Vonetta McGee', 'Neda Arneric', 'Debebe Eshetu']",['Tak Kubota'],['John Guillermin'],['United States'],"['Amharic', 'English']","['Metro-Goldwyn-Mayer', 'Shaft Productions Ltd.']"
69257,"When Shaft finds out that a dead friend ran a numbers racket out of his legitimate business and left $250,000 unaccounted for, he knows why he has suddenly found himself in the middle of a war between rival thugs. These goons are all trying to take over the territory of the dead man as well as get their hands on the missing 250 grand. Shaft has all he can handle trying to track down the money and, at the same time, keep his friend's sister from the clutches of the hoods.","['Richard Roundtree', 'Moses Gunn', 'Drew Bundini Brown', 'Joseph Mascolo', 'Kathy Imrie']","['Roger H. Lewis', 'Stirling Silliphant', 'Walter Burrell']",['Gordon Parks'],['United States'],['English'],"['Metro-Goldwyn-Mayer', 'Shaft Productions']"
159382,"Jack Manfred is an aspiring writer going nowhere fast. To make ends meet, and against his better judgement, he takes a job as a croupier. He finds himself drawn into the casino world and the job gradually takes over his life; his relationship with girlfriend Marion begins to deteriorate. One gambler in particular catches his attention: Jani, whom he starts to see outside of working hours - a serious violation of casino rules. Jani is down on her luck; under pressure from her creditors she approaches Jack, asking him to be the inside man for a planned heist at the casino. Jack carefully considers the odds; it all looks so simple, but even a professional like Jack can't predict the cards he will be dealt.","['Clive Owen', 'Nick Reding', 'Nicholas Ball', 'Alexander Morton', 'Barnaby Kay']","['Peta Browne', 'Sarah Critchley', 'Emma Davie', 'Carol Davis', 'Marie Therese Hamacher']",['Mike Hodges'],"['United Kingdom', 'Ireland', 'France', 'Germany']",['English'],"['Channel Four Films', 'ARTE', 'La Sept-Arte', 'Little Bird', 'Tatfilm', 'Westdeutscher Rundfunk']"
219854,"Russ Duritz (Bruce Willis) is a wealthy L.A. image consultant, but as he nears 40, he's cynical, dogless, chickless, estranged from his father (Daniel von Bargen), and he has no memories of his childhood. One night he surprises an intruder (Spencer Breslin), who turns out to be a kid, almost 8 years old. There's something oddly familiar about the chubby lad, whose name is Rusty. The boy's identity sparks a journey into Russ's past that the two of them take - to find the key moment that has defined who Russ is. Two long-suffering women look on with disbelief: Russ's secretary, Janet(Lily Tomlin), and his assistant, the lovely Amy, to whom Rusty takes a shine. What, and who, is at the end of this journey?","['Bruce Willis', 'Spencer Breslin', 'Emily Mortimer', 'Lily Tomlin', 'Jean Smart']","['Rick Adami', 'Eddie Adolph', 'Ellen Adolph', 'David Allsberry', 'H. Leah Amir']",['Jon Turteltaub'],['United States'],['English'],"['Chester Films Inc.', 'Junction', 'Walt Disney Pictures']"
175142,"A group of teenagers including Cindy Campbell and Bobby Prinze, accidentally hit a man when driving, and dispose of the body, but now they are being stalked by a very recognisable masked killer. The victim count increases, whilst Cindy must survive the carnage that has she has seen in so many films before.","['Carmen Electra', 'Dave Sheridan', 'Frank B. Moore', 'Giacomo Baessato', 'Kyle Graham']","['Cary Anderson', 'Karen Barretta', 'Jackie Bazan', 'Ashley Bell', 'Renee Bella']",['Keenen Ivory Wayans'],['United States'],['English'],"['Dimension Films', 'Wayans Bros. Entertainment', 'Gold/Miller Productions', 'Brad Grey Pictures']"
179116,"Megan is an all-American girl. She's a cheerleader and has a boyfriend, but she doesn't like kissing him very much, and she's pretty tactile with her cheerleader friends, and she only has pictures of girls up in her locker. Her parents and friends conclude that she *must* be gay and send her off to ""sexual redirection"" school, full of admittedly homosexual misfits, where she can learn how to be straight. Will Megan be turned around to successful heterosexuality, or will she succumb to her love for the beautiful Graham?","['Natasha Lyonne', 'Michelle Williams', 'Brandt Wille', 'Bud Cort', 'Mink Stole']","['Jose Avitia', 'Michael Back', 'Blake Busby', 'Genevieve Chalom', 'Lara Cody']",['Jamie Babbit'],['United States'],['English'],"['Cheerleader LLC', 'Hate Kills Man', 'Ignite Entertainment', 'The Kushner-Locke Company']"
215369,"Shenzhen businessman, Da Ming, goes home to Beijing when he thinks his father has died. He finds his father hard at work at the family's bathhouse (the false message was a ruse of Da's mentally-handicapped, exuberant brother, Er Ming, to get Da home). Da stays a couple days, observing his father being social director, marriage counselor, and dispute mediator for his customers and a boon companion to Er. Da is caught between worlds: the decaying district of his childhood and the booming south where he now lives with a wife who's not met his family. When Da realizes his father's health is failing and the district is slated for razing, he must take stock of family and future.","['Jiayi Du', 'Zheng Fang', 'Bing He', 'Wu Jiang', 'Ding Li']",[''],['Yang Zhang'],['China'],"['Mandarin', 'Italian']","['Imar Film', ""Xi'an Film Studio""]"
60176,"A successful mod photographer in London whose world is bounded by fashion, pop music, marijuana, and easy sex, feels his life is boring and despairing. Then he meets a mysterious beauty, and also notices something frightfully suspicious on one of his photographs of her taken in a park. The fact that he may have photographed a murder does not occur to him until he studies and then blows up his negatives, uncovering details, blowing up smaller and smaller elements, and finally putting the puzzle together.","['Vanessa Redgrave', 'Sarah Miles', 'David Hemmings', 'John Castle', 'Jane Birkin']","['John Cowan', 'Piers Haggard']",['Michelangelo Antonioni'],"['United Kingdom', 'Italy']",['English'],['Carlo Ponti Production']
59575,"In a poor neighborhood of New York, the bitter and lonely Jewish pawnbroker Sol Nazerman is a survivor from Auschwitz that has no emotions or feelings. Sol lost his dearest family and friends in the war and his faith in God and belief in mankind. Now he only cares for money and is haunted by daydreams, actually flashbacks from the period of the concentration camp. Sol's assistant is the ambitious Latino Jesus Ortiz, who wants to learn with Sol how to run a business of his own. When Sol realizes that the obscure laundry business he has with the powerful gangster Rodriguez comes also from brothels, Sol recalls the fate of his beloved wife in the concentration camp and has a nervous breakdown. His attitude leads Jesus Ortiz to tragedy and Sol finds a way to cry.","['Rod Steiger', 'Geraldine Fitzgerald', 'Brock Peters', 'Jaime Sánchez', 'Thelma Oliver']","['Belle Iacobellis', 'Ely A. Landau', 'Dana Steadley', 'Herbert R. Steinmann']",['Sidney Lumet'],['United States'],"['English', 'Spanish', 'German']","['Landau Company', 'The Pawnbroker Company']"
212974,"On Friday, a single e-mail blips through the Internet. The word spreads quickly through the city: the party is on. Saturday evening, two hundred people secretly converge at an abandoned San Francisco warehouse. As the sun sets the records start spinning, setting into motion a night that no one will forget. Meet David Turner, a Midwest transplant. He moved to the city with aspirations of starting his career as a writer but his hopes have stalled. After four years he finds himself writing instruction manuals for a computer company. Overworked and with little social life, David spends his time alone, his dream of being a novelist a distant memory. That night, his brother Colin Turner invites him to GROOVE. Colin has a surprise for his new girlfriend, young raver sprite Harmony Stitts, and he wants David there. David reluctantly agrees and is shocked when Colin proposes to Harmony at the party. In the ensuing celebration, they take Ecstasy and suddenly, David is thrust into the world of the San Francisco underground. In a chance encounter, David meets longtime New York raver Leyla Heydel and makes an unlikely connection. Through their budding relationship, they're reminded of a sense of possibility and freedom in their lives they had all but forgotten. But as the party rages on, Colin reveals a deep secret, one that threatens to destroy his relationship with Harmony. When the sun rises the party disappears, and the chaos of the last twelve hours changes the two brothers forever.","['Chris Ferreira', 'Mackenzie Firgens', 'Elizabeth Sun', 'Steve Van Wormer', 'Dmitri Ponce']","['Warlie Avillanoza', 'Lew Baldwin', 'Max Baloian', 'Justin Baumrucker', 'Brian Benson']",['Greg Harrison'],['United States'],['English'],"['415 Productions', 'Groove LLC']"
87277,"Big-city teenager Ren relocates from Chicago to the small rural town of Bomont, where its inhabitants have imposed an unjust ban on Rock 'n' Roll and dancing. Feeling trapped and confused, Ren tries to fit in; however, he will soon find himself neck-deep in trouble when beautiful Ariel Moore, the preacher's daughter, catches his eye. Now, to convince the city council to lift the ban on dancing, Ren has no choice but to fight prejudice and the community's fire-and-brimstone preacher through dance. But is Ren fighting a losing battle?","['Kevin Bacon', 'Lori Singer', 'John Lithgow', 'Dianne Wiest', 'Chris Penn']","['Wayne Fitzgerald', 'Chuck Gaylord', 'Spencer Henderson', 'Ronnie Kramer', 'Michael Maslansky']",['Herbert Ross'],['United States'],['English'],"['Paramount Pictures', 'Phoenix Pictures', 'IndieProd Company Productions']"
38499,"When her father is hanged for shooting his wife and her lover, biracial Pearl Chavez goes to live with distant relatives in Texas. Welcomed by Laura Belle and her elder lawyer son Jesse, she meets with hostility from the ranch-owner himself, wheelchair-bound Senator Jackson McCanles, and with lustful interest from demonizing, unruly younger son Lewt. Almost at once, already existing family tensions are exacerbated by her presence and the way she is physically drawn to Lewt.","['Jennifer Jones', 'Joseph Cotten', 'Gregory Peck', 'Lionel Barrymore', 'Herbert Marshall']","['Tilly Losch', 'Morgan Padelford', 'Lydia Schiller', 'David O. Selznick', 'Lloyd Shaw']",['King Vidor'],['United States'],['English'],"['Selznick International Pictures', 'Vanguard Films']"
120903,"In a world where both Mutants and Humans fear each other, Marie, better known as Rogue, runs away from home and hitches a ride with another mutant, known as Logan, a.k.a. Wolverine. Professor Charles Xavier, who owns a school for young mutants, sends Storm and Cyclops to bring them back before it is too late. Magneto, who believes a war is approaching, has an evil plan in mind, and needs young Rogue to help him.","['Hugh Jackman', 'Patrick Stewart', 'Ian McKellen', 'Famke Janssen', 'James Marsden']","['Murat Akser', 'Janine Anderton', 'Heath Banks', ""John 'Frenchie' Berger"", 'Susan Boyajian']",['Bryan Singer'],['United States'],['English'],"['Twentieth Century Fox', 'Marvel Enterprises', ""Donners' Company"", 'Bad Hat Harry Productions', 'Springwood Productions', 'Genetics Productions']"
200530,"Buck is a man-child who has lived his existence in a life of Romper Room, kindergarten collages, and lollipops. When his mother dies suddenly, Buck remembers his old childhood friend Chuck, with whom he feels a need to reconnect after having invited him to his mother's funeral. Buck treks out to Los Angeles where Chuck, an up-and-coming music record executive, is living his life. Buck ends up developing an obsession with Chuck and begins stalking him.","['Mike White', 'Chris Weitz', 'Lupe Ontiveros', 'Beth Colt', 'Paul Weitz']","['Rachel Aberly', 'Raymond Alvarino', 'Don Brewton', 'Mikey Buchbinder', 'Terry Crews']",['Miguel Arteta'],['United States'],['English'],"['Artisan Entertainment', 'Blow Up Pictures', 'Flan de Coco Films', 'Toga Productions']"
168794,"Interconnected stories examine situations involving the five senses. Touch is represented by a massage therapist who is treating a woman, while her daughter accidentally loses the woman's pre-school daughter in the park. The older daughter meets a voyeur (vision), a professional house-cleaner has an acute sense of smell, a cake maker has lost her sense of taste, and an older man is losing his hearing.","['Molly Parker', 'Gabrielle Rose', 'Elize Frances Stolk', 'Nadia Litz', 'Mary-Louise Parker']","['Michael Achtman', 'Max Burke-Phillips', 'William Cameron', 'Jennifer Capraru', 'Anthony Carovillano']",['Jeremy Podeswa'],['Canada'],"['French', 'English', 'Italian']","['Alliance Atlantis Communications', 'CTV Television Network', 'Canadian Broadcasting Corporation', 'Canadian Film or Video Production Tax Credit', 'Canadian Television Fund', 'Five Senses Productions', 'Government of Canada', 'The Harold Greenberg Fund', 'The Movie Network', 'Téléfilm Canada']"
120894,"Steven is multi-talented, handsome, and a expert seducer of women. He craves intimacy with women, literally cannot live without it, and is in search of the perfect woman, but all of his relationships end tragically. Eventually he meets Anne, a strong woman who is different, better than the others. However, soon it becomes clear that this is a relationship that only one of them will survive. The title refers to a quote from Francis Bacon about crocodiles, who shed tears when they devour their prey.","['Jude Law', 'Elina Löwensohn', 'Timothy Spall', 'Jack Davenport', 'Colin Salmon']","['Chris Allies', 'Morgan Blackmore', 'Chris Catterall', 'Sarah Ewing', 'John Field']",['Po-Chih Leong'],['United Kingdom'],['English'],"['Goldwyn Films', 'Film Foundry Partners', 'Entertainment Film Distributors', 'Zenith Entertainment', 'Arts Council of England']"
163676,"Adrien Williams enters the ""in crowd"" when she is hired by a posh East Coast country club and befriended by Brittany Foster, the charismatic leader of a clique of wealthy college students who are home for the summer. Brittany takes Adrien under her wing, attempts to show her the benefits of the good life and introduces her to other members of her inner circle, including the object of Brittany's affection, tennis pro Matt Curtis. When Matt shows an interest in Adrien, Brittany begins to reveal her dark side and Adrien slowly starts to learn that Brittany and her pack of friends will do anything to protect their circle and the dark secrets they harbor.","['Susan Ward', 'Lori Heuring', 'Matthew Settle', 'Nathan Bexton', 'Tess Harper']","['Cassie Brown', 'Devin Corey', ""David 'Kam' Coyner"", 'Robin Cross', 'Kirstie Field']",['Mary Lambert'],['United States'],['English'],['Morgan Creek Entertainment']
161081,"Norman Spencer, a university research scientist, is growing more and more concerned about his wife, Claire, a retired concert cellist who a year ago was involved in a serious auto accident, and who has just sent off her daughter Caitlin (Norman's stepdaughter) to college. Now, Claire reports hearing voices and witnessing eerie occurrences in and around their lakeside Vermont home, including seeing the face of a young woman reflected in water. An increasingly frightened Claire thinks the phenomena have something to do with the couple living next door, especially since the wife has disappeared without apparent explanation. At her husband's urging, Claire starts to see a therapist; she tells him she thinks the house is being haunted by a ghost. His advice? Try to make contact. Enlisting the help of her best friend, Jody, and a ouija board, Claire seeks to find out the truth of What Lies Beneath.","['Michelle Pfeiffer', 'Katharine Towne', 'Miranda Otto', 'James Remar', 'Harrison Ford']","['Geoff Abadee', 'Newell Alexander', 'Libuse Binder', 'Matthew J. Birch', 'Kayce Brown']",['Robert Zemeckis'],['United States'],['English'],"['Dreamworks Pictures', 'Twentieth Century Fox', 'ImageMovers']"
210234,"An evil genius in a flying fortress is trying to kidnap the birds of the fire, ice, and lightning islands in hopes of luring the sea power, Lugia, and controlling the world. Ash and his friends, in the process of carrying out an island tradition that requires visiting those three islands, discover the plot and try to stop it. Even the comic villains, Team Rocket, turn good and help out in the end against the threat of world destruction. And Pokemon assemble from all around the world in case they can be of help (but they end up helping only the merchandising).","['Rica Matsumoto', 'Ikue Ôtani', 'Unshô Ishizuka', 'Mayumi Izuka', 'Satomi Kôrogi']","['Mihaela Antoniou', 'Susumu Anzai', 'Yoshinobu Baba', 'Kaori Banma', 'Kazuharu Chiba']",['Kunihiko Yuyama'],"['Japan', 'United States']",['Japanese'],"[""Pikachu Project '99"", '4 Kids Entertainment', 'GAME FREAK', 'JR Kikaku', 'Nintendo', 'Oriental Light and Magic', 'Pikachu Project', 'Shogakukan', 'Shogakukan-Shueisha Productions', 'TV Tokyo', 'Tomy']"
52561,"Frederick Manion (Ben Gazzara), a lieutenant in the army, is arrested for the murder of a bartender, Barney Quill. He claims, in his defense, that the victim had raped and beaten up his wife Laura (Lee Remick). Although Laura supports her husband's story, the local paper has reported that the police surgeon can find no evidence that she has been raped. Manion is defended by Paul Biegler (James Stewart), a humble small-town lawyer and recently deposed district attorney. During the course of interviews, Biegler discovers that Manion is violently possessive and jealous, and also that his wife has a reputation for flirting with other men. Biegler realizes that the prosecution will try to make the court believe that Laura had been drunk and was picked up by the bartender and then her husband killed him and beat her up when he discovered they had been together. Manion pleads ""not guilty"" and Biegler, who knows that his case is weak, tries to find evidence that will save Manion.","['James Stewart', 'Lee Remick', 'Ben Gazzara', ""Arthur O'Connell"", 'Eve Arden']","['Saul Bass', 'Otto Preminger', 'Max Slater', 'Robert E. Blair', 'John Dunaway']",['Otto Preminger'],['United States'],['English'],['Otto Preminger Films']
104299,"Auto racer Alex Furlong (Emilio Estevez) is snatched by time travel, a split second before a fatal explosion, by Vasendak's (Mick Jagger's) twenty-first century team of techies, who plan to sell his healthy body to an ailing rich man at McCandless Corporation, for a mind transfer. He escapes, but has no rights in this nightmare future of violence and sleaze. The story concerns his survival, and his attempt to revive his relationship with his fiancée Julie (Rene Russo), now fifteen years older and an executive at McCandless.","['Emilio Estevez', 'Mick Jagger', 'Rene Russo', 'Anthony Hopkins', 'Jonathan Banks']","['Kathy Archer Buck', 'Elliot L. Backerman', 'Melanie Bell', 'Jan Blasingame', 'Rowan Brade']",['Geoff Murphy'],['United States'],['English'],['Morgan Creek Entertainment']
79257,"College exploitation film focusing on the wild escapades of the women of H.O.T.S. Sorority. The antics include but are certainly not limited to a wet t-shirt contest, a sky-diving episode, plenty of fraternity boys and even a house-keeping robot. Can the girls of H.O.T.S. overcome the scrutiny of their unliberated student counterparts and the University Administration as they unknowingly become the focus of bumbling crooks?","['Susan Kiger', 'Lisa London', 'Pamela Jean Bryant', 'Kimberly Cameron', 'Mary Steelsmith']","['William Bower', 'Roxanne Brewer', 'Gerald Connelly', 'Larry Droguett', 'Richard Charles Greenbaum']",['Gerald Seth Sindell'],['United States'],['English'],['Great American Dream Machine Movie Company']
