imdbId,plot,cast,crew,director,countries,languages,production_companies
199753,"In the near future, Earth is dying. A new colony on Mars could be humanity's only hope. A team of American astronauts, each a specialist in a different field, is making the first manned expedition to the red planet and must struggle to overcome the differences in their personalities, backgrounds and ideologies for the overall good of the mission. When their equipment suffers life-threatening damage and the crew must depend on one another for survival on the hostile surface of Mars, their doubts, fears and questions about God, man's destiny and the nature of the universe become defining elements in their fates. In this alien environment they must come face to face with their most human selves.","['Val Kilmer', 'Carrie-Anne Moss', 'Tom Sizemore', 'Benjamin Bratt', 'Simon Baker']","['Lorelle Adamson', 'Maren Brown', 'Mandy Butler', 'Aaron Crothers', 'Christophe Farber']",['Antony Hoffman'],"['United States', 'Australia']",['English'],"['Warner Bros.', 'Village Roadshow Pictures', 'NPV Entertainment', 'The Canton Company', 'Mars Production Pty. Ltd.']"
197096,"In Los Angeles, the loosely intertwined stories of four different extended families from four different ethno-cultural backgrounds - the Hispanic Avilas, the Vietnamese Nguyens, the Jewish Seeligs and the black Williamses - gathering for their respective Thanksgiving dinners are presented. Their stories are remarkably similar, but each with their own ethno-cultural spin: turkey with a twist being prepared primarily by the head female of the household, largely ethnic sides accompanying the turkey, football on television, and family dysfunction in many different forms pervading the atmosphere of the gathering, the elephant or elephants in the room which most in the know don't want to be discussed on what is supposed to be this day of thanks. A single event at one of the dinners has a profound effect on all four gatherings.","['Mercedes Ruehl', 'Victor Rivers', 'Douglas Spain', 'Maria Carmen', 'Isidra Vega']","['David Abbitt', 'Scott Adams', 'Conan Castro Jr.', 'Jose Chavez', 'Therese Clinton']",['Gurinder Chadha'],"['United Kingdom', 'United States']","['English', 'Spanish', 'Vietnamese', 'Yiddish']","['Because Entertainment', 'Flashpoint', 'Hope and Gravy Inc.', 'Stagescreen Productions']"
203230,"Adult siblings Sammy Prescott and Terry Prescott have had a special bond with each other since they were kids when their parents were tragically killed in a car accident. That bond is why single mom Sammy, who still lives in the family home in Scottsville, upstate New York with her eight year old son Rudy, is excited to hear that Terry, who she has not seen or heard from in a while, is coming home for a visit. That excitement is dampened slightly upon Terry's arrival, when she learns that he, broke, is only there to borrow money. As adults, Sammy, who works as a lending officer in the local bank, is seen as the responsible sibling, while unfocused Terry is seen as the irresponsible drifter. Regardless, Sammy welcomes what ends up being Terry's longer than planned visit if only so that he can help take care of Rudy, who has no adult male figure in his life. Rudy has never known his deadbeat biological father, with whom Sammy wants nothing to do. As Terry - acting as the supposed adult male role model figure - gets to know Rudy, and as Sammy deals with the issues in her life which includes figuring out what her relationship to longtime friend/lover Bob Steegerson means, and how to deal with her straight-laced micro-managing new boss Brian Everett, the maturity level between Sammy and Terry is not as far apart as it appears on the surface.","['Amy Ryan', 'Michael Countryman', 'Adam LeFevre', 'Halley Feiffer', 'Whitney Vance']","['Kevin Asch', 'Jason Block', 'Dan Brillman', 'Peter Burns', 'Alexandra Bush']",['Kenneth Lonergan'],['United States'],['English'],"['Hart Sharp Entertainment', 'Cappa Production', 'Crush Entertainment', 'Shooting Gallery']"
66995,"James Bond's mission is to find out who has been smuggling diamonds, which are not re-appearing. He adopts another identity in the form of Peter Franks. He joins up with Tiffany Case, and acts as if he is smuggling the diamonds, but everyone is hungry for these diamonds. He also has to avoid Mr. Wint and Mr. Kidd, the dangerous couple who do not leave anyone in their way. Ernst Stavro Blofeld isn't out of the question. He may have changed his looks, but is he linked with the heist? And if he is, can Bond finally defeat his ultimate enemy.","['Sean Connery', 'Jill St. John', 'Charles Gray', 'Lana Wood', 'Jimmy Dean']","['Maurice Binder', 'Albert R. Broccoli', 'Harry Saltzman', 'Brian Bailey', 'Ed Clark']",['Guy Hamilton'],['United Kingdom'],"['English', 'German']",['Eon Productions']
74452,"1943, The war is entering its final stages and Germany is teetering on the brink of defeat. An increasingly unhinged Hitler, orders a mission to have British Prime Minister Sir Winston Churchill kidnapped and brought to Germany. The plan seems ludicrous in the extreme, but a message sent from a German spy in the Norfolk countryside makes one German officer realize that such a mission may just be feasible.","['Michael Caine', 'Donald Sutherland', 'Robert Duvall', 'Jenny Agutter', 'Donald Pleasence']","['John Beharrell', 'Douglas Bianci', 'Edna Bianci', 'Penelope Forrester', 'Geoff Freeman']",['John Sturges'],['United Kingdom'],"['English', 'German', 'Polish']","['Associated General Films', 'ITC Entertainment']"
216216,"In the near future, cloning is now technically advanced, but human cloning is still illegal. Adam Gibson (Schwarzenegger) returns home after working with his friend Hank Morgan (Rapaport), only to find a clone of himself with his family. Before he has chance to find out the truth, he is attacked by a group who want him dead. Adam must escape and find out the truth from the creator of the clones, Michael Drucker (Goldwyn). Adam knows for sure he couldn't have been cloned, but isn't ready for what he's about to hear.","['Arnold Schwarzenegger', 'Michael Rapaport', 'Tony Goldwyn', 'Michael Rooker', 'Sarah Wynter']","['Cassandra Barbour', 'Andrew Barron', 'Jasmine Barry', 'Robert L. Catron', 'Timothy F. Crowley']",['Roger Spottiswoode'],['United States'],['English'],['Phoenix Pictures']
186894,"Buddy (Affleck) has just signed an airline in Chicago as a big client, but is ironically delayed at the airport waiting for a flight to LA on that same airline. He meets fellow passenger Greg, who opts to be bumped, even though it means missing an activity with his older son. When the flight gets resumed, Buddy thinks he's doing a good deed by swapping tickets with Greg so he can get home to his son. Sadly, the flight crashes. Buddy conspires with his friend, the ticket agent that night, to take his name off the passenger list and put Greg's on. Once he's back in LA, his new client dictates that the company run a series of feel-good ads about the crash. Buddy feels very hypocritical, and completely loses it when the commercials win a Cleo. After going through re-hab, he decides he needs to check on Greg's widow. But he doesn't plan on falling in love with her.","['Ben Affleck', 'Gwyneth Paltrow', 'Natasha Henstridge', 'Edward Edwards', 'Jennifer Grey']","['Delara C. Adams', 'Tony Antonelli', 'Carles Berot', 'Stephanie Boles', 'Johnny Braz']",['Don Roos'],['United States'],['English'],['Miramax']
170016,"Inside a snowflake exists the magical land of Whoville, wherein live the Whos, an almost-mutated sort of Munchkin-like people who all love Christmas. Just outside of their beloved town lives the Grinch (Jim Carrey), a nasty creature that hates Christmas and plans to steal it from the Whos, which he equally abhors. Little Cindy Lou Who (Taylor Momsen) decides to befriend the Grinch.","['Jim Carrey', 'Taylor Momsen', 'Kelley', 'Jeffrey Tambor', 'Christine Baranski']","['Kimberly Adams', 'Todd J. Adelman', 'Wendy Altman-Cohen', 'Melissa Altro', 'David Andriole']",['Ron Howard'],"['United States', 'Germany']",['English'],"['Universal Pictures', 'Imagine Entertainment', 'LUNI Productions GmbH and Company KG']"
230591,"The 1972 Munich Olympics were interrupted by Palestinian terrorists taking Israeli athletes hostage. Besides footage taken at the time, we see interviews with the surviving terrorist, Jamal Al Gashey, and various officials detailing exactly how the police, lacking an anti-terrorist squad and turning down help from the Israelis, botched the operation.","['Michael Douglas', 'Ankie Spitzer', 'Jamal Al Gashey', 'Gerald Seymour', 'Axel Springer']","['Jonathan Berger', 'Nick Fraser', 'Lynn Goldner', 'Dennis Hobbs', 'Monica Maurer']",['Kevin Macdonald'],"['Switzerland', 'Germany', 'United Kingdom']","['English', 'German']","['Passion Pictures', 'Arthur Cohn Productions', 'British Broadcasting Corporation', 'British Screen Productions', 'Dan Valley Film AG', 'European Co-production Fund', 'Soros Documentary Fund of the Open Society Movement']"
213203,"Wishes come true in this movie, and love makes its way into the hearts of those young, old, and overseas. Chuckie's dad, Chaz (Michael Bell), starts dating again, and it's Chuckie's wish to find a new mom. When Stu Pickles (Jack Riley) is summoned to Reptarland, an amazing new amusement park in Paris, to work on his Reptar invention, Tommy (Elizabeth Daily), Chuckie (Christine Cavanaugh), Angelica (Cheryl Chase), Phil (Kath Soucie), Lil (Kath Soucie), Dil (Tara Strong), Didi (Melanie Chartoff), and the whole gang tag along to the city of romance. But the Rugrats' big adventure turns out to be more than glamor, fashion, and smelly cheese. Chuckie learns that when it comes to Princesses and potential mommies, things are not always what they seem, and for Chaz, finding the right woman can be difficult in any language. As the Rugrats' travels take them from the Eiffel Tower to Notre Dame and everywhere in-between, the world's favorite babies learn new lessons about courage, loyalty, trust, and above all, true love.","['Elizabeth Daily', 'Tara Strong', 'Cheryl Chase', 'Christine Cavanaugh', 'Cree Summer']","['Charlie Adler', 'Kyung Sun Ahn', 'Dana Boulé', 'Josef Brandmaier', 'Chang Youl Choi']",['Stig Bergqvist'],"['Germany', 'United States']","['English', 'French']","['Paramount Pictures', 'Nickelodeon Movies', 'Klasky-Csupo', 'MFP Munich Film Partners GmbH & Company I. Produktions KG', 'Rugrats Production K.G.']"
211181,"After a spot of therapy, Cruella De Vil is released from prison a changed woman. Devoted to dogs and good causes, she is delighted that Chloe, her parole officer, has a dalmatian family and connections with a dog charity. But the sound of Big Ben can reverse the treatment so it is only a matter of time before Ms De Vil is back to her incredibly ghastly ways, using her new-found connections with Chloe and friends.","['Glenn Close', 'Gérard Depardieu', 'Ioan Gruffudd', 'Alice Evans', 'Tim McInnerny']","['Cate Arbeid', 'Malcolm Bale', 'Raymond W. Beal', 'Anthony Bloom', 'Susan Bradley']",['Kevin Lima'],"['United States', 'United Kingdom']",['English'],"['Cruella Productions', 'Kanzaman S.A.M.', 'Walt Disney Pictures']"
213847,"Malèna is about the peril of a beauty through the eyes of a 12 year old kid named Renato. He experiences three things on the same day, beginning of war, getting a bike and sees the arrival of Malèna in town. Through his eyes, we see the curse of beauty and loneliness of Malena, whose husband is presumed to be dead, and through his soul we see his love for her.","['Monica Bellucci', 'Giuseppe Sulfaro', 'Luciano Federico', 'Matilde Piana', 'Pietro Notarianni']","['Verena Balco', 'Carles Berot', 'Massimo Bertucci', 'Lucia Bugoloni', 'Enrico Cavallaro']",['Giuseppe Tornatore'],"['Italy', 'United States']","['Italian', 'English', 'Latin', 'Greek, Ancient (to 1453)']","['Medusa Film', 'Miramax', 'Pacific Pictures', 'Tele+']"
180073,"The infamous writer, the Marquis de Sade of eighteenth century France, is imprisoned at Charenton Insane Asylum for unmentionable activities. He manages to befriend the young Abbé de Coulmier, who runs the asylum, along with a beautiful laundress named Madeline. Things go terribly wrong when the Abbe finds out that the Marquis' books are being secretly published. Emperor Napoleon contemplates sending Dr. Royer-Collard to oversee the asylum, a man famed for his torturous punishments. It could mean the end of Charenton and possibly the Marquis.","['Geoffrey Rush', 'Kate Winslet', 'Joaquin Phoenix', 'Michael Caine', 'Billie Whitelaw']","['Elaine Burt', 'Sandra Butterworth', 'Paul Clarvis', 'Nick Cooper', ""Susan d'Arcy""]",['Philip Kaufman'],"['United States', 'Germany', 'United Kingdom']","['English', 'Latin']","['Searchlight Pictures', 'Industry Entertainment', 'Walrus & Associates', 'Hollywood Partners', 'Charenton Productions']"
217869,"David Dunn (Willis) is taking a train from New York City back home to Philadelphia after a job interview that didn't go well when his car jumps the tracks and collides with an oncoming engine, with David the only survivor among the 131 passengers on board. Astoundingly, David is not only alive, he hardly seems to have been touched. As David wonders what has happened to him and why he was able to walk away, he encounters a mysterious stranger, Elijah Prince (Samuel L. Jackson), who explains to David that there are a certain number of people who are ""unbreakable"" -- they have remarkable endurance and courage, a predisposition toward dangerous behavior, and feel invincible but also have strange premonitions of terrible events. Is David ""unbreakable""? And if he is, what are the physical and psychological ramifications of this knowledge?","['Bruce Willis', 'Samuel L. Jackson', 'Robin Wright', 'Spencer Treat Clark', 'Charlayne Woodard']","['Donnell Barnes', 'Sarah Bay Williams', 'Steven F. Beaupre', 'Mary Berkelbach', 'Robert Biddle']",['M. Night Shyamalan'],['United States'],['English'],"['Touchstone Pictures', 'Blinding Edge Pictures', 'Barry Mendel Productions', 'Limited Edition Productions Inc.']"
190332,"In early nineteenth-century China, in the waning years of the Qing dynasty, the renowned swordsman who yearns for enlightenment, Li Mu Bai, decides to give up his legendary Green Destiny sword: the sharp four-hundred-year-old blade of heroes. To mark the end of a blood-stained career, Li entrusts the excellent female warrior, Yu Shu Lien, with the precious weapon to deliver it to Governor Yu; however, once there, an audacious and nimble masked thief manages to steal it. As Shu Lien is hot on the trail of the skilled burglar, unrequited loves; fervent passions; an unconquerable desire for freedom, and bitter loose ends stand in the way. Can Mu Bai shake off his violent past?","['Chow Yun-Fat', 'Michelle Yeoh', 'Ziyi Zhang', 'Chang Chen', 'Sihung Lung']","['Hong-Qun Bai', 'John Charles', 'Ching Wei Chen', 'Ling-Ying Cheng', 'Wei Cu']",['Ang Lee'],"['Taiwan', 'Hong Kong', 'United States', 'China']","['Mandarin', 'Chinese']","['Sony Pictures Classics', 'Columbia Pictures Film Production Asia', 'Good Machine', 'Edko Films', 'Zoom Hunt International Productions', 'China Film Co-Production Corporation', 'Asia Union Film & Entertainment Ltd.']"
190374,"The Empire of Izmer has long been a divided land. The Mages - an elite group of magic-users - rule whilst the lowly commoners are powerless. Izmer's young Empress, Savina, wants equality and prosperity for all, but the evil Mage Profion is plotting to depose her and establish his own rule. The Empress possesses a scepter which controls Izmer's Golden Dragons. To challenge her rule, Profion must have the scepter, and tricks the Council of Mages into believing Savina is unfit to hold it. Knowing that Profion will bring death and destruction to Izmer, Savina must find the legendary Rod of Savrille, a mythical rod that has the power to control Red Dragons, a species even mightier than the Gold. Enter two thieves, Ridley and Snails, who unwittingly become instrumental in Savina's search for the Rod. Joined by a feisty Dwarf named Elwood, and helped by the Empress's expert tracker, the Elf Norda, the young heroes go in search of the Rod of Savrille. From the deadly maze of the Thieves Guild at Antius to an Elven Village, secret grotto and abandoned castles, Ridley and his band must outwit Profion's chief henchman Damodar at every turn while, back in Izmer, Profion prepares to do battle with the Empress. All depends on the Rod, but the outcome of the race to reach it first is far from certain, and Izmar's very survival hangs in the balance.","['Jeremy Irons', 'Bruce Payne', 'Justin Whalin', 'Marlon Wayans', 'Robert Miano']","['Ota Bares', 'Rino Bonavita', 'Kathi Danielson', 'Joseph Ford', 'Dhananjay Galani']",['Courtney Solomon'],"['United States', 'Czechia', 'Canada']",['English'],"['New Line Cinema', 'Sweetpea Entertainment', 'Silver Pictures', 'Behaviour Worldwide', 'MDP Worldwide', 'Stillking Films']"
228750,"Americans Alice and Peter Bowman have traveled from third world country to third world country working on humanitarian projects. They are currently in Tecala, a country nestled in the Andes, as Peter, an engineer, has been hired by QUAD Carbon, an oil company - the moral ""enemy"" - to lead a project to construct a dam to prevent what is the constant flooding in the country. Alice and Peter eventually learn that QUAD Carbon cares nothing about the dam, which is just a smoke-screen to get an oil pipeline approved and built. Despite loving each other, they have had problems in the marriage of late because of being in Tecala, where Alice has not been able to find her place, and needing to deal with the aftermath of Alice's recent miscarriage. On his way to work one day, Peter, along with a group of others, are random kidnap victims of left wing guerrillas, the Liberation Army of Tecala (ELT), whose reason for being has changed from a political agenda to a monetary one, primarily getting said money through kidnapping and the drug trade in cocaine. The ELT may believe they can get good money for Peter being an oil company executive, despite he not being wealthy as he is not on the oil side of the business. Luthan Risk International, who is the contracted agency for QUAD Carbon's kidnap and ransom (K&R) requirements, dispatches Australian-British Terry Thorne to negotiate Peter's release, Terry an ex-special ops soldier who is known as the best in the business within his own circles. But QUAD Carbon's financial troubles may prevent Terry or anyone else from Luthan Risk helping to get Peter back. Regardless, Alice has to decide whether to trust Terry, the global expert, or locals assigned by QUAD Carbon whose actions are on the surface more promising despite Terry's assertions to the contrary. All, however, need constant proof that Peter is indeed still alive to continue with their work to get him back. But what Alice and Terry begin to feel for each other ultimately factors into what they decide to do in relation to Peter.","['Meg Ryan', 'Russell Crowe', 'David Morse', 'Pamela Reed', 'David Caruso']","['Leslie Adler', 'Alonso Alegría', 'Jennifer Allen', 'Elena Almeida', 'Ana Lucía Arizo']",['Taylor Hackford'],['United States'],"['English', 'Spanish', 'Russian', 'Italian', 'French']","['Castle Rock Entertainment', 'Bel Air Entertainment', 'Anvil Films']"
190865,"A high-adrenaline tale of young climber Peter Garrett, who must launch a treacherous and extraordinary rescue effort up K2, the world's second-highest peak. Confronting both his own limitations and the awesome power of nature's uncontrollable elements, Peter risks his life to save his sister, Annie, and her summit team in a race against time. The team is trapped in an icy grave at 26,000 feet - a death zone above the vertical limit of endurance where the human body cannot survive for long. Every second counts as Peter enlists the help of a crew of fellow climbers, including eccentric, reclusive mountain man Montgomery Wick, to ascend the chilling might of the world's most feared peak to save her.","[""Chris O'Donnell"", 'Robin Tunney', 'Stuart Wilson', 'Augie Davis', 'Temuera Morrison']","['Amanda Aitken', 'Jennifer Allen', 'Robin Allen-Paris', 'Karen S. Alvarez', 'Joe Barzo']",['Martin Campbell'],"['United States', 'Germany']","['English', 'Urdu']","['Columbia Pictures', 'Global Entertainment Productions GmbH & Company Medien KG', 'Mountain High Productions']"
86993,"The story of Lieutenant Bligh (Sir Anthony Hopkins), whose cruelty leads to a mutiny on his ship. Follows both the efforts of Fletcher Christian (Mel Gibson) to get his men beyond the reach of British retribution and the epic voyage of Lieutenant Bligh to get his loyalists safely to East Timor in a tiny lifeboat.","['Mel Gibson', 'Anthony Hopkins', 'Laurence Olivier', 'Edward Fox', 'Daniel Day-Lewis']","['Margaret Adams', 'Cathy Anderson', 'Craig Barwick', 'Lyn Galbraith', 'Terry Gilbert']",['Roger Donaldson'],"['United Kingdom', 'United States', 'New Zealand']",['English'],"['Dino De Laurentiis Company', 'Bounty Productions Ltd.']"
88936,"Eddie Cusack is a Chicago police officer about to bust some members of the Comacho gang when the gang is shot up by a rival drug gang from the neighboring building, led by Tony Luna. Victor Comacho is the only survivor of the Comacho gang and his older brother, Luis, who is the leader of the gang, retaliates by killing Luna's family and kidnaps Luna's daughter, Diana. Cusack must face Tony Luna and Luis Comacho alone because nobody on the police force is willing to help him since he was the only cop who broke the code of silence by testifying against a fellow cop who killed an unarmed teenager, but Cusack is not really alone. A police robot called ""Prowler"" aides Cusack as he takes down the gangs.","['Chuck Norris', 'Henry Silva', 'Bert Remsen', 'Mike Genovese', 'Nathan Davis']","['Alicia Anthony', 'Kevin Bassett', 'James A. Dennett II', 'Kim S. Hobbs', 'John Iltis']",['Andrew Davis'],['United States'],['English'],['Orion Pictures']
93748,"All that Neal Page wants to do is to get home for Thanksgiving. When bad weather cancels his flight, he decides on other means of transportation. As well as bad luck, Neal is blessed with the presence of Del Griffith, shower-curtain-ring salesman and all-around blabbermouth who is never short of advice, conversation, bad jokes, or company. And when he decides that he is going the same direction as Neal..","['Steve Martin', 'John Candy', 'Laila Robins', 'Michael McKean', 'Kevin Bacon']","['Iono Abrams', 'Kevin Richard Buxbaum', 'Peter Carley', 'Nyna Cravens', 'Katharine Ann Curtiss']",['John Hughes'],['United States'],['English'],"['Paramount Pictures', 'Hughes Entertainment']"
96094,"Jake and Kristy Briggs are newlyweds. Being young, they are perhaps a bit unprepared for the full reality of marriage and all that it (and their parents) expect from them. Do they want babies? Their parents certainly want them to. Is married life all that there is? Things certainly aren't helped by Jake's friend Davis, who always seems to turn up just in time to put a spanner in the works.","['Kevin Bacon', 'Elizabeth McGovern', 'Alec Baldwin', 'James Ray', 'Holland Taylor']","['Iono Abrams', 'Susan J. Bonno-Buckner', 'Peter Carley', 'John Craig', 'Kevin Cronan']",['John Hughes'],['United States'],['English'],"['Paramount Pictures', 'Hughes Entertainment', 'Seven Stars Film Partners']"
93428,"James Bond 007's mission is to firstly, organise the defection of a top Soviet general. When the general is re-captured, Bond heads off to find why an ally of General Koskov was sent to murder him. Bond's mission continues to take him to Afghanistan, where he must confront an arms dealer known as Brad Whitaker. Everything eventually reveals its self to Bond.","['Timothy Dalton', ""Maryam d'Abo"", 'Jeroen Krabbé', 'Joe Don Baker', 'John Rhys-Davies']","['Zakaria Alaoui', 'Simon Atherton', 'Reginald A. Barkshire', 'Maurice Binder', 'Albert R. Broccoli']",['John Glen'],['United Kingdom'],"['English', 'Arabic', 'French', 'German', 'Russian', 'Czech', 'Slovak', 'Dari', 'Pashto']",['Eon Productions']
92106,"The Decepticons have invaded and taken over the Autobots' home planet, Cybertron. The Autobots are determined to fight back and go to Autobot City on Earth for supplies. Decepticons hijack and take over the ship, resulting in a fierce battle between the Autobots and Decepticons, the result of which is devastating. A new threat to the Autobots appears in the form of Unicron, a massive planet-devouring transformer.","['Norman Alden', 'Jack Angel', 'Michael Bell', 'Gregg Berger', 'Susan Blu']","['Emi Araki', 'Mark Bakshi', 'Walter Baric', 'Douglas Booth', 'Michael Brochstein']",['Nelson Shin'],"['United States', 'Japan', 'Italy']","['English', 'Japanese']","['Sunbow Productions', 'Marvel Productions', 'Hasbro']"
94291,"On the Wall Street of the 1980s, Bud Fox is a stockbroker full of ambition, doing whatever he can to make his way to the top. Admiring the power of unsparing corporate raider Gordon Gekko, Fox entices Gekko into mentoring him by providing insider trading. As Fox becomes embroiled in greed and underhanded schemes, his decisions eventually threaten the livelihood of his scrupulous father. Faced with this dilemma, Fox questions his loyalties.","['Charlie Sheen', 'Tamara Tunie', 'Franklin Cover', 'Chuck Pfeiffer', 'John C. McGinley']","['Jeff Beck', 'Marion Billings', 'Al Cerullo', 'Peter DePalma', 'Elon Dershowitz']",['Oliver Stone'],['United States'],['English'],"['Twentieth Century Fox', 'Amercent Films', 'American Entertainment Partners L.P.']"
