imdbId,plot,cast,crew,director,countries,languages,production_companies
94612,"Jericho ""Action"" Jackson is a Detroit police sergeant who was demoted from lieutenant for almost tearing the arm off of sexually violent sociopath Sean Dellaplane, whose father is Peter Dellaplane, a major car manufacturer. But Dellaplane himself is violent as well. Dellaplane kills his wife Patrice by shooting her. And then he plants her body in Jackson's apartment, framing Jackson. Dellaplane won't miss Patrice very much, because he has a drug-addicted mistress named Sydney Ash. He keeps Sydney hooked with a free supply of heroin. Jackson suspects Dellaplane of masterminding a murder spree against local officials from the auto workers' union. Dellaplane's mission is to gain a political power base and choose the next president of the United States. Because of what happened to Dellaplane's son Sean, Dellaplane has taken a particular dislike to Jackson. Jackson gets Sydney's help in going after Dellaplane.","['Carl Weathers', 'Craig T. Nelson', 'Vanity', 'Sharon Stone', 'Tom Wilson']","['Paula Abdul', 'Aurorah Allain', 'Gordon Antell', 'Corey Burton', 'Lisa Cogswell']",['Craig R. Baxley'],['United States'],['English'],"['Lorimar Film Entertainment', 'Silver Pictures']"
105316,"As tensions of apartheid spread across South Africa, many students revolts to massive stone throw, a demonstration that comes in a wake of the introduction of Afrikaans language as a means of teaching. This sparks riots among school age young people who have resolved to do what it takes for freedom to come tomorrow. In a township of Soweto, a group of students, led by a beautiful and intelligent young girl, Sarafina, mastermind a plot to rise against the apartheid regime by vehemently rejecting the proposal to have Afrikaans as a medium of instruction. This angers the white people and results in a massive unrest of the students and those others supporting them. Meanwhile, Sarafina's mother accepts a job of a housekeeper in a white household and it angers Sarafina. Following the unrest of students and their possible torture and trial, Sarafina is released from prison, reunites with some of the colleagues and composes a ""Freedom is Coming Tomorrow"" song.","['Leleti Khumalo', 'Whoopi Goldberg', 'Miriam Makeba', 'John Kani', 'Dumisani Dlamini']","['Alison Ellard', 'Fiona Fraser', 'Mark R. Lindsay', 'Mbongeni Ngema', 'Michael Peters']",['Darrell Roodt'],"['South Africa', 'United Kingdom', 'France', 'United States']","['English', 'Zulu']","['British Broadcasting Corporation', 'Distant Horizon', 'Hollywood Pictures', 'Ideal', 'Les Films Ariane', 'Miramax', 'Vanguard Productions', 'Videovision Entertainment']"
102951,"Celeste Talbert has been the queen of the soaps for over two decades. Montana Moorehead needs to get her out of her way before she can move on and begins her program to get her to leave. She hires an old boyfriend of Celeste to be on the show and has Celeste become a murderer in the script, but each attempt has unforseen consequences.","['Cathy Moriarty', 'Teri Hatcher', 'Robert Downey Jr.', 'Sally Field', 'Paul Johansson']","['Cindy Lee Arnold', 'Michael Bircumshaw', 'Mark Burnett', 'Cheryl Burton', 'Cass Coty']",['Michael Hoffman'],['United States'],['English'],['Paramount Pictures']
100046,"Dramatizes the events in 1955-1956 in Montgomery, Alabama, when blacks boycotted public transport because they were forced to sit at the back. Odessa works as a maid for the Thompsons, and as well as she is treated, she feels it is her duty to walk to work, even if it means she is exhausted, and gets to work late.","['Sissy Spacek', 'Whoopi Goldberg', 'Dwight Schultz', 'Ving Rhames', 'Dylan Baker']","['Robert Dawson', 'Chappy Hardy', 'Joel Heller', 'R. Scott Loughran', 'Leigh Anne Sides']",['Richard Pearce'],['United States'],['English'],"['Dave Bell Associates', 'New Visions Pictures']"
94882,"David is a teenager whose parents are in a deteriorating marriage after their infant daughter dies. Clara is a chambermaid at a Jamaican resort who's hired to be a housekeeper. She and David develop a close bond, opening his eyes and heart to new experiences, and eventually leading to a disturbing secret in Clara's past.","['Whoopi Goldberg', 'Michael Ontkean', 'Kathleen Quinlan', 'Neil Patrick Harris', 'Spalding Gray']","['Diana Austin', 'Andrew M. Flinn', 'Katie Gilbert', 'Granville Greene', 'Moby Griffin']",['Robert Mulligan'],['United States'],['English'],"['MTM Enterprises', 'Warner Bros.']"
92710,"Bernice ""Bernie"" Rhodenbarr is a burglar by trade, and she runs a bookstore as well. Her friend Carl Hefler is a dog groomer. After a successful burglary, it's discovered that a dead body was in the house she burgled. As she's the only one who can be placed at the scene of the crime, she has to use her criminal skills to clear her name of the murder AND avoid getting charged with the burglary.","['Whoopi Goldberg', 'Bobcat Goldthwait', 'G.W. Bailey', 'Lesley Ann Warren', 'James Handy']","['Chris Silver Finigan', 'Stuart Fink', 'Patricia Graf', 'Thomas J. Hageboeck', 'Michael Herzmark']",['Hugh Wilson'],"['Canada', 'United States']",['English'],"['Nelvana', 'Warner Bros.']"
93011,"Rita Rizzoli is a narcotics police officer with a plethora of disguises. When a drug shipment is hijacked, the thieves don't know that the drug is unusually pure, and packs of ""Fatal Beauty"" begin turning up next to too many dead bodies. Mike Marshak works for the original owner of the drugs and tries to tell himself that since he does not handle the drugs, he is ""clean"". Mike becomes Rita's constant companion as the drug hijackers (who are nearly psychotic and very well armed) are hunted, while more and more bodies continue to turn up.","['Whoopi Goldberg', 'Sam Elliott', 'Rubén Blades', 'Harris Yulin', 'John P. Ryan']","['Shannon Kane', 'Sheldon Katz', 'Jamie Kehoe', 'Dolores Klinger', 'Patrice J. Klinger']",['Tom Holland'],"['United States', 'Japan']",['English'],"['Metro-Goldwyn-Mayer (MGM)', 'CST Telecommunications']"
187078,"In exchange for his little brother's life, the reformed car thief, Randall ""Memphis"" Raines, has to do the impossible: in less than three days, he has to steal not one, but fifty exotic supercars for the ruthless crime lord, Ray Calitri. To stand a chance of pulling off this intricate and time-sensitive grand theft auto, once more, Memphis has to rely on his old gang--his knowledgeable mentor, Otto; the old friends, Sphinx and Donny; his reluctant ex-girlfriend, Sway, and a band of tech-savvy young thieves--however, the police are already onto them. Now, fast Lamborghinis, precious Ferraris, luxurious Porsches, and Eleanor--a rare Ford Shelby Mustang GT500--are just some of the cars in Raines' long list. Can Memphis execute the perfect car heist?","['Nicolas Cage', 'Giovanni Ribisi', 'Angelina Jolie', 'T.J. Cross', 'William Lee Scott']","['Wendy Altman-Cohen', 'Delilah Anderson', 'Vanessa Bendetti', 'Daniel Berkowitz', 'Derek Beumer']",['Dominic Sena'],['United States'],['English'],"['Touchstone Pictures', 'Jerry Bruckheimer Films']"
179074,"Street pimps, all of them African-American, discuss their lives and work: getting started, being flamboyant, pimping in various U.S. cities, bringing a woman into their group, taking a woman from another pimp, and the rules and regulations of pimping. The men are clear: it's about money. The women work every night, hustle hard, turn over all their earnings, and steal anything they can from clients. We meet a few of the women, who tell us what they want from a pimp. We also listen to a women who's legally employed at a Nevada brothel; we meet her White boss, a legal pimp. He and the street pimps, some of whom are now retired, make the case for legalizing the trade.","['John S. Dickson', 'Antonio Fargas', 'Heidi Fleiss', 'L. Hammond', 'Hugh Hefner']","['Keith Barefoot', 'Jerry Kitz']",['Albert Hughes'],['United States'],['English'],['Underworld Entertainment']
182295,"The King of Navarre and his three companions swear a very public oath to study together and to renounce women for three years. Their honor is immediately put to the test by the arrival of the Princess of France and her three lovely companions. It's love at first sight for all concerned followed by the men's highly entertaining, but hopeless efforts to disguise their feelings.","['Alessandro Nivola', 'Alicia Silverstone', 'Natascha McElhone', 'Kenneth Branagh', 'Carmen Ejogo']","['Ben Blanco', 'Jon R. Brown', 'Gavin Charlton', 'Stanley Donen', 'Sally Hilton']",['Kenneth Branagh'],"['United Kingdom', 'France', 'United States']",['English'],"['Pathé Pictures International', 'Intermedia Films', 'Arts Council of England', 'StudioCanal', 'Miramax', 'Shakespeare Film Company']"
145503,"The film follows a Jewish family living in Hungary through three generations, rising from humble beginnings to positions of wealth and power in the crumbling Austro-Hungarian Empire. The patriarch becomes a prominent judge but is torn when his government sanctions anti-Jewish persecutions. His son converts to Christianity to advance his career as a champion fencer and Olympic hero, but is caught up in the Holocaust. Finally, the grandson, after surviving war, revolution, loss, and betrayal, realizes that his ultimate allegiance must be to himself and his heritage.","['Ralph Fiennes', 'Rosemary Harris', 'Rachel Weisz', 'Jennifer Ehle', 'Deborah Kara Unger']","['Imre Balla', 'Eva Banhidi', 'Réka Belsô', 'János Berki', 'Farkas Borsa']",['István Szabó'],"['Hungary', 'Germany', 'Canada', 'Austria', 'France', 'United Kingdom', 'United States']","['English', 'French', 'Hebrew', 'Latin', 'Italian', 'German']","['Serendipity Point Films', 'Kinowelt Filmproduktion', 'Bavaria Film and Television Fund', 'Channel Four Films', 'Dor Film Produktionsgesellschaft', 'Eurimages', 'Filmfonds Wien', 'Hungarian Motion Picture Fund', 'ISL Film', 'InterCom', 'Starhaus Filmproduktion', 'TV2', 'The Movie Network', 'Téléfilm Canada', 'Österreichischer Rundfunk']"
99726,"Hamlet returns to Denmark when his father, the King, dies. His mother Gertrude has already married Hamlet's uncle Claudius, the new King. They urge Hamlet to marry his beloved Ophelia. But soon the ghost of Hamlet's father appears and tells Hamlet that he was murdered by Claudius and Gertrude. Hamlet must choose between passive acquiescence and the need for a vengeance which might lead to tragedy.","['Mel Gibson', 'Glenn Close', 'Alan Bates', 'Paul Scofield', 'Ian Holm']","['Luciano Bacchielli', 'Jill Bennett', 'Maurice Binder', 'Lucia Boni', 'Francesca Castellano']",['Franco Zeffirelli'],"['United States', 'United Kingdom', 'France']",['English'],"['Icon Productions', 'Carolco Pictures', 'Canal+', 'Nelson Entertainment', 'Sovereign Pictures', 'Nelson Entertainment', 'Polyphony Digital']"
77362,"Sally Bender is the wife of a Captain in the U.S. Marine Corps. He is sent over to Vietnam, and Sally is alone. With nothing else to do, she decides to volunteer at a local veteran's hospital, where she meets Luke, who went to high school with Sally. Luke was wounded and is paralyzed and confined to a wheelchair. When Sally begins to fall in love with Luke, she has to make a crucial decision about her life.","['Jane Fonda', 'Jon Voight', 'Bruce Dern', 'Penelope Milford', 'Robert Carradine']","['Michael Jacobs', 'Lucile Jones', 'Caren Levin', 'Michael Maslansky', 'Bruce Nahin']",['Hal Ashby'],['United States'],['English'],"['Jerome Hellman Productions', 'Jayne Productions Inc.']"
82009,"""American Pop"" is the animated story of a very talented and troubled family starting with 19th century Russia and moving through several generations of musicians. The film covers American popular music from the pre-jazz age through rhythm and blues, 1950s rock 'n' roll, drug-laden psychedelia, and punk rock, finally ending with the onset of New Wave in the early 1980s.","['Ron Thompson', 'Mews Small', 'Jerry Holland', 'Lisa Jane Persky', 'Jeffrey Lippa']","['Paula Berteit', 'Ken Bornstein', 'Jeffrey Chernov', 'Christine Danzo', 'Dick Davis']",['Ralph Bakshi'],['United States'],"['English', 'Hebrew', 'Russian', 'Yiddish']","['Bakshi Productions', 'Aspen Productions (I)', 'Columbia Pictures', 'Polyc International BV']"
74156,"Police ambush and kill several gang members in Los Angeles. Gang members make a pact of blood to strike back at police, and conduct a siege on the police station which is almost abandoned and due to be closed. Staff of the closing precinct and the criminals being held there while in transit must work together to fight off the attacking gang members.","['Austin Stoker', 'Darwin Joston', 'Laurie Zimmer', 'Martin West', 'Tony Burton']","['Tom Hansen', 'Marla Miller', 'Randy Moore', 'Blake Schaefer', 'Jocelyne Stoikovitch']",['John Carpenter'],['United States'],['English'],['CKK']
93605,A mid-western farm boy reluctantly becomes a member of the undead when a girl he meets turns out to be part of a band of southern vampires who roam the highways in stolen cars. Part of his initiation includes a bloody assault on a hick bar.,"['Adrian Pasdar', 'Jenny Wright', 'Lance Henriksen', 'Bill Paxton', 'Jenette Goldstein']","['Larry Bartels', 'Laura Cartwright', 'Bundy Chanock', 'Kim Deen', 'Lisa Etherington']",['Kathryn Bigelow'],['United States'],['English'],"['F/M', 'Near Dark Joint Venture']"
102592,"In Los Angeles, after a violent drug rip-off, the Los Angeles Police Department detectives find the identity of the trio - the sadistic I.Q. of 150 and college graduate Lenny ""Pluto"" Franklyn; his not so bright buddy in San Quentin Ray Malcolm; and his girlfriend Fantasia. Their further investigation indicates that the criminals are fleeing to Star City, Arkanas, and LAPD detective Dud Cole and his partner John McFeely contact the local Chief of Police Dale 'Hurricane' Dixon and they head to the little town. The yokel family man Dale, who is used to resolve domestic issues, is fascinated with the chance to participate of a manhunt and befriends the two detectives. But when he sees the picture of Fantasia, he recognizes her as Lila Walker and is haunted by his past, hiding a secret about Lila Walker.","['Bill Paxton', 'Cynda Williams', 'Billy Bob Thornton', 'Michael Beach', 'Jim Metzler']","['Christopher Byrne', 'Liz Chiz', 'Melissa Cobb', 'Marcel Doumerc', 'Larry Fisch']",['Carl Franklin'],['United States'],['English'],['IRS Media']
67741,"John Shaft is the ultimate in suave Black detectives. He first finds himself up against Bumpy, the leader of the Black crime mob, then against Black nationals, and finally working with both against the White Mafia who are trying to blackmail Bumpy by kidnapping his daughter.","['Richard Roundtree', 'Moses Gunn', 'Charles Cioffi', 'Christopher St. John', 'Gwenn Mitchell']","['Bud Brown', 'Ozzie Brown', 'Tom Miller']",['Gordon Parks'],['United States'],['English'],"['Metro-Goldwyn-Mayer', 'Shaft Productions']"
71360,"Harry Caul is a devout Catholic and a lover of jazz music who plays his saxophone while listening to his jazz records. He is a San Francisco-based electronic surveillance expert who owns and operates his own small surveillance business. He is renowned within the profession as being the best, one who designs and constructs his own surveillance equipment. He is an intensely private and solitary man in both his personal and professional life, which especially irks Stan, his business associate who often feels shut out of what is happening with their work. This privacy, which includes not letting anyone into his apartment and always telephoning his clients from pay phones is, in part, intended to control what happens around him. His and Stan's latest job (a difficult one) is to record the private discussion of a young couple meeting in crowded and noisy Union Square. The arrangement with his client, known only to him as ""the director"", is to provide the audio recording of the discussion and photographs of the couple directly to him alone in return for payment. Based on circumstances with the director's assistant, Martin Stett, and what Harry ultimately hears on the recording, Harry believes that the lives of the young couple are in jeopardy. Harry used to be detached from what he recorded, but is now concerned ever since the deaths of three people that were the direct result of a previous audio recording he made for another job. Harry not only has to decide if he will turn the recording over to the director, but also if he will try and save the couple's lives using information from the recording. As Harry goes on a quest to find out what exactly is happening on this case, he finds himself in the middle of his worst nightmare.","['Gene Hackman', 'John Cazale', 'Allen Garfield', 'Frederic Forrest', 'Cindy Williams']","['Jim Bloom', 'Randy Carter', 'Wayne Fitzgerald', 'Mona Houghton', 'Leo Jones']",['Francis Ford Coppola'],['United States'],['English'],"['The Directors Company', 'The Coppola Company', 'American Zoetrope', 'Paramount Pictures']"
82220,"Drifter Richard Bone is temporarily living with his friends, married couple Alex and Mo Cutter, in Santa Barbara, while working for their mutual friend, George Swanson, as a salesman at his boat dealership. Rich and Mo may have ended up together if Rich had stuck around at the time, something that Mo can't help but think about now in Alex long having dropped out of life the result of his experience in Vietnam, which included losing an eye, an arm and a leg, he largely turning to the bottle to cope. Only when he is brought in as a suspect does Rich comes to the realization that what he saw off in the distance one rainy night in a back alley was the disposal of a dead body, the victim seventeen year old Vicky Duran. Spotting him in a crowd, Rich is ""certain"" that who he saw dump the body is one of Santa Barbara's most upstanding citizens, oil baron J.J. Cord. What Rich and Alex discover about Cord and his movements that evening fit with him being the perpetrator. Bringing in Vicky's sister, Val Duran, who wants justice for Vicky, Alex comes up with a scheme to expose Cord as the murderer, that scheme - sending Cord a blackmail letter, he responding to such with the requested moneys proving he the murderer - which requires Rich's cooperation as the front man. While this plot seems to have brought Alex back to life, it may be the impetus for forever changing the relationships between Rich, Alex and Mo.","['Jeff Bridges', 'John Heard', 'Lisa Eichhorn', 'Ann Dusenberry', 'Stephen Elliott']","['Amanda Gill', 'Josef Lustig', 'Jimmy Medearis', 'Dan Perri', 'Elise Rohden']",['Ivan Passer'],['United States'],"['English', 'Spanish']",['Gurian Entertainment']
77588,"A secret US agency behind the unscrupulous Childress gathers children with parapsychologic abilities and trains them to become killers in war situations. To rescue his son, who was officially declared dead after an arranged accident, the ex-CIA agent Peter investigates against Childress.","['Kirk Douglas', 'John Cassavetes', 'Carrie Snodgress', 'Charles Durning', 'Amy Irving']","['John G. Fox', 'Alan Ladd Jr.', 'Sam Irvin', 'Charles A. Tamburro']",['Brian De Palma'],['United States'],['English'],"['Twentieth Century Fox', 'Frank Yablans Presentations']"
70509,"Serious, hard-working student James T. Hart faces the rigors of his first year at Harvard Law School. The pressure to succeed is tremendous and some of the students form study groups while also spending a great many hours studying. Hart's greatest challenge is contract law and his professor, Charles W. Kingsfield Jr. Using the Socratic method, Kingsfield challenges his students with questions demanding accuracy and creativity in their responses and often humiliating those who are unable to respond. As the school year progresses, Hart faces many challenges but befriends Susan Fields - unaware that she has a connection that affects their relationship. Finally, Hart accommodates himself to whatever might come his way, accepting a new set of priorities in his life.","['Timothy Bottoms', 'Lindsay Wagner', 'John Houseman', 'Graham Beckel', 'James Naughton']",['John Jay Osborn Jr.'],['James Bridges'],['United States'],"['English', 'Latin']","['Thompson-Paul Productions', 'Twentieth Century Fox']"
82945,"NYPD officer, Daniel Ciello's involved in some questionable police practices. He's approached by IAB, and in exchange for him potentially being let off he's instructed to begin looking at the inner workings of police corruption. Danny agrees as long as he doesn't have to turn on his partners but he soon learns he cannot trust anyone. He must decide whose side he's on and who's on his.","['Treat Williams', 'Jerry Orbach', 'Richard Foronjy', 'Don Billett', 'Kenny Marino']","['Lilith Jacobs', 'Gabrielle Kelly', 'Jennifer Ogden', 'Phillip Schopper', 'Lucille Smith']",['Sidney Lumet'],['United States'],"['English', 'Spanish', 'Italian']",['Orion Pictures']
70666,"Serpico is a cop in the 1960s-early 1970s. Unlike all his colleagues, he refuses a share of the money that the cops routinely extort from local criminals. Nobody wants to work with Serpico, and he's in constant danger of being placed in life threatening positions by his ""partners"". Nothing seems to get done even when he goes to the highest of authorities. Despite the dangers he finds himself in, he still refuses to 'go with the flow', in the hope that one day, the truth will be known.","['Al Pacino', 'John Randolph', 'Jack Kehoe', 'Biff McGuire', 'Barbara Eda-Young']","['Dino De Laurentiis', 'Shari Leibowitz']",['Sidney Lumet'],"['Italy', 'United States']","['English', 'Italian', 'Spanish']","['Artists Entertainment Complex', 'Produzioni De Laurentiis International Manufacturing Company']"
43338,"Charles Tatum, a down-on-his-luck reporter, takes a job with a small New Mexico newspaper. The job is pretty boring until he finds a man trapped in an old Indian dwelling. He jumps at the chance to make a name for himself by taking over and prolonging the rescue effort, and feeding stories to major newspapers. He creates a national media sensation and milks it for all it is worth - until things go terribly wrong.","['Kirk Douglas', 'Jan Sterling', 'Robert Arthur', 'Porter Hall', 'Frank Cady']","['Francis J. Abdo', 'Henry Giles', 'Harry F. Hogan', 'Sally Hunt', 'Irene Martin']",['Billy Wilder'],['United States'],"['English', 'Spanish', 'Latin']",['Paramount Pictures']
56195,"In order to free his best friend Paul Bondi from jail, cowboy Jack Burns gets himself imprisoned only to find out that Bondi does not want to escape. Thus Burns breaks out on his own and is afterwards being chased in the mountains by sheriff Johnson with a helicopter and jeeps.","['Kirk Douglas', 'Gena Rowlands', 'Walter Matthau', 'Michael Kane', ""Carroll O'Connor""]",[''],['David Miller'],['United States'],"['English', 'Spanish']",['Joel Productions']
72226,"Lou-Jean, a blonde woman, tells her husband, who is imprisoned, to escape. They plan to kidnap their own child, who was placed with foster parents. The escape is partly successful, they take a hostage, who is a policeman and are pursued through to Texas...","['Goldie Hawn', 'Ben Johnson', 'Michael Sacks', 'William Atherton', 'Gregory Walcott']","['William S. Gilmore', 'Lucy Ballentine', 'Roy D. Smith', 'Nona Tyson']",['Steven Spielberg'],['United States'],['English'],"['Universal Pictures', 'Zanuck/Brown Productions']"
23622,"High class European thief Gaston Monescu meets his soul mate Lily, a pickpocket masquerading as a countess. The two join forces and come under the employ of Mme. Colet, the beautiful owner of the Colet perfume company. Gaston works as Mme. Colet's personal secretary under the alias Monsieur La Valle. Rumors start to fly as 'M. La Valle' steals Mme. Colet away from her other suitors. When the secret of his true identity catches up to him, Gaston is caught between the two beautiful women.","['Miriam Hopkins', 'Kay Francis', 'Herbert Marshall', 'Charles Ruggles', 'Edward Everett Horton']",[''],['Ernst Lubitsch'],['United States'],"['English', 'Italian', 'French', 'Russian', 'Spanish', 'German']",['Paramount Pictures']
90728,"Jack Burton, a rational, wise-cracking, long-distance trucker, is in for a big surprise when he decides to help his best friend Wang free his kidnapped fiancée, Miao Yin. But as Jack rushes headlong into the perilous criminal underworld of San Francisco's Chinatown, hot on the trail of centuries-old Chinese sorcerer David Lo Pan, the mystery of an ancient curse unfolds. Now, as Jack and his companions embark on a frenzied rescue mission in the heart of the sorcerer's dark labyrinth, Lo Pan's deadly minions, blood-curdling supernatural horrors, and a trio of unstoppable Kung Fu masters stand in the way of success. Can Jack save the girl from the magician's clutches and live to tell the tale?","['Kurt Russell', 'Kim Cattrall', 'Dennis Dun', 'James Hong', 'Victor Wong']","['Susan Alpert', 'Christine Baer', 'Linda Brachman', 'Dale Brady', 'Kevin Brennan']",['John Carpenter'],['United States'],"['English', 'Cantonese']","['Twentieth Century Fox', 'TAFT Entertainment Pictures', 'SLM Production Group', 'Taft/Barish/Monash']"
