imdbId,plot,cast,crew,director,countries,languages,production_companies
88206,"After a power source for the community of Krypton survivors is accidentally whisked to earth, Kara-El, cousin to Superman and niece to Jor-El, chooses to go to earth to find it, and bring it back. Upon her arrival, she becomes just a powerful and Super as her cousin, but encounters dangerous battles and unexpected obstacles when a mean spirited woman who practices rituals of the occult takes the power source for herself, and uses it to cause destruction and attempt zenith human status.","['Faye Dunaway', 'Helen Slater', ""Peter O'Toole"", 'Mia Farrow', 'Brenda Vaccaro']","['Gordon Arnell', 'Brian Bailey', 'Kate Barton', 'Gillian Bates', 'June Broom']",['Jeannot Szwarc'],"['United Kingdom', 'United States']",['English'],"['Artistry Limited', 'Cantharus Productions', 'Investors In Industry PLC', 'Major Studio Partners', 'Pueblo Film', 'Robert Fleming Leasing Limited', 'St. Michael Finance Limited', 'Warner Bros.']"
160009,"Shaw is an operative for the United Nations' covert dirty-tricks squad, using espionage and quasi-ethical tactics to secure peace and cooperation. When a shipping container full of dead Vietnamese refugees turns up on the docks and China's ambassador is gunned down at a dinner celebrating a new trade agreement with China and the US, Shaw is framed for the murder and must evade the FBI and Triad gangsters to find out what is really going on.","['Wesley Snipes', 'Donald Sutherland', 'Maury Chaykin', 'Anne Archer', 'Marie Matiko']","['Guy Aumond', 'Josef Brandmaier', 'Dominique Brault', 'Al Cerullo', 'Paul Dupont']",['Christian Duguay'],"['United States', 'Canada']",['English'],"['Morgan Creek Entertainment', 'Franchise Pictures', 'Amen Ra Films', 'Filmline International', 'Imperial Entertainment Group', 'Canadian Film or Video Production Tax Credit', 'Quebec Film and Television Tax Credit', 'Echelon Productions, Inc.', ""Mel's Cite du Cinema""]"
204946,"Torrance Shipman has been chosen to lead the Rancho Carne High cheer team in Big Red's place. Aaron thinks that Torrance can't lead the team to the championships, but she is determined to prove her so-called boyfriend wrong. During practice, Carver gets injured and she must find another teammate. Torrance picks Missy Pantone to take Carver's place, due to her athletic prowess. Missy soon notices the moves her team are performing during the game actually belongs to the Clovers, a rival high school she attended years ago. The Clovers team is lead by Isis, who is hell-bent on defeating Rancho Carne Toros. It is soon discovered that Big Red is responsible for stealing the Clovers' cheer routine by filming their moves secretly and claiming them as their original routine, causing Torrance to make a new cheerleading performance so they can qualify for the upcoming national championships. Torrance soon develops a romantic attraction for Cliff Pantone, an aspiring musician and Missy's brother.","['Kirsten Dunst', 'Eliza Dushku', 'Jesse Bradford', 'Gabrielle Union', 'Clare Kramer']","['Stacy Adair', 'Kitty Adkins', 'Mark Barclay', 'Cecilia Cardwell', 'Allison Chesher']",['Peyton Reed'],['United States'],['English'],"['Beacon Communications', 'Beacon Pictures', 'Wonderworks Films']"
198386,"Four former made men, struggling to get by in a rundown Miami hotel, come up with a plot to drive out all of the young tenants that are slowly taking over the beach-front hotel and driving up their rent. Taking a man that was found dead on the beach, they arrange what appears to a mob hit and provide a note that says more killings are to occur. Unfortunately the old man they use turns out to be the senile father of a drug lord. The drug lord declares war on the killers of his father, thinking it was an action of his enemies. A stripper learns of the old men's involvement and threatens to squeal on them unless they kill her stepmother. Meanwhile, one man searches for his long-lost daughter, who is the investigating police officer, trying to divest herself from her crumb fellow officer and former boyfriend.","['Richard Dreyfuss', 'Burt Reynolds', 'Dan Hedaya', 'Seymour Cassel', 'Carrie-Anne Moss']","['Danielle J. Baker', 'Paul Barth', 'Ricou Browning Jr.', 'Patrick Fox', 'Carol Green']",['Michael Dinner'],['United States'],"['English', 'Spanish']","['Touchstone Pictures', 'George Litto Productions', 'Sonnenfeld Josephson Worldwide Entertainment']"
234137,"When her rather explicit copy is rejected, magazine journalist Kate is asked by her editor to come up with an article on loving relationships instead, and to do so by the end of the day. This gets Kate thinking back over her own various experiences, and to wondering if she is in much of a position to write on the subject.","['Famke Janssen', 'Jon Favreau', 'Noah Emmerich', 'Ann Magnuson', 'Cheri Oteri']","['Dana Byal', 'Barbara Casner', 'Catherine Christensen', 'Rich Colgin', 'Devin Cutler']",['Valerie Breiman'],"['United States', 'Canada']",['English'],"['Behaviour Worldwide', 'MDP Worldwide']"
161216,"Five years after Yippie founder Abbie Hoffman goes underground to avoid a drug-related prison sentence, he contacts a reporter to get out the story of the FBI's covert spying, harassment and inciting of violence they then blame on the Left. The skeptical reporter interviews Anita, Hoffman's wife, a single mom on welfare in New York City; Hoffman's attorney, Gerry Lefcourt; and others. As they talk, we see Hoffman's career in flashbacks, from early civil rights organizing through the trial of the Chicago Eight. While underground, as mental illness takes its toll, he meets Johanna Lawrenson, and an odd family develops: Abbie, Anita, their son, and Johanna. Will vindication ever arrive?","[""Vincent D'Onofrio"", 'Janeane Garofalo', 'Jeanne Tripplehorn', 'Kevin Pollak', 'Donal Logue']","['James Azzopardi', 'Jason Bretz', 'Donald Colafranceschi', 'Melissa Crich', 'Patricia Hanley Cumming']",['Robert Greenwald'],['United States'],['English'],"['Ardent Films', 'Greenlight Productions', 'Lakeshore International', 'Robert Greenwald Productions']"
144964,"When Connor MacLeod sees his old friend Rachel die in an explosion, he's had it with his immortal life and the endless pain it brings him and those he loves. He locks himself inside the Sanctuary, a Watcher-organized retreat stationed on holy ground, where immortals who are tired of the game can go to forever escape it, as well as to ensure that The Prize never falls into the wrong hands. But when an old enemy, Jacob Kell, and his posse of assassins attack the Sanctuary and kill everyone there but Connor, he is forced out into the open and into battle. Kell and Connor were friends once, and knew each other back when Connor was cast from Glenfinnan; he returned when news came that his mother was to be burned at the stake, and in the attempt to free her, Kell was killed by none other than Connor himself, and became an immortal, bitter with hate, and devoted to making Connor's life a living hell. In the present day, Connor's kinsman Duncan MacLeod is attacked by Kell's posse, including Kate, an old love of Duncan's who seeks revenge for her unwillingly being made an immortal centuries ago. This attack had something to do with Connor, and Duncan goes in search of him to find out why. In the process, he learns that in the 450 years since Connor and Kell's encounter in Glenfinnan, Kell has taken more than 600 heads and gained enough power to be called nothing less than the most powerful immortal alive. To make things worse, neither Connor nor Duncan are strong enough to face Kell alone.","['Adrian Paul', 'Christopher Lambert', 'Bruce Payne', 'Lisa Barbuscia', 'Donnie Yen']","['Catherine Charlton', 'Paige Chaytor', 'Rodica Gina Coclea', 'David Seth Cohen', 'Abbi Collins']",['Douglas Aarniokoski'],['United States'],"['English', 'French', 'Scottish Gaelic']","['Davis-Panzer Productions', 'Dimension Films']"
187696,"Medical student Paula Henning wins a place at an exclusive Heidelberg medical school. When the body of a young man she met on the train turns up on her dissection table, she begins to investigate the mysterious circumstances surrounding his death, and uncovers a gruesome conspiracy perpetrated by an Antihippocratic secret society operating within the school.","['Franka Potente', 'Benno Fürmann', 'Anna Loos', 'Sebastian Blomberg', 'Holger Speckhahn']","['Sedat Aslan', 'Dominik Auer', 'Borjana Barth', 'Jean Brauner', 'Claus Brockmeyer']",['Stefan Ruzowitzky'],['Germany'],"['German', 'Latin']","['Deutsche Columbia TriStar Filmproduktion', 'Claussen & Wöbke Filmproduktion GmbH']"
171580,"Kansas City waitress, Betty (Renée Zellweger), with dreams of becoming a nurse, becomes delusional after seeing her no-good car salesman husband murdered. Becoming delusional from shock, she becomes convinced that she is the former fiancée of her soap opera idol. What she also believes is that the soap opera is real and goes to Los Angeles, California to find the hospital where he works as a cardiologist. Meanwhile, her husband's murderers are searching for the drugs stolen by her husband and, as luck would have it, they are stored in the trunk of the car in which she drove off. Charlie (Morgan Freeman), an aging hitman planning his retirement after this job, also becomes delusional about the woman he is tracking.","['Morgan Freeman', 'Renée Zellweger', 'Chris Rock', 'Greg Kinnear', 'Aaron Eckhart']","['Gina Amoroso', 'Paul Ballon', 'Michael S. Baumohl', 'Jeff Bilger', 'David Boyle']",['Neil LaBute'],"['Germany', 'United States']","['Italian', 'English', 'Spanish']","['Gramercy Pictures (I)', 'Pacifica Film', 'Propaganda Films', ""ab'-strakt pictures"", 'IMF Internationale Medien und Film GmbH & Co. Produktions KG']"
190798,"Maria, whose parents live in the country, cannot stand her father's authoritarian ways and moves to the city. She finds a job as a cleaner and tries to survive in a wretched apartment in the shabby part of a big city. She is pregnant, and the fact that her boyfriend has abandoned her does not help matters. When her father goes to the hospital for an operation, her mother comes to stay with her. Her neighbor, an old recluse whose only friend is his dog, begins to come out of his shell and these three lost souls try to give each other the strength to start over.","['María Galiana', 'Ana Fernández', 'Carlos Álvarez-Nóvoa', 'Antonio Dechent', 'Paco De Osca']","['Sofía Aguilar', 'Juan Carlos Arrabal', 'J. Ignacio Astarida', 'José Manuel Astarida', 'Chelo Barrera']",['Benito Zambrano'],"['Spain', 'Canada']",['Spanish'],"['Maestranza Films', 'Canal Sur Televisión', 'Canwest Entertainment', 'Fireworks Pictures', 'Vía Digital']"
204626,"David Allen Griffin is a cool killer- time and time again, he chooses a female victim, studies her for weeks till he knows her routine to the smallest detail, makes meticulous preparations using his forensic knowledge to gain entry when she's quite alone, subdues her and administers a long, torturous death. Joel Campbell got so frustrated by his failure to capture Griffin in Los Angeles, that he quit the FBI, moved to Chicago, and remains in psychiatric therapy, unable to function normally. Then he realizes, when opening his mail very late, that a new murder victim is Griffin's, and the killer sent him pictures of her. Campbell reports this to the police, but is unwilling to join them in the search, suggesting Griffin is too slick and clever; yet he won't get out of it that easily.","['James Spader', 'Marisa Tomei', 'Keanu Reeves', 'Ernie Hudson', 'Chris Ellis']","['Jeffrey Brown', 'Laurie Carreira', 'Jonas Cukierman', 'Leslie Anne Engel', 'Eric L. Fersten']",['Joe Charbanic'],"['United States', 'Canada', 'Vietnam']","['English', 'Vietnamese']","['Lewitt / Eberts Productions', 'Choi Niami Productions', 'Driven Productions', 'Gamma Entertainment', 'Interlight']"
202677,"Two petty, violent criminals kidnap a woman who is being paid $1million to be a surrogate mother. As the baby is for a gangster, the pair's demand for money sees several henchmen and assorted other ruthless characters head after them to Mexico. Bullets rather than talking are always going to settle this one.","['Ryan Phillippe', 'Benicio Del Toro', 'Juliette Lewis', 'Taye Diggs', 'Nicky Katt']","['Nathan Alexander', 'Dennis Burrell', 'Patrick Carnahan', 'Brenton Chu', 'Ryan Cooke']",['Christopher McQuarrie'],['United States'],"['English', 'Spanish']","['Artisan Entertainment', 'Aqaba Productions']"
181875,"The early 1970s. William Miller is 15-years old and an aspiring rock journalist. He gets a job writing for Rolling Stone magazine. His first assignment: tour with the band Stillwater and write about the experience. Miller will get to see what goes on behind the scenes in a famous band, including the moments when things fall apart, and for him, it will be a period of new experiences and finding himself.","['Billy Crudup', 'Frances McDormand', 'Kate Hudson', 'Jason Lee', 'Patrick Fugit']","['Rachel Aberly', 'Edward Allen', 'Wendy Altman-Cohen', 'Lori Ashcraft', 'Robert James Ashe']",['Cameron Crowe'],['United States'],"['English', 'French']","['Dreamworks Pictures', 'Columbia Pictures', 'Vinyl Films']"
211938,"In New York, Alvin Sanders is a small-time thief who's just been hauled in for stealing a bunch of prawns (shrimp) from a local restaurant. He ends up in a cell with John Jaster, one half of a high-tech criminal team that's just stolen $42,000,000 worth of gold from the Federal Reserve. Realizing that he could die at any moment from his worsening heart condition, Jaster tells Alvin to relay a cryptic message to his wife about the whereabouts of the hidden gold. Alvin doesn't know exactly what the message means, and Edgar Clenteen, the U.S. Treasury investigator working the case, hopes it will lead to the gold or Jaster's partner Bristol, but it does neither. Eighteen months later, Jaster is dead, and both Clenteen and Bristol are still looking for that gold. Clenteen decides to secretly plant a tracking device in Alvin's jaw, release him from prison, and then let the word out that he knows where the gold is hidden. Knowing that Bristol is probably watching their every move, Clenteen hopes Alvin will act as the bait that'll lure Bristol in. To the dismay of Clenteen and his colleagues, agents Wooly, Blum, Boyle, and Walsh, who are tracking Alvin's every word and move, Alvin immediately gets into trouble, although he decides to go straight once he learns that while he was in prison, his girlfriend Lisa Hill gave birth to their son. Even so, run-ins with his criminal brother, Stevie Sanders and Stevie's two partners, Ramundo and Julio, puts Alvin in danger of being locked up again, which threatens to mess up Clenteen's plan. What will happen when Alvin realizes that he's being used as bait to nail Bristol?","['Jamie Foxx', 'David Morse', 'Robert Pastorelli', 'Doug Hutchison', 'Kimberly Elise']","['Kelley Baker', ""John 'Frenchie' Berger"", 'Liza Bigger', 'Pauline Chung', 'Timothy Clarkin']",['Antoine Fuqua'],"['Canada', 'United States']",['English'],"['Castle Rock Entertainment', 'Bait Films']"
197384,"This is a contemporary fable loosely based on Fyodor Dostoyevsky's ""Crime and Punishment"". Roseanne is outwardly a perfect and popular teen. However, her image is hiding the abuse at her stepfather's hands, and she decides to take revenge. The events that follow are a mix of dark humor and an exploration of modern morality as Roseanne faces not only a fellow suburbanite who knows, but her own conscience as well.","['Monica Keena', 'Ellen Barkin', 'Michael Ironside', 'Vincent Kartheiser', 'James DeBello']","['Laird Adamson', 'Amy Agzarian', 'Frank George Agzarian', 'Tamara Allen', 'Gina Amador']",['Rob Schmidt'],['United States'],['English'],"['G2 Films', 'Killer Films']"
134630,"Duets is a road-trip comedy which revolves around the little known world of karaoke and the whimsical characters who inhabit it. There's the struggling singer who dreams of making it to the big time, a frustrated salesman who ends up on an unexpected road trip, the dysfunctional family performers which includes a con-artist and his long lost daughter, and an escaped convict with the voice of an angel. All roads lead to Omaha, site of a national karaoke competition where this motley group of singers and stars come together for a blow-out sing-off.","['Lochlyn Munro', 'Carol Alexander', 'Michael J Rogers', 'Huey Lewis', 'Amanda Kravat']","['Mike Alberts', 'Ryan Argente', 'Donna Armstrong', 'Gregory Astop', 'Ildiko Barritt']",['Bruce Paltrow'],['United States'],['English'],"['Hollywood Pictures', 'Seven Arts Productions', 'Beacon Communications', 'Karaoke Productions']"
182508,"Charlie takes an odyssey through grief during a fall weekend in New York City. His encounters are planned and chance: with a homeless man who sleeps by his building, with a friend who's dying, with the couple who lives (and noisily loves) in the flat above him, with a bartender and a one-night-stand he follows home, and with a tattooed stranger whom he seeks out and befriends. Along the way, Charlie inhabits a city full of moments of violence and of stories and legends: a kidney thief, a microwaved poodle, a rat in a hot dog bun, a baby left on a car top, a tourist's toothbrush, needles in public-phone change slots. Charlie lives and tells his own stories. What caused his melancholy?","['Dan Futterman', 'Sam Ball', 'Lothaire Bluteau', 'Alan Cumming', 'Josh Hamilton']","['Marc Castle', 'Derek Decelles', 'Ross Guidici', 'Robert Hawk', 'Doug Lindeman']",['Jon Shear'],['United States'],['English'],"['Daly-Harris Productions', 'Davis Entertainment Classics']"
181836,"America's 7th Best Superhero Team, the Specials, are a group of geeks and oddballs. We get to see one day in their lives as fan and new member Nightbird joins the group, just in time for the group to get a new line of action figures. But the members' extreme personalities and personal issues threaten to rip the group apart.","['Jordan Ladd', 'Rob Lowe', 'Jamie Kennedy', 'Mike Schwartz', 'Thomas Haden Church']","['Max Berryhill', 'Brent Burpee', 'Crystal Connell', 'Eric Harbert']",['Craig Mazin'],['United States'],['English'],"['Brillstein-Grey Entertainment', 'Mindfire Entertainment']"
164212,"A lawyer is asked to come to the police station to clear up a few loose ends in his witness report of a foul murder. This will only take ten minutes, they say, but it turns out to be one loose end after another, and the ten minutes he is away from his speech become longer and longer...","['Gene Hackman', 'Morgan Freeman', 'Thomas Jane', 'Monica Bellucci', 'Nydia Caro']","['Sandrine Altglas', 'Aida Luz Balestra-Torres', 'Bruno Barde', 'Sophie Bataille', 'Jean-Louis Capra']",['Stephen Hopkins'],"['France', 'United States']","['English', 'Spanish', 'Italian']","['Revelations Entertainment', 'TF1 International']"
192731,"Urban Legends: The Final Cut follows Amy Mayfield (Morrison), a student at Alpine University who struggles to complete her thesis film on urban legends - only to have her crew members fall prey to fatal 'accidents.' Suspicious, Amy investigates and discovers a much more sinister hand at work. Now she must unmask the killer before she, too, becomes an urban legend.","['Jennifer Morrison', 'Matthew Davis', 'Hart Bochner', 'Loretta Devine', 'Joey Lawrence']","['Cassandra Barbour', 'Joseph Diaz', 'Janet Ellis', 'Missy Eustermann', 'Dana Fox']",['John Ottman'],"['United States', 'Canada']",['English'],"['Phoenix Pictures', 'Canal+ Droits Audiovisuels', 'Aon/Ruben-Winkler Entertainment Insurance', 'Original Film']"
206420,"Plagued by chronic motion sickness, Isabella--a sultry Brazilian belle, and a gifted chef--needs to be in control in every aspect of her life: in her car; in the kitchen; on the dance floor, and of course, during sex. Needless to say, this confusing situation drives Isabella's husband, Toninho, crazy--and after one infidelity too many--the feisty young woman decides to do what she knows best: take over the reins of her life, and move to San Francisco. There, a brilliant career as the presenter of her TV cooking show awaits Isabella--and for the first time in a long while--she feels loved. Will guilty Toninho realise what he's lost?","['Penélope Cruz', 'Murilo Benício', 'Harold Perrineau', 'Mark Feuerstein', 'John de Lancie']","['Terran Benveniste', 'Beth M. Bodo', 'Francisco Cortés', 'Darlene Eliopoulos', 'Gary Gillingham']",['Fina Torres'],['United States'],"['English', 'Portuguese']","['Propaganda Films', 'Searchlight Pictures']"
168629,"In small-town Washington state in 1964, Czechoslovakian immigrant Selma Jezková and her preteen son Gene live in a rented trailer owned by Bill and Linda Houston; Bill is the town sheriff. Selma also has a small group of friends, including her co-worker and primary confidante Kathy, and Jeff, who wants to be her boyfriend. Jeff regularly waits outside Selma's workplace to drive her home, although she always refuses, not wishing to lead him on. Her primary job is working on the Anderson Tool factory assembly line, but she does whatever else she can to earn money. What only Kathy knows among Selma's friends is that she is slowly going blind from a genetic medical condition. She can see just enough to be able to do her job. Her primary reason for moving to the USA and working all the time is to earn enough money for an operation for Gene when he turns 13; he knows nothing about his mother's or his own degenerative eyesight. Selma allows only one indulgence in her life: anything to do with musicals which she loves, because they're an escape from her bleak life. Kathy often takes her to the cinema to watch old musicals and must describe to her what's happening on the screen, to the other patrons' annoyance. Selma also has the role of Maria in a community-theatre production of ""The Sound of Music."" Close to having enough money for the operation, Selma races against time before she loses enough sight to lose her job and her role in the musical. What may also threaten Selma's goal of the operation for Gene is some financial problems facing Bill, who feels pressured to provide Linda with the comforts of life to which she's accustomed.","['Björk', 'Catherine Deneuve', 'David Morse', 'Peter Stormare', 'Joel Grey']","['Malini Ahlberg', 'Mattias Andersson', 'Mette Berggreen', 'Andrea F. Cannistraci', 'Jonas Frederiksen']",['Lars von Trier'],"['Denmark', 'Germany', 'Netherlands', 'Italy', 'United States', 'United Kingdom', 'France', 'Sweden', 'Finland', 'Iceland', 'Norway']","['English', 'German', 'Czech']","['Zentropa Entertainments', 'Trust Film Svenska', 'Film i Väst', 'Liberator Productions', 'Pain Unlimited GmbH Filmproduktion', 'Cinematograph A/S', 'What Else? B.V.', 'Icelandic Film', 'Blind Spot Pictures Oy', 'France 3 Cinéma', 'Danmarks Radio (DR)', 'Arte France Cinéma', 'SVT Drama', 'ARTE', 'Angel Films', 'Canal+', 'FilmFour', 'Fine Line Features', 'Filmek A/S', 'Constantin Film', 'Lantia Cinema & Audiovisivi', 'TV 1000', 'Vrijzinnig Protestantse Radio Omroep (VPRO)', 'Westdeutscher Rundfunk (WDR)', 'Yleisradio (YLE)', ""Centre national du cinéma et de l'image animée (CNC)"", 'Memfis Film', 'Slot Machine']"
218839,"At the prestigious Mayflower Dog Show, a ""documentary film crew"" captures the excitement and tension displayed by the eccentric participants in the outrageously hilarious satire Best In Show. This biting send-up exposes the wondrously diverse dog owners who travel from all over America to showcase their four-legged contenders. Mild-mannered salesman Gerry Fleck (Eugene Levy) and his vivacious wife, Cookie (Catherine O'Hara), happily prepare their Norwich Terrier, while shop owner Harlan Pepper (Christopher Guest) hopes his Bloodhound wins top prize. As two upwardly mobile attorneys (Parker Posey and Michael Hitchcock) anxiously ready their neurotic Weimaraner and an ecstatically happy gay couple (Michael McKean and John Michael Higgins) dote on their tiny Shih Tzu, inept commentator Buck Laughlin (Fred Willard) vainly attempts to provide colorful tidbits about each breed.","['Jay Brazeau', 'Parker Posey', 'Michael Hitchcock', ""Catherine O'Hara"", 'Eugene Levy']","['Michelle Almaz Tadege', 'David Auge', 'Robert Bauer', 'Derrick Beckles', 'Karin Behrenz']",['Christopher Guest'],['United States'],['English'],['Castle Rock Entertainment']
210567,"Sometimes you have to give up the life of your dreams, to discover the dream of your life... On her journey to become the next Miss American Miss, a young woman is forced to reevaluate her life's goal and, in the process, discovers what's really important and what it truly means to be... Beautiful.","['Minnie Driver', 'Joey Lauren Adams', 'Hallie Eisenberg', 'Kathleen Turner', 'Leslie Stefanson']","['Michael Barnes', 'Damien Breen', 'Michael Carriere', 'Aloura Melissa Charles', 'John Chisholm']",['Sally Field'],"['United States', 'United Kingdom']",['English'],"['Destination Films', 'Flashpoint', 'Fogwood Films', 'Prosperity Pictures', 'Two Drivers Productions Company']"
211219,"[""A rockumentary about the Canadian rock band Barenaked Ladies's life, in a nutshell.""]","['Steven Page', 'Ed Robertson', 'Jim Creeggan', 'Tyler Stewart', 'Kevin Hearn']","['Andrew Cunningham', 'James Jackman', 'Simon St. Laurent']",['Jason Priestley'],['Canada'],['English'],"['Finale Post Production', 'Nettfilms']"
