imdbId,plot,cast,crew,director,countries,languages,production_companies
330069,['The comedic stylings of four sort-of famous funnymen are brought to the big screen courtesy of this 2002 documentary.'],"['Jeff Foxworthy', 'Bill Engvall', 'Ron White', 'Larry the Cable Guy', 'Heidi Klum']","['Wayne Barker', 'Jae Benjamin', 'Denise Berry', 'Wesley S. Bloom', 'Amy R. Chaudry']",['C.B. Harding'],['United States'],['English'],"['Gaylord Films', 'Pandora Cinema', 'Parallel Entertainment']"
305711,"Charming, relatively poor, somewhat goofy Tom falls in love with haughty snob tycoon McNerney's spoiled daughter Sarah, who was destined for a more socialite match, such as slick Peter Prentiss. They still get married and fly to Europe for a romantic honeymoon Tom can't afford. Their love gets tested dangerously by misfortune of technical and other kinds all the way. Worse, Peter catches up with them on a mission to 'make Sarah see sense' just when the newlyweds are furious at each other.","['Ashton Kutcher', 'Brittany Murphy', 'Christian Kane', 'David Moscow', 'Monet Mazur']","['Matt Adler', 'Peter Arpesella', 'Christian Aubert', 'Robert Bahar', 'Maggie Baird']",['Shawn Levy'],"['Germany', 'United States']","['English', 'Italian', 'French', 'German']","['Twentieth Century Fox', 'Robert Simonds Productions', 'Mediastream Dritte Film GmbH & Co. Beteiligungs KG']"
291172,"Olivier - meticulous, careful, even-handed - teaches carpentry at a vocational school in Liège. He's asked to take on Francis, 16, a new student. He declines the request then begins to watch, even spy on, the new lad. Olivier knows something. Later that day, he's visited by Magali, his ex-wife, who tells him that she's remarrying and is pregnant. Olivier seems to follow instinctive responses: ""why today?"" he demands of Magali; he continues to follow Francis; he changes his mind about enrolling the youth. What's the history between the two? After that becomes clear, what is it Olivier will do? Is this precise and measured carpenter in control of himself?","['Olivier Gourmet', 'Morgan Marinne', 'Isabella Soupart', 'Nassim Hassaïni', 'Kevin Leroy']",['Anne-Catherine Leboutte'],['Jean-Pierre Dardenne'],"['Belgium', 'France']",['French'],"['Archipel 35', 'Les Films du Fleuve', 'Radio Télévision Belge Francophone']"
295289,"When he wakes up the morning after his bachelor party in bed with a strange woman, a man presumes he must have cheated on his fiancée. Guilt leads him to try to cover it up in the week before the wedding, high jinks ensue.","['Jason Lee', 'Julia Stiles', 'Selma Blair', 'James Brolin', 'Shawn Hatosy']","['Evan Allen', 'Peter Almolky', 'Michele Barber', 'Josh Bodnar', 'Barbara Brown']",['Chris Koch'],['United States'],['English'],"['Metro-Goldwyn-Mayer (MGM)', 'David Ladd Films']"
257568,"Louis Booker and Charlie Carbone are close friends with an association with the mob. After the duo botch a delivery of stolen TVs, the duo are given a second chance by mob leader Sal Maggio, who happens to be Charlie's stepfather. The duo are to deliver $50,000 to a contact in Australia. As simple as the job sounds, complications emerge when a kangaroo steals the money. Now Charlie and Louis must find the kangaroo and get the money back before they find themselves in a worse predicament.","[""Jerry O'Connell"", 'Anthony Anderson', 'Estella Warren', 'Christopher Walken', 'Marton Csokas']","['Jennifer Akana Sturla', 'Gordon Andersen', 'Orna Banarie', 'Kate Brown', 'Andrea Bruce']",['David McNally'],"['United States', 'Australia']",['English'],"['Castle Rock Entertainment', 'Jerry Bruckheimer Films', 'Warner Bros.']"
271668,"Earl and Hank have only one thing in common: they're both L.A.P.D. rejects. One just got kicked out, the other can't even get in. After confronting each other on opposite sides of the law during a traffic stop that escalates out of control, these two luckless individuals end up partnered as lowly security guards. Despite being damned to the lowest rung of the law enforcement ladder, Earl and Hank uncover a sophisticated smuggling operation led by Nash and his band of thugs. When Earl and Hank get their hands on some hot property, they go on the run from, first the bad guys, then the L.A.P.D.--led by Lt. Washington and Detective McDuff. What these two unlikely partners do to law enforcement is a crime, but they just might save the day. That is, if they don't kill each other first.","['Martin Lawrence', 'Steve Zahn', 'Colm Feore', 'Bill Duke', 'Eric Roberts']","['Crisoforo Aguilar', 'Tobin Armbrust', 'Gioia Bearden', 'Elizabeth A. Bergman', 'Randolph Bookman']",['Dennis Dugan'],['United States'],['English'],"['Columbia Pictures', 'Outlaw Productions', 'Intermedia Films', 'The Firm']"
317248,"Brazil, 1960s, City of God. The Tender Trio robs motels and gas trucks. Younger kids watch and learn well...too well. 1970s: Li'l Zé has prospered very well and owns the city. He causes violence and fear as he wipes out rival gangs without mercy. His best friend Bené is the only one to keep him on the good side of sanity. Rocket has watched these two gain power for years, and he wants no part of it. he keeps getting swept up in the madness. All he wants to do is take pictures. 1980s: Things are out of control between the last two remaining gangs...will it ever end? Welcome to the City of God.","['Alexandre Rodrigues', 'Leandro Firmino', 'Phellipe Haagensen', 'Douglas Silva', 'Jonathan Haagensen']","['Yelena Makarczyk', 'Paula P. Manzanedo', 'Alex Moreno', 'Anna Luiza Müller', 'Fabiano De Souza Ramos']",['Fernando Meirelles'],"['Brazil', 'France', 'Germany']",['Portuguese'],"['O2 Filmes', 'VideoFilmes', 'Globo Filmes', 'Lumière', 'Wild Bunch', 'StudioCanal', 'Hank Levine Film', 'Lereby Productions']"
75675,"Tom Ripley has a sweet deal with an art forger. The forger creates the paintings; Tom sells them. But another criminal business associate wants Tom to go in for an even riskier enterprise: murder. Tom suggests his associate ask a local picture framer instead. That man has a fatal disease, or so it's rumored. More, he has a wife and kid that surely he wouldn't want to leave penniless. Let this picture framer be a hit man, and no one will suspect. The terminally ill craftsman may agree to the misdeed, and several more, but he'll end up needing Tom Ripley in a pinch.","['Dennis Hopper', 'Bruno Ganz', 'Lisa Kreuzer', 'Gérard Blain', 'Nicholas Ray']","['Claude Bertonazzi', 'Anne Povel', 'Harald Vogel']",['Wim Wenders'],"['West Germany', 'France']","['German', 'English', 'French']","['Bavaria Film', 'Filmverlag der Autoren', 'Les Films du Losange', 'Road Movies Filmproduktion', 'Westdeutscher Rundfunk', 'Wim Wenders Productions', 'Wim Wenders Stiftung']"
103671,"This epic depiction of thirty years of Chicano gang life in Los Angeles focuses on a teen named Santana who, with his friends Mundo and the Caucasian-but-acting-Hispanic J.D., form their own gang and are soon arrested for a break-in. Santana gets into trouble again and goes straight from reform school to prison, spending eighteen years there, and becoming leader of a powerful gang, both inside and outside the prison, while there. When he is finally released, he tries to make sense of the violence in his life, in a world much changed from when last he was in it.","['Sal Lopez', 'Vira Montes', 'Roberto Martín Márquez', 'Dyana Ortelli', 'Joe Aubel']","['Fabiana Arrastia', 'Corey Burton', 'Tony Casas', 'Bundy Chanock', 'Fernando Cubillas']",['Edward James Olmos'],['United States'],"['English', 'Spanish']","['Hivemind', 'Olmos Productions', 'Universal Pictures', 'YOY']"
57869,"Besotted with cheap crime fiction, cinema, and popular culture, bored-to-death English language students Franz and Arthur love living in a dream world. But more than anything, the two layabouts fancy themselves a gang. In the meantime, Franz and Arthur vie for Odile's attention. And when their romantic classmate tips them off about a mountain of cash stashed in an unlocked cabinet in Aunt Victoria's suburban Joinville-le-Pont house, it's game on. As the amateur criminals take an immediate interest in Odile's incidental mention, they devise a plan and iron out the details of an audacious robbery--just like in the movies. However, what happens if Arthur's uncle and all-powerful love stand in the way of the perfect heist?","['Anna Karina', 'Danièle Girard', 'Louisa Colpeyn', 'Chantal Darget', 'Sami Frey']","['Patricia Finaly', 'Jeanne Marie Olivier']",['Jean-Luc Godard'],['France'],"['French', 'English']","['Columbia Films', 'Anouchka Films', 'Orsay Films']"
106500,"A ""rapumentary"", covering the rise to fame of MC Gusto, Stab Master Arson, and Dead Mike: members of the rap group ""CB4"". We soon learn that these three are not what they seem and don't apear to know as much about rap music as they claim... but a lack of musical ability in an artist never hurts sales, does it? You've just got to play the part of a rap star...","['Chris Rock', 'Allen Payne', 'Deezer D', 'Chris Elliott', 'Phil Hartman']","['Elena Azuola', 'Jeffrey Berk', 'Yalonda Busbee', 'Cassandra Butcher', 'Jimmie Crain']",['Tamra Davis'],['United States'],['English'],"['Imagine Entertainment', 'Universal Pictures']"
101748,"In 1963, the night before the 18 years old ""Birdlace"" Eddie and his friends are shipped to Vietnam. They play a dirty game called 'Dogfight': all of them seek a woman for a party, and who finds the most ugly one, wins a prize. Eddie finds the lonesome pacifist Rose working in a coffee shop. She's happy to accompany him - but then she sees through the game. However by this time he already learned to like her, so he follows her home. Will he manage to win her heart despite their differences?","['River Phoenix', 'Lili Taylor', 'Richard Panebianco', 'Anthony Clark', 'Mitchell Whitfield']","['Brett Baker', 'David Bockmann', 'Jennifer Campbell', 'David Canwell', 'Mitchell E. Dauterive']",['Nancy Savoca'],['United States'],['English'],['Warner Bros.']
52918,"Aspiring actress Lora Meredith meets Annie Johnson, a homeless Black woman at Coney Island, and soon they share a tiny apartment. Each woman has an intolerable daughter. However, Annie's little girl Sarah Jane is by far the worst. Neurotic and obnoxious, Sarah Jane doesn't like being Black; since she's light-skinned (her father was practically white), she spends the rest of the film trying to pass as white, much to her mother's heartache and shame. Lora, meanwhile, virtually ignores her own daughter in a single-minded quest for stardom.","['Lana Turner', 'John Gavin', 'Sandra Dee', 'Susan Kohner', 'Robert Alda']","['David Webb', 'Wayne Fitzgerald', 'Don Morgan']",['Douglas Sirk'],['United States'],['English'],['Universal International Pictures (UI)']
79477,"A French boy (Daniel) and an American girl (Lauren), who go to school in Paris, meet and begin a little romance. They befriend Julius, who enchants them with his storytelling. In an attempt to ensure the teens' love forever, the three journey to Venice.","['Laurence Olivier', 'Diane Lane', 'Thelonious Bernard', 'Arthur Hill', 'Sally Kellerman']","['Nestore Baratella', 'Nicole Cateux', 'Judith Mullen']",['George Roy Hill'],"['France', 'United States']","['English', 'French', 'Italian']","['Orion Pictures', 'Pan Arts', 'Trinacra Films']"
29453,"Holed up in the labyrinthine trap of narrow cobblestoned streets and dark dead-end alleys in the bustling Casbah quarter of Algiers, the charismatic leader and elegant Parisian gangster, Pépé le Moko, is starting to reach the end of his tether. Under those pressing circumstances, and always homesick for his beloved Paris after two long years in the impenetrable district, Pépé and his loyal gang find themselves in a constant cat-and-mouse game with the local police and the sly, manipulative detective, Inspector Slimane, trying hard to be one step ahead of them. But, as if that weren't enough, a chance encounter with the dazzling coquette, Gaby, will expose the Achilles' heel of the love-smitten lord of the Casbah, who is now eager to dice with death only to be with her. Is she Pépé le Moko's last chance to leave his squalid criminal haven?","['Jean Gabin', 'Gabriel Gabrio', 'Saturnin Fabre', 'Fernand Charpin', 'Lucas Gridoux']",[''],['Julien Duvivier'],['France'],"['French', 'Arabic', 'English']",['Paris Film']
89981,"On the last day before summer vacation, Michael Ryan finds an anonymous love letter in his locker. Michael has a crush on Deborah Anne Fimple, who is the most beautiful girl in high school, and his friend Roger Despard convinces him that Deborah has written the letter. Michael writes a love letter to Deborah and asks his best friend Toni Williams, who actually wrote the letter for him, to deliver the letter to Deborah that is also her friend. However, Toni reads the letter and rewrites it to Deborah, who immediately falls in love with the unknown author. Meanwhile, Michael's mother Connie Ryan finds Michael's letter and believes it belongs to her husband George Ryan and Deborah's father Lou Fimple finds Deborah's letter and believes it belongs to his wife Elizabeth Fimple. Michael dates Deborah while their parents are astonished with the betrayals of their mates. Michael soon finds that Deborah is a shallow teenager who only dates college students and he misses Toni. Furthermore, he realizes that she has written the love letters and he feels that he loves her. But Toni is aboard of a ship ready to travel to study abroad for one year. Will they meet each other?","['C. Thomas Howell', 'Lori Loughlin', 'Kelly Preston', 'Dee Wallace', 'Cliff De Young']","['James Bailey', 'Sam Bernstein', 'Joan Eisenberg', 'Teresa A. Gullihur', 'Eileen McGuire']",['David Greenwalt'],['United States'],['English'],['Orion Pictures']
84737,"A young American couple, Michael and Cathy who have just graduated from college, have known each other about 10 years and have been together about half that time go to of Santorini, a Greek island for the summer and are dazzled by the beauty and the uninhibited people surrounding them. Michael meets and begins an affair with Lina, a French archaeologist working on a dig. Cathy discovers this and goes to confront the other woman. Lina is quite taken with Cathy's photographic work, and the three become very close.","['Peter Gallagher', 'Daryl Hannah', 'Valérie Quennessen', 'Barbara Rush', 'Carole Cook']","['Janis Benjamin', 'Amy Bloch', 'Steven Fazekas', 'Mark M. Frederick', 'Jeff Freedman']",['Randal Kleiser'],['United States'],['English'],['Filmways Pictures']
88414,"Teddy is a middle-aged man who has a good wife, kids, friends and a fine job. You could say that he has everything he wants; but he doesn't. One day he sees a gorgeous woman in a red dress, and goes crazy! He must have her...","['Gene Wilder', 'Charles Grodin', 'Joseph Bologna', 'Judith Ivey', 'Michael Huddleston']","['Penny Brocato', 'Nicolas Cann', 'Lisa Cogswell', 'Tom Gillman', 'Jan Heininger']",['Gene Wilder'],['United States'],['English'],['Orion Pictures']
282209,"In the Nineteenth Century, in Darkness Falls, Matilda Dixon is a good woman, who exchanges with children their baby teeth per coins. One day, her face is burnt in a fire in her house, she becomes sensitive to light and uses a china mask to protect her face against light. When two children are not found in the town, Matilda is blamed by the population and burnt in a fire, as if she were a witch. She claims to be not guilty and curses the whole population of the town and their descendants, stating that when each child loses the last tooth, she would come to get it, and if the child looks at her, she would kill him or her. After her death, the two children are found, and the shamed citizens decide to bury this sad and unfair event and never mention it again. Twelve years ago, the boy Kyle accidentally saw the Tooth Fairy, and she killed his mother. All the persons in Darkness Falls but his girlfriend Caitlin accused the boy of murdering his mother and sent him to an institution, considered deranged. In the present days, Caitlin calls Kyle to help her young brother Michael, who has seen the Fairy Tooth and is afraid of the dark.","['Chaney Kley', 'Emma Caulfield Ford', 'Lee Cormie', 'Grant Piro', 'Sullivan Stapleton']","['Ahmet Ahmet', 'Colleen Bachman', 'Devin Bailey', 'Jackie Boardman', 'Antony Burrows']",['Jonathan Liebesman'],"['United States', 'Australia']",['English'],"['Revolution Studios', 'Distant Corners Entertainment Group Inc.', 'Blue Star Productions']"
280653,"In World War II, the sanitation engineer and family man Kurt Gerstein is assigned by SS to be the Head of the Institute for Hygiene to purify the water for the German Army in the front. Later, he is invited to participate in termination of plagues in the concentration camps and he develops the lethal gas Zyklon-B. When he witnesses that the SS is killing Jews instead, he decides to denounce the genocide to the Pope to expose to the world and save the Jewish families. The idealist Jesuit priest Riccardo Fontana from an influent Italian family gives his best efforts being the liaison of Gerstein and the leaders of the Vatican.","['Mathieu Kassovitz', 'Ulrich Tukur', 'Ulrich Mühe', 'Michel Duchaussoy', 'Ion Caramitru']","['Anne Abitbol', 'Sabina Aldea', 'George Anghel', 'Vasile Anghel', 'Angeliki Arvanitis']",['Costa-Gavras'],"['France', 'Germany', 'Romania']","['English', 'French', 'Italian', 'German']","['Canal+', 'K.G. Productions', 'KC Medien', 'Katharina', 'Renn Productions', 'TF1 Films Production']"
311320,"Traudl Junge was Adolf Hitler's private secretary, from Autumn 1942 until the collapse of the Nazi regime. She worked for him at the Wolfsschanze in Obersalzberg, on his private train and, finally, in his bunker in the besieged capital. It was Traudl Junge, who Hitler dictated his final testament to. In her first ever on-camera interview, 81-year-old Junge talks about her unique life. In the spring of 2001, Andre Heller succeeded in convincing Traudl Junge how valuable it is to record her unique memories. Fifty-six years after the end of the Second World War, an important eyewitness reveals her experiences to us. What she saw and heard turned her into an furious opponent of National Socialism, an opponent, who is still painfully aware and seems incapable of forgiving the young girl she once was--for her naivete, ignorance, and her liking for Hitler.",['Traudl Junge'],['Beatrix Wesle'],['André Heller'],['Austria'],['German'],['Dor Film Produktionsgesellschaft']
115781,"A Jewish junkie is paroled after 8 years in prison, and once back on the street, rips off a drug dealer whom he already had a grudge against. The drug dealer hires an enforcer to retaliate, and things quickly escalate out of control. With only two friends to back him up, the junkie prepares for the inevitable showdown.","['Mickey Rourke', 'Frank Senger', 'Adrien Brody', 'John Enos III', 'Fatmir Haskaj']","['David Avery', 'Iwona Awlasewicz', 'Sirad Balducci', 'Jamie Lee Bianco', 'Robbie Brenner']",['Julien Temple'],['United States'],['English'],"['Clipsal Films', 'Red Ruby', 'Village Roadshow Pictures']"
39305,Rip Murdock and Johnny Drake are en route to Washington when Johnny disappears and then turns up dead. Rip learns that Johnny had been accused of murder and sets out to find out what he can. He falls in love with Coral whose husband Johnny is supposed to have killed.,"['Humphrey Bogart', 'Lizabeth Scott', 'Morris Carnovsky', 'Charles Cane', 'William Prince']","['Mike Morelli', 'Bette Orsini']",['John Cromwell'],['United States'],"['English', 'Latin']",['Columbia Pictures']
70155,"With dreams of becoming a successful Reggae singer, a young Jamaican man finds corruption from his record producers and the drug pushers they're connected to. Rather than fail his dreams Ivan lets nothing stand in his way, not even the law.","['Jimmy Cliff', 'Janet Bartley', 'Carl Bradshaw', 'Ras Daniel Hartman', 'Basil Keane']","['Barbara Blake Hannah', 'John Solie']",['Perry Henzell'],['Jamaica'],['English'],['International Films']
326769,"A mythic motorcycle tale of father and son, this is the story of Manuel ""Smoke"" Galloway, also known as ""the King of Cali"", the president of a motorcycle club whose members are all African-American men, mostly white-collar workers who exchange their suits and ties at night and on weekends for leather outfits and motorcycle helmets. The focus of this story takes place at an annual drag-racing event in Fresno, as Manuel tries to retain his championship title.","['Laurence Fishburne', 'Derek Luke', 'Orlando Jones', 'Djimon Hounsou', 'Lisa Bonet']","['Wendy Altman-Cohen', 'Michael Asiman', 'Maeyen A. Bassey', 'John Edward Bunch II', 'Doug Byers']",['Reggie Rock Bythewood'],['United States'],['English'],"['Dreamworks Pictures', '3 Arts Entertainment']"
309593,"Whilst heading onto the highway, Kimberly Corman has a vision of a huge car accident. Bringing the traffic to a halt, Kimberly is horrified when the accident actually happens. Kimberly links the occurrence with a similar event that occurred one year ago, on the same date that she had her premonition: the Flight 180 disaster. After speaking with Clear Rivers, the only remaining survivor of the Flight 180 disaster, Kimberly discovers that Death's pattern has been disturbed, meaning everyone who was originally supposed to die will now be killed in separate freak accidents. Kimberly and the remaining survivors must work with Clear to try and stop Death from repeating its process.","['Ali Larter', 'A.J. Cook', 'Michael Landes', 'David Paetkau', 'James Kirk']","['Laura Arcangeli', 'Debera Barager', 'Cassandra Barbour', 'Carter Baynham', 'Lisa Behlendorf']",['David R. Ellis'],"['United States', 'Canada']",['English'],"['New Line Cinema', 'Zide-Perry Productions']"
292506,"In an era when the country's first line of defense, intelligence, is more important than ever, this story opens the CIA's infamous closed doors and gives an insider's view into the Agency: how trainees are recruited, how they are prepared for the spy game, and what they learn to survive. James Clayton might not have the attitude of a typical recruit, but he is one of the smartest graduating seniors in the country - and he's just the person that Walter Burke wants in the Agency. James regards the CIA's mission as an intriguing alternative to an ordinary life, but before he becomes an Ops Officer, James has to survive the Agency's secret training ground, where green recruits are molded into seasoned veterans. As Burke teaches him the ropes and the rules of the game, James quickly rises through the ranks and falls for Layla, one of his fellow recruits. But just when James starts to question his role and his cat-and-mouse relationship with his mentor, Burke taps him for a special assignment to root out a mole. As the suspense builds toward a gripping climax, it soon becomes clear that the CIA's old maxims are true: ""trust no one"" and ""nothing is what it seems.""","['Al Pacino', 'Colin Farrell', 'Bridget Moynahan', 'Gabriel Macht', 'Kenneth Mitchell']","['Markus Alexander', 'Wayne Arnold', 'Lorrie Barth', 'Denise A. Beale', 'J.B. Benna']",['Roger Donaldson'],"['United States', 'Switzerland']","['English', 'Persian', 'Russian']","['Touchstone Pictures', 'Spyglass Entertainment', 'Epsilon Motion Pictures', 'Place Productions']"
