imdbId,plot,cast,crew,director,countries,languages,production_companies
298203,"The setting is Detroit in 1995. The city is divided by 8 Mile, a road that splits the town in half along racial lines. A young white rapper, Jimmy ""B-Rabbit"" Smith Jr. summons strength within himself to cross over these arbitrary boundaries to fulfill his dream of success in hip hop. With his pal Future and the three one third in place, all he has to do is not choke.","['Eminem', 'Kim Basinger', 'Mekhi Phifer', 'Brittany Murphy', 'Evan Jones']","['Kevin Baker', 'Jackie Bazan', 'Jody Beaudin', 'Ralph Bertelle', 'Jamie Biehl']",['Curtis Hanson'],"['United States', 'Germany']",['English'],"['Imagine Entertainment', 'Interscope Films', 'Mikona Productions GmbH & Co. KG']"
297884,"Cathy is the perfect 50s housewife, living the perfect 50s life: healthy kids, successful husband, social prominence. Then one night she stumbles in on her husband Frank, kissing another man, and her tidy world starts spinning out of control. In her confusion and grief, she finds consolation in the friendship of their African-American gardener, Raymond - a socially taboo relationship that leads to the further disintegration of life as she knew it. Despite Cathy and Frank's struggle to keep their marriage afloat, the reality of his homosexuality and her feelings for Raymond open a painful, if more honest, chapter in their lives.","['Julianne Moore', 'Dennis Quaid', 'Dennis Haysbert', 'Patricia Clarkson', 'Viola Davis']","['Ethan Anderson', 'Anita Boudreaux', 'Paul Brennan', 'Rich Cairns', 'Cheyanne M. Casey']",['Todd Haynes'],"['United States', 'France']",['English'],"['Focus Features', 'Vulcan Productions', 'Killer Films', 'John Wells Productions', 'Section Eight', 'Clear Blue Sky Productions', 'TF1 International', 'USA Films']"
297162,A criminal mastermind has set in motion a plan to infiltrate a high tech prison in order to persuade a death row inmate to reveal the whereabouts of $200 million worth of gold. It's up to an undercover FBI agent to stop him before it's too late.,"['Steven Seagal', 'Morris Chestnut', 'Ja Rule', 'Nia Peeples', 'Tony Plana']","['Alan Abrams', 'Jackie Bazan', ""John 'JR' Craigmile"", 'Ava DuVernay', 'Torrence Hall']",['Don Michael Paul'],"['United States', 'Germany']",['English'],"['Screen Gems', 'Franchise Pictures', 'Half Dead Productions Inc.', 'Modern Media Filmproduktion']"
295297,"Forced to spend his summer holidays with his muggle relations, Harry Potter (Daniel Radcliffe) gets a real shock when he gets a surprise visitor: Dobby (Toby Jones) the house-elf, who warns Harry against returning to Hogwarts, for terrible things are going to happen. Harry decides to ignore Dobby's warning and continues with his pre-arranged schedule. But at Hogwarts, strange and terrible things are indeed happening. Harry is suddenly hearing mysterious voices from inside the walls, muggle-born students are being attacked, and a message scrawled on the wall in blood puts everyone on his or her guard, ""The Chamber Of Secrets Has Been Opened. Enemies Of The Heir, Beware"".","['Daniel Radcliffe', 'Rupert Grint', 'Emma Watson', 'Richard Griffiths', 'Fiona Shaw']","['Mike Alexander', 'Jeanne Austin', 'Paul Bayfield', 'Emma Bendell', 'Drew Bennett']",['Chris Columbus'],"['United Kingdom', 'United States']","['English', 'Latin']","['Warner Bros.', 'Heyday Films', '1492 Pictures', 'MIRACLE Productions GmbH & Co. KG']"
273435,"People tell stories. In Toronto, an art historian lectures on Arshile Gorky (1904 -1948), an Armenian painter who lived through the Armenian Genocide in the Ottoman Empire. A director invites the historian to help him include Gorky's story in a film about the genocide and Turkish assault on the town of Van. The historian's family is under stress: her son is in love with his step-sister, who blames the historian for the death of her father. The daughter wants to revisit her father's death and change that story. An aging customs agent tells his son about his long interview with the historian's son, who has returned from Turkey with canisters of film. All the stories connect.","['Simon Abkarian', 'Charles Aznavour', 'Christopher Plummer', 'Arsinée Khanjian', 'Setta Keshishian']","['Saro Ajnedijan', 'Janine Anderton', 'Jill Antal', 'Darrell Armstrong', 'Marty Arthur']",['Atom Egoyan'],"['Canada', 'France']","['English', 'Armenian', 'French', 'German', 'Turkish']","['Alliance Atlantis Communications', 'Serendipity Point Films', 'Ego Film Arts', 'ARP Sélection', 'Téléfilm Canada', 'The Movie Network (TMN)', 'Super Ecran', 'The Harold Greenberg Fund']"
313196,"Recently ordained a priest, 24-year-old Father Amaro is sent to a small parish church in Los Reyes, Mexico to assist the aging Father Benito in his daily work. Benito--for years a fixture in the church as well as the community--welcomes Father Amaro into a new life of unseen challenges. Upon arriving in Los Reyes, the ambitious Father Amaro meets Amelia, a beautiful 16-year-old girl whose religious devotion soon becomes helplessly entangles in a growing attraction to the new priest. Amelia is quickly following into the footsteps of her mother, Sanjuanera, who has been engaged in a long-time affair with Father Benito. Amaro soon discovers that corruption and the Church are old acquaintances in Los Reyes. Father Benito has been receiving financial help from the region's drug lord for the construction of a new health clinic. As well, another priest in the diocese, Father Natalio, is suspected of assisting guerilla troops in the highlands. Maenwhile, Amelia and Father Amaro have fallen in love and have begun a passionate sexual relationship. As things become increasingly more complicated in the small community, the walls around Father Amaro begin to crumble. Torn between the divine and the carnal, the righteous and the unjust, Father Amaro must summon his strength to choose which life he will lead.","['Gael García Bernal', 'Ana Claudia Talancón', 'Sancho Gracia', 'Angélica Aragón', 'Luisa Huertas']","['Victoria Alberca', 'José Luis Caballero', 'Juan Pablo Goya', 'Blanca Lidia Guzmán', 'Raul Jacome']",['Carlos Carrera'],"['Mexico', 'Argentina', 'Spain']",['Spanish'],"['Alameda Films', 'Artcam International', 'Blu Films', 'Cinecolor', 'Fondo para la Producción Cinematográfica de Calidad', 'Gobierno del Estado de Veracruz', 'Instituto Mexicano de Cinematografía', 'Programa Ibermedia', 'Videocolor', 'Wanda Films']"
314725,"In 1959, Berry Gordy Jr. gathered the best musicians from Detroit's thriving jazz and blues scene to begin cutting songs for his new record company. Over a fourteen year period they were the heartbeat on every hit from Motown's Detroit era. By the end of their phenomenal run, this unheralded group of musicians had played on more number ones hits than the Beach Boys, the Rolling Stones, Elvis and the Beatles combined - which makes them the greatest hit machine in the history of popular music. They called themselves the Funk Brothers. Forty-one years after they played their first note on a Motown record and three decades since they were all together, the Funk Brothers reunited back in Detroit to play their music and tell their unforgettable story, with the help of archival footage, still photos, narration, interviews, re-creation scenes, 20 Motown master tracks, and twelve new live performances of Motown classics with the Brothers backing up contemporary performers.","[""Richard 'Pistol' Allen"", 'Jack Ashford', 'Bob Babbitt', ""Benny 'Papa Zita' Benjamin"", ""Eddie 'Bongo' Brown""]","['Danya Abt', 'Keith Benson', 'April Campbell', 'Lizzie Cook', 'Cameron Cox']",['Paul Justman'],['United States'],['English'],"['Artisan Entertainment', 'Rimshot', 'Elliott Scott Productions']"
280870,"A gunman ties up an actor and locks him in his dressing room just before a performance. He also puts a bomb with a 90-minute timer next to the actor. Then, he goes to a room above an L.A. plaza and draws a bead on the actor's lover, international arms dealer Liberty Wallace. Calling himself ""Joe,"" he calls her cell phone, demonstrates that a rifle is pointed at her, and tells her to cuff herself to a hot-dog cart nearby (the cuffs are there). Over the next 90 minutes, the story unfolds: as a result of his daughter's death, he wants a public debate on the Second Amendment. As Liberty begins to bond with Joe on the phone, he gets some truths from her--and his revenge.","['Tanya Allen', 'Hart Bochner', 'Fulvio Cecere', 'Gregory Calpakis', 'Terry Chen']","['Gregory Diamond Almas', 'Marie Amenta', 'Cynthia Amsden', 'Jennifer Lynne Anderson', 'Josef Brandmaier']",['Kari Skogland'],"['Germany', 'Canada']",['English'],"['Lions Gate Films', 'Cinerenta Medienbeteiligungs KG', 'Pearl Pictures', 'Cinestone', 'Still Productions']"
36112,"Portrays in warm-hearted detail the life and loves of one extraordinary man. We meet the imposingly rotund General Clive Wynne-Candy, a blustering old duffer who seems the epitome of stuffy, outmoded values. Traveling backwards 40 years we see a different man altogether: the young and dashing officer ""Sugar"" Candy. Through a series of relationships with three women and his lifelong friendship with a German officer, we see Candy's life unfold and come to understand how difficult it is for him to adapt his sense of military honor to modern notions of ""total war.""","['James McKechnie', 'Neville Mapp', 'Vincent Holman', 'Roger Livesey', 'David Hutcheson']","['Charles R. Beard', 'Douglas Brownrigg', 'Robert Harris', 'Arthur Lawson', 'Joan Page']",['Michael Powell'],['United Kingdom'],"['English', 'French', 'German']","['The Archers', 'Independent Producers']"
42895,"Rio Grande takes place after the Civil War when the Union turned their attention towards the Apaches. Union officer Kirby Yorke is in charge of an outpost on the Rio Grande in which he is in charge of training of new recruits one of which is his son whom he hasn't seen in 15 years. He whips him into shape to take on the Apaches but not before his mother shows up to take him out of there.The decision to leave is left up to Trooper Yorke who decides to stay and fight. Through it all Kirby and Kathleen though separated for years fall back into love and decide that it's time to give it another try. But Yorke faces his toughest battle when his unorthodox plan to outwit the elusive Apaches leads to possible court-martial. Locked in a bloody Indian war, he must fight to redeem his honor and save the love and lives of his broken family.","['John Wayne', ""Maureen O'Hara"", 'Ben Johnson', 'Claude Jarman Jr.', 'Harry Carey Jr.']","['D.R.O. Hatswell', 'Philip Kieffer', 'Herbert J. Yates', 'Sid Davis']",['John Ford'],['United States'],['English'],['Argosy Pictures']
263734,"Long Bay resident Donald Foley, a life long curler and more recent curling coach, has just passed away. He has requested that his cremated ashes be bored into a specific curling stone he has just had retrieved from the bottom of Long Bay. His will also has a non-binding codicil to reunite the last team he coached to curl in the Golden Broom Bonspiel in town, a Long Bay team which has never won and that team which was the closest ever to doing so. Donald wants that specific stone in which he is buried to be delivered as the final shot to sit on the button for the win for the Long Bay team. Beyond the four team members not having curled at all since their last bonspiel ten years ago, they each have issues in their lives which may make coming together as a team and winning, and curling in its entirety difficult or a non-priority. Lead Neil Bucyk's life is directed by his controlling wife Linda, a right she believes she has as his livelihood is in her family's business, a funeral home. Second Eddie Strombeck and his wife Lilly are trying to conceive, her ovulation cycles which may trump all else in his life especially as they have long tried to have a baby without success (although they are having a good time in the trying). Third James Lennox, who has recently returned to town with Joanne, the latest in a long line of not too bright casual and short term girlfriends, is a drug dealer whose biggest priority may be to evade the thugs to who he owes a lot of money. But the biggest question mark may be skip Chris Cutter, who unilaterally made the decision to break up the team when he left town to work in the Alberta oil patch. He quit curling over guilt in not reporting a burnt rock in that last bonspiel, that rock which he ultimately threw into Long Bay (i.e. the rock in which Donald is now buried). The issue of skill may be somewhat addressed if Chris is willing to reconnect with his father and Donald's friend, Gordon Cutter, with who Chris has been estranged over family issues but who remains the most knowledgeable curler in town. The other part of the skill issue is that the Butte team will be curling in the bonspiel, their entire team, but especially skip Alexander Yount, who are treated like rock stars in the curling world. If Chris remains in town to curl, he also has to address some personal issues, as his departure ten years ago broke up his relationship with Donald's daughter, Julie Foley, that adversity which in part led to she coming out ahead professionally as a member now of the space program. However, Donald's other daughter, single mother physiotherapist and admitted alcoholic Amy Foley, who was Chris' drinking buddy and is everyone's best friend, has always had feelings for Chris herself, something of which Chris and Julie, deep in their hearts, are aware.","['James B. Douglas', 'Molly Parker', 'Paul Gross', 'Barbara Gordon', 'Michelle Nolden']","['Sean Coyne', 'Jack DePoe', 'Amy Green', 'Alexandra Lane', 'Marc Lefler']",['Paul Gross'],['Canada'],"['English', 'American Sign Language', 'German']","['Serendipity Point Films', 'Whizbang Films']"
55207,"During the US Civil War, Union POWs escape in a balloon and end up stranded on a South Pacific island, inhabited by giant plants and animals. They must use their ingenuity to survive the dangers, and to devise a way to return home. Sequel to '20,000 Leagues Under the Sea'.","['Michael Craig', 'Joan Greenwood', 'Michael Callan', 'Gary Merrill', 'Herbert Lom']","['Bob Gill', 'Donald L. Piccard']",['Cy Endfield'],['United Kingdom'],['English'],['Ameran Films']
283644,"Those left behind face war, famine, plagues, and natural disaster so devastating that only one in four people will survive. Odds are even worse for the enemies of the Antichrist and his new world order. Rayford Steele, Buck Williams, Bruce Barnes, and Chloe Steele band together to form the Tribulation Force. Their task is clear, and their goal is nothing less than to stand and fight against the enemies of God during the seven most chaotic years the planet will ever know.","['Kirk Cameron', 'Brad Johnson', 'Clarence Gilyard Jr.', 'Janaya Stephens', 'Gordon Currie']","['Anthony Innone', 'David Steinberg', 'Jen Stivala', 'Alan Sutton', 'Beverly Sutton']",['Bill Corcoran'],"['United States', 'Canada']",['English'],"['Canadian Film or Video Production Tax Credit', 'Cloud Ten Pictures', 'Darius Films', 'Namesake Entertainment', 'Ontario Film and Television Tax Credit']"
280609,"A British Squad is sent on a training mission in the Highlands of Scotland against Special Operations squad. Ignoring the childish ""campfire"" stories heard about the area, they continue with their mission and come across the bloody remains of the Special Ops Squad, and a fierce howling is pitching the night sky... With two mortally wounded men, they make an escape, running into a zoologist by the name of Megan - who knows exactly what hunts them. What began as what they thought was a training mission turns into a battle for their lives against the most unlikely enemies they would have expected - werewolves.","['Sean Pertwee', 'Kevin McKidd', 'Emma Cleasby', 'Liam Cunningham', 'Thomas Lockyer']","['Paul de Bourcy', 'Kirsten Ferwerda', 'Richard Glass', 'Gus Gouldsbrough', 'Craig Handley']",['Neil Marshall'],"['United Kingdom', 'Luxembourg']",['English'],"['Centurion', 'Kismet Entertainment Group', 'The Noel Gay Motion Picture Company', 'The Carousel Picture Company', 'The Victor Film Company', 'Luxembourg Film Fund']"
51745,"Tom Winters, a widower, is trying to understand and raise three precocious children alone. He gets a little unexpected help from Cinzia, when the children decide she is to be the new maid. She is actually an Italian socialite who is trying to get away from her overprotective father.","['Cary Grant', 'Sophia Loren', 'Martha Hyer', 'Harry Guardino', 'Eduardo Ciannelli']","['Hal C. Kern', 'Yul Brynner']",['Melville Shavelson'],['United States'],"['English', 'Italian']",['Paramount Pictures']
99669,"A young boy's life in turn-of-the-century France. Marcel, witnesses the success of his teacher father, as well as the success of his arrogant Uncle Jules. Marcel and family spend their summer vacation in a cottage in Provence, and Marcel befriends a local boy who teaches him the secrets of the hills in Provence.","['Philippe Caubère', 'Nathalie Roussel', 'Didier Pain', 'Thérèse Liotard', 'Julien Ciamaca']","['Colette Chevereau', 'Roger Pera', 'Dominique Segall']",['Yves Robert'],['France'],"['French', 'Occitan']","['Gaumont', 'Gaumont Production', 'Les Productions de la Guéville', 'TF1 Films Production', ""Centre national du cinéma et de l'image animée (CNC)""]"
99266,"Every holiday Marcel and his family go to their cottage in the Provence (France). He likes the hills in this region. Before they arrive at the cottage they have to walk about 5 miles. With the co-operation of an ex-pupil of Marcel's father, who's a teacher, they only have to walk 1 mile, since they can take a shortcut along a canal, through the backyards of some eccentric people. During one of these holidays he meets Isabelle, a pretty but conceited girl...","['Philippe Caubère', 'Nathalie Roussel', 'Didier Pain', 'Thérèse Liotard', 'Julien Ciamaca']","['Colette Chevereau', 'Danièle David', 'Roger Pera', 'Dominique Segall']",['Yves Robert'],['France'],"['French', 'Occitan']","['Gaumont', 'Gaumont Production', 'Les Productions de la Guéville', 'TF1 Films Production', ""Centre national du cinéma et de l'image animée (CNC)""]"
102782,"While the general theme of this film resembles ""The Blue Lagoon"" (the film for which this is a sequel), the basic plot is quite different. We open the film with a ship finding the craft with our original characters in it, Richard and Emmeline dead and Paddy alive. Established in the first film, the only word Paddy ever says is ""Richard"", so the crew assumes Richard is the infant's name. Taken in by Sarah, a widow with an infant baby girl Lilli, Richard (Paddy) is cared for in a return to civilization. Struck by cholera, the crew of the ship start to die and the captain sets Sarah, Richard, Lilli and a healthy crew member on a lifeboat in an attempt to preserve their lives. With water and food running short, the crew member escorting Sarah and the children becomes dangerous, so Sarah takes the only course of action she feels suitable to preserve the children: she strikes him and throws him overboard. Taking control of the small craft, she eventually guides them back to the island of the first film. Recognizing where he is, the infant Richard finds his home and is very unhappy not to find his parents. Fixing up the hut and settling in the children, Sarah begins their life on the island, slowly teaching the children survival tools, as well as schooling them as though they were in school, and teaching them slowly about the facts of life, including Lilli's eventual growth to womanhood. When Sarah dies from pneumonia, she leaves the children far more prepared than Richard and Emmeline in the first film. Years later as the children grow into teenagers, the film skims the same themes as the first of their developing relationship, and introduces the characters to civilization when a ship, low on fresh water, stops on their island and offers to take them home. After a confrontation with one of the crew and the captain's daughter, Lilli finds herself pregnant and they decide to stay, as they feel the civilization the visitors have to offer will not compare to the life they lead on the island.","['Milla Jovovich', 'Brian Krause', 'Lisa Pelikan', 'Courtney Barilla', 'Garette Ratliff Henson']","['Rick Anderson', 'Chris Canute', 'Marilyn Heston', 'David Lucas', 'Sue MacKay']",['William A. Graham'],['United States'],['English'],"['Columbia Pictures', 'Price Entertainment']"
103112,"Billy Tepper is the leader of a group of rebellious boys at The Regis School. He has already been expelled from three prominent private schools. His best friend, Joey Trotta, is the son of the Head of the New York Mafia; Billy, all their friends and many other kids at the school have equally influential and prominent, if more law-abiding, parents. When Luis Cali's father is put in jail, he heads for the Regis School to put the son of the judge in charge of the case under hostage, only to find he has been removed. However, once he realises who the parents of the rest are, he decides the entire student body of the Regis School would be an even better bargaining chip.","['Sean Astin', 'Wil Wheaton', 'Keith Coogan', 'Andrew Divoff', 'R. Lee Ermey']","['Noah Albert', 'Spence Bovee', 'Christopher G. Chalko', 'Stephanie Clayton', 'Darrell Elmore']",['Daniel Petrie Jr.'],['United States'],"['English', 'Spanish', 'Italian']","['TriStar Pictures', 'Island World']"
82970,"The story runs in the 1910's New York. Coalhouse Walker Jr. (Howard E. Rollins Jr.) is a black piano player. He has won fame and fortune playing with a jazz band. Some white men do not like this situation, and one day they assault him and spoil his brand new car. Walker tries by all means to get justice, without satisfaction.","['James Cagney', 'Brad Dourif', 'Moses Gunn', 'Elizabeth McGovern', 'Kenneth McMillan']","['Gordon Arnell', 'Len Barnard', 'Mary Breen-Farrelly', 'June Broom', 'Dino De Laurentiis']",['Milos Forman'],['United States'],['English'],"['Dino De Laurentiis Company', 'Sunley Productions Ltd.']"
83033,"Primarily a spoof of the Friday the 13th series, but also takes shots at several other horror films. After his family moves to a new house, a young boy discovers a mysterious book describing the curse hanging over the date of Saturday the 14th. Opening the book releases a band of monsters into the house, and the family must join together to save themselves and their neighborhood.","['Richard Benjamin', 'Paula Prentiss', 'Jeffrey Tambor', 'Severn Darden', 'Kari Michaelsen']","['Gerry Blumenthal', 'Bonnie Cirino', 'Albert Cohen', 'Jane Covner', 'Julie Feiner']",['Howard R. Cohen'],['United States'],['English'],['New World Pictures']
81455,"Darryl Revok is the most powerful of all the scanners, and is the head of the underground scanner movement for world domination. Scanners have great psychic power, strong enough to control minds; they can inflict enormous pain/damage on their victims. Doctor Paul Ruth finds a scanner that Revok hasn't, and converts him to their cause - to destroy the underground movement.","[""Jennifer O'Neill"", 'Stephen Lack', 'Patrick McGoohan', 'Lawrence Dane', 'Michael Ironside']","['Neil Bibby', 'Victor Blazevic', 'Robert Boyd', 'Pierre David', 'Patrick Ferrerro']",['David Cronenberg'],['Canada'],['English'],"['Canadian Film Development Corporation', 'Filmplan International', 'Montreal Trust Company of Canada']"
83064,"Tom Sharky is a narcotics cop in Atlanta who's demoted to vice after a botched bust. In the depths of this lowly division, while investigating a high-dollar prostitution ring, Sharky stumbles across a mob murder with government ties, and responds by assembling his downtrodden fellow investigators (Sharky's ""machine"") to find the leaders and bring them to justice before they kill off all his partners and witnesses, including Sharky himself.","['Burt Reynolds', 'Vittorio Gassman', 'Brian Keith', 'Charles Durning', 'Earl Holliman']","['Don Bachardy', 'Beverly Baker', 'Blanche Bisbing', 'Roberta Brecher', 'Stanley Brossette']",['Burt Reynolds'],['United States'],"['English', 'French', 'Italian']","['Deliverance Productions', 'Orion Pictures']"
83067,"Following on from ""The Rocky Horror Picture Show"", this musical is set several years later in Brad and Janet Majors' hometown, which has become a giant TV station; residents are either participants or viewers. Brad and Janet have been married for several years now, but their romance has slouched and slumped. Ostensibly to fix their marriage, Brad is imprisoned on the program ""Dentonvale"" (the local mental hospital) while Janet is conscripted to become a new star. As Janet is entranced by the high life, she forgets Brad. Who is trying to woo her away? And why?","['Jessica Harper', 'Cliff De Young', ""Richard O'Brien"", 'Patricia Quinn', 'Charles Gray']","['Andy Birmingham', 'Ruth Bourchier', 'Marilyn Clarke', 'Joe Dunton', 'Gillian Gregory']",['Jim Sharman'],['United States'],['English'],['Twentieth Century Fox']
83111,"A squad of National Guards on an isolated weekend exercise in the Louisiana swamp must fight for their lives when they anger local Cajuns by stealing their canoes. Without live ammunition and in a strange country, their experience begins to mirror the Vietnam experience.","['Keith Carradine', 'Powers Boothe', 'Fred Ward', 'Franklyn Seales', 'T.K. Carter']","['Judy Bernardoni', 'Jerry Chinn', 'Rob Corn', 'Lori Covel', 'Lyla Foggia']",['Walter Hill'],['United States'],"['English', 'French']","['Cinema Group Ventures', 'Phoenix Films']"
