imdbId,plot,cast,crew,director,countries,languages,production_companies
305357,"The Angels--Natalie, Dylan, and Alex are back again but this time they're preparing for a strike without even warning as they go undercover to retrieve two missing silver bands. These are no ordinary rings. They contain valuable encrypted information that reveal the new identities of every person in the Federal Witness Protection Program. When witnesses start turning up dead, only the Angels, using their expertise as masters of disguise, espionage and martial arts can stop the perpetrator, a mysterious ""fallen"" Angel. Aided by their trusty colleague, Jimmy Bosley, the Angels' adventure begins at a remote Mongolian outpost and ends only after Dylan is forced to face a dark secret from her past--a secret that puts the lives of her two best friends in danger.","['Cameron Diaz', 'Drew Barrymore', 'Lucy Liu', 'Bernie Mac', 'Crispin Glover']","['Michelle Acosta-Betts', 'Crisoforo Aguilar', 'Wendy Altman-Cohen', 'Robin Antin', 'Sheri Apap']",['McG'],['United States'],"['English', 'Mandarin', 'Spanish']","['Columbia Pictures', 'Flower Films', 'Tall Trees Productions', 'Wonderland Sound and Vision']"
286635,"For many years professional assassin O has resided in an isolated world of killing and loneliness, which only becomes worse after the death of his love, Nancy. But his life begins to change once he meets the innocent Chin. Chin, hired to clean O's apartment. However, soon the flamboyent and reckless Tok enters Chin's life with a mission--to unveil O's identity and usurp his place as the number one sharp-shooting assassin in the game.","['Andy Lau', 'Takashi Sorimachi', 'Simon Yam', 'Kelly Lin', 'Cherrie Ying']","['Kam-Pui Cheung', 'Ebara Chitose', 'Ching-Ting Law', 'Clement Mak', 'Yuk-Fong Siu']",['Johnnie To'],['Hong Kong'],"['English', 'Mandarin', 'Japanese', 'Cantonese', 'Italian']","['Team Work Motion Pictures Ltd.', 'CMC Magnetics Corporation', 'Milky Way Image Company']"
241223,"['The Bank is a thriller about banking, corruption and alchemy.']","['David Wenham', 'Anthony LaPaglia', 'Sibylla Budd', 'Steve Rodgers', 'Mitchell Butel']","['Debra Annear', 'Mike Betar', 'Miranda Colman', 'Tom Coltraine', 'Brendan Dillon']",['Robert Connolly'],['Australia'],"['English', 'Japanese']","['Arenafilm', 'Showtime Australia']"
71141,"The wildly prolific German filmmaker Rainer Werner Fassbinder paid homage to his cinematic hero Douglas Sirk with this update of that filmmaker's All That Heaven Allows (1955). A lonely widow (Brigitte Mira) meets a much younger Moroccan worker (El Hedi ben Salem) in a bar during a rainstorm. They fall in love, to their own surprise-and to the outright shock of their families, colleagues, and drinking buddies. In Ali: Fear Eats the Soul, Fassbinder expertly wields the emotional power of classic Hollywood melodrama to expose the racial tensions underlying contemporary German culture.","['Brigitte Mira', 'El Hedi ben Salem', 'Irm Hermann', 'Elma Karlowa', 'Anita Bucher']",['Wolfgang Hess'],['Rainer Werner Fassbinder'],['West Germany'],"['German', 'Arabic']","['Tango Film', 'Filmverlag der Autoren']"
48947,"Russian exiles in Paris plot to collect ten million pounds from the Bank of England by grooming a destitute, suicidal girl to pose as heir to the Russian throne. While Bounin is coaching her he comes to believe she is really Anastasia. In the end the Empress must decide her claim.","['Ingrid Bergman', 'Yul Brynner', 'Helen Hayes', 'Akim Tamiroff', 'Martita Hunt']",['Paul Dickson'],['Anatole Litvak'],['United States'],"['English', 'French']",['Twentieth Century Fox']
103747,Traces the career of Babe Ruth from his days as a youngster in an orphanage to his last days as a manager. Includes such moments as the famous predicted home run and the promise to little Johnny.,"['John Goodman', 'Kelly McGillis', 'Trini Alvarado', 'Bruce Boxleitner', 'Peter Donat']","['James Bond', 'Laura Booker', 'Angela H. Brice', 'Mikki Capparelli', 'Al Cerullo']",['Arthur Hiller'],['United States'],['English'],"['Universal Pictures', 'Waterhorse Productions', 'Finnegan/Pinchuk Productions']"
99587,"After his bombardier is killed, Jake ""Cool Hand"" Grafton (Brad Johnson)', a carrier-based Intruder pilot, questions the purpose of Navy bombing missions. He finds an ally for his cynicism in Virgil Cole, a bombardier on his third tour of duty, and together they ponder the notion of one unsanctioned mission ""downtown"", to ""Sam City"" in North Vietnam.","['Danny Glover', 'Willem Dafoe', 'Brad Johnson', 'Rosanna Arquette', 'Tom Sizemore']","['Bob Bergen', 'Jim Box', 'Leonard Brady', 'James E. Brooks', 'Deborah L. Campbell']",['John Milius'],['United States'],['English'],['Paramount Pictures']
76059,"Manager Dick Harper and his attractive young wife Jane are used to a comfortable lifestyle. They just build a swimming-pool when Dick is fired very unexpectedly - leaving him with $70,000 debt on the house. They try to hide this from the neighbors and just cut down their expenses, but soon it's obvious: living from unemployment bonus drives them crazy, it's uncertain if they can keep the house. Dick doesn't see another way out than robbing drug stores - but this takes more skill than expected! Only as a team Dick and Jane can succeed.","['George Segal', 'Jane Fonda', 'Ed McMahon', 'Dick Gautier', 'Allan Miller']","['Micheline Lanctôt', 'Chuck Murray', 'Bruce Nahin', 'Eric A. Sears', 'Tobi C. Singleton']",['Ted Kotcheff'],['United States'],['English'],"['Columbia Pictures', 'Polyphony Digital']"
79510,"Hillary Kramer, successful Perfume magnate awakes one morning to find that her accountant has robbed her blind and left for South America. Going through all of her remaining assets she finds a boxer, purchased as a tax write off. She decides to take Kid Natural, (Eddie Scanlon) who is much more at home giving driving lessons, into the ring and use him as her key to riches. Eddie thinks this will only get him killed and resists.","['Barbra Streisand', ""Ryan O'Neal"", 'Paul Sand', 'Whitman Mayo', ""Patti D'Arbanville""]","['Judy Bernardoni', 'Wayne Fitzgerald', 'Vic Heutschy', 'Gene Levy', 'Hedgemon Lewis']",['Howard Zieff'],['United States'],['English'],"['First Artists', 'Barwood Films']"
104926,"Although a one-time MVP for the New York Yankees, Jack Elliott is now on the down side of his baseball career. His batting average is low and one of his few claims to fame is that during the previous year, he led the team in 9th inning doubles in the month of August. With an up and coming slugger ready to replace him, he learns that he's been traded to the Chunichi Dragons of the Japanese Central baseball league. Elliott is set in his ways and quite inflexible, not only in accepting Japanese culture in general, but also with the way the baseball team is managed. When he meets his very pretty PR agent, Hiroko, he begins to gain a greater appreciation that he should accept his current situation. When he realizes her other connection to the team, his attitudes begin to change at an even greater pace","['Tom Selleck', 'Ken Takakura', 'Aya Takanashi', 'Dennis Haysbert', 'Toshi Shioya']","['Jennifer Barty', 'Al Cerullo', 'Terry Dunn', 'Susan Gee', 'Ryan Hintz']",['Fred Schepisi'],"['United States', 'Japan']","['English', 'Japanese']","['DENTSU Music And Entertainment', 'Outlaw Productions', 'Sogovision', 'Universal Pictures']"
54198,"Beautiful and corrupt, sociable and sensitive, Ilya, an independent, happy-go-lucky streetwalker in the bustling Port of Piraeus, is the talk of the town. Intrigued by her character, the love-smitten American intellectual and amateur philosopher, Homer Thrace, sets his sights on becoming Ilya's Pygmalion, and in the process, attempt to explain the decline of the great Ancient Greek civilisation. Of course--as Ilya belongs to no one, and the handsome Greek-Italian dockhand, Tonio, is bent on winning her heart--this is a challenging task, especially when proud Ilya swears that she leads a full and exciting life. Now, the romantic philhellene has two short weeks to accomplish his task. Will he learn a thing or two about life, and maybe, just maybe, find the secret of happiness?","['Melina Mercouri', 'Jules Dassin', 'Giorgos Foundas', 'Titos Vandis', 'Mitsos Ligizos']",['Giorgos Provias'],['Jules Dassin'],['Greece'],"['English', 'Greek', 'Russian']",['Melina Film']
93660,"A high-class call girl kills a customer in self-defense. To avoid scandal, her parents try to have her declared mentally incompetent. Not helping matters is that she is very distrustful of everybody, including her court-appointed attorney, and is very disruptive during her court hearings.","['Barbra Streisand', 'Richard Dreyfuss', 'Maureen Stapleton', 'Karl Malden', 'Eli Wallach']","['Jim Barr', 'Suzanne Bishop', 'Stanley Brossette', 'Linda Brown', 'Renata Buser']",['Martin Ritt'],['United States'],['English'],"['Warner Bros.', 'Barwood Films']"
101991,"An elderly woman living in Nagasaki Japan takes care of her four grandchildren for their summer vacation. They learn about the atomic bomb that fell in 1945, and how it killed their grandfather.","['Sachiko Murase', 'Hisashi Igawa', 'Narumi Kayashima', 'Tomoko Ôtakara', 'Mitsunori Isaki']","['Peter Grilli', 'Ishirô Honda', 'Shushin Hosoya', 'Hiroko Idetsu', 'Ryosetsu Imai']",['Akira Kurosawa'],['Japan'],"['Japanese', 'English']","['Feature Film Enterprise II', 'Kurosawa Production Co.', 'Shochiku']"
45125,"Andre-Louis Moreau is a nobleman's bastard in the days of the French revolution. Noel, the Marquis de Mayne, a nobleman in love with the Queen, is ordered to seek the hand of a young ingenue, Aline, in marriage. Andre also meets Aline, and forms an interest in her. But when the marquis kills his best friend Andre declares himself the Marquis's enemy and vows to avenge his friend. He hides out, a wanted man, as an actor in a commedia troupe, and spends his days learning how to handle a sword. When de Maynes becomes a spadassinicide, challenging opposing National Assembly members to duels they have no hope of winning, Andre becomes a politician to protect the third estate (and hopefully ventilate de Maynes).","['Stewart Granger', 'Eleanor Parker', 'Janet Leigh', 'Mel Ferrer', 'Henry Wilcoxon']","['James Gooch', 'Alfred Baalas', 'Jean Heremans', 'Henry Imus', 'John Indrisano']",['George Sidney'],['United States'],['English'],['Metro-Goldwyn-Mayer (MGM)']
66402,"An account of the adventures of two sets of identical twins, badly scrambled at birth, on the eve of the French Revolution. One set is haughty and aristocratic, the other poor and somewhat dim. They find themselves involved in palace intrigues as history happens around them. Based, very loosely, on Dickens's _A Tale of Two Cities_, Dumas's _The Corsican Brothers_, etc.","['Gene Wilder', 'Donald Sutherland', 'Hugh Griffith', 'Jack MacGowran', 'Billie Whitelaw']",['Hunt Downs'],['Bud Yorkin'],['United States'],['English'],"['NorBud Productions', 'Norbud Films', 'Warner Bros.']"
74811,"In Paris, the shy bureaucrat Trelkovsky rents an old apartment without bathroom where the previous tenant, the Egyptologist Simone Choule, committed suicide. The unfriendly concierge (Shelley Winters) and the tough landlord Mr. Zy establish stringent rules of behavior and Trelkovsky feels ridden by his neighbors. Meanwhile he visits Simone in the hospital and befriends her girlfriend Stella. After the death of Simone, Trelkovsky feels obsessed for her and believes his landlord and neighbors are plotting a scheme to force him to also commit suicide.","['Roman Polanski', 'Isabelle Adjani', 'Melvyn Douglas', 'Jo Van Fleet', 'Bernard Fresson']","['Walter Alford', 'Josée Bénabent-Loiseau', 'Simone Escoffier', 'Robert Rietty']",['Roman Polanski'],['France'],"['French', 'English']",['Marianne Productions']
107146,"In medieval France, young lawyer Richard Courtois leaves Paris for the simpler life in the country. However, he is soon drawn into amorous and political intrigues. At the same time, he is pushed to defend a pig, owned by the mysterious gypsy Samira. The pig has been arrested for the murder of a young boy.","['Colin Firth', 'Ian Holm', 'Donald Pleasence', 'Amina Annabi', 'Nicol Williamson']","['Wayne Docksey', 'Jane Gibson', 'Rhian Llewellyn', 'Jean-Pierre Morillon', 'Richard Morrison']",['Leslie Megahey'],"['France', 'United Kingdom']",['English'],"['BBC Films', 'CiBy 2000', 'British Screen Finance Ltd.', 'European Co-production Fund']"
69495,"Two researchers have come to San Francisco to compete for a research grant in music. One seems a bit distracted, and that's before he meets her: a strange woman who seems to have devoted her life to confusing and embarrassing him. At the same time, a woman has her jewels stolen and a government whistle-blower arrives with his stolen top-secret papers. All, of course, have the same style and color overnight bag.","['Barbra Streisand', ""Ryan O'Neal"", 'Madeline Kahn', 'Kenneth Mars', 'Austin Pendleton']","['Neil Canton', 'Frank Marshall', 'Mae Woods', 'Joe Amsler', 'Barbara Barrett']",['Peter Bogdanovich'],['United States'],"['English', 'French', 'German']","['Warner Bros.', 'Saticoy Productions']"
286716,Bruce is an ordinary Gamma expert who one day gets blasted with radiation and somehow survives. But in the process a monster was born. Now whenever he gets angry he grows bigger and stronger until he is no longer Bruce Banner. He becomes The Hulk,"['Eric Bana', 'Jennifer Connelly', 'Sam Elliott', 'Josh Lucas', 'Nick Nolte']","['Rachel Aberly', 'Co-Co Aiello-Younger', 'Wendy Altman-Cohen', 'John W. Armbrust', 'Julie Fay Ashborn']",['Ang Lee'],['United States'],"['English', 'Spanish']","['Universal Pictures', 'Marvel Enterprises', 'Valhalla Motion Pictures', 'Good Machine']"
333780,"Sassy postgrad Elle Woods (Reese Witherspoon) is all about animal rights. In fact, she puts her nuptial plans on hold to head to Washington, D.C. to get an anti-animal testing bill passed. Her building's doorman quickly shows her the ways and workings of our nation's capital.","['Reese Witherspoon', 'Sally Field', 'Regina King', 'Jennifer Coolidge', 'Bruce McGill']","['Travis Avitabile', 'Jeanine Barry', 'Christina Barton', 'Toni Basil', 'Rachel Bati']",['Charles Herman-Wurmfeld'],['United States'],['English'],"['Metro-Goldwyn-Mayer', 'Marc Platt Productions', 'Type A Films']"
165982,"A sailor named Sinbad is on a quest to find the magical legendary Book of Peace, a mysterious artifact that Eris, the wicked Greek goddess of chaos, has ultimately framed him for stealing. If he fails on this quest, his childhood friend Prince Proteus of Syracuse will take Sinbad's death penalty while Eris gains a desired foothold of power in the world of mortals.","['Brad Pitt', 'Catherine Zeta-Jones', 'Michelle Pfeiffer', 'Joseph Fiennes', 'Dennis Haysbert']","['Ed Adams', 'Steve Apostolina', 'Kirk Baily', 'Ryan Behnke', 'Will Bilton']",['Patrick Gilmore'],"['United States', 'Canada']","['English', 'Cantonese', 'Italian']","['Dreamworks Pictures', 'DreamWorks Animation']"
181852,"More than 10 years after 'Terminator 2', John Connor now exists only as a drifter - living 'off the grid', so no more Terminators from the future can hunt him down. Unfortunately, SkyNet does send another one back - and this one is called the T-X, even more powerful & advanced than the dreaded T-1000. However, another CSM-101 Terminator is also sent back to protect John against the T-X. Now, Skynet is patiently assuming control of civilian computer systems, under the guise of a computer virus. John has also met his future wife, Kate Brewster, whose father - a U.S. Air Force General - is in charge of the military computer systems & is leery of up linking SkyNet. However, when the SkyNet virus infects the U.S military computers & leaves the country open to attack, the machines begin their horrific takeover. Soon a nuclear war will result - and the war against the machines will begin. Can the outdated CSM-101 Terminator eliminate the highly advanced T-X - or will a darker future await man following the nuclear attack?","['Arnold Schwarzenegger', 'Nick Stahl', 'Claire Danes', 'Kristanna Loken', 'David Andrews']","['Karen Chang Ambrose', 'Robert Amstler', 'Lea Anderson', 'Tobin Armbrust', 'Angela Athayde']",['Jonathan Mostow'],"['United States', 'Germany', 'United Kingdom']",['English'],"['C-2 Pictures', 'Intermedia Films', 'IMF Internationale Medien und Film GmbH & Co. 3. Produktions KG', 'Mostow/Lieberman Productions', 'Valhalla Motion Pictures']"
324133,"Sarah Morton is a famous British mystery author. Tired of London and seeking inspiration for her new novel, she accepts an offer from her publisher John Bosload to stay at his home in Luberon, in the South of France. It is the off-season, and Sarah finds that the beautiful country locale and unhurried pace is just the tonic for her--until late one night, when John's indolent and insouciant French daughter Julie unexpectedly arrives. Sarah's prim and steely English reserve is jarred by Julie's reckless, sexually charged lifestyle. Their interactions set off an increasingly unsettling series of events, as Sarah's creative process and a possible real-life murder begin to blend dangerously together.","['Charlotte Rampling', 'Ludivine Sagnier', 'Charles Dance', 'Jean-Marie Lamour', 'Marc Fayolle']","['Aurélie Assié Lécroart', 'Christophe Cervoni', 'Thierry Chapat', 'Mike Clark-Hall', 'Marylène Dastugue']",['François Ozon'],"['France', 'United Kingdom']","['English', 'French']","['Fidélité Productions', 'France 2 Cinéma', 'Gimages', 'FOZ', 'Headforce Ltd.', 'Canal+']"
325980,"This swash-buckling tale follows the quest of Captain Jack Sparrow, a savvy pirate, and Will Turner, a resourceful blacksmith, as they search for Elizabeth Swann. Elizabeth, the daughter of the governor and the love of Will's life, has been kidnapped by the feared Captain Barbossa. Little do they know, but the fierce and clever Barbossa has been cursed. He, along with his large crew, are under an ancient curse, doomed for eternity to neither live, nor die. That is, unless a blood sacrifice is made.","['Johnny Depp', 'Geoffrey Rush', 'Orlando Bloom', 'Keira Knightley', 'Jack Davenport']","['Courtney J. Andersen', 'Bob Anderson', 'Heather Anderson', 'Lea Anderson', 'Louise Baker']",['Gore Verbinski'],['United States'],['English'],"['Walt Disney Pictures', 'Jerry Bruckheimer Films']"
311429,"Renowned adventurer Allan Quatermain leads a team of extraordinary figures with legendary powers to battle the technological terror of a madman known as ""The Fantom"". This ""League"" comprises seafarer and inventor Captain Nemo, vampire Mina Harker, an invisible man named Rodney Skinner, American Secret Service Agent Tom Sawyer, the ageless and invincible Dorian Gray, and the dangerous split personality of Dr. Jekyll and Mr. Hyde.","['Sean Connery', 'Naseeruddin Shah', 'Peta Wilson', 'Tony Curran', 'Stuart Townsend']","['Ian Abercrombie', 'Robert Alonzo', 'Kirsten Anderson', 'Daren Bailey', 'Debra Leilani Bakeman']",['Stephen Norrington'],"['United States', 'Germany', 'Czechia', 'United Kingdom']","['English', 'German', 'Italian']","['Angry Films', 'International Production Company', 'JD Productions', 'Mediastream Dritte Film GmbH & Co. Beteiligungs KG', 'Twentieth Century Fox']"
308476,"September of 1944, a few days before Finland went out of the Second World War. A chained to a rock Finnish sniper-kamikadze Veikko managed to set himself free. Ivan, a captain of the Soviet Army, arrested by the Front Secret Police 'Smersh', has a narrow escape. They are soldiers of the two enemy armies. A Lapp woman Anni gives a shelter to both of them at her farm. For Anni they are not enemies, but just men.","['Anni-Kristiina Juuso', 'Ville Haapasalo', 'Viktor Bychkov', 'Mikhail Korobochkin', 'Aleksey Kashnikov']","['Gianni Rossi', 'Alec Schulmann']",['Aleksandr Rogozhkin'],['Russia'],"['Saami', 'Finnish', 'Russian', 'German']",['CTB Film Company']
300015,"The film follows 17-year-old Cassandra Mortmain and the fortunes of her eccentric family as they struggle to survive in a decaying English castle. Her father is desperate to repeat the spectacular success of his first novel but hasn't written a word for 12 years; her exquisite sister Rose can only rail against their fate, and their Bohemian stepmother Topaz is a nudist and no help at all. Salvation comes in the form of their American landlord Simon Cotton and his brother Neil. Although initially repelled by Simon, Rose is determined to make him fall in love with her, and succeeds. A wedding is arranged and Cassandra is left on the sidelines as everyone around her is drawn into a maelstrom of interconnected relationships. But events spiral out of control, and before the summer ends she will experience frustrated desire, first love, and a broken heart.","['Romola Garai', 'Sophie Stuckey', 'Bill Nighy', 'Helena Little', 'Florence Jones']","['Mark Barry-Jackson', 'Joanna Beckett', 'Daniel Budd', 'Tim Desbois', 'Chloe Emmerson']",['Tim Fywell'],['United Kingdom'],['English'],"['BBC Films', 'Isle of Man Film Commission', 'Isle of Man Film', 'Take 3 Partnership', 'Trademark Films']"
322659,"In a near-empty Northfork orphanage, Father Harlan gently tends to Irwin, an eight-year-old who lies between a dream state and death. As orphanage caretaker Harlan reads aloud about Northfork's years-ago forced evacuation to make way for a hydro-electric dam, Irwin's imagination takes flight. While a team of six men evacuate the last remaining citizens of the town, Irwin, too, invents a cast of characters to prepare himself for his own evacuation. (the above states the caretaker - who is actually the priest - is reading about a years-ago evacuation. In the movie, the evacuation is taking place as the boy lays dying!)","['James Woods', 'Nick Nolte', 'Douglas Sebern', 'Claire Forlani', 'Duel Farnes']","['Curt L. Ayers', 'Steve Berman', 'Robert Browning', 'Maury Duchamp', 'Justin Grohs']",['Michael Polish'],['United States'],['English'],"['Paramount Classics', 'Romano Shane Productions', 'Departure Entertainment', 'Prohibition Pictures', 'Polish Brothers Construction', 'Departure Studios', 'Northfork Productions']"
172156,"Miami is being flooded with ecstasy that's coming from Cuba through drug lord Johnny Tapia. Detectives Mike Lowrey and Marcus Burnett are on the case, and are determined to bring the man to justice. Additional drama is provided by friction with the DEA, which counts Marcus' younger sister Sydney among its agents, and from Marcus possibly transferring out of the department, leaving Mike without his longtime partner.","['Martin Lawrence', 'Will Smith', 'Jordi Mollà', 'Gabrielle Union', 'Peter Stormare']","['David Aaron', 'Crisoforo Aguilar', 'Edward Albolote', 'Charles E. Alston', 'Sara Alvarez']",['Michael Bay'],['United States'],"['English', 'Spanish', 'Russian']","['Columbia Pictures', 'Don Simpson/Jerry Bruckheimer Films']"
319524,"Halley is a young high school student who is disillusioned with love after seeing the many dysfunctional relationships around her. Her parents are now divorced and her father has a new young girlfriend she doesn't care for too much. Her mother is now always alone; and her sister is so overwhelmed by her upcoming wedding that she barely leaves the house anymore. On top of that, the shallowness of all the girls and guys at her school convinces Halley that finding true love is impossible. A tragic accident, however, leads her to meeting Macon, and suddenly Halley finds that true love can occur under unusual circumstances.","['Mandy Moore', 'Allison Janney', 'Trent Ford', 'Alexandra Holden', 'Dylan Baker']","['Kate Abernathy', 'Allison Bergstrand', 'David Boyle', 'David M. Chisholm', 'Ken Dhaliwal']",['Clare Kilner'],['United States'],['English'],"['Focus Features', 'Golden Mean', 'Radar Pictures']"
274166,"When a funeral of a British spy is attacked, all of the remaining spies are killed. Only one spy is left and is now Britain's last hope. Johnny English and his sidekick, Bough have been assigned the case of investigating the theft of the British Crown Jewels. The prime suspect is a mysterious French entrepreneur, known as Pascal Sauvage. English and Bough soon find out the horrifying truth behind the theft and Sauvage, but it's not going to be an easy job to bring him to justice.","['Rowan Atkinson', 'Tasha de Vasconcelos', 'Ben Miller', 'Greg Wise', 'Douglas McFerran']","['Devina Artley', 'Daren Bailey', 'Jon Baker', 'Jules Baker-Smith', 'Kellie Belle']",['Peter Howitt'],"['United Kingdom', 'France']","['English', 'French', 'Japanese']","['Universal Pictures', 'StudioCanal', 'Working Title Films', 'Kanzaman S.A.M.']"
301199,"Okwe is an irregular Nigerian immigrant leading a hard life and struggling to survive in London's underground. He works as a hotel receptionist by night and, as he has a medical degree, he practices some medicine during the day, in a very odd way. Besides that he must constantly escape from Immigration officers. One day Okwe discovers that an illegal scheme of surgeries is being lead by Juan, his boss at the hotel. Juan comes up with a tempting proposal: if Okwe agrees to perform the illegal surgeries he makes a lot of money and gets legal citizenship in the U.K. Can Okwe keep his moral values intact?","['Chiwetel Ejiofor', 'Kriss Dosanjh', 'Israel Oyelumade', 'Yemi Goodman Ajibade', 'Nizwar Karanj']","['Julie Brinkman', 'Jana Camacho', 'Rashad Clinton', 'James Cooper', 'Jan Fleischer']",['Stephen Frears'],['United Kingdom'],"['English', 'Somali', 'Spanish', 'French']","['BBC Films', 'Celador Films', 'Jonescompany Productions']"
