imdbId,plot,cast,crew,director,countries,languages,production_companies
316188,"Victor is growing up on the Lower East Side and is at the age where he is driven by desire and unchained by maturity. His image as a ladies man is shattered when he is found in Fat Donna's bedroom. Soon, as a result of his sister's big mouth, the whole Dominican community knows. Full of confidence, Victor sets out to reclaim his image by winning Judy. Judy proves to be elusive and difficult. Victor persists, and with a surprising tenderness, ultimately wins Judy's heart.","['Victor Rasuk', 'Donna Maldonado', 'Kevin Rivera', 'Krystal Rodriguez', 'Judy Marte']","['Scott Burik', 'Kristen Dubberstein', 'Shawn Hamilton', 'Matthew Hysell', 'Jesika Khadivi']",['Peter Sollett'],"['France', 'United States']","['English', 'Spanish']","['Canal+', 'Forensic Films', 'StudioCanal', 'Untitled Productions']"
334416,"He began a film, a search, to discover not only what had happened to Stevie over the past ten years but to understand the forces that had shaped his entire life. Part way through the filming, Stevie is arrested and charged with a serious crime that tears his family apart. What was to be a modest profile turns into a intimate four and half year chronicle of Stevie, his broken family, the criminal justice system and the filmmaker himself, as they all struggle with what Stevie has done and who he has become.","['Steve James', 'Stephen Fielding', 'Tonya Gregory', 'Bernice Hagler', 'Verna Hagler']","['Mark Adler', 'Lizzy Calhoun', 'Alexandra Denman', 'Jacqueline Eckhouse', 'Kristen Fligel']",['Steve James'],['United States'],['English'],"['Kartemquin Films', 'SenArt Films']"
100998,"This is essentially eight separate short films, though with some overlaps in terms of characters and thematic material - chiefly that of man's relationship with his environment. 'Sunshine Through The Rain': a young boy is told not to go out on the day when both weather conditions occur, because that's when the foxes hold their wedding procession, which could have fatal consequences for those who witness it. 'The Peach Orchard': the same young boy encounters the spirits of the peach trees that have been cut down by heartless humans. 'The Blizzard': a team of mountaineers are saved from a blizzard by spiritual intervention. 'The Tunnel': a man encounters the ghosts of an army platoon, whose deaths he was responsible for. 'Crows': an art student encounters 'Vincent Van Gogh' and enters the world of his paintings. 'Mount Fuji in Red': nuclear meltdown threatens the devastation of Japan. 'The Weeping Demon': a portrait of a post-nuclear world populated by human mutations. 'Village of the Watermills': a sunny portrait of a village whose population is entirely at one with nature.","['Akira Terao', 'Mitsuko Baishô', 'Toshie Negishi', 'Mieko Harada', 'Mitsunori Isaki']","['Kazutami Hara', 'Michiyo Hata', 'Yasuhiko Higashi', 'Ishirô Honda', 'Shushin Hosoya']",['Akira Kurosawa'],"['Japan', 'United States']","['Japanese', 'French', 'English']",['Akira Kurosawa USA']
70460,"The shooting of ""Je vous presente Pamela"" (may I introduce Pamela) begins. This is the story of en English married wife falling in love and running away with the father of her French husband. Will be simultaneously shown the shooting, the behavior of the people (including the technical team) on the set, and a part of their private life (a factor of complication)...","['Jacqueline Bisset', 'Valentina Cortese', 'Dani', 'Alexandra Stewart', 'Jean-Pierre Aumont']","['Christian Lentretien', 'Alex Maineri', 'Roland Thénot', 'John Marshall']",['François Truffaut'],"['France', 'Italy']","['French', 'English', 'Italian']","['Les Films du Carrosse', 'PECF', 'Produzione Intercontinentale Cinematografica (PIC)']"
42593,"Screenwriter Dixon Steele, faced with the odious task of scripting a trashy bestseller, has hat-check girl Mildred Atkinson tell him the story in her own words. Later that night, Mildred is murdered and Steele is a prime suspect; his record of belligerence when angry and his macabre sense of humor tell against him. Fortunately, lovely neighbor Laurel Gray gives him an alibi. Laurel proves to be just what Steele needed, and their friendship ripens into love. Will suspicion, doubt, and Steele's inner demons come between them?","['Humphrey Bogart', 'Gloria Grahame', 'Frank Lovejoy', 'Carl Benton Reid', 'Art Smith']",['Rod Amateau'],['Nicholas Ray'],['United States'],['English'],['Santana Pictures Corporation']
281820,"Set against the glitzy backdrop of the French Riviera, aging gambler Bob Montagnet is about to gamble it all on the casino heist of a lifetime; a spectatcular sleight of hand--two heists, one real, one not, but which is which? Under the watchful eye of Roger, a policeman who would as soon save his longtime opponent as arrest him, Montagnet assembles a team that consists of partners Paulo and Raoul, technical mastermind Vladimer, former-drug-dealer-turned-informant Said, Anne, a young Eastern girl Montagnet rescued from prostitution, and the perfect complement to a double theft--identical twins Albert and Bertram.","['Nutsa Kukhianidze', 'Ouassini Embarek', 'Tchéky Karyo', 'Marc Lavoine', 'Nick Nolte']","['Mariangela Angelucci', 'Joëlle Baland', 'Matthew Billingsly', 'Daniel Bird', 'Andrea Borella']",['Neil Jordan'],"['France', 'United Kingdom', 'Ireland', 'Canada', 'United States']","['English', 'French', 'Arabic']","['Alliance Atlantis Communications', 'Double Down Productions Ltd.', 'Metropolitan Films', 'TNVO']"
266465,"Sean Vetter and Demetrius Hicks are members of the DEA who are fighting an ongoing drug war on the California/Mexico border, they are most successful at it because of their edge of growing up on the street and being thugs converted to cops. The DEA busts one of the major players by the name of ""Memo"" Lucero and imprison him in the United States but then a major player named Diablo then takes over the business and now he is now the major player targeted by Vetter and his team. But when Vetter's wife is killed in a botched hit organized by Diablo, he seeks revenge against those responsible and in the process has to seek help from the imprisoned Lucero in order to catch Diablo. But in the process, Vetter and Hicks have to fight their way up the chain to get to Diablo but it's easier said than done when all Vetter can focus on is revenge...","['Vin Diesel', 'Larenz Tate', 'Timothy Olyphant', 'Geno Silva', 'Jacqueline Obradors']","['Alan Austin', 'Robert Bastens', 'Jim Blumenthal', 'Christopher S. Bryson', 'Jules Carideo']",['F. Gary Gray'],"['United States', 'Germany']","['English', 'Spanish']","['""DIA"" Productions GmbH & Co. KG', 'Joseph Nittolo Entertainment', 'New Line Cinema', 'Newman/Tooley Films']"
183649,"Stu Shepard is a fast talking and wise cracking New York City publicist who gets out of trouble and lies with his clever charm, connections, and charisma. Stu's greatest lie is to his wife Kelly, who he is cheating on with his girlfriend, Pam. Upon answering a call in a phone booth in belief it is Pam, Stu is on the line with a dangerous yet intelligent psychopath with a sniper rifle. When realizing it is not a joke, Stu is placed in a powerful mind game of wits and corruption. The New York City Police eventually arrive thereafter and demand Stu comes out of the phone booth- but how can he when if he hangs up or leaves the booth he will die?","['Colin Farrell', 'Kiefer Sutherland', 'Forest Whitaker', 'Radha Mitchell', 'Katie Holmes']","['Mike Ades', 'Bill Ahern', 'Steve Alterman', 'Kimberly Bailey', 'Claire Baker']",['Joel Schumacher'],['United States'],"['English', 'Swahili']","['Fox 2000 Pictures', 'Zucker/Netter Productions']"
275277,"The year is 2071. Following a terrorist bombing, a deadly virus is released on the populace of Mars and the government has issued a 300 million woo-long reward, the largest bounty in history, for the capture of whoever is behind it. The bounty hunter crew of the spaceship Bebop; Spike, Faye, Jet and Ed, take the case with hopes of cashing in the bounty. However, the mystery surrounding the man responsible, Vincent, goes deeper than they ever imagined, and they aren't the only ones hunting him. The original creators of the virus have dispatched Electra to deal with Vincent and take out anyone who may stumble on the truth behind him. As the hunt for the man with no past and no future continues to escalate, they begin to question what about the world is reality and what is a dream as the line between sanity and insanity becomes more apparent.","['Kôichi Yamadera', 'Unshô Ishizuka', 'Megumi Hayashibara', 'Aoi Tada', 'Yûsaku Yara']","['Takashi Abe', 'Naoki Amano', 'Marc Handler', 'Daichi Kagawa', 'Michiyo Koyanagi']","[""Shin'ichirô Watanabe""]","['Japan', 'United States']","['Japanese', 'English']","['Bandai Visual Company', 'Bones', 'Bones', 'Destination Films', 'Sunrise']"
304328,"The film discusses a philosophical approach at redemption. The protagonist Manual Jordan has gotten parole from a life sentence for the murder of Abner Easley, and returns to the city he lived in to try to seek redemption. He ends up living and working at a community house run by a preacher, Miles Evans. The film is equipped with beautiful voice-overs about the meaning of life and different philosophies for getting redeemed. Manual also becomes friends with Adele Easley, his victim's sister, in an attempt to make up for what he did. While working at the home he has interactions with Sofia Mellinger, the druggie daughter of a famous singer, struggling with the lack of adult guidance in her life.","['Billy Bob Thornton', 'Morgan Freeman', 'Holly Hunter', 'Kirsten Dunst', 'Manuel Aranguiz']","['Michael Annett', 'Chantal Boisclair', 'Andrea Callan', 'Sylvain Caron', 'Roxanne Charbonneau']",['Ed Solomon'],"['United States', 'France']",['English'],"['StudioCanal', 'Sony Pictures Classics', 'FilmColony', 'Echo Lake Entertainment', 'Entitled Entertainment', 'Revelations Entertainment', 'Columbia Pictures']"
311519,"The second part of Aki Kaurismäki's ""Finland"" trilogy, the film follows a man who arrives in Helsinki and gets beaten up so severely he develops amnesia. Unable to remember his name or anything from his past life, he cannot get a job or an apartment, so he starts living on the outskirts of the city and slowly starts putting his life back on track.","['Markku Peltola', 'Kati Outinen', 'Juhani Niemelä', 'Kaija Pakarinen', 'Sakari Kuosmanen']","['Haije Alanoja', 'Erkki Astala', 'Mimmo Hildén', 'Eevi Kareinen', 'Tatu Masilkin']",['Aki Kaurismäki'],"['Finland', 'Germany', 'France']",['Finnish'],"['Sputnik', 'Yleisradio (YLE)', 'Pandora Filmproduktion', 'ZDF/Arte', 'Network Movie Film-und Fernsehproduktion', 'Pyramide Productions', 'Arte France Cinéma', 'Canal+', ""Centre national du cinéma et de l'image animée (CNC)"", 'Bavaria Film']"
305224,"Mild-mannered timid businessman Dave Buznik works for a pet clothing company out of New York City. He's got an abrasive boss named Mr. Frank Head who frequently takes credit for his work and steps on him in return. He's got a loving girlfriend, Linda, whose best friend is her condescending college ex, Andrew. But when a misunderstanding aboard an airplane goes haywire, Dave is ordered by the court to undergo anger management therapy at the hands of specialist Dr. Buddy Rydell, who is an unpredictable, psychopathic character. As the relationship between Dave and Buddy becomes more tense, when the unorthodox treatment wreaks havoc Dave's life, and Buddy might be the only one who can save him from a problem he recognizes right away in his patient, that could only get worse.","['Adam Sandler', 'Jack Nicholson', 'Marisa Tomei', 'Luis Guzmán', 'Allen Covert']","['Wendy Altman-Cohen', 'James K. Amerian', 'Ethan Anderson', 'Laurie Arnow-Epstein', 'Christopher Au']",['Peter Segal'],['United States'],['English'],"['Revolution Studios', 'Happy Madison Productions', 'Anger Management LLC', 'Jack Giarraputo Productions']"
280477,"Ben is a perfectionist and overachiever whose tunnel vision leads to nothing less than graduating at the top of his class. As he struggles to achieve social success, he discovers his darker side. He and his friends: Virgil, Daric and Han lead a double life of mischief and petty crimes to alleviate the pressures of perfection. As their adopted identity grows, the gang tumbles into a downward spiral of excitement, excess and fun.","['Parry Shen', 'Jason Tobin', 'Shirley Anderson', 'Nanette Matoba', 'Kenji Matoba']","['Keith E. Cooper', 'Winston Emano', 'Erin Heidenreich', 'David Magdael', 'Annalee Paulo']",['Justin Lin'],['United States'],['English'],"['Cherry Sky Films', 'Day O Productions', 'Hudson River Entertainment', 'MTV Films', 'Trailing Johnson Productions']"
297144,"Academy Award® winning director and master storyteller James Cameron journeys back to the site of his greatest inspiration, the legendary wreck of the Titanic. With a team of the world's foremost historic and marine experts and friend, Bill Paxton, he embarks on an unscripted adventure back to the final grave where nearly 1,500 people lost their lives almost a century ago. Using state-of-the-art technology developed expressly for this expedition, Cameron and his crew are able to explore virtually all of the ship, inside and out, as never before. With the most advanced 3D photography, moviegoers will experience the ship as if they are part of the crew right inside the dive subs. In this unprecedented motion picture event, made especially for IMAX 3D Theatres and specially outfitted 35mm 3D theaters across the country, Cameron and his crew bring audiences to sights not seen since the sinking 91 years ago and explore why the landmark vessel, more than any shipwreck, continues to intrigue and fascinate the public.","['Bill Paxton', 'John Broadwater', 'Lori Johnston', 'Charles Pellegrino', 'Don Lynch']","['Johnathan Aldrin', 'Peter Barnett', 'Hillary Bibicoff', 'Geoff Burdick', 'Carlos Carillo']",['James Cameron'],"['France', 'United States']",['English'],"['Walt Disney Pictures', 'Walden Media', 'Earthship Productions', 'Summit Entertainment', 'UGC PH', 'Blue Rider Pictures']"
251736,"On the eve of Halloween, on October 1977, four friends--Bill, Jerry, Mary, and Denise--embark on an exciting cross-country road trip to write a guidebook about offbeat roadside attractions in America's less-travelled roads. Before long, the young explorers chance upon Captain Spaulding's Museum of Monsters and Madmen, only to become infatuated with the local legend of a deranged serial-killer doctor, and cross paths with the mysterious hitchhiker, Baby. However, when the unsuspecting group meets Baby's eccentric family after having a flat tyre, an endless night of terror, torture, and murder ensues. Has anyone ever got out alive from the House of Thousand Corpses?","['Chad Bannon', 'William Bassett', 'Karen Black', 'Erin Daniels', 'Joe Dobbs III']","['Scott Adair', 'Linden Bierman-Lytle', 'Peter Block', 'Jeff Bock', 'Anna Bradley']",['Rob Zombie'],['United States'],['English'],"['Spectacle Entertainment Group', 'Universal Pictures']"
300140,"While waiting for her mothers reply to take her to the USA, Lilya idles the time away smoking, drinking and having fun with her, too, outcast friend Volodya. In time, the chance of a new life becomes non-existent; her life is going nowhere. Meeting a young man, she then finds a plane ticket in her hand and a new life in Sweden: a job, an apartment and prospects. All is not what it seems. There shall be work, there shall be housing and there shall be no escape. This is the stark, frank and disturbing vision of the life of a young victim of the underground sex trade and in all its tone of realism of abject poverty, despicable actions and of wanting to show that dreaming of a better life is not a crime but that life can shatter the illusion of a happy ending.","['Oksana Akinshina', 'Artyom Bogucharskiy', 'Lyubov Agapova', 'Liliya Shinkaryova', 'Elina Benenson']","['Andres Arro', 'Stina Berggren', 'Nils Bindslev', 'Lena Hansson', 'Pia Janols']",['Lukas Moodysson'],"['Sweden', 'Denmark']","['Russian', 'Swedish', 'English', 'Polish']","['Memfis Film', 'Det Danske Filminstitut', 'Film i Väst', 'Nordisk Film & TV-Fond', 'Svenska Filminstitutet', 'Sveriges Television (SVT)', 'Zentropa Entertainments']"
245573,"When two college students, Sam and Thea, meet Coles at a party, their mutual attraction is immediate, leading to a passionate and awkward night together, and the onset of an intensely charged bond. As they continue to push the sexual boundaries of their friendship, however, they are tested by Sam and Coles' incipient romance and Thea's increasing recklessness, until the relationship dissolves amid a cloud of fear, resentment and mistrust. Eight years later they reunite. An animator for a high-profile ad agency, Coles now lives with Claire, his girlfriend of five years. Thea is happily married to Miles, with whom she owns a flourishing restaurant. And Sam has just returned to Manhattan after working in London where she recently broke off her engagement. Yet upon reconnecting, the three are drawn back into the complicated dynamic that defined their relationship from the start and are forced to confront the true meaning of commitment and love.","['Mark Ruffalo', 'Maya Stange', 'Kathleen Robertson', ""Kel O'Neill"", 'Ben Tolpin']","['Ibrahim Abdulaheem', 'John Acosta', 'John Alagna', 'Gil Amiaga', 'Zakiyya Awali']",['Austin Chick'],['United States'],['English'],"['Intrinsic Value Films', 'Natural Nylon Entertainment', 'The 7th Floor']"
245803,"For 60 years a mysterious monk with no name has zigzagged the globe to protect an ancient scroll - a scroll that holds the key to unlimited power. Now the Monk must look for a new scrollkeeper. Kar is an unlikely candidate, a streetwise young man whose only interest is himself. But when he inadvertently saves the Bulletproof Monk from capture, the two become partners in a scheme to save the world from the scroll's most avid pursuer. Packed with spectacular special effects and martial arts action, the Monk, Kar, and a sexy Russian mob princess called Bad Girl must struggle to find, face, and fight the ultimate enemy.","['Chow Yun-Fat', 'Seann William Scott', 'Jaime King', 'Karel Roden', 'Victoria Smurfit']","['Kevin Alakas', ""John 'Frenchie' Berger"", 'Stephanie Lee Berger', 'Isai Rivera Blas', 'Mel Braxton']",['Paul Hunter'],"['United States', 'Canada']","['English', 'Tibetan', 'Punjabi', 'German']","['Metro-Goldwyn-Mayer (MGM)', 'Lakeshore Entertainment', 'Mosaic', 'Lion Rock Productions', 'Flypaper Press', 'Cub Five Productions', 'Image Comics', 'Signpost Films']"
310281,"When folk icon Irving Steinbloom passed away, he left behind a legacy of music and a family of performers he has shepherded to folk stardom. To celebrate a life spent submerged in folk, Irving's loving son Jonathan has decided to put together a memorial concert featuring some of Steinbloom's best-loved musicians. There's Mitch and Mickey, who were the epitome of young love until their partnership was torn apart by heartbreak; classic troubadours The Folksmen, whose records were endlessly entertaining for anyone able to punch a hole in the center to play them; and The New Main Street Singers, the most meticulously color-coordinated neuftet ever to hit an amusement park. Now for one night only in New York City's Town Hall, these three groups will reunite and gather together to celebrate the music that almost made them famous.","['Jim Moret', 'Stuart Luce', 'Mary Gross', 'Marty Belafsky', 'Michael S. Baser']","['Chris Angelich', 'Simona Aranda', 'Judith M. Brown', 'Ian Calip', 'Barbara Calloway']",['Christopher Guest'],['United States'],"['English', 'Yiddish']",['Castle Rock Entertainment']
311289,"""But if you forget to come back for Madame Zeroni, you and your family will be cursed for always and eternity."" Those were the exact words spoken to young Elya Yelnats the day he forgot to repay Madame Zeroni. From then on his family was cursed with bad luck. One hundred years later Stanley Yelnats IV is accused of stealing a pair of cleats from a major league baseball player and sent to Camp Green Lake (a dry lake bed in the middle of the desert). It never rains at Camp Green Lake, it hasn't for one hundred years. The secretive and mysterious Warden has each inmate spend every day digging one hole to ""build character."" But when an artifact from the famous ""Kissin' Kate"" Barlow is found in a hole, the Warden forces the boys to work double time leading Stanley to deduce they're digging because the Warden is looking for something. But what? And how is the mystery of Camp Green Lake connected to Stanley's family curse?","['Sigourney Weaver', 'Jon Voight', 'Tim Blake Nelson', 'Shia LaBeouf', 'Khleo Thomas']","['Drew Aveling', 'Donna L. Bascom', 'Bob Beltz', 'Ephraim Benton', 'Eddie Brega']",['Andrew Davis'],['United States'],['English'],"['Walt Disney Pictures', 'Walden Media', 'Chicago Pacific Entertainment', 'Phoenix Pictures']"
328099,"Brad Gluckman or ""B-rad"" acts like he is from the hood, when he is white and lives in a rich neighborhood in Malibu. He is ruining his fathers election for governor, and he and his crew come up with an idea, to send ""B-rad"" to the hood to turn him back into a white boy. This movie is filled with laughs and is a great comedy.","['Jamie Kennedy', 'Taye Diggs', 'Anthony Anderson', 'Regina Hall', 'Blair Underwood']","['John Albrecht', 'Edward Allen', 'Tammy Apana', 'Laura Lynn Berrios', 'Bianca Bezdek-Goodloe']",['John Whitesell'],['United States'],['English'],"['Warner Bros.', 'Karz Entertainment', 'Big Ticket Productions']"
301727,"This documentary follows several species of migratory birds over a four year filming period. These birds travel several hundreds if not thousands of miles toward the equator in the autumn, and make the return journey to their higher latitude summer homes in the spring, always taking the same route, using the natural compasses of the universe, the stars, to find their way. Some species, like the arctic tern, even fly from pole to pole. These long and often torturous treks are a matter of survival, to live in a hospitable climate and find sources of food. With the exception of migratory penguins, travel over oceans is especially difficult as the birds have little refuge unless there is something floating on the water, such as a ship, on which to land. Otherwise they must continue flying until they reach land. Some will not survive the migration due to predators, including man, illness or injury. Although the migrations themselves are done as a community, once the birds reach their respective summer and winter homes, they disperse into family units. And every continent is affected by the migration as every continent is home, at least part of year, to a species of migratory bird.","['Philippe Labro', 'Jacques Perrin']","['Peter Berthold', 'Romain Bianchi', 'Valentine Marvel', 'Olivier Meunier-Colin', 'Leighton Oosthuisen']",['Jacques Perrin'],"['France', 'Germany', 'Switzerland', 'Spain', 'Italy']","['English', 'French']","['Galatée Films', 'France 2 Cinéma', 'France 3 Cinéma', 'Les Productions de la Guéville', 'Bac Films', 'Canal+', 'Pandora Filmproduktion', 'Westdeutscher Rundfunk (WDR)', 'Filmstiftung Nordrhein-Westfalen', 'Les Productions JMH', 'Télévision Suisse-Romande (TSR)', 'Wanda Visión S.A.', 'Eyescreen S.r.l.', 'Liliane Bettencourt au Nom de la Bettencourt Schuller', 'Crédit Agricole', 'Primagaz', ""Conseil Général de l'Aveyron"", 'Conseil Régional du Languedoc-Roussillon', 'Conseil Régional du Calvados', 'Conseil Régional de Basse Normandie', 'Conseil Régional de Franche-Comté', 'Conseil Régional de la Lozère', ""Centre national du cinéma et de l'image animée (CNC)"", 'Commission Européenne', 'Eurimages', 'Société des Producteurs de Cinéma et de Télévision (Procirep)', 'Fondation GAN pour le Cinéma', 'EDF']"
236027,"Four small-time gangsters from Copenhagen trick a gangster boss: they take over 4,000,000 kroner which they were supposed to bring him. Trying to escape to Barcelona they are forced to stop in the countryside, in an old, wrecked house, hiding there for several weeks. Slowly, one after another, they realize, that they would like to stay there, starting a new life, renovating the house and forming it into a restaurant. But they can't avoid being caught up by their past.","['Søren Pilmark', 'Ulrich Thomsen', 'Mads Mikkelsen', 'Nikolaj Lie Kaas', 'Sofie Gråbøl']","['Vibeke Aagaard', 'Ivan Ahrendt', 'Jesper Andersen', 'Charlotte Buch', 'Christian Buch']",['Anders Thomas Jensen'],"['Denmark', 'Sweden']",['Danish'],"['M&M Productions', 'Danmarks Radio', 'SVT Drama']"
67800,"Upon moving to Britain to get away from American violence, astrophysicist David Sumner and his wife Amy are bullied and taken advantage of by the locals hired to do construction. When David finally takes a stand it escalates quickly into a bloody battle as the locals assault his house.","['Dustin Hoffman', 'Susan George', 'Peter Vaughan', 'T.P. McKenna', 'Del Henney']","['Anthony Goldschmidt', 'Katherine Haber', 'George Davis', 'Brian Doyle', 'Susan Shaw']",['Sam Peckinpah'],"['United Kingdom', 'United States']",['English'],['Amerbroco Productions']
