imdbId,plot,cast,crew,director,countries,languages,production_companies
452637,"The super Cleveland Heep finds a woman swimming in the swimming pool of the condominium during the night; he slips, hits his head on the floor and faints in the water, and she rescues him. He discloses that she is a ""Narf"" called Story, a character of bedtime stories, that is chased by a ""Scrunt"" and she needs to return to her Blue World with an eagle. Cleveland convinces the tenants to help and protect Story.","['Paul Giamatti', 'Bryce Dallas Howard', 'Jeffrey Wright', 'Bob Balaban', 'Sarita Choudhury']","['Guy Adan', 'Gabrielle Allen', 'Richard Bloom', 'Victoria Boaz', 'Lisa Breitman']",['M. Night Shyamalan'],['United States'],['English'],"['Warner Bros.', 'Blinding Edge Pictures', 'Legendary Entertainment']"
465624,"In New York, when the shy and lonely project manager of a design firm Matt Saunders meets Jenny Johnson in the subway, he invites her to date and have dinner with him. Jenny immediately falls in love for him, they have sex and she discloses her true identity to him, telling that she is the powerful superhero G-Girl. After meeting his co-worker and friend Hannah Lewis, the needy Jenny becomes jealous, controlling and manipulative, and Matt follows the advice of his best friend Vaughn Haige and dumps her, breaking her heart. Jenny turns Matt's life into hell, while he has a romance with Hannah. However, the archenemy of G-Girl and former high school sweetheart of Jenny, Professor Bedlam, proposes Matt to lure Jenny to strip her superpowers.","['Uma Thurman', 'Luke Wilson', 'Anna Faris', 'Rainn Wilson', 'Eddie Izzard']","['Matthew Amenta', 'David M. Atkinson', 'Brooks Baldwin', 'Paul Bock', 'Jane Bulmer']",['Ivan Reitman'],['United States'],['English'],"['New Regency Productions', 'Pariah', 'New Regency Productions', 'S E Productions Inc.']"
437179,"While investigating a call in an abandoned house, Officer Frank Williams and a rookie find a woman brutally blinded, but they are attacked by a huge psychopath with an ax; the rookie is killed and Frank shoots the criminal in the head, but has a severed arm. Four years later, the mutilated Frank is relocated, working as a guard in the County Detention Center. Frank goes with some delinquents to the Blackwell Hotel, an abandoned place since a fire burnt the last two floors, with the purpose of cleaning the location, preparing it to work as a shelter for the homeless; in return, the criminals will have their sentences reduced. During the night, one inmate is captured by the deranged serial-killer Jacob Goodnight, collecting the eyes of his victims.","['Glenn Jacobs', 'Christina Vidal', 'Michael J. Pagan', 'Samantha Noble', 'Steven Vidler']","['Karen Bull', 'Laura Clelland', 'James Cunningham', 'Melissa Elliott', 'Suzie Freeman']",['Gregory Dark'],"['United States', 'Australia']",['English'],"['World Wrestling Entertainment (WWE)', 'Eye Scream Man Productions', 'Eye Scream Productions', 'Lions Gate Films', 'WWE Studios']"
422720,"""All eyes will be on you,"" says the Austrian Empress, Maria Theresa to her youngest daughter Marie Antoinette. The film, marketed for a teen audience, is an impressionistic retelling of Marie Antoinette's life as a young queen in the opulent and eccentric court at Versailles. The film focuses on Marie Antoinette, as she matures from a teenage bride to a young woman and eventual queen of France.","['Kirsten Dunst', 'Jason Schwartzman', 'Steve Coogan', 'Judy Davis', 'Clara Brajtman']","['Barbara Adducci', 'Segolene Amice Lagny', 'Victoria Arbiter', 'Marion Audier', 'Fred Berger']",['Sofia Coppola'],"['United States', 'France', 'Japan']","['English', 'Latin', 'French']","['Columbia Pictures', 'Pricel', 'Tohokushinsha Film Corporation (TFC)', 'American Zoetrope', 'Commission du Film France', 'Commission du Film Île-de-France']"
489037,"With gasoline prices approaching $4/gallon, fossil fuel shortages, unrest in oil producing regions around the globe and mainstream consumer adoption and adoption of the hybrid electric car (more than 140,000 Prius' sold this year), this story couldn't be more relevant or important. The foremost goal in making this movie is to educate and enlighten audiences with the story of this car, its place in history and in the larger story of our car culture and how it enables our continuing addiction to foreign oil. This is an important film with an important message that not only calls to task the officials who squelched the Zero Emission Vehicle mandate, but all of the other accomplices, government, the car companies, Big Oil, even Eco-darling Hydrogen as well as consumers, who turned their backs on the car and embrace embracing instead the SUV. Our documentary investigates the death and resurrection of the electric car, as well as the role of renewable energy and sustainable living in our country's future; issues which affect everyone from progressive liberals to the neo-conservative right.","['Martin Sheen', 'Reverend Gadget', 'Dave Barthmuss', 'Ed Begley Jr.', 'Jim Boyd']","['Rasmus Bech Jørgensen', 'Lisa Callif', 'John Church', 'Kevin Fisher', 'Ashley Fondrevay']",['Chris Paine'],['United States'],['English'],"['Plinyminor', 'Electric Entertainment', 'Papercut Films']"
497116,"A documentary on the threat that climate change poses to the Earth - it's causes, effects and history and potential solutions to it. Presented by Al Gore through a lecture that he has given to audiences across the globe, plus through more introspective moments.","['Al Gore', 'Billy West', 'George Bush', 'George W. Bush', 'Ronald Reagan']","['Claire Bernard', 'Susan Bradley', 'Daniel J. Brewster', 'Thom Buckley', 'Gwen Cassidy']",['Davis Guggenheim'],['United States'],['English'],"['Lawrence Bender Productions', 'Participant']"
475293,"Troy Bolton and Gabriella Montez are two totally different teenagers who meet at a party while singing karaoke on New Year's Eve. The next week, Troy returns to East High, his high school in New Mexico, to find that Gabriella is a new student there. They quickly become close friends and accidentally audition for the school musical. They both get callbacks, infuriating drama queen Sharpay Evans and her sidekick brother Ryan. Then Chad, Troy's best friend and basketball teammate, and Taylor, Gabriella's new friend on the decathlon team, must make Gabriella hate Troy.","['Zac Efron', 'Vanessa Hudgens', 'Ashley Tisdale', 'Lucas Grabeel', 'Corbin Bleu']","['Holly Alderman', 'Flavio Aquilone', 'Dallin Bassett', 'James Bereece', 'Barbara Biddle']",['Kenny Ortega'],['United States'],"['English', 'Spanish']","['Salty Pictures', 'First Street Films']"
446059,"Martial arts legend Huo Yuanjia became the most famous fighter in all of China at the turn of the 20th Century. Huo faced personal tragedy but ultimately fought his way out of darkness and into history, defining the true spirit of martial arts. His self-discovery, and the choices he made, inspired his nation. The son of a great fighter who did not wish for his child to follow in his footsteps, the bullied Huo Yuanjia resolves to teach himself how to fight - and win. Years of training enable him to ace match after match in his home region of Tianjin. But as his fame as a martial arts master grows, so does his pride. After an ill-advised fight leads to another master's death, members of Huo's family are slain in revenge. Grieving and ashamed, Huo wanders the country in shock. Near death, he is rescued by women from an idyllic village, and is offered simple kindness and generosity that help him heal and regain his equilibrium over a period of several years. Huo realizes that the future of martial arts lies in sportsmanship and not brutality, and he rejoins society to apply what he has learned. Returning to Tianjin, Huo takes steps to come to terms with his past and restore his family's name. His evolving, graceful Mizong (Missing) Fist method of fighting brings Huo renewed success, and he forms the progressive Jingwu Sports Federation. Taking note, duplicitous members of the Foreign Chamber of Commerce engineer a Shanghai tournament pitting Huo against four fighters, each representing the major foreign powers in China. Huo commits to the bout and faces off against, respectively, a British boxer, a Spanish swordsman, a Belgian soldier, and a Japanese martial artist. What happened that day in 1910 has never been, and will never be, forgotten in China.","['Jet Li', 'Li Sun', 'Yong Dong', 'Yun Qu', 'Ailing Xu']","['Tekin Cetinkaya', 'Roy Hin Yeung Chow', 'Winston Emano', 'Richard Epcar', 'Flax Glor']",['Ronny Yu'],"['China', 'Hong Kong', 'United States']","['Mandarin', 'Japanese', 'English']","['Golden Harvest Company', 'Beijing Film Studio', 'China Film Co-Production Corporation', 'China Film Group Corporation', 'Hero China International', 'Prosperity Pictures', 'Wide River Investments']"
463985,"An American teenager named Sean Boswell is a loner in school, however he challenges his rival for an illegal street racing, and he totals his car in the end of the race. To avoid time in prison he is sent to Tokyo to live with his father who is in the military. As soon as he arrives he discovers a new, fun but dangerous way of street racing in the underworld of the streets of Tokyo, Japan.","['Lucas Black', 'Damien Marzette', 'Trula M. Marcus', 'Zachery Ty Bryan', 'Brandon Brendel']","['Hitoshi Abe', 'Sam Alvelo', 'Yoshi Ando', 'Julie Asbury', 'Katsuaki Atsumi']",['Justin Lin'],"['United States', 'Germany', 'Japan']","['English', 'Japanese', 'Portuguese']","['Universal Pictures', 'Relativity Media', 'Original Film', 'MP Munich Pape Filmproductions']"
455499,"Garfield is back and this time he and his canine sidekick, Odie, follow their owner, Jon Arbuckle, to London, which may never recover, as Garfield is mistaken for a look-alike, regal cat who has inherited a castle. Garfield savors the royal treatment afforded by his loyal four-legged subjects, but his reign is in jeopardy. The evil nefarious stubborn Lord Dargis is determined to do away with him, so he can turn the castle into a resort. Garfield's bigger, better, more perfect world is soon turned upside down in this tale of two kitties.","['Breckin Meyer', 'Jennifer Love Hewitt', 'Billy Connolly', 'Bill Murray', 'Ian Abercrombie']","['Robert Ambrose', 'Raymond W. Beal', 'Jeremy T. Black', 'Anthony Bloom', 'Matthew Bowden']",['Tim Hill'],"['United Kingdom', 'United States']",['English'],"['Twentieth Century Fox', 'Davis Entertainment', 'Dune Entertainment', 'Major Studio Partners', 'Ingenious Film Partners', 'Twentieth Century Fox Animation']"
478209,"Sam Dunn is a 30-year old anthropologist who wrote his graduate thesis on the plight of Guatemalan refugees. Recenly he has decided to study the plight of a different culture, one he has been a part of since he was a 12-year old: the culture of heavy metal. Sam sets out on a global journey to find out why this music has been consistently stereotyped, dismissed and condemned and yet is loved so passionately by its millions of fans. Along the way, Sam explores metals' obsession with some of life's most provacative subjects - sexuality, religion, violence and death - and discovers some things about the culture that even he can't defend. Shot on location in the UK, Germany, Norway, Canada and the US, this documentary is the first of its kind. It is both a defense of a long-misunderstood art form and a window for the outsider into the spectacle that is heavy metal.","['Tom Araya', 'Gavin Baddeley', 'Blasphemer', 'Randy Blythe', 'Joe Bottiglieri']","['Lisa Clapperton', 'Vlasta Jolic', 'Chris McDonald', 'Samir Rehem', 'Erin Sharp']",['Sam Dunn'],['Canada'],['English'],"['Seville Pictures', 'Banger Productions', '235 Films', 'Chum Television', 'Canadian Television Fund', 'Canadian Film or Video Production Tax Credit (CPTC)', 'Government of Ontario', 'Ontario Film and Television Tax Credit (OFTTC)', 'Banger Films']"
348150,"Following a mysterious absence of several years, the Man of Steel comes back to Earth in the epic action-adventure Superman Returns, a soaring new chapter in the saga of one of the world's most beloved superheroes. While an old enemy plots to render him powerless once and for all, Superman faces the heartbreaking realization that the woman he loves, Lois Lane, has moved on with her life. Or has she? Superman's bittersweet return challenges him to bridge the distance between them while finding a place in a society that has learned to survive without him. In an attempt to protect the world he loves from cataclysmic destruction, Superman embarks on an epic journey of redemption that takes him from the depths of the ocean to the far reaches of outer space.","['Brandon Routh', 'Kate Bosworth', 'Kevin Spacey', 'James Marsden', 'Parker Posey']","['Tere Alexeeff', 'Tanya Allan', 'Gabrielle Allen', 'Jon Attenborough', 'Todd Baillere']",['Bryan Singer'],"['United States', 'Australia']","['English', 'German', 'French']","['Warner Bros.', 'Legendary Entertainment', 'Peters Entertainment', 'Bad Hat Harry Productions', 'DC Comics', 'Red Sun Productions Pty. Ltd.']"
468094,"In 2001, four Pakistani Britons, Ruhal Ahmed, Asif Iqbal and Shafiq Rasul and another friend, Monir, travel to Pakistan for a wedding and in a urge of idealism, decide to see the situation of war torn Afganistan which is being bombed by the American forces in retaliation for the 9/11 terrorist attacks. Once there, with the loss of Monir in the wartime chaos, they are captured by Northern Alliance fighters. They are then handed them over the American forces who transport them to the prison camps at the Guantanamo Bay base in Cuba. What follows is three years of relentless imprisonment, interrogations and torture to make them submit to blatantly wrong confessions to being terrorists. In the midst of this abuse, the three struggle to keep their spirits up in that face of this grave injustice.","['Riz Ahmed', 'Farhad Harun', 'Waqar Siddiqui', 'Arfan Usman', 'Shahid Iqbal']","['Ramin Ahmadzadeh', 'Reno Antoniades', 'Mohammed Arsalan', 'Seyed Rahim Bathaei', 'Rachel Clark']",['Mat Whitecross'],['United Kingdom'],"['English', 'Urdu']","['Film4', 'Revolution Films', 'Screen West Midlands']"
443496,"A man in a suit at a Manhattan firm leaves work on Friday, looking unhappy. He stops at a fortune-teller's for a Tarot reading: ""You are not where you belong,"" she tells him. That evening he quits his marriage and walks the streets of New York, passing from a classy bar to a gentleman's club, to a high-class bordello, a mugging, a pawnshop, and a diner where someone does listen. He shares his insights with her and later with others. Violence, disappointment, and musings intertwine as Edmond loses his moorings while believing he's found them. Where does he belong?","['William H. Macy', 'Frances Bay', 'Rebecca Pidgeon', 'Joe Mantegna', 'Denise Richards']","['James Applebury', 'Garret Blutter', 'Minnie Duerr', 'Sam Englebardt', 'Josh Garrett']",['Stuart Gordon'],['United States'],['English'],"['120dB Films', 'Catfish Productions', 'Code Entertainment', 'Dog Pond Productions', 'Fully Loaded Pictures', 'Muse Productions', 'Neverland Films', 'Pretty Dangerous Films', 'Red Hen Productions', 'Tartan Films', 'The Hecht Company', 'Werner Film']"
422861,"In Ohio, Priscilla Chase is the VP of a company that works to bring new business to Cleveland. She has been married for more than a decade to Jack Chase, the biology of the local public school. Priscilla is successful in her career but is frigid and has never reached an orgasm, which hurts her frustrated husband. When Priscilla decides to buy a vibrator, Jack is seduced by his teenage student Kristen Taylor and recovers his self-esteem--working out, losing weight, and dressing adequately. Priscilla has new sexual experiences and becomes closer to Wayne the Pool Guy, the constructor of swimming pools in her neighborhood since she was a child. The new relationships upgrade the personal and professional lives of Priscilla and Jack.","['Parker Posey', 'Danny DeVito', 'Winter Ave Zoli', 'Miranda Bailey', 'Paul Rudd']","['Alexis Alexander', 'Greg Bernstein', 'Gina Crane', 'Amanda Dragon', 'Sylvia Frantom']",['Billy Kent'],['United States'],['English'],"['Ambush Entertainment', 'The AV Club', 'Cold Iron Pictures']"
449059,"In Albuquerque, Sheryl Hoover brings her suicidal brother Frank to the breast of her dysfunctional and emotionally bankrupted family. Frank is homosexual, an expert in Proust. He tried to commit suicide when he was rejected by his boyfriend and his great competitor became renowned and recognized as number one in the field of Proust. Sheryl's husband Richard is unsuccessfully trying to sell his self-help and self-improvement technique using nine steps to reach success, but he is actually a complete loser. Her son Dwayne has taken a vow of silence as a follower of Nietzsche and aims to be a jet pilot. Dwayne's grandfather Edwin was sent away from the institution for elders (Sunset Manor) and is addicted to heroin. When her seven-year-old daughter Olive has a chance to dispute the Little Miss Sunshine pageant in Redondo Beach, California, the whole family travels together in their old Volkswagen Type 2 (Kombi) in a funny journey with a hope of winning the talent contest and to make a dream come true.","['Abigail Breslin', 'Greg Kinnear', 'Paul Dano', 'Alan Arkin', 'Toni Collette']","['Sebastian Arocha Morton', 'Mike Artimo', 'Erik Bright', 'Cecilia Cardwell', 'Joe Eddie Casares']",['Jonathan Dayton'],['United States'],['English'],"['Searchlight Pictures', 'Big Beach Films', 'Bona Fide Productions', 'Deep River Productions', 'Third Gear Productions', 'Major Studio Partners']"
40338,"Philippe, an ambassador's son and good friend of Baines, major domo of the embassy, is confused by the complexities and evasions of adult life. He tries to keep secrets but ends up telling them. He lies to protect his friends, even though he knows he should tell the truth. Confusion reigns when Baines is suspected of murdering his wife and Philippe flips back and forth with the police.","['Ralph Richardson', 'Michèle Morgan', 'Sonia Dresdel', 'Bobby Henrey', ""Denis O'Dea""]",[''],['Carol Reed'],['United Kingdom'],"['English', 'French']",['London Film Productions']
449467,"Four interlocking stories connected by a single gun converge at the end to reveal a complex, tragic story of the lives of humanity around the world and how we truly aren't all that different. In Morocco, a troubled married couple are on vacation trying to work out their differences. Meanwhile, a Moroccan herder buys a rifle for his sons so they can keep the jackals away from his herd. A girl in Japan dealing with rejection, her mother's death, her father's emotional distance, her own self-consciousness, and a disability, deals with modern life in the enormous metropolis of Tokyo, Japan. On the opposite side of the world the married couple's Mexican nanny takes the couple's two children with her to her son's wedding in Mexico, only to meet trouble on the return trip. Combined, it provides a powerful story and an equally-powerful looking glass into the lives of seemingly random people around the world and it shows just how connected we really are.","['Brad Pitt', 'Cate Blanchett', 'Mohamed Akhzam', 'Peter Wight', 'Harriet Walter']","['Hiam Abbass', 'Karim Abouobayd', 'Giovanna Acha Aleman', 'Richie Adams', 'José Angel Aguilar Severino']",['Alejandro G. Iñárritu'],"['United States', 'Mexico', 'France']","['English', 'Arabic', 'Spanish', 'Japanese', 'Berber languages', 'French', 'Russian', 'Japanese Sign Language']","['Paramount Pictures', 'Paramount Vantage', 'Anonymous Content', 'Zeta Film', 'Central Films', 'StudioCanal', 'Media Rights Capital']"
369994,"46-year-old Jerri Blank is a socially-unaware ex-con junkie alcoholic prostitute. After being released from her latest stint behind bars, Jerri wants to clean up her life and decides the best way is to return to the home and family she left 32 years earlier to embark on her depraved life. When she gets there, her mother has died and her father has married a much-younger woman and fallen into a stress-induced coma in part because she disappeared. She takes the cleaning-up-her-life one step further when her father's doctor tells her that he might emerge from his coma if life could return to the way it was before she left, only better: she must make her father proud. So Jerri returns to Flatpoint High to get her high school diploma. She quickly decides the best way to be the best student possible is to participate in and win the state science fair. In her quest, she gets caught up in the competing agendas of: Principal Onyx Blackman, who needs a winning science fair team so as not to have to return discretionary school board funding, which he obtained through fraud and which he has since misappropriated; science teacher Chuck Noblet, a married born-again-Christian closet homosexual who tries quietly (or not so quietly) to win back the affections of his lover, Geoffrey Jellineck, the sensitive art teacher; and Roger Beekman, the winning teacher of the past nine science fairs whom Blackman brings into Flatpoint as a ringer, much to Noblet's chagrin. Jerri must also also keep her focus on the end goal of her father, which might not be easy for a socially-unaware middle-aged libidinous junkie prostitute who wants to be one of the popular kids, and do it with the big man and the innocent virginal girl on campus.","['Amy Sedaris', 'Paul Sedaris', 'Chandra Wilson', 'Kristy Thomas', 'Dee Finley']","['Ashley Bearden', 'John Bloom', 'Donna Cipriani', 'John Daro', 'Lindsay Feldman']",['Paul Dinello'],['United States'],['English'],"['Comedy Central Films', 'Roberts/David Films', 'Worldwide Pants']"
32155,"Ten years in the life of Abraham Lincoln, before he became known to his nation and the world. He moves from a Kentucky cabin to Springfield, Illinois, to begin his law practice. He defends two men accused of murder in a political brawl, suffers the death of his girlfriend Ann, courts his future wife Mary Todd, and agrees to go into politics.","['Henry Fonda', 'Alice Brady', 'Marjorie Weaver', 'Arleen Whelan', 'Eddie Collins']",['Rosemary Benét'],['John Ford'],['United States'],['English'],"['Cosmopolitan Productions', 'Twentieth Century Fox']"
492506,"A documentary that focuses on the world of crossword puzzles: those that construct them, those that love to solve them, those that compete in the annual Crossword competition in Stamford and also on Will Shortz, the editor of the New York Times crossword since the early 1990s. Shortz actually has a university degree in games and organized the first crossword championship in 1978. Some of the contributors to the Times puzzle explain how they go about building them while some aficionados, including former President Bill Clinton and comedian Jon Stewart talk about their love of solving them. The film also introduces several past champions and near champions competing in the 2006 tournament and it takes you from the preliminary rounds to the final where the top three contestants compete in front of a room full of admiring contestants.","['Will Shortz', 'Merl Reagle', 'Tyler Hinman', 'Trip Payne', 'Al Sanders']","['P.F. Bentley', 'Donald Christensen', 'Jon Delfin', 'Winston Emano', 'Erin Heidenreich']",['Patrick Creadon'],['United States'],['English'],"['Grinder Productions', ""O'Malley Creadon Productions"", 'The Weinstein Company']"
64040,"France, 1942, under German occupation. Philippe Gerbier, a civil engineer, is a French Resistance commandant. Denounced by a French collaborator, he is interned in a concentration camp. He manages to escape, and rejoins his network in Marseille, where he has the traitor executed. This movie reveals rigorously and austerely what life was like in the French Resistance: the solitude and fear of its members; their relationships with one another; the constant threat of arrest by the Gestapo; the Resistance command structure and the way its orders were carried out. Head writer Joseph Kessel and co-writer/director Jean-Pierre Melville were both veterans of the ""Shadow Army"".","['Lino Ventura', 'Paul Meurisse', 'Jean-Pierre Cassel', 'Simone Signoret', 'Claude Mann']","['Jean-Pierre Spiri-Mercanton', 'Howard Vernon']",['Jean-Pierre Melville'],"['France', 'Italy']","['French', 'German', 'English']","['Les Films Corona', 'Fono Roma']"
430304,"After leaving prison, dwarf criminal Calvin Sims joins his moron brother Percy to steal an expensive huge diamond for the mobster Walken. They are chased by the police, and Calvin hides the stone in the purse of executive Vanessa Edwards, whose husband Darryl Edwards wants them to have a baby. Percy convinces Calvin to dress like a baby and be left in front of the Edwards' house to get inside it and retrieve the diamond. Darryl and Vanessa keep Calvin for the weekend and decide to adopt him, while Walken threatens Darryl to get the stone back.","['Marlon Wayans', 'Shawn Wayans', 'Kerry Washington', 'John Witherspoon', 'Tracy Morgan']","['Dean Altit', ""Euphrates 'Tee' Arthur"", 'Toni Atterbury', 'Paul Becker', 'Adam Bernstein']",['Keenen Ivory Wayans'],"['United States', 'Canada']",['English'],"['Revolution Studios', 'Wayans Bros. Entertainment', 'Wayans Alvarez Productions']"
