imdbId,plot,cast,crew,director,countries,languages,production_companies
367594,"When Willy Wonka decides to let five children into his chocolate factory, he decides to release five golden tickets in five separate chocolate bars, causing complete mayhem. The tickets start to be found, with the fifth going to a very special boy, called Charlie Bucket. With his Grandpa, Charlie joins the rest of the children to experience the most amazing factory ever. But not everything goes to plan within the factory.","['Johnny Depp', 'Freddie Highmore', 'David Kelly', 'Helena Bonham Carter', 'Noah Taylor']","['Mike Alexander', 'Carolyn Allen', 'Celia Barnett', 'Kizzy Barton-White', 'Brenda Berrisford']",['Tim Burton'],"['United States', 'United Kingdom']",['English'],"['Warner Bros.', 'Village Roadshow Pictures', 'The Zanuck Company', 'Plan B Entertainment', 'Theobald Film Productions', 'Craig Miller Productions', 'Tim Burton Productions']"
423866,"Tae-suk (Hee Jae) is a lonely drifter who spends his nights in one empty vacation home after another. However, Tae-suk is not your usual squatter, as the courteous young man always makes sure to show his absent -- and unknowing -- hosts his gratitude by doing small household tasks or making simple improvements before moving on. One day, Tae-suk mistakes a quiet home for an empty one and stumbles across an abused housewife (Seung-yeon Lee) in urgent need of his intervention.","['Lee Seung-yun', 'Hee Jae', 'Hyuk-ho Kwon', 'Jin-mo Joo', 'Jeong-ho Choi']",[''],['Kim Ki-duk'],"['South Korea', 'Japan']",['Korean'],"['Kim Ki-Duk Film', 'Cineclick Asia', 'Happinet Pictures']"
362270,"When his partner is killed by the mysterious and possibly nonexistent Jaguar Shark, Steve Zissou (Bill Murray) and his Team Zissou crew set off for an expedition to hunt down the creature. Along with his estranged wife, a beautiful journalist and a co-pilot who could possibly be Zissou's son, the crew set off for one wild expedition.","['Bill Murray', 'Owen Wilson', 'Cate Blanchett', 'Anjelica Huston', 'Willem Dafoe']","['Andrea Alunni', 'Daren Bailey', 'Matteo Bardelli', 'Jaclyn Bashoff', 'Bryan Biermann']",['Wes Anderson'],['United States'],"['English', 'Icelandic', 'Filipino', 'Portuguese', 'French', 'Tagalog', 'German', 'Italian']","['Touchstone Pictures', 'American Empirical Pictures', 'Scott Rudin Productions', 'Life Aquatic Productions Inc.']"
338751,"Biopic of billionaire Howard Hughes, starting with his early filmmaking years as owner of R.K.O. Pictures, but mostly focusing on his role in designing and promoting new aircraft. Hughes was a risk-taker spending several fortunes on designing experimental aircraft and eventually founding TWA as a rival to Pan Am airlines owned by his great rival Juan Trippe. When Trippe's politico Senator Ralph Owen Brewster accuses Hughes of being a war profiteer, it's Hughes who gains the upper hand. Hughes also had many women in his life including a long relationship with Katharine Hepburn. From an early age, however, Hughes was also germophobic and would have severe bouts of mental illness.","['Leonardo DiCaprio', 'Cate Blanchett', 'Kate Beckinsale', 'John C. Reilly', 'Alec Baldwin']","['H. Leah Amir', 'Heather Anderson', 'Michel Bachand', 'Christine Ball', 'Susan Bannout']",['Martin Scorsese'],"['United States', 'Germany']","['English', 'Persian']","['Forward Pass', 'Appian Way', 'IMF Internationale Medien und Film GmbH & Co. 3. Produktions KG', 'Initial Entertainment Group (IEG)', 'Warner Bros.', 'Miramax', 'Cappa Productions', ""Mel's Cite du Cinema""]"
293508,"Begins when an opera ghost terrorizes the cast and crew of the French Opera House while tutoring a chorus girl. He finally drives the lead soprano crazy so she and her friend leave. The girl is able to sing lead one night but the soprano doesn't want her show stolen so she comes back. The ghost demands they keep giving his protégé lead roles. Meanwhile, His pupil falls in love with the Vicomte de Chagny, but the Phantom is in love with Christine, his student. The Phantom is outraged by their love and kidnaps Christine to be his eternal bride. Will Raoul, the Vicomte, be able to stop this dastardly plan?","['Gerard Butler', 'Emmy Rossum', 'Patrick Wilson', 'Miranda Richardson', 'Minnie Driver']","['Sophie Aitken', 'Hannah Alazhar', 'Caridad Angus', 'Cate Arbeid', 'Claire Baker']",['Joel Schumacher'],"['United Kingdom', 'United States']","['English', 'Italian']","['Warner Bros.', 'Odyssey Entertainment', 'Really Useful Films', 'Scion Films']"
363473,"The life of crooner/actor Bobby Darin is presented as part fact, part fiction and much fantasy. It is framed around a biopic being filmed about and starring Darin as himself, with he being surrounded by many of his lifelong entourage from the Bronx. In that fantasy, the young actor portraying him as a child in the biopic emerges as his true younger self, questioning, knowing all, if his adult self wants the biopic to be all sugar and roses, as is the want of his manager, Steve Blauner, or if he wants to tell the truth. Regardless, what is presented of his life includes: his sickly childhood - where he was not expected to survive past his teens - with his vaudevillian mother, Polly Cassotto, his musical mentor, and his much older sister, Nina Cassotto, both who ultimately lived vicariously through his fame; his early singing career where the ultimate goal was not to rival but surpass the fame of Frank Sinatra; the meeting of who would become his wife, already famous actress Sandra Dee - his costar in his first movie role - he needing to win over her protective stage mother, Mary Douvan, to get to Sandra; their turbulent marriage due to the competing priorities of work and family, and their respective egos not allowing each to celebrate the other's success; his turn to political activism in the late 1960s during the changing times when his style of music was no longer in vogue; what affected his thoughts of running for political office himself; and how he tried to reinvent his singer self in the early 1970s.","['Kevin Spacey', 'Kate Bosworth', 'John Goodman', 'Bob Hoskins', 'Brenda Blethyn']","['Rob Ashford', 'Pavlos Bacharis', 'Linda Maria Barutzki', 'Allison Binder', 'Steve Blauner']",['Kevin Spacey'],"['United Kingdom', 'Germany', 'United States']","['English', 'Italian']","['Lions Gate Films', 'Archer Street Productions', 'QI Quality International GmbH & Co. KG', 'Trigger Street Productions', 'Visionview Production', 'Studio Babelsberg', 'Endgame Entertainment', 'Element X', 'Media 8 Entertainment', 'Medienboard Berlin-Brandenburg']"
361127,"After twelve years in prison, Walter arrives in an unnamed city, moves into a small apartment across the street from an elementary school, gets a job at a lumberyard, and mostly keeps to himself. A quiet, guarded man, Walter finds unexpected solace from Vickie, a tough-talking woman who promises not to judge him for his history. But Walter cannot escape his past. A convicted sex offender, Walter is warily eyed by his brother-in-law, shunned by his sister, lives in fear of being discovered at work, and is hounded by a suspicious local police officer, Detective Lucas. After befriending a young girl in a neighborhood park, Walter must also grapple with the terrible prospect of his own reawakened demons.","['Kevin Bacon', 'David Alan Grier', 'Eve', 'Kyra Sedgwick', 'Benjamin Bratt']","['Nana Ashong', 'R.C. Baral', 'Mary Berkelbach', 'Jason Block', 'Ronnie Brescio']",['Nicole Kassell'],['United States'],['English'],"['Dash Films', 'Lee Daniels Entertainment', 'The Woodsman LLC']"
385267,"Dan is a 51 year old executive who learns that his company is being restructured and he is being demoted. Carter, who is 26, replaces him. Dan who has two teenage daughters with another on the way, decides to suck it up and work for Carter. Dan and Carter's working relationship is tested when Carter begins a relationship with Alex, who is Dan's daughter.","['Dennis Quaid', 'Topher Grace', 'Scarlett Johansson', 'Marg Helgenberger', 'David Paymer']","['Charlie Araki', 'Paul Belenardo', 'Heather Berrett', 'Myron Bitting', 'Alan Blackney']",['Paul Weitz'],['United States'],['English'],"['Universal Pictures', 'Depth of Field']"
290002,"Having managed to enter the longed-for ""circle of trust"" after the events in Meet the Parents (2000), Greg Focker invites the straight-laced Byrnes family to meet mum and dad, the eccentric Fockers. However, as conservative Jack and Dina finally get to meet the uninhibited, cool parents Bernie and Roz, rivalries and secrets emerge, and someone learns a new word. But there's still something fishy about Greg. Will Jack resort to using his infallible contraptions to get to the bottom of Greg's suspicious behaviour?","['Robert De Niro', 'Ben Stiller', 'Dustin Hoffman', 'Barbra Streisand', 'Blythe Danner']","['Natalie Alexander', 'Wendy Altman-Cohen', 'Kirk Baily', 'Netta Bank', 'Dawn Barkan']",['Jay Roach'],['United States'],"['English', 'Spanish', 'Hebrew']","['Universal Pictures', 'Dreamworks Pictures', 'Tribeca Productions', 'Everyman Pictures']"
364961,"Fact-based story about a disturbed office furniture salesman who in 1972 concocted a plot to kill then-President Nixon by hi-jacking a plane to fly over the White House to drop a gas bomb. At the start of the movie, the man is separated from his wife and stressed in his job where he is made the butt of jokes and is an under-performer. Attempts to get his brother's old tire business resurrected with a black partner is rejected by the banks. When he is officially served with divorce papers, everything comes apart and Richard Nixon's broken promises comes to represent all the evils that have come down on him. A news story about a pilot that landed a helicopter on the White House lawn gives him the idea for his attack. Bolting onto a Baltimore plane, he attempts the hi-jacking.","['Sean Penn', 'Naomi Watts', 'Don Cheadle', 'Jack Thompson', 'Brad William Henke']","['Deborah Alexander-Lee', 'Karen Baker', 'Steve Bannatyne', 'Ian Baptiste', 'Kanta Barrios']",['Niels Mueller'],"['United States', 'Mexico']",['English'],"['Anhelo Productions', 'Appian Way', 'Esperanto Filmoj']"
369672,"A young woman, Pursy (played by Scarlett Johansson), learns that her estranged mother has died in New Orleans. She returns to her mother's house to discover that it is inhabited by two men, one an aging alcoholic, Bobby Long (John Travolta).","['John Travolta', 'Scarlett Johansson', 'Gabriel Macht', 'Deborah Kara Unger', 'Dane Rhodes']","['Scott August', 'Jason C. Bitzer', 'Merrill Capps', 'Chip Carey', 'John Charles']",['Shainee Gabel'],['United States'],['English'],"['Lions Gate Films', 'Destination Films', 'El Camino Pictures', 'Crossroads Films', 'Bob Yari Productions', 'Emmett/Furla/Oasis Films', 'Motion Picture Corporation of America', 'Stratus Film Co.']"
379889,"Venice, 1596. Melancholy Antonio loves the youthful Bassanio, so when Bassanio asks for 3000 ducats, Antonio says yes before knowing it's to sue for the hand of Portia. His capital tied up in merchant ships at sea, Antonio must go to Shylock, a Jewish moneylender he reviles. Shylock wraps his grudge in kindness, offering a three-month loan at no interest, but if not repaid, Antonio will owe a pound of flesh. The Jew's daughter elopes with a Christian, whetting Shylock's hatred. While Bassanio's away wooing Portia, Antonio's ships founder, and Shylock demands his pound of flesh. With court assembled and a judgment due, Portia swings into action to save Bassanio's friend.","['Al Pacino', 'Jeremy Irons', 'Joseph Fiennes', 'Lynn Collins', 'Zuleikha Robinson']","['Denver Beattie', 'Nicky Bell', 'Bob Bellion', 'Shirine Best', 'Corrina Bonicelli']",['Michael Radford'],"['United Kingdom', 'Italy', 'Luxembourg', 'United States']","['English', 'Italian', 'Arabic']","['Movision', 'Avenue Pictures', 'UK Film Council', 'Luxembourg Film Fund', 'Delux Productions', 'Immagine e Cinema', 'Dania Film', 'Istituto Luce', 'Navidi-Wilde Productions Ltd.', '39 McLaren St. Sydney', 'Barry Navidi Productions', 'LSG Productions', 'Rough Diamond Productions', 'Spice Factory']"
416220,"Momoko Ryugasaki is the daughter of a smalltime gangster that forges Versace brand and a lowlife woman. Momoko is smitten by the Rococo period and dresses in a Lolita style, with frilly dresses and embroidery bonnet. She is raised by her father since her mother divorced him to marry her gynecologist, and he has taught her how to perfectly embroider. When Mr. Ryugasaki includes the Universal Studios brand in his products, he is forced to move to the rural Shimotsuma with Momoko to live in the house of her grandmother. Momoko decides to sell her collection of forged Versace and Universal Studios to make money to buy her expensive clothing. The rebel ""yanki"" Ichigo Shirayuri visits Momoko to buy clothes and soon they begin the most unlikely friendship.","['Kyôko Fukada', 'Anna Tsuchiya', 'Hiroyuki Miyasako', 'Sadao Abe', 'Eiko Koike']","['Blanche Aurore Duault', 'Andrew P. Kirkham', 'Sae Nirazuka']",['Tetsuya Nakashima'],['Japan'],"['Japanese', 'French', 'English']","['Amuse Pictures', 'Hakuhodo DY Media Partners', 'Hori Production', 'Ogura Jimusyo Co.', 'Parco Co. Ltd.', 'Shogakukan', 'Toho Company', 'Tokyo Broadcasting System', 'Tokyo FM Broadcasting Co.']"
396592,"An obese boy named Fat Albert and his friends Rudy, Mushmouth, Bill, Dumb Donald, Russell, and Weird Harold, pulls into trouble when they ""fall"" out of their TV world into the real world, where Fat Albert tries to help a young girl, Doris, make friends. However, the simple life of the group is interrupted when Fat Albert falls for Doris' older sister, Lauri, sparking his friends to worry that their leader may never want to return to his cartoon world again.","['Kenan Thompson', 'Kyla Pratt', 'Dania Ramirez', 'Shedrack Anderson III', 'Aaron Frazier']","['Monica Allison', 'Steve Alterman', 'Maggie Baird', 'Nico Bally', 'Ogie Banks']",['Joel Zwick'],['United States'],['English'],"['Twentieth Century Fox', 'Davis Entertainment', 'The Culver Studios']"
390123,"Henry Darger worked all his life in menial jobs in Chicago. Living alone and in poverty, he had no friends or close family. Spending all his off hours alone, he whiled away the hours working on a 15,000 page illustrated novel called The Realms of the Unreal. A stunning amalgam of religious imagery, fantasy, and heroic drama, the work was only discovered after Darger was moved to a hospital during the last days of his life. Darger also wrote journals and an autobiography. The documentary uses interviews with Darger's neighbors and narration of passages from his works, along with his illustrations, to explore the mind and work of Henry Darger.","['Larry Pine', 'Dakota Fanning', 'Frier McCollister', 'Wally Wingert', 'Janice Hong']","['Bill Abrams', 'David Beall', 'David Berglund', 'Scott Marvel Cassidy', 'Denise Chavez']",['Jessica Yu'],['United States'],['English'],"['Cherry Sky Films', 'Diorama Films', 'ITVS International']"
375210,"The car of successful author Anna Rivers is found disabled next to the river, the thought being that she accidentally fell into the river while trying to change a flat tire. Her dead body is found upstream several weeks later, consistent with the accidental death theory. Based on incidents around him, her grieving husband, architect Jonathan Rivers, decides several months later to visit with Raymond Price, who approached John prior to Anna's body being found with news that she was trying to contact him from beyond. At that time, John was skeptical of Raymond's claims of electronic voice phenomena (EVP): that he is contacted from the beyond through electronic means - radio, television - which he is able to record. Along with Sarah Tate, another of Raymond's ""clients"" whose fiancé passed away, John becomes obsessed with EVP as he gets more and more audio and video messages, however fuzzy, from Anna from beyond. That obsession takes a slight change in focus when John believes that Anna is trying to pass along information to help others. But the nature of those messages and their connection to Raymond in combination with John learning that not all good comes through EVP leads to the possible belief that he dabbling in EVP in and of itself may be dangerous and the cause of those potentially deadly issues in which he is supposed to assist in helping. John has to decide whether or not to continue with his work in EVP, not continuing which means that he may actually prevent bad things from happening, and continuing which means that he gets his much wanted connection with Anna.","['Michael Keaton', 'Chandra West', 'Deborah Kara Unger', 'Ian McNeice', 'Sarah Strange']","['Steve Adams', 'Kimberlee Alexander', 'Kim Arnott', 'Lawren Bancroft-Wilson', 'Andrew Boutilier']",['Geoffrey Sax'],"['United Kingdom', 'Canada', 'United States']",['English'],"['Brightlight Pictures', 'Universal Pictures', 'Gold Circle Films', 'White Noise UK Ltd.', 'Endgame Entertainment', 'Corus', 'The Movie Network (TMN)', 'Province of British Columbia Film Incentive BC', 'Canadian Film or Video Production Tax Credit (CPTC)']"
365885,"A sharp-witted suburban wife, Terry Wolfmeyer, is left to raise her four headstrong daughters when her husband unexpectedly disappears. Things get even more hectic when she falls for her neighbor Denny, a once-great baseball star turned radio d.j. This leaves her daughters out on a limb. They are forced to juggle their mom's romantic dilemmas as well as their own.","['Joan Allen', 'Kevin Costner', 'Erika Christensen', 'Keri Russell', 'Alicia Witt']","['Jasa Abreo', 'Huda Abuzeid', 'Sonya A. Avakian', 'Tamara Birkemoe', 'Sean Bradley']",['Mike Binder'],"['United States', 'Germany', 'United Kingdom']",['English'],"['New Line Cinema', 'Media 8 Entertainment', 'VIP 2 Medienfonds', 'VIP 3 Medienfonds', 'MDP Filmproduktion', 'Sunlight Productions', 'FilmBudget.com', 'Greentrees Films']"
98090,"In New York, the Julliard student Christine Day meets her friend Meg in the library where she works and she shows a piece of music from the unknown author Erik Destler that she has found on the shelf. Christine decides to use the music in her audition on the next day for a role in a version of Faust in the New York Opera. During the audition, there is an accident on the stage and Christina faints. She relives her past life in the 19th century in London, when she is an aspirant opera singer and becomes the protégée of the Phantom of the London Opera House. The Phantom is the unknown composer Erik Destler who makes a pact with the devil in order to the world would love his music. In return, the devil destroys his face and tells him that he would never be loved by anyone and would be disfigured forever. After a tragic ending, Christine awakes in the present day and has a great surprise when she is introduced to the producer of the opera.","['Robert Englund', 'Jill Schoelen', 'Alex Hyde-White', 'Bill Nighy', 'Stephanie Lawrence']","['Wenden K. Baldwin', 'John Carl Buechler', 'Earl Ellis', 'Matt Falls', 'Anita Lischak']",['Dwight H. Little'],"['United States', 'United Kingdom', 'Hungary']",['English'],"['21st Century Film Corporation', 'Breton Film Productions', 'Columbia Pictures', 'Dee Gee Entertainment']"
86429,"Nuclear war in the United States is portrayed in a realistic and believable manner. The story is told through the eyes of a woman who is struggling to take care of her family. The entire movie takes place in a small suburban town outside San Francisco. After the nuclear attack, contact with the outside world is pretty much cut off.","['Jane Alexander', 'William Devane', 'Rossie Harris', 'Roxana Zal', 'Lukas Haas']","['Laura Blumenthal', 'Becky Butler', 'George Cooper', 'Laurie Gilbert', 'John Kaufman']",['Lynne Littman'],['United States'],['English'],"['Paramount Pictures', 'Entertainment Events', 'American Playhouse']"
326208,"In mid-1970s Johannesburg, white police officer Andre Stander (Thomas Jane) suffers a crisis of conscience due to his involvement in apartheid and becomes a notorious bank robber on the run. Then from 1983 to 1984, the ""Stander gang"" (Stander, Alan Heyl, and Patrick McCall) rob as many as four banks a day.","['Thomas Jane', 'Dexter Fletcher', ""David O'Hara"", 'Deborah Kara Unger', 'Ashley Taylor']","['Thomas Becker', 'Sam Bhembe', 'Josef Brandmaier', 'Richard Brodie', 'Nan Brown']",['Bronwen Hughes'],"['Canada', 'Germany', 'South Africa', 'United Kingdom', 'United States']","['English', 'Afrikaans', 'Zulu']","['ApolloProMedia GmbH & Co. 1. Filmproduktion KG', 'Grosvenor Park Productions', 'Rough Diamond Productions', 'Seven Arts Productions', 'Stander Productions', 'The Imaginarium', 'ZenHQ Films', 'ZenHQ']"
373024,The Travis family façade is destroyed by an event incomprehensible to them -- an event which will open locked doors and finally reveal the secrets that have haunted them for decades.,"['Sigourney Weaver', 'Emile Hirsch', 'Jeff Daniels', 'Michelle Williams', 'Kip Pardue']","['René Besson', 'Julie Black', 'Joan Devilla', 'Kareem Elseify', 'Mia Farrell']",['Dan Harris'],"['United States', 'Germany', 'Belgium']",['English'],"['ApolloProMedia GmbH & Co. 1. Filmproduktion KG', 'QI Quality International GmbH & Co. KG', 'Signature Pictures', 'Art Linson Productions']"
34167,"Somewhat fictionalized account of the life and war service of Alvin York, who went from humble beginnings to being one of the most celebrated American servicemen to fight in World War I. As depicted in the film, Alvin turned to religion when he was struck by lightning during one of his drunken outings. Alvin took his newfound religion seriously claiming to be a conscientious objector when receiving his draft notice. When that was refused, he joined the infantry where he served with valor, capturing a large number of Germans and saving the lives of many of his men who were under heavy fire.","['Gary Cooper', 'Walter Brennan', 'Joan Leslie', 'George Tobias', 'Stanley Ridges']","['Donoho Hall', 'Paul Walters', 'William Yetter Sr.', 'Lucille Anderson', 'Teddy Blue']",['Howard Hawks'],['United States'],"['English', 'French', 'German']",['Warner Bros.']
310203,"After hiding his loot and getting thrown in jail, Ruby, a brooding outlaw, encounters Quentin, a dim-witted and garrulous giant who befriends him. After Quentin botches Runy's solo escape attempt, they make a break together. Unable to shake the clumsy Quentin, Ruby is forced to take him along as he pursues his former partners in crime to avenge the death of the woman he loved and get to the money before they do.","['Gérard Depardieu', 'Jean Reno', 'Richard Berry', 'André Dussollier', 'Jean-Pierre Malo']","['Karim Bennai', 'Claude Dallet', 'Claude Davy', 'Jacques Delahaye', 'Denis Hecker']",['Francis Veber'],"['France', 'Italy']",['French'],"['Union Générale Cinématographique', 'DD Productions', 'EFVE', 'TF1 Films Production', 'Filmauro', 'Canal+', 'Sofica Sofinergie 5', 'TPS Star']"
76929,"In a post apocalyptic future that appears as a blend of World War II Europe and J.R.R. Tolkien's Middle-earth, a pint-size wizard named Avatar must save the world from a band of fascist mutants controlled by his evil twin brother, Blackwolf, who likes to confuse enemy armies by projecting films of Adolf Hitler speeches during attacks. Painted live-action footage of advancing Nazi armies contrasts with Saturday-morning-cartoon-style animation of fairies and elves as Avatar travels through various magical and radioactive realms on his quest. Aiding him are the beautiful Fairy princess Elinore, hot-blooded warrior elf Weehawk, and Peace, a misunderstood robot rebelling against his Blackwolf-controlled programming. A bizarre and psychedelic meditation on magic vs. technology, this ultimate futuristic fantastic epic cult film still finds an audience on college campuses and will prove quite rewarding to viewers in the right frame of mind.","['Bob Holt', 'Jesse Welles', 'Richard Romanus', 'David Proval', 'Jim Connell']","['Leah Bernstein', 'Scott Citron', 'John Kaufman', 'Jose Kfuri', 'Alan Ladd Jr.']",['Ralph Bakshi'],['United States'],"['English', 'German']","['Bakshi Productions', 'Dong Seo Animation', 'Twentieth Century Fox']"
352520,"The professional and personal life of actor and comedian Peter Sellers was a turbulent one. His early movie fame was based primarily on his comic characterizations, often of bumbling and foreign-accented persons, characters which he embodied. As his movie fame rose, he began to lose his own personal identity to his movie characters, leading to self-doubt of himself as a person and a constant need for reassurance and acceptance of his work. This self-doubt manifested itself in fits of anger and what was deemed as arrogance by many. In turn, his personal relationships began to deteriorate as his characterizations were continually used to mask his problems. His first wife, Anne Howe, left/divorced him and his relationships with his parents and children became increasingly distant. His relationship with his second wife, Swedish actress Britt Ekland, was based on this mask. In his later life, he tried to rediscover himself and his career with what would become his penultimate film role, that of Chance in Being There (1979).","['Geoffrey Rush', 'Charlize Theron', 'Emily Watson', 'John Lithgow', 'Miriam Margolyes']","['Carolyn Allen', 'Guy Barker', 'Francesca Castellano', 'Gavin Charlton', 'Paul Donnellon']",['Stephen Hopkins'],"['United Kingdom', 'United States']",['English'],"['HBO Films', 'BBC Films', 'The De Mann Entertainment Company', 'Company Pictures']"
