imdbId,plot,cast,crew,director,countries,languages,production_companies
55728,"Robert Leffingwell is the president's nominee for Secretary of State. Prior to his approval, he must go through a Senate investigation to determine if he's qualified. Leading the Senate committee is idealistic Senator Brig Anderson, who soon finds himself unprepared for the opposition and political dirt that's revealed, including Leffingwell's past affiliations with a Communist organization. When Leffingwell testifies about his political leanings, he proves his innocence. Later, however, Anderson learns that he lied under oath and asks the president to withdraw Leffingwell from consideration, especially after the young senator and his wife begins receiving blackmail threats about a skeleton in his own closet.","['Franchot Tone', 'Lew Ayres', 'Henry Fonda', 'Walter Pidgeon', 'Charles Laughton']","['Saul Bass', 'David De Silva', 'Allen Drury', 'Florence Nerlinger', 'Otto Preminger']",['Otto Preminger'],['United States'],['English'],"['Otto Preminger Films', 'Alpha Alpina']"
56058,"Peace in 17th-century Japan causes the Shogunate's breakup of warrior clans, throwing thousands of samurai out of work and into poverty. An honorable end to such fate under the samurai code is ritual suicide, or hara-kiri (self-inflicted disembowelment). An elder warrior, Hanshiro Tsugumo (Tatsuya Nakadai) seeks admittance to the house of a feudal lord to commit the act. There, he learns of the fate of his son-in-law, a young samurai who sought work at the house but was instead barbarically forced to commit traditional hara-kiri in an excruciating manner with a dull bamboo blade. In flashbacks the samurai tells the tragic story of his son-in-law, and how he was forced to sell his real sword to support his sick wife and child. Tsugumo thus sets in motion a tense showdown of revenge against the house.","['Tatsuya Nakadai', 'Akira Ishihama', 'Shima Iwashita', 'Tetsurô Tanba', 'Masao Mishima']","['Kaneshige Inokuma', 'Ryôzô Nakamura', 'Sofu Teshigahara']",['Masaki Kobayashi'],['Japan'],['Japanese'],['Shochiku']
56194,"A rebellious youth, sentenced to a boy's reformatory for robbing a bakery, rises through the ranks of the institution through his prowess as a long distance runner. During his solitary runs, reveries of his life and times before his incarceration lead him to re-evaluate his privileged status as the Governor's prize runner.","['Michael Redgrave', 'Tom Courtenay', 'Avis Bunnage', 'Alec McCowen', 'James Bolam']","['Patrick Boyle', 'Jane Moscrop']",['Tony Richardson'],['United Kingdom'],['English'],['Woodfall Film Productions']
56262,"It's the early 20th-century American Midwest. A con man going by the assumed name Harold Hill has used several different schemes to bilk the unsuspecting, and now travels from town to town pretending to be a professor of music - from the Gary (Indiana) Conservatory of Music, class of '05 - who solves all the respective towns' youth problems by forming boys' marching bands. He takes money from the townsfolk to buy instruments, music, instructional materials, and uniforms for their sons. However, in reality, he has no degree and knows nothing about music, and after all the materials arrive and are distributed, he absconds with all the money, never to be seen again. Many of the traveling salesmen in the territory have been negatively impacted by him, as the townsfolk then become suspicious of any stranger trying to sell them something. For Harold's scheme to work, he must gain the trust of the local music teacher, usually by wooing her, regardless of her appearance. And if the town doesn't believe it has a youth problem needing to be fixed, he will manufacture one for them. That is the case when he arrives in River City, Iowa, population 2,212, where he will have some unexpected help from Marcellus Washburn, a friend and former grifter colleague who now lives in River City and has gone straight, but he still wants to make sure Harold survives his stay in town. River City's music teacher is spinster and town librarian Marian Paroo. He's able to impress all the other River Citizens with his fast-talking sales pitches, but not suspicious Marian, whose hard-as-nails exterior is unlike all the other River Citizens. Her exterior is partly due to her somewhat removed standing in the town, as all the gossipy housewives believe she is a smut peddler - encouraging the teenagers to read authors such as Chaucer and Balzac - and mistakenly believe that she got her position as librarian through less-than-scrupulous means. What Harold does not know is that one way to Marian is through her young adolescent brother, Winthrop Paroo, a sullen boy who has withdrawn from life since their father's death two years before, when he started to lisp. Harold starts to fall for Marian, something that never happened with any of the other music teachers. Further complications may ensue if any of those traveling salesmen who have been following his route through the territory catch up with and expose him.","['Robert Preston', 'Shirley Jones', 'Buddy Hackett', 'Hermione Gingold', 'Paul Ford']","['Kermit Bloomgarden', 'Herbert Greene', 'Tom Panko', 'Onna White', 'Robert E. Blair']",['Morton DaCosta'],['United States'],['English'],['Warner Bros.']
56264,"The Bounty leaves Portsmouth in 1787. Its destination: to sail to Tahiti and load bread-fruit. Captain Bligh will do anything to get there as fast as possible, using any means to keep up a strict discipline. When they arrive at Tahiti, it is like a paradise for the crew, something completely different than the living hell aboard the ship. On the way back to England, officer Fletcher Christian becomes the leader of a mutiny.","['Marlon Brando', 'Trevor Howard', 'Richard Harris', 'Hugh Griffith', 'Richard Haydn']","['Bengt Danielsson', 'Leo Langomazino', 'Donald MacIntyre', 'Aurora Natua', 'Hamil Petroff']",['Lewis Milestone'],['United States'],"['English', 'Polynesian', 'French', 'Dutch']",['Arcola Pictures']
56736,"In the suburbs of Rome, translator Vittoria breaks her engagement with her boyfriend, writer Riccardo, after a troubled night. Vittoria goes downtown to meet her mother, who is addicted to the stock market, and she meets materialist broker Piero on a day the stock-market crashes. Piero and Vittoria begin a monosyllabic relationship.","['Alain Delon', 'Monica Vitti', 'Francisco Rabal', 'Lilla Brignone', 'Rossana Rory']","['Gabriele Antonini', 'Aldo Giuffrè']",['Michelangelo Antonioni'],"['Italy', 'France']","['Italian', 'English']","['Cineriz', 'Interopa Film', 'Paris Film']"
57298,"George Washington McLintock, ""GW"" to friends and foes alike, is a cattle baron and the richest man in the territory. He anxiously awaits the return of his daughter Becky who has been away at school for the last two years. He's also surprised to see that his wife Katherine has also returned. She had left him some years before without really explaining what he had done, but she does make the point of saying that she's returned to take their daughter back to the State Capitol with her. GW is highly respected by everyone around him, including the farmers who are pouring into the territories with free grants of land and the Indians who are under threat of being relocated to another reservation. Between his wife, his headstrong daughter, the crooked land agent and the thieving government Indian agent, GW tries to keep the peace and do what is best for everyone.","['John Wayne', ""Maureen O'Hara"", 'Patrick Wayne', 'Stefanie Powers', 'Jack Kruschen']","['Richard Kuhn', 'Cliff Lyons', 'Robert E. Morrison']",['Andrew V. McLaglen'],['United States'],"['English', 'Chinese', 'Navajo']","['Batjac Productions', 'Polyphony Digital']"
57877,"Debauched King Henry II (Peter O'Toole) installs his longtime court facilitator Thomas Becket (Richard Burton) as the Archbishop of Canterbury, assuming that his old friend will be a compliant and loyal lackey in the King's on-going battles with the church. But Becket unexpectedly finds his true calling on the ecclesiastical side, and aligns himself against the King's selfish wishes, causing a rift and an eventual showdown not only between the two men, but also the institutions they represent.","['Richard Burton', ""Peter O'Toole"", 'John Gielgud', 'Gino Cervi', 'Paolo Stoppa']","['Richard McWhorter', 'David Merrick', 'Mike Maidlin', 'Charles Wilder']",['Peter Glenville'],"['United Kingdom', 'United States']","['English', 'Latin', 'Welsh']","['Wallis-Hazen', 'Keep Films']"
58213,"Aged, wealthy Charlotte Hollis has lived as a recluse in the crumbling family plantation mansion in Hollisport, Louisiana since her father Sam Hollis' death thirty-six years ago. The only people who regularly see her are her hard-as-nails but seemingly loyal housekeeper, Velma Crowther, and her longtime friend and physician, Dr. Drew Bayliss. She has lived there most of her life except for a short stint in London thirty-seven years ago following the vicious murder of her lover, John Mayhew, at the plantation's summer house while Sam was hosting one of his legendary grand balls in the mansion. She and John had planned to run off together that night, but instead he was bludgeoned to death. Nobody was ever convicted for his murder, but most people believe Charlotte did it. They also believe that Charlotte, whom they haven't seen in years, is a crazy old woman. Conversely, Charlotte has hidden away fearing that people would always be glaring at her. Charlotte is surprised that her younger cousin Miriam Deering has accepted her invitation to stay at the mansion. While Charlotte wanted Miriam to help her overturn the expropriation with the state government in Baton Rouge. By this time, Charlotte's mental state seemingly hits a sharp decline, perhaps because she would be leaving her family home, but could it be issues surrounding John's murder?","['Bette Davis', 'Olivia de Havilland', 'Joseph Cotten', 'Agnes Moorehead', 'Cecil Kellaway']",['Robert Sherman'],['Robert Aldrich'],['United States'],['English'],['The Associates & Aldrich Company']
58390,"The setup is pure pulp: A former prostitute (a crackerjack Constance Towers) relocates to a buttoned-down suburb, determined to fit in with mainstream society. But in the strange, hallucinatory territory of writer-director-producer Samuel Fuller, perverse secrets simmer beneath the wholesome surface. Featuring radical visual touches, full-throttle performances, brilliant cinematography by Stanley Cortez, and one bizarrely beautiful musical number, The Naked Kiss is among Fuller's greatest, boldest entertainments.","['Constance Towers', 'Anthony Eisley', 'Michael Dante', 'Virginia Grey', 'Patsy Kelly']",[''],['Samuel Fuller'],['United States'],['English'],"['Allied Artists Pictures', 'F & F Productions']"
58430,"In the Fourteenth Century, during a civil war in Japan, a middle-aged woman and her daughter-in-law survive in a hut in a field of reed killing warriors and soldiers to trade their possessions for food. When their neighbor Hachi defects from the war and returns home, they learn that their son and husband Kichi died while stealing supplies from farmers. Soon Hachi seduces the young widow and she sneaks out of her hut every night to have sex with him. When the older woman finds the affair of her daughter-in-law, she pleads with Hachi to leave the young woman with her since she would not be able to kill the warriors without her help. However, Hachi ignores her request and continues to meet the young woman. When a samurai wearing a demon mask stumbles upon the older woman at her hut asking her to guide him out of the field, she lures him and he falls in the pit where she drops the bodies of her victims. She climbs down the hole to take his possessions and his mask, and she finds he is a disfigured man. The she uses the demon mask to haunt her daughter-in-law to keep her away from Hachi. However, when she decides to remove the mask, she has a surprise.","['Nobuko Otowa', 'Jitsuko Yoshimura', 'Kei Satô', 'Jûkichi Uno', 'Taiji Tonoyama']","['Shizuka Hanayasu', 'Taro Okamoto', 'Mihoko Yoshino']",['Kaneto Shindô'],['Japan'],['Japanese'],"['Kindai Eiga Kyokai', 'Tokyo Eiga Co Ltd.']"
58530,"During a flight to Mars in the spaceship Mars Gravity Probe 1, Commander Christopher 'Kit' Draper and Colonel Dan McReady are forced to deviate from an asteroid and they leave their spacecraft in pods. Draper lands on the surface of the Red Planet and survives. He learns how to produce oxygen and while exploring the planet, he finds McReady dead in his crashed pod. He finds also the monkey Mona and brings the animal to the cave where he is sheltered. He learns that he can breathe the Martian air for short periods but needs also oxygen. But Mona finds water and an edible plant in the underground. .After a long period alone, Draper feels the loneliness. One day, he sees a spacecraft landing on Mars and he believes it might be the rescue team to save him. But he finds aliens working on the planet and some of them are slaves. One of them flees and stumble with Draper and he names him Friday. Now he needs to find a way to be rescued and return to Earth.","['Paul Mantee', 'Victor Lundin', 'Adam West', 'The Woolly Monkey']",['Edward V. Ashburn'],['Byron Haskin'],['United States'],['English'],"['Paramount Pictures', 'Aubrey Schenck Productions']"
58946,A film commissioned by the Algerian government that shows the Algerian revolution from both sides. The French foreign legion has left Vietnam in defeat and has something to prove. The Algerians are seeking independence. The two clash. The torture used by the French is contrasted with the Algerian's use of bombs in soda shops. A look at war as a nasty thing that harms and sullies everyone who participates in it.,"['Brahim Hadjadj', 'Jean Martin', 'Yacef Saadi', 'Samia Kerbash', 'Ugo Paletti']","['Margherita Autuori', 'Alfredo Di Santo', 'Enrico Lucherini', 'Mario Maestrelli', 'Matteo Spinola']",['Gillo Pontecorvo'],"['Italy', 'Algeria']","['Arabic', 'French', 'English']","['Igor Film', 'Casbah Film']"
59026,"When Charlie Brown complains about the overwhelming materialism that he sees amongst everyone during the Christmas season, Lucy suggests that he become director of the school Christmas pageant. Charlie Brown accepts, but it proves to be a frustrating struggle. When an attempt to restore the proper spirit with a forlorn little fir Christmas tree fails, he needs Linus.","['Ann Altieri', 'Chris Doran', 'Sally Dryer', 'Bill Melendez', 'Karen Mendelson']",[''],['Bill Melendez'],['United States'],['English'],"['Lee Mendelson Film Productions', 'Bill Melendez Productions', 'United Feature Syndicate (UFS)', 'Lee Mendelson and Bill Melendez Productions']"
59127,"Two couples traveling in eastern Europe decide to visit Karlsbad despite dire local warnings. Left outside the village by a coachman terrified at the approach of night, they find themselves in the local castle and are surprised at the hospitality extended by the sinister Klove. It turns out the owner, Count Dracula, dead for ten years, has been hoping for such a visit.","['Christopher Lee', 'Barbara Shelley', 'Andrew Keir', 'Francis Matthews', 'Suzan Farmer']","['Jimmy Spoard', 'Tony Tweedale']",['Terence Fisher'],['United Kingdom'],['English'],"['Associated British Productions (ABP)', 'Hammer Films']"
59825,"As the Allied forces approach Paris in August 1944, German Colonel Von Waldheim is desperate to take all of France's greatest paintings to Germany. He manages to secure a train to transport the valuable art works even as the chaos of retreat descends upon them. The French resistance however wants to stop them from stealing their national treasures but have received orders from London that they are not to be destroyed. The station master, Labiche, is tasked with scheduling the train and making it all happen smoothly but he is also part of a dwindling group of resistance fighters tasked with preventing the theft. He and others stage an elaborate ruse to keep the train from ever leaving French territory.","['Burt Lancaster', 'Paul Scofield', 'Jeanne Moreau', 'Suzanne Flon', 'Michel Simon']","['Jules Bricken', 'Arthur Penn']",['John Frankenheimer'],"['France', 'Italy', 'United States']","['English', 'German']","['Les Films Ariane', 'Les Productions Artistes Associés', 'Dear Film Produzione', 'Polyphony Digital', 'United Artists', 'Vides Cinematografica']"
60107,"Andreiv Rublev charts the life of the great icon painter through a turbulent period of 15th Century Russian history, a period marked by endless fighting between rival Princes and by Tatar invasions.","['Anatoliy Solonitsyn', 'Ivan Lapikov', 'Nikolay Grinko', 'Nikolay Sergeev', 'Irina Tarkovskaya']","['M. Mertsalova', 'V. Pashuto', 'S. Yamshchikov']",['Andrei Tarkovsky'],['Soviet Union'],"['Russian', 'Italian', 'Tatar']","['Mosfilm', 'Tvorcheskoe Obedinienie Pisateley i Kinorabotnikov']"
60138,"This is the story of a donkey and the somewhat difficult life it leads. During a summer holiday, the baby donkey is a child's pet but when they return home, it begins it's life of misery. It works as a farm animal, pulling a delivery cart and working as any manner as various owners require of it. Meanwhile, the young girl who first acquired Balthazar as a pet grows up, only to be badly treated herself by an indifferent and selfish boyfriend.","['Anne Wiazemsky', 'Walter Green', 'François Lafarge', 'Jean-Claude Guilbert', 'Philippe Asselin']",['Guy Renault'],['Robert Bresson'],"['France', 'Sweden']","['French', 'Latin']","['Argos Films', 'Athos Films', 'Parc Film', 'Svensk Filmindustri', 'Svenska Filminstitutet']"
60153,"The arch-villains of the United Underworld - the Joker, the Penguin, the Riddler and the Catwoman - combine forces to dispose of Batman and Robin as they launch their fantastic plot to control the entire world. From his submarine, Penguin and his cohorts hijack a yacht containing a dehydrator, which can extract all moisture from humans and reduce them to particles of dust. The evildoers turn the nine Security Council members in the United World Building into nine vials of multicolored crystals! Batman and Robin track the villains in their Batboat and use Batcharge missiles to force the submarine to surface.","['Adam West', 'Burt Ward', 'Lee Meriwether', 'Cesar Romero', 'Burgess Meredith']","['Richard Kuhn', 'Tyler Atkinson', 'George Barris', 'J. David Jones']",['Leslie H. Martinson'],['United States'],"['English', 'French', 'German', 'Hebrew', 'Japanese', 'Russian', 'Spanish', 'Swahili']",['Greenlawn Productions']
60666,"A family is driving across the country when they stumble across a mysterious house inhabited by the satyr-man Torgo. When the family decides to stay over at the house, mother Margaret is now the object of desire for Torgo and the owner of the house, The Master: a mysterious figure who dresses in a black robe decorated with red hands.","['Tom Neyman', 'John Reynolds', 'Diane Adelson', 'Harold P. Warren', 'Stephanie Nielson']",[''],['Harold P. Warren'],['United States'],['English'],"['Norm-Iris', 'Sun City Films']"
60802,"A young man follows his father's footsteps and joins the railway company, where he learns the job and has his first affair. Set in the country, during the German occupation.","['Václav Neckár', 'Josef Somr', 'Vlastimil Brodský', 'Vladimír Valenta', 'Alois Vachek']","['Ladislav Fikar', 'Frantisek Golysev', 'J. Simák', 'Bohumil Smída']",['Jirí Menzel'],['Czechoslovakia'],"['Czech', 'German']",['Filmové studio Barrandov']
61101,"In Tokyo, the gangster Tetsu (Tetsuya Watari) regenerates when his yakuza boss Kurata (Ryuji Kita) decides to quit his criminal life. However, the mobster family leaded by Otsuka (Hideaki Esumi) threatens Kurata's legitimate business, and Tetsu decides to leave Kurata to relief the pressure on him. He leaves also his girlfriend Chiharu (Chieko Matsubara) and becomes a drifter moving to the country. When Tetsu is betrayed, he returns to Tokyo to resolve his situation.","['Tetsuya Watari', 'Chieko Matsubara', 'Hideaki Nitani', 'Tamio Kawaji', 'Ryûji Kita']",[''],['Seijun Suzuki'],['Japan'],"['Japanese', 'English']",['Nikkatsu']
61589,"Portrait of the artist as a young man. In spring, 1965, Bob Dylan, 23, a pixyish troubador, spends three weeks in England. Pennebaker's camera follows him from airport to hall, from hotel room to public house, from conversation to concert. Joan Baez and Donovan, among others, are on hand. It's the period when Dylan is shifting from acoustic to electric, a transition that not all fans, including Baez, applaud. From the opening sequence of Dylan holding up words to the soundtrack's ""Subterranean Homesick Blues,"" Dylan is playful and enigmatic.","['Bob Dylan', 'Albert Grossman', 'Bob Neuwirth', 'Joan Baez', 'Alan Price']",[''],['D.A. Pennebaker'],['United States'],['English'],['Leacock-Pennebaker']
61882,"The number-three-ranked hit-man, with a fetish for sniffing boiling rice, fumbles his latest job, which puts him into conflict with a mysterious woman whose death wish inspires her to surround herself with dead butterflies and dead birds. Worse danger comes from his own treacherous wife and finally with the number-one-ranked hit-man, known only as a phantom to those who fear his unseen presence.","['Jô Shishido', 'Mariko Ogawa', 'Annu Mari', 'Kôji Nanbara', 'Isao Tamagawa']",['Don Brown'],['Seijun Suzuki'],['Japan'],"['Japanese', 'English']",['Nikkatsu']
62136,"Monsieur Hulot has to contact an American official in Paris, but he gets lost in the maze of modern architecture which is filled with the latest technical gadgets. Caught in the tourist invasion, Hulot roams around Paris with a group of American tourists, causing chaos in his usual manner.","['Jacques Tati', 'Barbara Dennek', 'Rita Maiden', 'France Rumilly', 'France Delahalle']","['Jérôme Deschamps', 'Véronique Failliot', 'Macha Makeïeff', 'Bernard Grenet']",['Jacques Tati'],"['France', 'Italy']","['French', 'English', 'German']","['Specta Films', 'Jolly Film']"
62138,"Mal Reese is in a real bind--owing a good deal of money to his organized crime bosses--and gets his friend Walker to join him in a heist. It goes off without a hitch, but when Reese realizes the take isn't as large as he had hoped, he kills Walker--or so he thinks. Some time later, Walker decides it's time to get his share of the money and starts with his ex-wife Lynne, who took up with Reese after the shooting. That leads him on a trail--to his wife's sister Chris, to Reese himself, then onto Big Stegman, then Frederick Carter, then up the line of gangsters in an effort to get money from people who simply won't acknowledge that they owe him anything.","['Lee Marvin', 'Angie Dickinson', 'Keenan Wynn', ""Carroll O'Connor"", 'Lloyd Bochner']","['Patricia Casey', 'Rafe Newhouse', 'David Steen', 'Norman Stuart']",['John Boorman'],['United States'],['English'],"['Metro-Goldwyn-Mayer (MGM)', 'Winkler Films']"
62407,"Joanna and her architect husband, Mark Wallace have been married for a decade, and their relationship's become very rocky. As they drive from their London home to St. Tropez for the unveiling of a house Mark has designed for his clients, Maurice and Francoise Dalbret, they recall the events - both happy and sad, which neither then to this point. Told in flashback they pair recall their first meeting, and memorable moments in their courtship and early wedded life, as well as the tensions they both felt which led them each to extramarital affairs. With a terrific score by Henry Mancini, this welli-loved Stanley Donnen film's a sparkling effervescent story which deals in an atypical way for films of this time - showing both the joyousness and pathos off love.","['Audrey Hepburn', 'Albert Finney', 'Eleanor Bron', 'William Daniels', 'Gabrielle Middleton']","['Maurice Binder', 'Arthur Carroll', 'Jean-Fabrice Janaudy', 'Maurice Landsberger', 'Adele Sanders']",['Stanley Donen'],['United Kingdom'],"['English', 'French', 'Italian']",['Stanley Donen Films']
62472,"Taw Jackson returns from prison having survived being shot, to the ranch and gold that Frank Pierce stole from him. Jackson makes a deal with Lomax, the man who shot him 5 years ago to join forces against Pierce and steal a large gold shipment. The shipments are transported in the War Wagon, an armored stage coach that is heavily guarded. The two of them become the key players in the caper to separate Pierce from Jackson's gold.","['John Wayne', 'Kirk Douglas', 'Howard Keel', 'Robert Walker Jr.', 'Keenan Wynn']","['Orin Borsten', ""'Chema' Hernandez"", 'Arvo Ojala']",['Burt Kennedy'],['United States'],"['English', 'Spanish']","['Batjac Productions', 'Marvin Schwartz Productions']"
62687,"Popular animated hero Asterix and his faithful sidekick Obelix travel to ancient Egypt to help Cleopatra build a new summer home. Cleopatra and Julius Caesar have made a bet, with Caesar wagering the project cannot be completed in a few weeks time. With the help of a magic potion, Asterix comes to the rescue of the Queen of the Nile as Caesar and an angry architect plot against them.","['Roger Carel', 'Jacques Morel', 'Micheline Dax', 'Jacques Balutin', 'Jacques Bodoin']",['Lee Payant'],['René Goscinny'],"['France', 'Belgium']",['French'],"['Belvision', 'Dargaud Films']"
62759,"Semyon Gorbunkov goes on a cruise. In Istanbul, he slips and breaks his arm. What he didn't know is that this was a signal for a gang of smugglers (a real smuggler - Gena - was also on board the same ship). So his arm gets bandaged with gold and diamonds. After he returns home, the gangsters are trying to get their stuff back, while the police try to catch them using Gorbunkov and his arm.","['Yuriy Nikulin', 'Nina Grebeshkova', 'Andrey Mironov', 'Anatoliy Papanov', 'Stanislav Chekan']",[''],['Leonid Gaidai'],['Soviet Union'],['Russian'],['Mosfilm']
