imdbId,plot,cast,crew,director,countries,languages,production_companies
387898,"Set in France, Georges is a TV Literary Reviewer and lives in a small yet modern town house with his wife Ann, a publisher and his young son Pierrot. They begin to receive video tapes through the post of their house and family, along side obscure child-like drawings. They visit the police with hope of aid to find the stalker, but as there is no direct threat, they refuse to help. As the tapes become more personal, Georges takes it upon himself to figure out who is putting through his family through such horror. A true Michael Haneke Classic.","['Daniel Auteuil', 'Juliette Binoche', 'Maurice Bénichou', 'Annie Girardot', 'Bernard Le Coq']","['Amira Chemakhi', 'Martine Etchegaray', 'Mathilde Incerti', 'Angelika Katz', 'Richard Lormand']",['Michael Haneke'],"['France', 'Austria', 'Germany', 'Italy']",['French'],"['Les Films du Losange', 'Wega Film', 'Bavaria Film', 'BIM Distribuzione', 'France 3 Cinéma', 'Arte France Cinéma', 'Eurimages', ""Centre national du cinéma et de l'image animée (CNC)"", 'Canal+', 'ORF Film/Fernseh-Abkommen', 'Westdeutscher Rundfunk (WDR)', 'StudioCanal', 'Österreichisches Filminstitut', 'Filmfonds Wien', 'Filmstiftung Nordrhein-Westfalen']"
133385,"The well-known little village from the Asterix and Obelix-comic books is in trouble: It is the last place not controlled by Rome. When Tax collector Claudius Incorruptus does not get his money from the villagers, Julius Caesar himself comes to the place to see what's so special about their resistance. A special magic potion, prepared by the village's druid, gives incredible power to those who drink it. And Obelix, who fell into the pot as a child has been invincible ever since. With the help of Tullius Destructivus, an intrigeur, the Romans try to get Obelix and the druid into their hands in order to wipe the little village off the map, when the last potion of it's stock has been used up. But each individual also has some plans of his own...","['Christian Clavier', 'Gérard Depardieu', 'Roberto Benigni', 'Michel Galabru', 'Claude Piéplu']","['Michele Benhassen', 'Frédéric Chauvineau', 'Hélène Chéruy', 'Sylvie Coen', 'Claude Davy']",['Claude Zidi'],"['France', 'Italy', 'Germany']","['French', 'German']","['AMLF', 'Bavaria Entertainment', 'Canal+', 'Cecchi Gori Group Tiger Cinematografica', ""Centre national du cinéma et de l'image animée (CNC)"", 'Constantin Film', 'Eurimages', 'FilmFernsehFonds Bayern', 'Filmförderungsanstalt (FFA)', 'Films 7', 'Katharina', 'Melampo Cinematografica', 'Pathé', 'Président Films', 'Renn Productions', 'TF1 Films Production']"
91341,"One winter evening, a Russian foreman named Vladimir and a Georgian student named Gedevan meet a strange man at the street, who claims to be stranded on Earth away from his home planet and shows them a teleportation device. Not knowing the odds, Vladimir and Gedevan press a random button on the device and end up on the planet named Pluke, where the advanced technology coexists with deserted wastelands, rusty exterior, tyrannical government and a rigid caste system. Now the two will have to get back home, getting acquainted with local customs and culture on their way.","['Stanislav Lyubshin', 'Evgeniy Leonov', 'Yuriy Yakovlev', 'Levan Gabriadze', 'Olga Mashnaya']",[''],['Georgiy Daneliya'],['Soviet Union'],"['Georgian', 'Russian', 'French', 'English']",['Mosfilm']
361089,"Set in 1944, Valiant (Ewan McGregor) is a woodland pigeon who wants to become a great hero someday. When he hears they are hiring recruits for the Royal Homing Pigeon Service, he immediately sets out for London. On the way, he meets a smelly, but friendly pigeon named Bugsy (Ricky Gervais), who joins him, mainly to get away from clients he cheated in a game of find-the pebble, and helps him sign up for the war.","['Ewan McGregor', 'Ricky Gervais', 'Tim Curry', 'Jim Broadbent', 'Hugh Laurie']","['Johnathan Abbott', 'Philip A. Brown', 'Neil Chatterjee', 'Daisy Church', 'Marisa Dean']",['Gary Chapman'],"['United Kingdom', 'United States']",['English'],"['Vanguard Films and Animation', 'Ealing Studios', 'UK Film Council', 'Take Film Partnerships', 'Odyssey Entertainment', 'Walt Disney Pictures']"
355295,"Widely known for their valiant acts of supernatural bravado, the bogus ghost-busters, Wilhelm and Jacob, or the Brothers Grimm, try their best to banish all sorts of evil in early-19th-century French-occupied Germany. For the right amount of money, the intrepid charlatans pretend to rid superstitious villages of its local ghouls or witches, until disturbing rumours about missing children in the small village of Marbaden start to spread like wildfire. Now--exposed by the French governor and Napoleon's general, Delatombe--the shameless duo of alleged paranormal fighters will have to prove their worth, and, for the first time in their entire career, do battle with a genuine malevolent force. However, can the utterly unprepared boys confront the real deal? Above all, can the Brothers Grimm clear their name?","['Petr Ratimec', 'Barbora Lukesová', 'Anna Rust', 'Jeremy Robson', 'Matt Damon']","['Damian Anderson', 'Joëlle Baland', 'Ota Bares', 'Neil Bell', 'Pavel Berka']",['Terry Gilliam'],"['United States', 'Czechia', 'United Kingdom']","['English', 'French', 'German', 'Italian']","['Dimension Films', 'Metro-Goldwyn-Mayer (MGM)', 'Mosaic', 'Reforma Films', 'Atlas Entertainment', 'Summit Entertainment', 'The Weinstein Company']"
401244,"[""In the style of a Howard Hawks comedy, Baxter follows the twists and turns of a young man's life during the two weeks before his wedding.""]","['Michael Showalter', 'Elizabeth Banks', 'Michelle Williams', 'Justin Theroux', 'Zak Orth']","['Pastor Alvarado III', 'Carina Alves', 'Victor Avila', 'Leah Baley', 'Erin Benach']",['Michael Showalter'],['United States'],['English'],"['IFC Films', 'IFC Productions', 'Plum Pictures']"
402901,"Decades after a rock church in communist Romania's Carpathians caved when an expedition caused a landslide and buried everyone, Dr. Nicolai's scientific team exploring the associated Templar Knights monster fighting-legend discovers a deep, flooded cave system and hires the brothers Jack and Tyler's brilliant divers team to explore it. Another explosion traps them, after finding a mysterious parasite turning all species carnivore, and later an independently evolved predator species. Jack may be infected and turning, but Tyler sticks with him, so the group splits, hunted by the monsters, which also fly.","['Cole Hauser', 'Eddie Cibrian', 'Morris Chestnut', 'Lena Headey', 'Piper Perabo']","['Vasile Anghel', 'Sallie Beechinor', 'Ilsa Berg', 'Ioana Bernacchi', 'Josef Brandmaier']",['Bruce Hunt'],"['United States', 'Germany']","['English', 'Romanian']","['Screen Gems', 'Cinerenta Medienbeteiligungs KG', 'Lakeshore Entertainment', 'City Productions', 'Cineblue Internationale Filmproduktionsgesellschaft']"
407732,"An American Pie-like teen comedy in which a high school senior tries to become the first student in years to complete the Dirty Deeds, an outrageous series of challenges that must be completed by the Homecoming banquet at 9 a.m.","['Milo Ventimiglia', 'Lacey Chabert', 'Tom Amandes', 'Matthew Carey', 'Mark Derwin']","['Andy Bouvé', 'Harold De Jesus', 'Sofie Dejus', 'Gavin Feek', 'Darin Ganitch']",['David Kendall'],['United States'],['English'],"['Green Diamond Entertainment', 'Ten Deeds', 'Bill Civitella/Todd Zeile Production', 'Thats Hollywood']"
387131,"In a remote area of Northern Kenya, activist Tessa Quayle is found brutally murdered. Tessa's companion, a doctor, appears to have fled the scene, and the evidence points to a crime of passion. Members of the British High Commission in Nairobi assume that Tessa's widower, their mild-mannered and unambitious colleague Justin Quayle, will leave the matter to them. They could not be more wrong. Haunted by remorse and jarred by rumors of his late wife's infidelities, Quayle surprises everyone by embarking on a personal odyssey that will take him across three continents. Using his privileged access to diplomatic secrets, he will risk his own life, stopping at nothing to uncover and expose the truth - a conspiracy more far-reaching and deadly than Quayle could ever have imagined.","['Ralph Fiennes', 'Rachel Weisz', 'Hubert Koundé', 'Danny Huston', 'Daniele Harford']","['Janine Abery', 'Musa Ali', 'Andrew Allen', 'Ulius M. Ambuche', 'Phylis Andika']",['Fernando Meirelles'],"['United Kingdom', 'Germany', 'Kenya', 'France', 'United States', 'Switzerland']","['English', 'Italian', 'Swahili', 'German']","['Focus Features', 'UK Film Council', 'Potboiler Productions', 'Scion Films', 'Blue Sky Films', 'Epsilon Motion Pictures', 'Studio Babelsberg', 'StudioCanal']"
388482,"Frank Martin is the best in the business. The ex-Special Forces operative hires himself out as a mercenary ""transporter"" who moves goods--human or otherwise. Very simple, he delivers, no questions asked. Frank has relocated from the French Mediterranean to Miami, Florida, where as a favor to a friend, Frank is driving for the wealthy Billings family. There's very little that can surprise The Transporter, but young Jack Billings has done just that; Frank has unexpectedly bonded with Jack, age 6, who he drives to and from school. But when Jack is kidnapped, Frank must use his battle-tested combat skills to retrieve the boy and thwart the kidnappers' master plan to release a virus that will kill anyone with whom it comes in contact.","['Jason Statham', 'Alessandro Gassmann', 'Amber Valletta', 'Kate Nauta', 'Matthew Modine']","['Paulo G. Acosta', 'Isabelle Agid', 'Josué D. Aguilar', 'Oscar Aguirre', 'Paul Aldanée']",['Louis Leterrier'],"['France', 'Germany', 'United States']","['English', 'French', 'Italian']","['EuropaCorp', 'TF1 Films Production', 'Current Entertainment', 'Sea Side Films Florida Inc.', 'Canal+', 'TPS Star', 'Telepool', 'Universum Film']"
425123,"Elizabeth Masterson, a dedicated doctor in San Francisco, had almost no time for anything. When she gets into a tragic car crash and goes into a coma, a landscape architect moves into Elizabeth's apartment for rent - where he meets her amnesiac ethereal form.","['Reese Witherspoon', 'Mark Ruffalo', 'Donal Logue', 'Dina Spybey-Waters', 'Ben Shenkman']","['Adam H. Anderson', 'Rachel Bati', 'Alex Betuel', 'Ariana Black', 'Jonathan Block']",['Mark Waters'],['United States'],"['English', 'Spanish', 'Mandarin']","['Dreamworks Pictures', 'Parkes/MacDonald Image Nation', 'Amblin Entertainment', 'The Kennedy/Marshall Company']"
377107,"Catherine is a woman in her late twenties who is strongly devoted to her father, Robert, a brilliant and well-known mathematician whose grip on reality is beginning to slip away. As Robert descends into madness, Catherine begins to wonder if she may have inherited her father's mental illness along with his mathematical genius. When Robert's work reveals a mathematical proof of potentially historic proportions, it sets off shock waves in more ways than one.","['Gwyneth Paltrow', 'Anthony Hopkins', 'Jake Gyllenhaal', 'Danny McCarthy', 'Hope Davis']","['Nick Abrahams', 'Colette Appleby', 'Josh Barber', 'Robert C. Barnett', 'Bridgett Baron']",['John Madden'],['United States'],['English'],"['Miramax', 'Endgame Entertainment', 'Hart Sharp Entertainment', 'Inside Track 1']"
399295,"This movie charts the rise and fall of Yuri Orlov, from his early days in the early 1980s in Little Odessa, selling guns to mobsters in his local neighborhood, through to his ascension through the decade of excess and indulgence into the early 1990s, where he forms a business partnership with an African warlord and his psychotic son. This movie also charts his relationship through the years with his younger brother, his marriage to a famous model, his relentless pursuit by a determined INTERPOL Agent and his inner demons that sway between his drive for success and the immorality of what he does.","['Nicolas Cage', 'Bridget Moynahan', 'Jared Leto', 'Shake Tukhmanyan', 'Jean-Pierre Nshanian']","['Paul Acutt', 'Monika Agorelius', 'Ahmet Ahmet', 'Judyie Al-Bilali', 'Justin Ambrosino']",['Andrew Niccol'],"['United States', 'Germany']","['English', 'Ukrainian', 'German', 'Spanish', 'Russian', 'French', 'Arabic', 'Turkish']","['Entertainment Manufacturing Company', 'VIP 3 Medienfonds', 'Ascendant Pictures', 'Saturn Films', 'Rising Star', 'Copag V', 'Endgame Entertainment', 'Majority Entertainment', 'Metro-Goldwyn-Mayer']"
428251,"SPOILER: Eric and his Yankee teenage mates travel South by motorbike to a swampy backwater town in Louisiana, where Sean's father Ray lived, the local tow truck driver, who abandoned the then baby-boy and his mother. Ray recently died, while trying to rescue a voodoo witch and at her urging her trunk, which got opened and released the poisonous serpents possessed by the souls of truly evil sinners she trapped in them. Ray was bitten and possessed as the car sunk, and shortly after it's dragged out rises as an 'undead' zombie, who murders without provocation and is immune to lethal weapons. He soon finds the teens' trace and proves his indiscriminately evil blood-thirst by charging his only offspring equally lethally. However they were warned by Eden's friend Cece, the witch's granddaughter, who explained the situation in her home and assures them when the zombie attacks it's safe thanks to a 'blessed' spell preventing evil from entering; alas the chain- and crowbar-waving undead finds a way round that: drag them out of it and make it fall apart. After the boys prove too brave and loyal for their own good, only Eden escapes alive, and the battle-site is moved to the tomb where the voodoo evil resides in a sarcophagus for their fight to the (un)death while she sort of learns enough voodoo by trial and error...","['Agnes Bruckner', 'Jonathan Jackson', 'Laura Ramsey', 'D.J. Cotrona', 'Rick Cramer']","['Steven Abramson', 'Wendy Altman-Cohen', 'Alexis Bayoud', 'Sue Bokobza', 'Erin Borel']",['Jim Gillespie'],['United States'],['English'],"['Dimension Films', 'Outerbanks Entertainment', 'Collision Entertainment']"
384286,"Nobody believes a liar - even when they're telling the truth. When a young woman is found murdered, a group of local high school students decide to further scare their classmates by spreading online rumors that a serial killer called ""The Wolf"" is on the loose. By describing ""The Wolf's"" next victims, the students' game is to see how many people they can convince - and if anyone will uncover the lie. But when the described victims actually do start turning up dead, suddenly no one knows where the lies end and the truth begins. As someone or something begins hunting the students themselves, the game turns terrifyingly real.","['Erica Yates', 'Julian Morris', 'Lindy Booth', 'Jane Beard', 'Gary Cole']","['Romulo Alejandro', 'Jeff L. Anderson', 'Coriena Baer', 'Jackie Bazan', 'Kathryn Beane']",['Jeff Wadlow'],['United States'],['English'],"['Rogue Pictures', 'Hypnotic']"
404030,"Jewish-American writer Jonathan Safran Foer is a collector of his family's memorabilia, although most of the items, some which he takes without asking, would not be considered keepsakes by the average person. He places most of those items in individual Ziploc bags, and hangs them on his keepsake wall under the photograph of the person to who it is most associated. He has this compulsion in an effort to remember. He is able to tie a photograph that he receives from his grandmother, Sabine Foer, on her deathbed - it of his grandfather, Safran Foer, during the war in the Ukraine, and a young woman he will learn is named Augustine - back to a pendant he stole from his grandfather on his deathbed in 1989, the pendant of a glass encased grasshopper. Learning that Augustine somehow saved his grandfather's life leads to Jonathan going on a quest to find out the story at its source where the photograph was taken, in a now non-existent and probably largely forgotten town called Trachimbrod that was razed by the Nazis during the war, he armed only with his limited knowledge, the pendant, his grandfather's Star of David necklace, the photograph, tip ""money"", and an old and largely outdated map. Prior to arriving in the Ukraine, Jonathan prearranges the guide services of Odessa-based Heritage Tours, which specializes in helping Jewish expats discover their past. The company is owned and operated by three generations of the Alexander Perchov family, who generally think Jewish people are stupid for wanting to revisit their past, and spend large sums of money for their services in doing so. The three from Heritage assigned to Jonathan's file are: the company founder Alexander I (""Grandpa""), the retired, non-blind blind man who will be the driver; his ""seeing eye"" dog, Sammy Davis Jr. Jr., a deranged bitch of a dog; and Alexander III (""Alex""), a western pop cultural loving young man, whose broken English will need to suffice for translation. Jonathan will learn that his guides are a loving but dysfunctional lot who have little interest in helping him beyond taking his money. But during their time together, this quest will affect Jonathan, Grandpa and Alex in different ways, all tied to the value of remembering.","['Eugene Hutz', 'Elijah Wood', 'Jonathan Safran Foer', 'Jana Hrabetova', 'Stephen Samudovsky']","['Judy Aley', 'David Allsberry', 'Lauren Barnhart', 'Oksana Batuik', 'Mandy Butler']",['Liev Schreiber'],['United States'],"['English', 'Russian', 'Ukrainian']","['Warner Independent Pictures', 'Telegraph Films', 'Big Beach Films', 'Stillking Films']"
318761,"Justin is a teenager boy, who has an oral obsession with his thumb. His mother seems to be a normal housekeeper, but she has her own obsessions as well, like a crush on a TV-star. The only person who's aware of Justin's problem is his father, manager in a store, but none of his advices seem to be working for Justin. The kid is signed up in a debate workshop, but the thing isn't going well, because he has his mind in a pretty classmate and, of course, in his thumb, affecting all the rest of his classes. So, Justin is a loner kid in the school, who prefers to lock himself in the bathroom and suck his thumb. Justin's dentist, a mystical-hippie person, will try to help to overcome his thumb problem, through the hypnosis. But the school's psychologist will diagnose Justin with the Attention Deficit Disorder, and will prescribe him some drugs. Suddenly, Justin's problem with his thumb will disappear, becoming an hyperactive genius, winning several debate contests and the admiration from his teacher. Nevertheless, more serious problems will come for Justin with his mother, his father and with a drug addiction.","['Ted Beckman', 'Benjamin Bratt', ""Vincent D'Onofrio"", 'Arvin V. Entena', 'Tyler Gannon']","['Stefanie Azpiazu', 'Peter Barnett', 'Jason Biggs', 'Marty Brantley', 'Dennis Brenhaug']",['Mike Mills'],['United States'],['English'],"['Bob Yari Productions', 'This Is That Productions', 'Cinema-Go-Go', ""Bull's Eye Entertainment"", 'Good Machine']"
95403,"Despite his success at apprehending criminals, Kevin Chan's unorthodox approach to his work as a police officer sees him demoted to the traffic branch. Despite this, the man he put behind bars is now out of prison, and has vowed to make his life a misery. While this crime boss his harassing Kevin and his girlfriend, the police are contemplating reinstating Kevin to help them fight a group of bombers attempting to extort $10 million from building owners.","['Jackie Chan', 'Maggie Cheung', 'Kwok-Hung Lam', 'Bill Tung', 'Keung-Kuen Lai']","['Chi-Keung Chan', 'Raymond Chow', 'Paul Clay', 'Kai-Ho Kam', 'Sarah-Jane King']",['Jackie Chan'],['Hong Kong'],['Cantonese'],"['Golden Harvest Company', 'Golden Way Films Ltd.', 'Paragon Films Ltd.']"
436971,"He may have been the ultimate icon of 1950s conformity and postwar complacency, but Dwight D. Eisenhower was an iconoclast, visionary, and the Cassandra of the New World Order. Upon departing his presidency, Eisenhower issued a stern, cogent warning about the burgeoning ""military industrial complex,"" foretelling with ominous clarity the state of the world in 2004 with its incestuous entanglement of political, corporate, and Defense Department interests.","['Ken Adelman', 'John Ashcroft', 'Osama bin Laden', 'George Bush', 'George W. Bush']","['Mohammad Al-Ami', 'Mahmoud Baghdady', 'Claudia Becker', 'Joe Beirne', 'Rob Berkey']",['Eugene Jarecki'],"['United Kingdom', 'France', 'Denmark', 'Canada', 'United States']","['English', 'Arabic']","['ARTE', 'BBC Storyville', 'British Broadcasting Corporation', 'Canadian Broadcasting Corporation', 'Charlotte Street Films', 'TV2 Danmark']"
419706,Something has gone wrong at a remote scientific research station on Mars. All research has ceased. Communication has failed. And the messages that do get through are less than comforting. It's a level 5 quarantine and the only souls allowed in or out are the Rapid Response Tactical Squad - hardened Marines armed to the teeth with enough firepower to neutralize the enemy...or so they think.,"['Dwayne Johnson', 'Karl Urban', 'Rosamund Pike', 'Deobia Oparei', 'Ben Daniels']","['Vivian Al-Samarraie', 'Ota Bares', 'Ryan Beeman', 'Ondrej Bylok', 'Karolina Cerna']",['Andrzej Bartkowiak'],"['United Kingdom', 'Czechia', 'Germany', 'United States']","['English', 'Japanese']","['John Wells Productions', 'Di Bonaventura Pictures', 'Doom Productions', 'Stillking Films', 'Babelsberg Film', 'Reaper Productions', 'Distant Planet Productions']"
421054,"The daughter of an actor father and a social-climber mother, Domino Harvey, bored with her life, decides to join the team of Ed Moseby and becomes a bounty hunter. But she gets in trouble when the Mafia's money is stolen from an armored truck, while Moseby and his crew are participating in a reality show produced by Mark Heiss. The situation gets out of control when the sons of a rival mobster are kidnapped while the FBI is monitoring two gangs of mobsters.","['Keira Knightley', 'Mickey Rourke', 'Edgar Ramírez', 'Rizz Abbasi', 'Delroy Lindo']","['Wendy Altman-Cohen', 'Donna Armstrong', 'Michael Barnes', 'Dave Bennett', 'Susan H. Bodine']",['Tony Scott'],"['United States', 'United Kingdom', 'France']",['English'],"['New Line Cinema', 'Scott Free Productions', 'Davis-Films', 'Metropolitan Filmexport', 'Domino 17521']"
348333,"It's the dinner shift at ShenaniganZ. Cluess boss Dan assigns Mitch, a 22-year-old trainee, to Monty, the smooth-talker who chases girls for one-night stands. Dean, a 22-year-old waiter, feels that life is passing him by. Dan offers him the assistant-manager job and gives him until midnight to decide. Other waiters, cooks, and bus boys have their issues and personalities. Bishop, the dishwasher, is their counselor. During this shift, Monty may learn something, Dean makes his decision, Dan makes a play for the not-yet-18 hostess, customers get their comeuppance, the guys all play the in-house homophobic flashing game, the gals demonstrate why they won't, and Mitch gets the last word.","['Ryan Reynolds', 'Anna Faris', 'Justin Long', 'David Koechner', 'Luis Guzmán']","['Brian Anderson', 'Kimberly Calhoun Boling', 'Chris Browne', 'Victor Brunette', 'Helio DeOliveira']",['Rob McKittrick'],['United States'],"['English', 'German']","['Eden Rock Media', 'Element Films', 'L.I.F.T. Production', 'Wisenheimer Films']"
402022,"Four hundred years in the future, set in the year 2415, Æon Flux is a mysterious assassin. Four centuries after a virus nearly annihilated the human race, leaving only five million survivors in a utopian city called Bregna. Aeon is struggling to destroy the Goodchild regime led by its namesake, Trevor Goodchild, the ruler of Bregna and a descendant of the man who found a cure for the deadly virus. As instructed by the Handler, Æon is assigned to assassinate Goodchild, but there are deeper secrets to be discovered, and conspiracies to be foiled.","['Charlize Theron', 'Marton Csokas', 'Jonny Lee Miller', 'Sophie Okonedo', 'Frances McDormand']","['Natalie Beer', 'Christopher Berg', 'Ilsa Berg', 'Claudine Biswas-MacKenzie', 'Josef Brandmaier']",['Karyn Kusama'],"['United States', 'Germany', 'Brazil', 'Italy']",['English'],"['Paramount Pictures', 'Lakeshore Entertainment', 'Valhalla Motion Pictures', 'MTV Films', 'Zohar International', 'Colossal Pictures', 'Studio Babelsberg', 'Rai Cinema']"
350261,"To escape an abusive boyfriend, without announcing her plans in advance, Jean Gilkyson takes her young daughter Griff to the Wyoming ranch of her father-in-law, Einar. Jean and Einar are disaffected, as he blames her for the death of his son in a car accident. Einar is taking care of his friend Mitch, who was attacked by a bear, and Einar does not know that he has a granddaughter. While Mitch heals and forgives the bear, Einar also changes his feelings regarding Jean, finally understanding that accidents happen and accepting her and loving Griff.","['Robert Redford', 'Jennifer Lopez', 'Morgan Freeman', 'Josh Lucas', 'Damian Lewis']","['Wendy L. Adjoury', 'Jennifer Aichholz', 'Mike Aichholz', 'Marie Amenta', 'Ariel Arce']",['Lasse Hallström'],"['United States', 'Canada']",['English'],"['Miramax', 'Revolution Studios', 'Initial Entertainment Group (IEG)', 'The Ladd Company', 'Kalis Productions GmbH & Co. Zweite KG', 'Persistent Entertainment', 'Unfinished Films']"
