imdbId,plot,cast,crew,director,countries,languages,production_companies
1023114,"In 1940, three men attempt to flee communist Russia, escaping a Siberian gulag. This movie tells their story and that of four others who escaped with them and a teenage girl, Irena Zielinska, who joins them in flight. The group's natural leader is Janusz Weiszczek, a Pole condemned by accusations secured by torturing his wife, spent much of his youth outdoors, and knows how to live in the wild. They escape under cover of a snowstorm: cynical American Mr. Smith, Russian thug Valka, comedic accountant Zoran, pastry chef Tomasz Horodinsky, who draws, Priest Andrejs Voss, and Polish Kazik, who suffers from night blindness. They face freezing nights, lack of food and water, mosquitoes, an endless desert, the Himalayas, as well as many moral and ethical dilemmas throughout the journey towards freedom.","['Dragos Bucur', 'Colin Farrell', 'Ed Harris', 'Alexandru Potocean', 'Saoirse Ronan']","['Ngadi Abdeslam', 'Mustapha Adidou', 'Michael Adler', 'Anne Applebaum', 'Maya Atanasova']",['Peter Weir'],"['United States', 'United Arab Emirates', 'Poland', 'India']","['English', 'Russian', 'Polish', 'Tibetan', 'Mongolian']","['Exclusive Films', 'National Geographic Films', 'Imagenation Abu Dhabi FZ', 'Allied Filmmakers', 'Monolith Films', 'On the Road', 'Point Blank Productions', 'Polish Film Institute']"
1032751,"Yang, the world's finest swordsman, packs it in and leaves Japan to find an old friend in the Wild West rather than kill the infant queen of a rival clan. He carries the baby to his friend's desolate, broken-down town; the friend has died, so Yang reopens a laundry and settles down, hanging wet clothes, growing flowers, raising the infant, and finding himself attracted to Lynne, a red-haired woman with a tragic past. As long as Yang keeps his sword sheathed, his rivals won't find him, but a band of reprobate gunmen terrorize the town and threaten Lynne. Showdowns are inevitable, but once the sword is drawn, can Yang find rest, a home, and a family?","['Jang Dong-Gun', 'Kate Bosworth', 'Geoffrey Rush', 'Danny Huston', 'Tony Cox']","['Scott Anderson', 'Ellie Callahan', 'Ivana Chubbuck', 'Natasha Dahlberg', 'Al Dunn']",['Sngmoo Lee'],"['New Zealand', 'South Korea']",['English'],"['Rogue', 'Boram Entertainment', 'Wellmade Entertainment', 'Star M', 'Sidus', 'Fuse Media', ""Mike's Movies"", 'Ozworks', 'FilmWest Productions', 'Sad Flutes']"
1166100,"One of the wealthiest business tycoon Sanjay Singhania (Owner of Singhania group of Industries) who was a very nice businessman and fell in love with a beautiful girl Kalpana who was an ad film actress. His life is ruined by a man called Ghajini who killed his love and also damaged his brain and two years later he is suffering from a mental disease called short-term memory lost he is living his life by writing notes, clicking pictures and sketching tattoos on his body just to take avenge from the man ghajini.","['Aamir Khan', 'Asin Thottumkal', 'Jiah Khan', 'Aamir Naik', 'Pradeep Singh Rawat']","['Prakash Bharadwaj', 'Deepak Gawade', 'Aman Gill', 'Geeta Kapoor', 'Ahmed Khan']",['A.R. Murugadoss'],['India'],"['Hindi', 'English', 'Urdu']",['Geetha Arts']
479997,"A 14th-century Crusader returns to a homeland devastated by the Black Plague. A beleaguered church, deeming sorcery the culprit of the plague, commands the two knights to transport an accused witch to a remote abbey, where monks will perform a ritual in hopes of ending the pestilence. A priest, a grieving knight, a disgraced itinerant, and a headstrong youth who can only dream of becoming a knight join a mission troubled by mythically hostile wilderness and fierce contention over the fate of the girl. When the embattled party arrives at the abbey, a horrific discovery jeopardises the knight's pledge to ensure the girl fair treatment, and pits them against an inexplicably powerful and destructive force.","['Nicolas Cage', 'Ron Perlman', 'Stephen Campbell Moore', 'Stephen Graham', 'Ulrich Thomsen']","[""Danny 'Dano' Anderson"", 'Nina Armstrong', 'Amber Asaro', 'Bara Barova', 'Joey Baxter']",['Dominic Sena'],['United States'],"['English', 'Latin']","['Atlas Entertainment', 'Relativity Media']"
1462667,"The plot concerns a struggle for power amongst Tokyo's Yakuza clans, today just as likely to be playing the stock market as shaking down pachinko parlors, over which the Sanmo-kai clan holds sway in the face of constant betrayal and ever-changing allegiances. The Sanmo-kai chairman learns that his henchman Ikemoto has struck an alliance with the drug-dealing Murase family, and is not best pleased, to say the least. The ensuing retaliation triggers an orgy of killings, territorial invasions and score settling while law enforcement officers are too corrupt to intervene.","['Takeshi Kitano', 'Kippei Shîna', 'Ryo Kase', 'Fumiyo Kohinata', 'Sôichirô Kitamura']","['Scott Ennis', 'Tsutomu Horiuchi', 'Shigehito Itô', 'Junichi Kimura', 'Jessica Loddo']",['Takeshi Kitano'],['Japan'],"['Japanese', 'English']","['Bandai Visual Company', 'Office Kitano', 'Omnibus Japan', 'TV Tokyo', 'Tokyo FM Broadcasting Co.']"
409847,"The Old West.. where a lone cowboy leads an uprising against a terror from beyond our world. 1873. New Mexico Territory. A stranger with no memory of his past stumbles into the hard desert town of Absolution. The only hint to his history is a mysterious shackle that encircles one wrist. What he discovers is that the people of Absolution don't welcome strangers, and nobody makes a move on its streets unless ordered to do so by the iron-fisted Colonel Dolarhyde (Ford). It's a town that lives in fear. But Absolution is about to experience fear it can scarcely comprehend as the desolate city is attacked by marauders from the sky. Screaming down with breathtaking velocity and blinding lights to abduct the helpless one by one, these monsters challenge everything the residents have ever known. Now, the stranger they rejected is their only hope for salvation. As this gunslinger slowly starts to remember who he is and where he's been, he realizes he holds a secret that could give the town a fighting chance against the alien force. With the help of the elusive traveler Ella (Olivia Wilde), he pulls together a posse comprised of former opponents-townsfolk, Dolarhyde and his boys, outlaws and Apache warriors-all in danger of annihilation. United against a common enemy, they will prepare for an epic showdown for survival.","['Daniel Craig', 'Abigail Spencer', 'Buck Taylor', 'Matthew Taylor', 'Cooper Taylor']","[""Jason 'Iat' Seigal"", 'Kevin Acevedo', 'Doug Acton', 'Andrew P. Aguilar', 'Brian Altounian']",['Jon Favreau'],"['United States', 'India']","['English', 'Apache languages']","['Universal Pictures', 'Dreamworks Pictures', 'Reliance Entertainment', 'Relativity Media', 'Imagine Entertainment', 'K/O Paper Products', 'Fairview Entertainment', 'Platinum Studios', 'K/O Camera Toys', 'O Entertainment']"
1183665,"At an elite girls boarding school, the award winning diving team is considered the premier group of girls in the school. When a new girl from Spain, Fiamma, comes to the school and joins the team, the rest of the squad is jealous of her relationship with the coach and force her off the team and out of the school by bullying her. When the girl is forced to rejoin the group, they decide to let her into their social circle and begin to be as fascinated with her as their coach is. But things take a turn when the coach lets her fascination lead her too far.","['Eva Green', 'Juno Temple', 'María Valverde', 'Imogen Poots', 'Ellie Nunn']","['Martina Carey', 'Pablo Carrera', 'Jacqueline Carroll', 'Ronald Carroll', 'Eamonn Cleary']",['Jordan Scott'],"['United Kingdom', 'Ireland', 'Spain', 'France', 'Switzerland']",['English'],"['Antena 3 Films', 'Bord Scannán na hÉireann / The Irish Film Board', 'Element Pictures', 'Future Films', 'Industry Entertainment', 'John Wells Productions', 'Killer Films', 'Scott Free Productions']"
1620446,"When Day, a sunny fellow, encounters Night, a stranger of distinctly darker moods, sparks fly! Day and Night are frightened and suspicious of each other at first, and quickly get off on the wrong foot. But as they discover each other's unique qualities--and come to realize that each of them offers a different window onto the same world-the friendship helps both to gain a new perspective.","['Muneer Lyati', 'Wayne Dyer']","['Mickayela Jade Beatty', 'Kelly Bonbright', 'Laurens Fein', 'Emily Forbes', 'Stephen Galgas']",['Teddy Newton'],['United States'],['English'],['Pixar Animation Studios']
1391092,"""Marwencol"" is a documentary about the fantasy world of Mark Hogancamp. After being beaten into a brain-damaging coma by five men outside a bar, Mark builds a 1/6th scale World War II-era town in his backyard. Mark populates the town he dubs ""Marwencol"" with dolls representing his friends and family and creates life-like photographs detailing the town's many relationships and dramas. Playing in the town and photographing the action helps Mark to recover his hand-eye coordination and deal with the psychic wounds of the attack. When Mark and his photographs are discovered, a prestigious New York gallery sets up an art show. Suddenly Mark's homemade therapy is deemed ""art"", forcing him to choose between the safety of his fantasy life in Marwencol and the real world that he's avoided since the attack.","['Mark Hogancamp', 'Emmanuel Nneji', 'Edda Hogancamp', 'Tom Neubauer', 'Julie Swarthout']","['Peter Grant', 'Andrew Herwitz', 'Lesley Langs', 'Robert Williams']",['Jeff Malmberg'],['United States'],['English'],['Open Face']
1578275,"A man finds out that what you don't say to a friend is just as important as what you do is this story of how far you can bend a brotherly bond before it snaps. Since college, confirmed bachelor Ronny (Vaughn) and happily married Nick (James) have been through thick and thin. Now partners in an auto design firm, the pals are vying to land a dream project that would launch their company. Ronny's girlfriend Beth (Connelly) and Nick's wife Geneva (Ryder) are by their sides. But Ronny's world is turned upside-down when he catches Geneva out with another man and makes it his mission to get answers. As the amateur investigation dissolves into mayhem, he learns that Nick has his own secrets. With the clock ticking and pressure mounting on the biggest presentation of their careers, Ronny must decide whether to reveal the truth to his best friend.","['Vince Vaughn', 'Kevin James', 'Jennifer Connelly', 'Winona Ryder', 'Channing Tatum']","['Kalie Acheson', 'Kimberly Aguirre', 'Michael Altstadt', 'Mardie Anderson', 'Jessica Bahr']",['Ron Howard'],['United States'],['English'],"['Universal Pictures', 'Imagine Entertainment', 'Spyglass Entertainment', 'Wild West Picture Show Productions']"
1740047,"When Steve Coogan is asked by The Observer to tour the country's finest restaurants, he envisions it as the perfect getaway with his beautiful girlfriend. But, when she backs out on him, he has no one to accompany him but his best friend and source of eternal aggravation, Rob Brydon.","['Steve Coogan', 'Rob Brydon', 'Rebecca Johnson', 'Elodie Harrod', 'Dolya Gavanski']","['Andrew Georgiou', 'Josh Hyams', 'Amy Jackson', 'Sophie Neave', 'Martha Skelly']",['Michael Winterbottom'],['United Kingdom'],['English'],"['Baby Cow Productions', 'British Broadcasting Corporation', 'Revolution Films']"
1287878,"[""A sixty-something woman, faced with the discovery of a heinous family crime and in the early stages of Alzheimer's disease, finds strength and purpose when she enrolls in a poetry class.""]","['Yun Jeong-hie', 'Lee Da-wit', 'Kim Hee-ra', 'Ahn Nae-sang', 'Kim Yong-taek']",['Eun-hee Her'],['Lee Chang-dong'],['South Korea'],['Korean'],"['UniKorea Pictures', 'Pine House Film', 'Diaphana Films', 'KT Capital Corporation', 'KTB Capital', 'Next Entertainment World']"
1219289,"An action-thriller about a writer who takes an experimental drug that allows him to use 100% of his mind. As one man evolves into the perfect version of himself, forces more corrupt than he can imagine mark him for assassination. Out-of-work writer Eddie Morra's (Cooper) rejection by girlfriend Lindy (Abbie Cornish) confirms his belief that he has zero future. That all vanishes the day an old friend introduces Eddie to NZT, a designer pharmaceutical that makes him laser-focused and more confident than any man alive. Now on an NZT-fueled odyssey, everything Eddie's read, heard or seen is instantly organized and available to him. As the former nobody rises to the top of the financial world, he draws the attention of business mogul Carl Van Loon (De Niro), who sees this enhanced version of Eddie as the tool to make billions, but brutal side effects jeopardize his meteoric ascent. With a dwindling stash and hit men who will eliminate him to get the NZT, Eddie must stay wired long enough to elude capture and fulfill his destiny. If he can't, he will become just another victim who thought he'd found invincibility in a bottle.","['Bradley Cooper', 'Robert De Niro', 'Abbie Cornish', 'Andrew Howard', 'Anna Friel']","['Nick Abreu', 'Nicole Agostino', 'Jon Applebaum', 'Kenneth Armstrong', 'Jodi Arneson']",['Neil Burger'],['United States'],"['English', 'Russian', 'Italian', 'Mandarin', 'French']","['Relativity Media', 'Virgin Produced', 'Rogue', 'Many Rivers Productions', 'Boy of the Year', 'Intermedia']"
1683876,"In the center of the story is the life of the indigenous people of the village Bakhtia at the river Yenisei in the Siberian Taiga. The camera follows the protagonists in the village over a period of a year. The natives, whose daily routines have barely changed over the last centuries, keep living their lives according to their own cultural traditions. The expressive pictures are accompanied by original sound bites quoting the villagers.","['Werner Herzog', 'Gennady Soloviev', 'Anatoly Blumei', 'Gennady Tiganov', 'Mikhail Tarkovsky']","['Andrey Filtchagov', 'Katja Hoerstmann', 'Alexander Karhu', 'Yuriy Korchuganov', 'Bianca Makarewicz']",['Werner Herzog'],['Germany'],"['English', 'Russian']",['Studio Babelsberg']
860906,"Under constant attack by Angels, NERV introduces two new pilots: the mysterious Makinami Mari Illustrous and the intense Asuka Langley Shikinami. Parallel to the incursion, Gendo Ikari and SEELE proceed the secret project that involves both Rei and Shinji.","['Kotono Mitsuishi', 'Megumi Ogata', 'Megumi Hayashibara', 'Yûko Miyamura', 'Fumihiko Tachiki']","['Hideaki Anno', 'Yôji Enokido', 'Joe Fria', 'Shinji Higuchi', 'Ryûsuke Hikawa']",['Masayuki'],['Japan'],"['Japanese', 'German']","['Gainax', 'Khara Corporation', 'Studio Khara Digital-bu']"
1242432,"The writer Jennifer Hills rents an isolated lakeside cabin in the woods of the peaceful Mockingbird Trail for two months to write a novel. Two days later, she is brutally gang raped by three local bigots, the sheriff and a handyman. Jennifer returns later to revenge against the rapists.","['Sarah Butler', 'Jeff Branson', 'Andrew Howard', 'Daniel Franzese', 'Rodney Eastman']","['Jeff Begun', 'Samantha Black', 'Aaron T. Brown', 'Candace Cahan', 'Eric Cire']",['Steven R. Monroe'],['United States'],['English'],"['Cinetel Films', 'Anchor Bay Films']"
1183923,"Something's wrong at the Rileys. Married nearly 30 years, Doug and Lois rarely talk. She doesn't leave their Indianapolis home, and she's ordered a gravestone with their names and birth years on it. He has a long-time Thursday night mistress whom he invites to go with him to a plumbing supply conference in New Orleans. Once there, Doug calls Lois to say he's staying for a while. What's he leaving behind and what's he looking for in New Orleans? And Lois, can she break out?","['James Gandolfini', 'Kristen Stewart', 'Melissa Leo', 'Joe Chrest', 'Ally Sheedy']","['Kimberly Bailey', 'Kelley Baker', 'Shelly Bancroft', 'Mike Barnard', 'Sebastien Betsch']",['Jake Scott'],"['United Kingdom', 'United States']",['English'],"['Samuel Goldwyn Films', 'Destination Films', 'Scott Free Productions', 'Argonaut Pictures']"
1781069,"A feature length documentary work which presents a case for a needed transition out of the current socioeconomic monetary paradigm which governs the entire world society. This subject matter will transcend the issues of cultural relativism and traditional ideology and move to relate the core, empirical ""life ground"" attributes of human and social survival, extrapolating those immutable natural laws into a new sustainable social paradigm called a ""Resource-Based Economy"".","['Peter Joseph', 'Robert Sapolsky', 'Gabor Maté', 'Richard Wilkinson', 'James Gilligan']",[''],['Peter Joseph'],['United States'],['English'],['Gentle Machine Productions']
329200,"Kevin McCallister's parents have split up. Now living with his mom, he decides to spend Christmas with his dad at the mansion of his father's rich girlfriend, Natalie. Meanwhile robber Marv Merchants, one of the villains from the first two movies, partners up with a new criminal named Vera to hit Natalie's mansion.","['French Stewart', 'Erick Avari', 'Barbara Babcock', 'Jason Beghe', 'Clare Carey']","['Elise Ganz', 'Robin Ginsberg', 'Genevieve Hofmeyr', 'Angela Phillips', 'Dezi Rorich']",['Rod Daniel'],['United States'],['English'],"['20th Century Fox Television', 'Fox Television Studios']"
1411238,"Occasionally in the 15 years since summer camp, Adam and Emma cross paths. When he discovers that an ex-girlfriend is living with his dad, he gets drunk, calls every woman in his cell phone contact list, and ends up passed out naked in her living room. By this time, she's a medical resident in L.A. and he's a gopher on a ""Glee""-like TV series, hoping to be a writer. She guards her emotions (calling her father's funeral ""a thing""), so after a quick shag in the moments she has before leaving for the hospital, she asks if he wants a no-strings-attached, sex-only relationship, without romance or complications. A prescription for fun or for disaster?","['Natalie Portman', 'Ashton Kutcher', 'Kevin Kline', 'Cary Elwes', 'Greta Gerwig']","['Jesse J. Adams', 'Nick Irving Allen', 'Teri J. Barber', 'John Bocchicchio', 'Amy Bradley']",['Ivan Reitman'],"['United States', 'United Kingdom']","['English', 'Ukrainian']","['Paramount Pictures', 'Cold Spring Pictures', 'Spyglass Entertainment', 'The Montecito Picture Company', 'Handsomecharlie Films', 'Katalyst Films', 'DreamWorks']"
1189340,"Mick Haller is a defense lawyer who works out of his Lincoln. When a wealthy Realtor is accused of assaulting a prostitute, Haller is asked to defend him. The man claims that the woman is trying to get some money out of him. But when Haller looks at the evidence against him, he learns that this case might be linked to an old case of his.","['Matthew McConaughey', 'Marisa Tomei', 'Ryan Phillippe', 'William H. Macy', 'Josh Lucas']","['Greg Anderson', 'Joshua Aufrance', 'Alfonso Barrientos', 'Adam Bayless', 'Robert Benun']",['Brad Furman'],['United States'],['English'],"['Lionsgate', 'Lakeshore Entertainment', 'Sidney Kimmel Entertainment', 'Stone Village Pictures']"
1161864,"Michael Kovak (Colin O'Donaghue), the son of a funeral director, grows indifferent to his father and joins a Seminary. On his way to the course completion, he is overwhelmed by a strong lack of faith. His religious beliefs are further jolted when he sees a young girl haplessly dying in a road accident for whom he reluctantly performs the ritual to absolve her sins. His mentor still believes in him and urges him to go to Italy to take an exorcism course, hoping that it would strengthen his faith in Christianity. In Italy, he attends a session from Father Xavier (Ciarán Hinds), who soon becomes aware of his skepticism. As a result, he sends him to an eminent Jesuit exorcist, Father Lucas Trevant (Sir Anthony Hopkins), whose ways, though questionable, are quite effective. He witnesses the exorcism of a sixteen year old girl but still seems unconvinced. Father Lucas explains to him that it takes multiple sessions over a long stretch of time to completely free a victim from the demon. Despite witnessing some supernatural occurrences during the aforesaid exorcism, Michael is as skeptical as ever. After the second exorcism, the girl's condition becomes quite critical as she is moved to a hospital. She soon dies and the demon finds a new victim. As the moment of reckoning draws near, Michael may be the only hope left, but first he must overcome his own doubts and apprehensions in order to fight and destroy the ominous forces.","['Anthony Hopkins', ""Colin O'Donoghue"", 'Alice Braga', 'Ciarán Hinds', 'Toby Jones']","['Akemi Abe', 'Camrin Agin', 'Adriano Aragon', 'Peter Arpesella', 'Matt Baglio']",['Mikael Håfström'],"['United States', 'Hungary', 'Italy']","['English', 'Welsh', 'Italian', 'Latin', 'Russian', 'Hungarian', 'Greek']","['New Line Cinema', 'Contrafilm', 'Mid Atlantic Films', 'Hungarian National Film Office', 'Roma Lazio Film Commission', 'Italian Tax Credit', 'Mouse Film']"
1555064,"A drama centered on a rising country-music songwriter (Hedlund) who sparks with a fallen star (Paltrow). Together, they mount his ascent and her comeback, which leads to romantic complications involving her husband/manager (McGraw) and a beauty queen-turned-singer (Meester).","['Gwyneth Paltrow', 'Tim McGraw', 'Garrett Hedlund', 'Leighton Meester', 'Marshall Chapman']","['Scott Adcock', 'Josh Benavidez', 'Andrew Benz', 'Jennifer Blair', 'Marla Blessey']",['Shana Feste'],['United States'],['English'],"['Screen Gems', 'Maguire Entertainment', 'Material Pictures', 'TVM']"
1401152,"A biochemist and his wife arrive in Berlin for a conference at which a scientist and his controversial Arab funder will announce breakthrough research. While his wife checks into the hotel, he grabs a cab to return to the airport for his briefcase, left at the curb. En route, an auto accident puts him in a coma, from which he awakes four days later without identification and with gaps in his memory. He goes to the hotel: his wife refuses to recognize him and another man has claimed his identity. With help from a nurse, the cab driver, a retired Stasi agent, and an academic friend, he tries to unravel what's going on. Is the answer in the briefcase?","['Liam Neeson', 'Diane Kruger', 'January Jones', 'Aidan Quinn', 'Bruno Ganz']","['Damian Anderson', 'Sabrina Barteleit', 'Jean-Marc Bellu', 'Stephen Bender', 'Markus Bensch']",['Jaume Collet-Serra'],"['United Kingdom', 'Germany', 'France', 'United States']","['English', 'German', 'Turkish', 'Arabic']","['Dark Castle Entertainment', 'Panda Productions Inc.', 'Canal+', 'Horticus UK', 'Studio Babelsberg', 'StudioCanal', 'TF1 Films Production']"
881320,"The 3-D action-thriller Sanctum follows a team of underwater cave divers on a treacherous expedition to the largest, most beautiful and least accessible cave system on Earth. When a tropical storm forces them deep into the caverns, they must fight raging water, deadly terrain and creeping panic as they search for an unknown escape route to the sea. Master diver Frank McGuire has explored the South Pacific's Esa-ala Caves for months. But when his exit is cut off in a flash flood, Frank's team-including 17-year-old son Josh and financier Carl Hurley are forced to radically alter plans. With dwindling supplies, the crew must navigate an underwater labyrinth to make it out. Soon, they are confronted with the unavoidable question: Can they survive, or will they be trapped forever?","['Richard Roxburgh', 'Ioan Gruffudd', 'Rhys Wakefield', 'Alice Parkinson', 'Dan Wyllie']","['Kristin Berbae', 'Hillary Bibicoff', 'Jason Blackwell', 'Sonia Borella', 'Ted Cahn']",['Alister Grierson'],"['United States', 'Australia']",['English'],"['Universal Pictures', 'Relativity Media', 'Wayfare Entertainment', 'Great Wight Productions/ Osford Films', 'Sanctum Australia', 'Start Media']"
1477837,"Tim Lippe (Helms) was the guy people always thought would go places but then he just ... didn't. He's been living in über-sleepy Brown Valley, Wisconsin his whole life, still ""pre-engaged"" to his 7th grade teacher Macy Vanderhei (Weaver), while selling insurance to protect other people's dreams. But now, Tim's stalled life is about to get a kick-start because, for the first time in his 34 years, he's headed to a ""major"" metropolis - Cedar Rapids, Iowa - where he must try to save his company at a do-or-die insurance convention that, for him, will be entirely unconventional. From the minute he checks into his hotel with his ancient American Tourister and cummerbund money belt, it's clear Tim has no idea how the modern world really works. He is soon smitten with seductive Nebraskan insurance agent Joan Ostrowski-Fox (Heche) and awed by his experienced roommates, the straight-shooting Ronald Wilkes (Whitlock Jr.) and the suspicious Dean Zeigler (Reilly). Disheartened when he comes face-to-face with corporate corruption, Tim is ultimately lured beyond the lobby into an urban jungle he's only ever seen on DVD and when it seems his life - and chances to succeed - have gone completely topsy-turvy, he finds his own unjaded way to turn it all around.","['Ed Helms', 'John C. Reilly', 'Anne Heche', 'Isiah Whitlock Jr.', 'Stephen Root']","['Deidre Backs', 'Sarah Bastian', 'Charlie Berens', 'Naomi Bombardi-Wilson', 'Anna Ramey Borden']",['Miguel Arteta'],['United States'],['English'],['Ad Hominem Enterprises']
