imdbId,plot,cast,crew,director,countries,languages,production_companies
1486190,"The Independent journalist Tamara Drewe returns to Dorset, Ewedown, to sell the Winnard Farm that belonged to her deceased mother. Her neighbor Beth Hardiment runs a writers retreat with her unfaithful and womanizer husband Nicholas Hardiment who is a successful writer of Inchcombe adventures and cheats on Beth every now and then with younger women. Tamara was the sweetheart of the handyman Andy Cobb, whose family owned the Winnard Farm but lost it to Tamara's family, and when she sees him, she rekindles her love for him. However, when Tamara travels to interview the unpleasant drummer of the Swipe band Ben Sergeant, he has just found that his girlfriend Fran is having an affair with the other musician Steven Culley and he breaks up with the band. Tamara and Ben have a love affair and Ben moves to Winnard. Meanwhile, Ben's teenager fan Jody Long and her best friend Casey Shaw who are bored in Ewedown feel happy with the presence of Ben in the village. When Ben proposes to Tamara, they travel to London to spend a couple of days in the big city. Meanwhile, the jealous Casey breaks in Tamara's house and uses her computer to send an e-mail pretending to be Tamara that will change the lives of the dwellers and end in a tragedy.","['Gemma Arterton', 'Roger Allam', 'Bill Camp', 'Dominic Cooper', 'Luke Evans']","['Aaron Anderson', 'Caridad Angus', 'Nick Atkinson', 'Geraldine Atlee', 'Stephanie Barker']",['Stephen Frears'],['United Kingdom'],['English'],"['Ruby Films', 'BBC Films', 'Notting Hill Films', 'UK Film Council', 'WestEnd Films']"
1228987,"In Los Alamos, New Mexico, the twelve year-old Owen is a lonely and outcast boy bullied in school by Kenny and two other classmates; at home, Owen dreams of avenging himself against the trio of bullies. He befriends his twelve-year-old next door neighbor, Abby, who only appears during the night in the playground of their building. Meanwhile, Abby's father is a wanted serial-killer who drains the blood of his victims to supply Abby, who is actually an ancient vampire. Abby advises Owen to fight Kenny; however, soon he discovers that she is a vampire, and he feels fear and love for the girl. Meanwhile a police officer is investigating the murder cases, believing that it is a satanic cult.","['Kodi Smit-McPhee', 'Chloë Grace Moretz', 'Richard Jenkins', 'Cara Buono', 'Elias Koteas']","['Kazim Aminy', 'Phil Arnold', 'Kristen Blodget', 'Elizabeth Chassie', 'Rob Corlew']",['Matt Reeves'],"['United Kingdom', 'United States']",['English'],"['Overture Films', 'Exclusive Media Group', 'Hammer Films', 'EFTI']"
1028576,"Housewife and mother Penny Chenery agrees to take over her ailing father's Virginia-based Meadow Stables, despite her lack of horse-racing knowledge. Against all odds, Chenery -- with the help of veteran trainer Lucien Laurin -- manages to navigate the male-dominated business, ultimately fostering the first Triple Crown winner in twenty-five years.","['Diane Lane', 'John Malkovich', 'Dylan Walsh', 'Margo Martindale', 'Nelsan Ellis']","['Geoff Abadee', 'Lisa Baldwin', 'Sara Bartkiewicz', 'Michelle Basterrechea', 'Mary Bean']",['Randall Wallace'],['United States'],['English'],"['Walt Disney Pictures', 'Fast Track Productions', 'Mayhem Pictures']"
816556,"Sixteen-year-old Alice Palmer drowns while swimming in the local dam. When her body is recovered and a verdict of accidental death returned, her grieving family buries her. The family then experiences a series of strange and inexplicable events centered in and around their home. Profoundly unsettled, the Palmers seek the help of psychic and parapsychologist, Ray Kemeny. Ray discovers that Alice led a secret, double life. A series of clues lead the family to Lake Mungo where Alice's secret past emerges. Lake Mungo is a mystery, a thriller and a ghost story.","['Rosie Traynor', 'David Pledger', 'Martin Sharpe', 'Talia Zucker', 'Tania Lentini']","['Mark R. Lindsay', 'Annabel McPhee', 'Sara Moroney', 'Chris Schwarze', 'Rita Walsh']",['Joel Anderson'],['Australia'],['English'],"['Mungo Productions', 'Screen Australia', 'SBS Independent']"
1314655,"In Philadelphia, Detective Bowden is still grieving for his wife and son, killed in a hit-and-run five years ago. When someone jumps from a skyscraper onto a truck, Bowden is sent to investigate. Meanwhile, five strangers are trapped in an elevator in the building where the jumper committed suicide. The communication radio in the elevator is broken but the guards, Lustig and Ramirez, observe the individuals via CCTV as events unfold. Tensions run high among those trapped, so Lustig calls the police and Detective Bowden assumes the case. Without being able to contact the individuals, he tries to work out who they are, but he can only account for four of them. Time is running out for the occupants of the elevator, as Bowden realizes he has to get them out quickly.","['Chris Messina', 'Logan Marshall-Green', ""Jenny O'Hara"", 'Bojana Novakovic', 'Bokeem Woodbine']","['Tal Aulbrook', 'John Bardswich', 'Kristofer Barton', 'Matt Coatsworth', 'Bernadette Couture']",['John Erick Dowdle'],['United States'],"['English', 'Spanish', 'Ukrainian']","['Universal Pictures', 'Media Rights Capital (MRC)', 'Night Chronicles', 'Relativity Media']"
1414382,"As a teenager Marni (Kristen Bell) was the kind of girl no guy would go near and would be tormented by the mean girls, and no one was meaner to her than Joanna (Odette Annable), the head cheerleader. Years later, she's a successful woman with a good job. When she goes home for her brother's wedding, she discovers that her brother (James Wolk) is marrying Joanna. And he doesn't know what she did to Marni. When they meet, she wants Joanna to apologize for the way she treated her but Joanna feigns ignorance. When Marni tells her mother, Gail (Jamie Lee Curtis), about her and Joana, Gail tells her to try and put it behind her. But when Gail meets Joana's aunt Mona (Sigourney Weaver), it turns that she's her old friend Ramona who was her best friend in high school whom she had falling out with with years ago, and Gail is unaware what caused it. Gail feels like Mona is trying to rub her success in her face. When Marni learns that Joanna does remember her she sets to expose her to her brother.","['Kristen Bell', 'Jamie Lee Curtis', 'Sigourney Weaver', 'Odette Annable', 'Victor Garber']","['Scott Ballew', 'Lori Beth Bernat', 'Anna Ramey Borden', 'Jason C. Brown', 'Ross Coscia']",['Andy Fickman'],['United States'],"['English', 'French', 'German', 'Spanish', 'Hawaiian', 'Japanese', 'Italian', 'Hebrew']","['Touchstone Pictures', 'Frontier Pictures', 'Oops Doughnuts Productions']"
1055292,"Holly and Eric were set up on a blind date by their married friends Peter and Allison, but it didn't go well. After Peter and Allison are killed in an accident, Holly and Eric learn that they have been named as the guardian of their late friends' infant daughter Sophie, so they move into their house and try their best to honor their friends' wishes. But raising a child cramps their style--and they still don't exactly get along.","['Katherine Heigl', 'Josh Duhamel', 'Josh Lucas', 'Alexis Clagett', 'Brynn Clagett']","['Russell Allen', 'Gena Berry', 'Sebastien Betsch', 'Susan Boyajian', 'Max Calder']",['Greg Berlanti'],['United States'],['English'],"['Josephson Entertainment', 'Gold Circle Films', 'Village Roadshow Pictures']"
1584016,"In late 2007, filmmakers Ariel Schulman and Henry Joost sensed a story unfolding as they began to film the life of Ariel's brother, Nev. They had no idea that their project would lead to the most exhilarating and unsettling months of their lives. A reality thriller that is a shocking product of our times, Catfish is a riveting story of love, deception and grace within a labyrinth of online intrigue.","['Nev Schulman', 'Ariel Schulman', 'Henry Joost', 'Angela Wesselman-Pierce', 'Melody C. Roscher']","['Jason Barhydt', 'Linda Benjamin', 'Robbie Brenner', 'Paul Davidge', 'Nate Greenwald']",['Henry Joost'],['United States'],['English'],"['Supermarché', 'Hit The Ground Running Films']"
1182350,"Follows a pair of married couples, Alfie (Sir Anthony Hopkins) and Helena (Gemma Jones), and their daughter Sally (Naomi Watts) and husband Roy (Josh Brolin), as their passions, ambitions, and anxieties lead them into trouble and out of their minds. After Alfie leaves Helena to pursue his lost youth and a free-spirited call girl named Charmaine (Lucy Punch), Helena abandons rationality and surrenders her life to the loopy advice of a charlatan fortune teller. Unhappy in her marriage, Sally develops a crush on her handsome art gallery owner boss, Greg (Antonio Banderas), while Roy, an author nervously awaiting the response to his latest manuscript, becomes moonstruck over Dia (Freida Pinto), a mystery woman who catches his gaze through a nearby window.","['Gemma Jones', 'Pauline Collins', 'Anthony Hopkins', 'Rupert Frazer', 'Kelly Harrison']","['Deborah Alexander-Lee', 'Lauren Barnhart', 'Catherine Booton', 'Sara Briggs', 'Sadie Brown']",['Woody Allen'],"['United States', 'Spain']","['English', 'Italian']","['Mediapro', 'Versátil Cinema', 'Gravier Productions', 'Antena 3 Films', 'Antena 3 Televisión', 'Dippermouth', 'Location HQ']"
1423995,"Parole officer Jack Mabry (Robert De Niro) has only a few weeks left before retirement and wishes to finish out the cases he's been assigned. One such case is that of Gerald ""Stone"" Creeson (Edward Norton), a convicted arsonist who is up for parole. Jack is initially reluctant to indulge Stone in the coarse banter he wishes to pursue and feels little sympathy for the prisoner's pleas for an early release. Seeing little hope in convincing Jack by himself, Stone arranges for his wife, Lucetta (Milla Jovovich), to seduce the officer, but motives and intentions steadily blur amidst the passions and buried secrets of the corrupted players in this deadly game of deception.","['Robert De Niro', 'Edward Norton', 'Milla Jovovich', 'Frances Conroy', 'Enver Gjokaj']","['Jeff L. Anderson', ""Richard 'Rick' Bobier"", 'Devon Boyd', 'Melissa Bradac', 'Michele Campbell']",['John Curran'],['United States'],['English'],"['Millennium Films', 'Mimran Schur Pictures', 'Mimran Schur Pictures', 'Holly Wiersma Productions', 'Stone Productions']"
1645089,"'Inside Job' provides a comprehensive analysis of the global financial crisis of 2008, which at a cost over $20 trillion, caused millions of people to lose their jobs and homes in the worst recession since the Great Depression, and nearly resulted in a global financial collapse. Through exhaustive research and extensive interviews with key financial insiders, politicians, journalists, and academics, the film traces the rise of a rogue industry which has corrupted politics, regulation, and academia. It was made on location in the United States, Iceland, England, France, Singapore, and China.","['Matt Damon', 'Gylfi Zoega', 'Andri Snær Magnason', 'Sigridur Benediktsdottir', 'Paul Volcker']","['Kristin Bye', 'Lisa Callif', 'Al Cerullo', 'Robin Cutter', 'Jerry L. Dasti']",['Charles Ferguson'],['United States'],['English'],"['Sony Pictures Classics', 'Representational Pictures', 'Screen Pass Pictures']"
1470827,"Six years ago NASA discovered the possibility of alien life within our solar system. A probe was launched to collect samples, but crashed upon re-entry over North America. Soon after, new life forms began to appear and half of Mexico was quarantined as an infected zone","['Scoot McNairy', 'Whitney Able', 'Mario Zuniga Benavides', 'Annalee Jefferies', 'Justin Hall']","['Chidozie C. Ahaiwe', 'Wahida Begum', 'Chee-Lan Chan', 'Victoria Chapple', 'Hector Crisantes']",['Gareth Edwards'],"['United Kingdom', 'Mexico']","['English', 'Spanish']","['Protagonist Pictures', 'Vertigo Films']"
1646887,"Bigger and Blackerer was taped during two shows, back-to-back on the same evening at Boston's Wilbur Theatre. Only by watching this video will you learn of Cross unique relationship with the deaf community, share his canny insights into the editorial machinations behind the Bible, and marvel at how well a bald, middle-aged white guy can fill out a pair of jeans.","['David Cross', 'Todd Glass', 'Dean Crow', 'Mort Burke']",[''],['Lance Bangs'],['United States'],['English'],['Field Recordings']
1244754,"Betty Anne Waters (Swank) is a high school dropout who spent nearly two decades working as a single mother while putting herself through law school, tirelessly trying to beat the system and overturn her brother's (Rockwell) unjust murder conviction.","['Hilary Swank', 'Sam Rockwell', 'Thomas D. Mahard', 'Owen Campbell', 'Conor Donovan']","['Adam Abelson', 'Alan Abrams', 'Paul Almond', 'Cassandra Barbour', 'Alyssa Batchelor']",['Tony Goldwyn'],"['Switzerland', 'United Kingdom', 'United States']",['English'],"['Omega Entertainment', 'Longfellow Pictures', 'Oceana Media Finance', 'Hindsight Media', 'Innocence Productions', 'Pantheon Entertainment Corporation']"
1334260,"As children, Ruth, Kathy and Tommy spend their childhood at a seemingly idyllic English boarding school. As they grow into young adults, they find that they have to come to terms with the strength of the love they feel for each other, while preparing themselves for the haunting reality that awaits them.","['Carey Mulligan', 'Andrew Garfield', 'Izzy Meikle-Small', 'Charlie Rowe', 'Ella Purnell']","['John Barnes', ""Steve 'Barney' Barnett"", 'Linda Bowen', 'Stuart Cadenhead', 'Fiona Carruthers']",['Mark Romanek'],['United Kingdom'],['English'],"['DNA Films', 'Film4', 'Searchlight Films']"
775489,"Details the story of a dying breed of stage entertainer whose thunder is being stolen by emerging rock stars. Forced to accept increasingly obscure assignments in fringe theaters, garden parties and bars, he meets a young fan who changes his life forever.","['Jean-Claude Donda', 'Eilidh Rankin', 'Duncan MacNeil', 'Raymond Mearns', 'James T. Muir']","['Anne Beaudic', 'Stuart Brown', 'Helen Bywater', 'Rosanna Cecchini', 'Sally Chomet']",['Sylvain Chomet'],"['France', 'United Kingdom']","['English', 'French', 'Scottish Gaelic']","['Pathé', 'Django Films', 'Ciné B', 'France 3 Cinéma', 'Canal+', 'CinéCinéma', 'France Télévisions', 'Allied Filmmakers', 'Ink.Digital']"
1523483,"Smith's everyday life in the dorm - hanging out with his arty, sarcastic best friend Stella, hooking up with a beautiful free spirit named London, lusting for his gorgeous but dim surfer roommate Thor - all gets turned upside-down after one fateful, terrifying night.","['Thomas Dekker', 'Haley Bennett', 'Chris Zylka', 'Roxane Mesquida', 'Juno Temple']","['Chris Aguilar Garcia', 'Jessica Bahr', 'Alishe Beardeaux', 'Nic Berlin', 'Annalis Clint']",['Gregg Araki'],"['United States', 'France']",['English'],"['Desperate Pictures', 'Wild Bunch', 'Super Crispy Entertainment', 'The Next World', 'Graveyard Machine', 'Why Not Productions']"
1612774,"['A homicidal car tire, discovering it has destructive psionic power, sets its sights on a desert town once a mysterious woman becomes its obsession.']","['Stephen Spinella', 'Jack Plotnick', 'Wings Hauser', 'Roxane Mesquida', 'Ethan Cohn']","['Myriam Bruguière', 'Sarah Clifford', 'Samantha Lyn Dickinson', 'Tonto Goldstein', 'Olivier Guigues']",['Quentin Dupieux'],['France'],['English'],"['Realitism Films', 'Elle Driver', 'Arte France Cinéma', '1.85 Films', 'Backup Media', 'Sindika Dokolo', 'Canal+', 'ARTE']"
1179069,"After the death of her husband, Dr. Cara Harding's faith in God has been shaken, but not her belief in science. In an attempt to get her more open to accepting unexplainable psychiatric theories, her father introduces her to Adam, a patient with multiple personalities who also takes on some of the physical characteristics of his other personalities. But Cara quickly discovers that his other personalities were murder victims and the more she finds out about Adam and his past, the closer she and her loved ones are to becoming murder victims themselves.","['Julianne Moore', 'Jonathan Rhys Meyers', 'Jeffrey DeMunn', 'Frances Conroy', 'Nate Corddry']","['Noor Ahmed', 'Brittany Aikey', 'Roberta L. Asman', 'Nicole Bagood', 'Laura Barone']",['Måns Mårlind'],['United States'],['English'],"['NALA Films', 'Macari/Edelstein', 'IM Global', 'Shelter Productions']"
1116184,"'Jackass 3D' opens with the entire cast all lined up, each wearing a different color of the rainbow, in front of a rainbow colored background, each in turn being attacked in various ways. Some of the footage is slowed down for maximal effect. This is repeated again at the end of the movie with additional explosions mixed in with gallons of water to wash away the cast- chaos is resumed. Throughout the movie the team are subjected to the usual foray of physical abuse from team members or perform hilarious stunts (including some of the more stomach turning stunts such as the Sweat suit cocktail, Toy Train Eruption and Poo Cocktail Supreme - not for the weak stomached!).","['Johnny Knoxville', 'Bam Margera', 'Steve-O', 'Ryan Dunn', ""Jason 'Wee Man' Acuña""]","['Douglas Banks', 'Selina Becker', 'Ernest Britt Jr.', 'Michael Brzeski', 'Moises Candelaria']",['Jeff Tremaine'],['United States'],['English'],"['Dickhouse Productions', 'Film Roman Productions', 'MTV Films', 'Polyphony Digital']"
1559549,"Sebastian Junger and Tim Hetherington's year dug in with the Second Platoon in one of Afghanistan's most strategically crucial valleys reveals extraordinary insight into the surreal combination of back breaking labor, deadly firefights, and camaraderie as the soldiers painfully push back the Taliban.","['The Men of Battle Company 2nd of the 503rd Infantry Regiment 173rd Airborne Brigade Combat Team', ""Juan 'Doc Restrepo"", 'Dan Kearney', 'LaMonta Caldwell', 'Aron Hijar']","['Victor Barroso', 'Mark Chamlin', 'Sinead Duell', 'Richard Koenigsberg', 'Ben Lay']",['Tim Hetherington'],['United States'],['English'],"['Outpost Films', 'Virgil Films & Entertainment', 'Passion Pictures']"
1085779,"Susan and her sons Dane and Lucas Thompson move from Brooklyn to small town Benzonville. Dane is upset with the constant changes of address and the family has lived in many cities. Lucas and Dane befriend their next door neighbor, the gorgeous Julie and the brothers find a bottomless hole in the basement of their house locked with several padlocks. They take the locks off and soon they are haunted by their darkest fears. Further, they believe that the hole might be a gateway to hell.","['Chris Massoglia', 'Haley Bennett', 'Nathan Gamble', 'Teri Polo', 'Bruce Dern']","['Dustin Lee Abram', 'Darlyl Adam', 'Cara E. Anderson', 'Kimberly Andrews', 'Len Antonation']",['Joe Dante'],['United States'],['English'],"['Bold Films', 'BenderSpink', 'The Hole']"
1320304,"It has been a year since the isolated Alaskan town of Barrow's population was decimated by vampires during its annual month long sunset. Riddled with grief over the death of her husband Eben, bound by nightmares and void of all emotions beyond hate and sorrow, Stella Oleson has spent the past months traveling the world, trying to convince others that vampires exist. Met with skepticism and laughter, she is ready to throw in the towel when a group of lost souls offers an incredible opportunity: the chance to exact revenge upon Lilith, the vampire queen responsible for the assault on her sleepy Alaskan town. With nothing remaining to live for, and nothing left to fear, Stella joins their mission and ventures into the uncharted underbelly of Los Angeles where she pushes herself to the most extreme limits to stop the evil from striking again.","['Kiele Sanchez', 'Rhys Coiro', 'Diora Baird', 'Harold Perrineau', 'Mia Kirshner']","['Troy Adamson', 'Cindy Byerley', 'Clayton Carroll', 'Morley Cruikshank', 'Irena Dargenio']",['Ben Ketai'],['United States'],['English'],"['Stage 6 Films', 'RCR Media Group', 'Ghost House Pictures', 'Dark Horse Entertainment']"
1566648,"Filmmaker Davis Guggenheim reminds us that education ""statistics"" have names: Anthony, Francisco, Bianca, Daisy, and Emily, whose stories make up the engrossing foundation of WAITING FOR SUPERMAN. As he follows a handful of promising kids through a system that inhibits, rather than encourages, academic growth, Guggenheim undertakes an exhaustive review of public education, surveying ""drop-out factories"" and ""academic sinkholes,"" methodically dissecting the system and its seemingly intractable problems.","['Charles Adams', 'Jonathan Alter', 'Robert Balfanz', 'Harriet Ball', 'Steve Barr']","['Steve Berman', 'Sebastien Betsch', 'Rochelle T.A. Brown', 'Lisa Callif', 'Samantha Casey']",['Davis Guggenheim'],['United States'],"['English', 'Spanish']","['Electric Kinney Films', 'Participant', 'Walden Media']"
1245526,"Frank (Bruce Willis) is retired, bored, and lonely living off of his government pension in a nondescript suburb in an equally nondescript house. The only joy in Frank's life is his calls to the government pension processing center when he gets to talk to his case worker, Sarah (Mary-Louis Parker). Sarah is as bored and lonely as Frank and marks her conversations with the unknown Frank and her spy novels as the only things fun in her life. When something in Frank's past forces him back into his old line of work and puts an unwitting Sarah in the middle of the intrigue, Frank and Sarah begin a journey into his past and the people with whom he used to work. Like Frank they are all ""R.E.D."" - Retired Extremely Dangerous.","['Bruce Willis', 'Mary-Louise Parker', 'Heidi von Palleske', 'Jefferson Brown', 'Karl Urban']","['Christy Adair', 'Elise Aliberti', 'Diana Ascher', 'John Bardswich', 'Liz Barker']",['Robert Schwentke'],"['United States', 'China']","['English', 'Russian']","['Summit Entertainment', 'Di Bonaventura Pictures', 'DC Entertainment', 'DMG Entertainment']"
1340107,"Anton is a doctor who commutes between his home in an idyllic town in Denmark and his work at an African refugee camp. In these two very different worlds, he and his family face conflicts that lead them to difficult choices between revenge and forgiveness. Anton and his wife Marianne, who have two young sons, are separated and struggling with the possibility of divorce. Their older, 10-year-old Elias, is being bullied at school, until he is defended by Christian, a new boy who has just moved from London with his father, Claus. Christian's mother recently lost her battle with cancer, and Christian is greatly troubled by her death. Elias and Christian quickly form a strong bond, but when Christian involves Elias in a dangerous act of revenge with potentially tragic consequences, their friendship is tested and lives are put in danger. Ultimately, their parents help them come to terms with the complexity of human emotions, pain, and empathy.","['Mikael Persbrandt', 'Wil Johnson', 'Eddy Kimani', 'Emily Mulaya', 'Gabriel Muli']","['Camilla Brem', 'Piodor Gustafsson', 'Louise Palmkvist Hansen', 'Sidsel Hybschmann', 'Wambui Kairo']",['Susanne Bier'],"['Denmark', 'Sweden']","['Danish', 'Swedish', 'English', 'Arabic']","['Danmarks Radio', 'Det Danske Filminstitut', 'Film i Väst', 'FilmFyn', 'MEDIA Programme of the European Union', 'Memfis Film', 'Nordisk Film & TV-Fond', 'Svenska Filminstitutet', 'Sveriges Television', 'Trollhättan Film AB', 'Zentropa Entertainments', 'Zentropa International', 'Zentropa Productions']"
1465487,"You could say Alex Lippi is a ladies' man but it is not true. Of course he has already wooed and charmed armies of women, young and less young, French and foreign. But Alex does it only on active service. Indeed he is appointed to break up undesired couplings. This time he must prevent a rich young lady from marrying an English millionaire. The girl is beautiful and the future husband a perfect match. Will he manage to accomplish this difficult mission?","['Romain Duris', 'Vanessa Paradis', 'Julie Ferrier', 'François Damiens', 'Héléna Noguerra']","['Virginie Berrachi', 'Christophe Danchaud', 'Hicham El Ghorfi', 'Sylvie Forester', 'Sophie Fortat']",['Pascal Chaumeil'],"['France', 'Monaco', 'United States']","['Italian', 'Portuguese', 'French', 'English', 'Spanish', 'Japanese', 'Arabic', 'Mandarin']","['Quad', 'Script Associés', 'Focus Features', 'Chaocorp', 'Cinémage 4', 'A Plus Image', 'Banque Populaire Images 10', 'Orange Cinéma Séries']"
1588337,"In 1996, in Algeria, eight French monks of The Monastery Notre-Dame de l'Atlas of Tibhirine have a simple life serving the poor community that was raised around the monastery. During the Algerian Civil War, they are threatened by terrorists but they decide to stay in the country and not return to France.","['Lambert Wilson', 'Michael Lonsdale', 'Olivier Rabourdin', 'Philippe Laudenbach', 'Jacques Herlin']","['Frédéric Cauvy', 'Agnès Chabot', 'Serge Hayat', 'Henry Quinson', 'Karen Rudolph']",['Xavier Beauvois'],['France'],"['French', 'Arabic']","['Why Not Productions', 'Armada Films', 'France 3 Cinéma', 'France Télévisions', 'Canal+', 'CinéCinéma', ""Centre national du cinéma et de l'image animée (CNC)"", 'Cinémage 4', 'Cofinova 6', 'Soficinéma 6']"
