imdbId,plot,cast,crew,director,countries,languages,production_companies
1375670,"In 1978, five 12-year-olds win a CYO basketball championship. Thirty years later, they gather with their families for their coach's funeral and a weekend at a house on a lake where they used to party. By now, each is a grownup with problems and challenges: Marcus is alone and drinks too much. Rob, with three daughters he rarely sees, is always deeply in love until he turns on his next ex-wife. Eric is overweight and out of work. Kurt is a househusband, henpecked by wife and mother-in-law. Lenny is a successful Hollywood agent married to a fashion designer with three kids and his two sons take their privilege for granted. Can the outdoors help these grownups rediscover connections or is this chaos in the making?","['Adam Sandler', 'Kevin James', 'Chris Rock', 'David Spade', 'Rob Schneider']","['Eric Olin Anderson', 'Bethany Andriuzzo', 'Daniel Baxter', 'Dane Benton', 'Cindy S. Bishop']",['Dennis Dugan'],['United States'],"['English', 'Spanish']","['Columbia Pictures', 'Relativity Media', 'Happy Madison Productions']"
963966,"Balthazar Blake (Nicolas Cage) is a master sorcerer in modern-day Manhattan trying to defend the city from his arch-nemesis, Maxim Horvath (Alfred Molina). Balthazar can't do it alone, so he recruits Dave Stutler (Jay Baruchel), a seemingly average guy who demonstrates hidden potential, as his reluctant protégé. The sorcerer gives his unwilling accomplice a crash course in the art and science of magic, and together, these unlikely partners work to stop the forces of darkness. It'll take all the courage Dave can muster to survive his training, save the city and get the girl as he becomes The Sorcerer's Apprentice.","['Nicolas Cage', 'Jay Baruchel', 'Alfred Molina', 'Teresa Palmer', 'Toby Kebbell']","['Ellen Adolph', 'Tara Ahamed Tucker', 'Monica Barraza', 'Breta Bas', 'Vanessa Bendetti']",['Jon Turteltaub'],['United States'],"['English', 'Cantonese', 'Ukrainian', 'Hindi']","['Walt Disney Pictures', 'Jerry Bruckheimer Films', 'Saturn Films', 'Broken Road Productions', 'Junction Entertainment']"
1013743,"Looking forward to attending her sister April's wedding, the commitment-shy tomboy and classic cars aficionado, June Havens, catches a plane to Boston. Then, out of the blue, she crosses paths with the handsome and charming stranger with the killer sense of humour, Roy Miller, and just like that, June's life will never be the same again. Now, as the dashing man of intrigue plunges June into an excitingly risky world of high-speed car chases, deadly man-to-man fights, and lethal stray bullets, dangerous, no-nonsense adversaries are after the mismatched duo, hell-bent on retrieving a tiny state-of-the-art device that's worth millions. But, who's this Roy Miller guy? Is he truly one of the good guys? Above all, could he be the one?","['Tom Cruise', 'Cameron Diaz', 'Peter Sarsgaard', 'Jordi Mollà', 'Viola Davis']","['Cristina Aciara Troncoso', 'Guy Adan', 'Juan Aledo', 'Sam Alvelo', 'John Arbuckle']",['James Mangold'],['United States'],"['English', 'German', 'Spanish']","['Twentieth Century Fox', 'New Regency Productions', 'Pink Machine', 'Tree Line Film', 'Dune Entertainment', 'New Regency Productions', 'Roth Films', 'Wintergreen Productions']"
1155076,"12-year-old Dre Parker has moved to China, and finds himself like a fish out of water. He befriends a fellow classmate, Mei Ying, only to make a rival, Cheng, who starts to bully and attack Dre. Soon, Mr Han, the maintenance man of Dre's apartment, fends off Cheng and his friends when they are attacking Dre and signs Dre up to fight in the Kung Fu tournament in return for the bullies laying off of Dre. Dre realizes Mr. Han is much more than a maintenance man, when he's revealed as a master of Kung Fu and Dre soon learns that Kung Fu is about self defense and peace, instead of violence and bloodshed.","['Jaden Smith', 'Jackie Chan', 'Taraji P. Henson', 'Wenwen Han', 'Rongguang Yu']","['Lark Bernini', 'Unjoo Lee Byars', 'Alexandre Chen', 'Ewan Chung', 'Kyle Cooper']",['Harald Zwart'],"['United States', 'China']","['English', 'Mandarin']","['Columbia Pictures', 'Overbrook Entertainment', 'Sony Pictures Releasing', 'China Film Group Corporation', 'Emperor Film Production', 'Jerry Weintraub Productions']"
842926,"Nic and Jules are in a long term, committed, loving but by no means perfect same-sex relationship. Nic, a physician, needs to wield what she believes is control, whereas Jules, under that control, is less self-assured. During their relationship, Jules has floundered in her ""nine to five"" life, sometimes trying to start a business - always unsuccessfully - or being the stay-at-home mom. She is currently trying to start a landscape design business. They have two teen-aged children, Joni (conceived by Nic) and Laser (by Jules). Although not exact replicas, each offspring does more closely resemble his/her biological mother in temperament. Joni and Laser are also half-siblings, having the same unknown sperm donor father. Shortly after Joni's eighteenth birthday and shortly before she plans to leave the house and head off to college, Laser, only fifteen and underage to do so, pleads with her to try and contact their sperm donor father. Somewhat reluctantly, she does. He is late thirty-something Paul, a co-op farmer and restaurateur. Despite his seemingly successful businesses, Paul has always shirked responsibility, most specifically in his personal life. After Joni and Laser meet with Paul, Nic and Jules learn what their children have done and, although they don't want Paul infiltrating their lives, want to meet him - especially as Joni and Laser seem to want to maintain some sort of relationship with him. As Paul's relationship with the entire family grows (which includes his hiring Jules to design and construct his backyard), they have an effect on what he wants in life. In turn, he affects their family dynamic as well as each person's relationships outside of it.","['Julianne Moore', 'Annette Bening', 'Mark Ruffalo', 'Mia Wasikowska', 'Josh Hutcherson']","['Caroline Applegarth', 'Mark Asaro', 'William Batsel', 'Tyler Beem', 'Shauna Bogetz']",['Lisa Cholodenko'],"['United States', 'France']",['English'],"['Focus Features', 'Gilbert Films', 'Saint Aire Production', '10th Hole Productions', 'Antidote Films', 'Mandalay Vision', 'UGC PH']"
1273235,"In Serbia, the retired porn star Milos is married with his beloved wife Marija and they have a little son, Peter, that is their pride and joy. The family is facing financial difficulties, but out of the blue, Milos is contacted by the porn actress Lejla who offers him a job opportunity in an art film. Milos is introduced to the director Vukmir who offers a millionaire contract to Milos to act in a film. However, Vukmir neither show the screenplay nor tells the story to Milos. Milos discusses the proposal with Marija and he signs the contract. But soon he finds that Vukmir and his crew are involved in sick snuff films of pedophilia, necrophilia and torture and there is no way back for him and maybe it is too late to protect his family.","[""Srdjan 'Zika' Todorovic"", 'Sergej Trifunovic', 'Jelena Gavrilovic', 'Slobodan Bestic', 'Katarina Zutic']",['Natasa Milojevic'],['Srdjan Spasojevic'],['Serbia'],"['Serbian', 'English', 'Swedish']",['Contra Film']
944835,"Evelyn Salt is a CIA agent and highly respected by all, including her boss, Ted Winter. Out of the blue, a Russian spy walks into their offices and offers a vital piece of information: the President of Russia will be assassinated during his forthcoming visit to New York City to attend the funeral of the recently deceased U.S. Vice President. The name of the assassin: Evelyn Salt. Concerned about the safety of her husband, who she cannot contact, she goes on the run. Winter refuses to accept that she is a mole or a double agent but her actions begin to raise doubts. Just who is Evelyn Salt and what is she planning?","['Angelina Jolie', 'Liev Schreiber', 'Chiwetel Ejiofor', 'Daniel Olbrychski', 'August Diehl']","['Elise Aliberti', 'Tyler Lee Allen', 'Malcolm Alston', 'Stephen Ananicz', 'Stephanie Angel']",['Phillip Noyce'],['United States'],"['English', 'Russian', 'Korean']","['Columbia Pictures', 'Relativity Media', 'Di Bonaventura Pictures', 'Wintergreen Productions']"
1396557,"Jack Rebney is the most famous man you've never heard of - after cursing his way through a Winnebago sales video, Rebney's outrageously funny outtakes became an underground sensation and made him an internet superstar. Filmmaker Ben Steinbauer journeys to the top of a mountain to find the recluse who unwittingly became the ""Winnebago Man.""","['Jack Rebney', 'Ben Steinbauer', 'Keith Gordon', 'Nick Prueher', 'Joe Pickett']","['Sharon Arteaga', 'Josh Baran', 'Sarah Garrahan', 'Elizabeth Hansen', 'Deena Kalai']",['Ben Steinbauer'],['United States'],['English'],"['The Bear', 'Field Guide Media']"
485947,"'Nemo Nobody' is recounting his life story to a reporter. He's less than clear, often times thinking that he is 34 years of age, others, well over 100. But his story becomes more confusing after he does focus on the fact of his current real age.","['Jared Leto', 'Sarah Polley', 'Diane Kruger', 'Linh-Dan Pham', 'Rhys Ifans']","['Housnl Abdelmajid', 'Frédèric Amistadi', 'Lucy Anthony', 'Joel Arsenault', 'Mohamed Assri']",['Jaco Van Dormael'],"['Belgium', 'Germany', 'Canada', 'France', 'United Kingdom', 'Luxembourg', 'United States']","['English', 'Mohawk']","['Pan Européenne', 'Integral Films', 'Lago Film', 'Christal Films', 'Toto & Co Films', 'France 2 Cinéma', 'France 3 Cinéma', 'ARD Degeto Film', 'Belgium Film Fund', 'Canal+', 'Caviar', 'CinéCinéma', 'Climax Films', 'Deutscher Filmförderfonds (DFFF)', 'Fortis Film Fund', 'France 2 (FR2)', 'France 3', 'MEDIA Programme of the European Union', 'Medienboard Berlin-Brandenburg', 'Poisson Rouge Pictures', 'Radio Télévision Luxembourg - Télévision Indépendante (RTL-TVI)', 'Région Wallone', 'Scope Pictures', 'Société de Développement des Entreprises Culturelles (SODEC)', 'Studio Babelsberg', 'Tax Shelter du Gouvernement Fédéral Belge', 'Téléfilm Canada', 'Wild Bunch']"
427152,"Tim (Rudd) is a rising executive who ""succeeds"" in finding the perfect guest, IRS employee Barry (Carell), for his boss's monthly event, a so-called ""dinner for idiots,"" which offers certain advantages to the exec who shows up with the biggest buffoon.","['Steve Carell', 'Paul Rudd', 'Zach Galifianakis', 'Jemaine Clement', 'Stephanie Szostak']","['Amit Awasthi', 'Teri J. Barber', 'Taylor Benavides', 'Randin Brown', 'Kim Buttlar']",['Jay Roach'],['United States'],['English'],"['Paramount Pictures', 'Dreamworks Pictures', 'Spyglass Entertainment', 'Reliance Big Entertainment', 'Parkes/MacDonald Image Nation', 'Everyman Pictures', 'Gaumont']"
1415283,"The 1940s. With her husband away fighting Adolf Hitler's Nazis, overworked Isabel Green finds herself caught between a hectic life of tending to the family farm and raising three mutinous children. In desperate need of a helping hand and at the end of her tether, Isabel can't believe her eyes when Nanny McPhee, the extraordinary government nanny, shows up at her front door after the events of Nanny McPhee (2005). As Isabel's scheming brother-in-law, Phil, tries to talk her into selling her half of the farm, the poor mother is going to need all the help she can get. Will a sprinkle of good old magic do the trick once more?","['Maggie Gyllenhaal', 'Oscar Steer', 'Asa Butterfield', 'Lil Woods', 'Eros Vlahos']","['Mandy Aldridge', 'Christina Angeloudes', 'Celia Bannerman', 'Lauren Barrand', 'Thom Berryman']",['Susanna White'],"['United Kingdom', 'France', 'United States']",['English'],"['Universal Pictures', 'StudioCanal', 'Relativity Media', 'Working Title Films', 'Three Strange Angels']"
78915,"The Bugs Bunny/Road Runner Movie is basically a collection of Warner Bros. short cartoon features, ""starring"" the likes of Daffy Duck, Porky Pig and Wile.E.Coyote. These animations are interspersed by Bugs Bunny reminiscing on past events and providing links between the individual animations which are otherwise unconnected. The Road Runner feature at the end consists of sketches from various RR separates (well it does in the 78-minute version anyway).","['Mel Blanc', 'Arthur Q. Bryan', 'Paul Julian', 'Nicolai Shutorev', 'Joan Gerber']","['Marian Dern', 'Lloyd Vaughan']",['Chuck Jones'],['United States'],['English'],"['Chuck Jones Enterprises', 'Warner Bros.']"
1386932,"Ip Man 2 is a 2010 Hong Kong biographical martial arts film loosely based on the life of Ip Man, a grandmaster of the martial art Wing Chun. A sequel to the 2008 film Ip Man, the film was directed by Wilson Yip, and stars Donnie Yen, who reprises the leading role. Continuing after the events of the earlier film, the sequel centers on Ip's movements in Hong Kong, which is under British colonial rule. He attempts to propagate his discipline of Wing Chun, but faces rivalry from other practitioners, including the local master of Hung Ga martial arts.","['Donnie Yen', 'Xiaoming Huang', 'Sammo Kam-Bo Hung', 'Lynn Xiong', 'Kent Cheng']","['Bruce Blain', 'Erich Fleshman', 'Chun Ip', 'Chris Wegoda', 'Henri Wong']",['Wilson Yip'],"['Hong Kong', 'China']","['Cantonese', 'Chinese', 'English']","['Golden Harvest Company', 'Henan Film & TV Production Group Henan Film Studio', 'Mandarin Films Distribution', 'Beijing ShengShi HuaRei Film Investment & Management Co.', 'Foshan Pearl River Media Group', 'Desen International Media', 'Donlord Skykee Film Investment', 'Teng Yuan Film & TV Media', 'Beijing Baron Stars Culture Media', 'Shenzhen Haiguchi Investment', 'Beijing Xinyinglian Cinema Circuit', 'Prosperity Pictures']"
493949,"Ramona Quimby, is a grade-school student with a big imagination. So big, in fact, that she often clashes with her no-nonsense teacher Mrs. Meacham. When Ramona's upbeat dad Robert loses his job, the family - including her teenage sister, Beezus, and their practical-minded mother - must make major adjustments, like dad learning how to run the house. Ramona dreams up various plans to make money so that she can save their house, but because everybody in the family seems too preoccupied to help her with her own worries, she turns to the one person who always has time for her, Aunt Bea. But even Aunt Bea is distracted these days because of her ex-boyfriend - and Quimby family next-door neighbour - Hobart","['Joey King', 'Selena Gomez', 'John Corbett', 'Bridget Moynahan', 'Ginnifer Goodwin']","['Steve Alterman', 'Brent Badger', 'Maggie Baird', 'Carmen Bennett', 'Stephanie Brown']",['Elizabeth Allen Rosenbaum'],['United States'],['English'],"['Fox 2000 Pictures', 'Walden Media', 'DiNovi Pictures', 'Dune Entertainment III']"
1438254,"Fatherless golden high school boy Charlie St. Cloud had a golden future, handsome, popular and admitted to Stanford on a scholarship, even recruited for a prestigious yacht sailing team. But shortly after graduating, Charlie feels existentially guilty about the death of his doting, beloved kid brother Sam whom he was driving to a playmate when a crashing car killed the junior. Charlie pledges to continue the baseball practice he promised to continue until entering Stanford, which he now ditches fro a menial job as graveyard keeper, while their mother shamelessly moved out of state, and tends to the grave of his Vietnam-killed former school buddy Sully, the second ghost who binds his sole to their beach home town. He's finally tempted to start living his own life again when he meets a female sailor his age about to embark on a transatlantic voyage and spends a ho night, but still can't 'leave Sam'. Only when he hears the authorities give up searching for her, having gone missing at sea during a storm, he misses a 'practice' at the beach when the morning canon is fired to sail hoping to save her life.","['Zac Efron', 'Charlie Tahan', 'Amanda Crew', 'Augustus Prew', 'Donal Logue']","['Carolyn Adair', 'Tom Bahr', 'John Balfour', 'Nancy Banks', 'Patrice BelleRose']",['Burr Steers'],"['Canada', 'United States']",['English'],"['Universal Pictures', 'Relativity Media', 'Marc Platt Productions', 'Rampage VFX']"
1205535,"Sandy, upon discovering her husband's infidelity while watching her son's birthday video, leaves the suburbs and moves into the city. She gets an apartment that's above a coffee house where she befriends one of the workers, Aram, a guy whose wife only married him so she could get a green card. Aram's family thinks he's wasting his life and education by working in the coffee house. Soon after moving into the apartment, Sandy hires Aram to be her nanny while she takes on work for the first time since her children were born. It isn't long when Aram and Sandy find they get along wonderfully and start to date. But the question is: is their relationship real or is it, in fact, just a rebound for both of them?","['Catherine Zeta-Jones', 'Justin Bartha', 'Andrew Cherry', 'Kelly Gould', 'Lynn Whitfield']","['Jodi Arneson', 'Robin Borden', 'Natalie Borlaug', 'Anna Bosco', 'Philip Brown']",['Bart Freundlich'],['United States'],['English'],"['The Film Department', 'A&F Productions', 'Dillywood', 'Karma Film Prod', 'Neon Productions', 'Process Media']"
1386588,"Terry Hoitz's past mistakes in the line of duty and Allen Gamble's reluctance to take risks have landed them the roles of the ""Other Guys"", disgraced New York City police detectives relegated to filling out paperwork for cocky hero cops Danson and Highsmith. The mismatched duo must look past their differences when they take on a high-profile investigation of shady capitalist David Ershon and attempt to fill the shoes of the notoriously reckless officers they idolize.","['Will Ferrell', 'Derek Jeter', 'Mark Wahlberg', 'Eva Mendes', 'Michael Keaton']","['Christina Acevedo', 'Ramona Adair', 'Natalie Alexander', 'Rhana Alhaid', 'Chris P. Anderson']",['Adam McKay'],['United States'],"['English', 'Ukrainian']","['Columbia Pictures', 'Gary Sanchez Productions', 'Mosaic', 'Wintergreen Productions']"
437405,"A coming-of-middle-age comedy that chronicles the unlikely friendship between failed author Richard Dunne and a Long Island teen who teaches him a thing or two about growing up, all under the disapproving eye of his long-suffering wife and his imaginary Superhero friend.","['Lisa Kudrow', 'Jeff Daniels', 'Ryan Reynolds', 'Emma Stone', 'Kieran Culkin']","['Kirk Baily', 'Matt Beharry', 'Beverly Billin', 'Megin T. Boyles', 'Grace Brailsford Cato']",['Kieran Mulroney'],['United States'],['English'],"['Artfire Films', 'Entertainment 360', 'FilmColony', 'Fireman Capital Partners', 'Paper Man Productions']"
1320253,"Barney Ross leads the ""Expendables"", a band of highly skilled mercenaries including knife enthusiast Lee Christmas, martial arts expert Yin Yang, heavy weapons specialist Hale Caesar, demolitionist Toll Road and loose-cannon sniper Gunner Jensen. When the group is commissioned by the mysterious Mr. Church to assassinate the merciless dictator of a small South American island, Barney and Lee head to the remote locale to scout out their opposition. Once there, they meet with local rebel Sandra and discover the true nature of the conflict engulfing the city. When they escape the island and Sandra stays behind, Ross must choose to either walk away and save his own life - or attempt a suicidal rescue mission that might just save his soul.","['Sylvester Stallone', 'Jason Statham', 'Jet Li', 'Dolph Lundgren', 'Eric Roberts']","['Christopher Abbey', 'Wendy Altman-Cohen', 'Chris Angerdina', 'Owen Argoe', 'Lauren Askew']",['Sylvester Stallone'],"['United States', 'Bulgaria', 'Spain', 'Germany']","['English', 'Spanish']","['Millennium Films', 'Millennium Films', 'Nu Image Entertainment GmbH', 'Nimar Studios', 'Rogue Marble', 'Splendid Film', 'Wide Pictures']"
446029,"Scott Pilgrim plays in a band which aspires to success. He dates Knives Chau, a high-school girl five years younger, and he hasn't recovered from being dumped by his former girlfriend, now a success with her own band. When Scott falls for Ramona Flowers, he has trouble breaking up with Knives and tries to romance Ramona. As if juggling two women wasn't enough, Ramona comes with baggage: seven ex-lovers, with each of whom Scott must do battle to the death in order to win Ramona.","['Michael Cera', 'Kieran Culkin', 'Anna Kendrick', 'Alison Pill', 'Aubrey Plaza']","['Karen Beever', 'Hannah Bergstrom', 'Sebastien Betsch', 'Litza Bixler', 'Woody Brown']",['Edgar Wright'],"['United States', 'United Kingdom', 'Canada', 'Japan']",['English'],"['Universal Pictures', 'Marc Platt Productions', 'Big Talk Productions', 'Closed on Mondays Entertainment', 'Dentsu', 'Relativity Media', 'Scott Pilgrim Productions']"
1313092,"Despite being no saint herself, Julia Cody has shielded her seventeen year old son, Joshua ""J"" Cody, from her Melbourne-based criminal relatives who they have not seen in years. After Julia dies in front of J's eyes from a self-inflicted heroin overdose, J, who is slightly detached from life, feels he has no choice but to contact his maternal grandmother, Janine ""Smurf"" Cody, the family matriarch, for a place to live. Smurf rules the family with a borderline incestuous love over her three sons, the quietly menacing Andrew ""Pope"" Cody, the hyperactive Craig Cody, and the barely of age Darren Cody. Pope and his best friend, Barry ""Baz"" Brown, are armed robbers, with Darren their up and coming apprentice, while Craig is a mid level drug dealer. Melbourne's Armed Robbery Squad is after specifically Pope, who is hiding out. But when the standoff between the Codys and the Armed Robbery Squad is brought up a notch, an all out war ensues, with some casualties and J caught in the middle. The only grounding in J's life is his girlfriend, Nicky Henry. With those casualties comes an investigation by Homicide Detective Senior Sergeant Nathan Leckie, who knows the Codys are involved in some of those deaths. As Leckie tries to get J on his side, J has to figure out how best to get himself out from the middle, where he trusts neither side. J also wants to figure out how to exact what he considers justice in an all around bad situation.","['James Frecheville', 'Bryce Lindemann', 'Paul Smits', 'Jacki Weaver', 'Joel Edgerton']","['Lance Anderson', 'Tony Arapoglou', 'Jeremy Atcliffe', 'Mark Barlow', 'Chris Besseling']",['David Michôd'],['Australia'],['English'],"['Porchlight Films', 'Screen Australia', 'Film Victoria', 'Screen NSW', 'Fulcrum Media Finance', 'Showtime Australia']"
1020558,"Britain, A.D. 117. Quintus Dias, the sole survivor of a Pictish raid on a Roman frontier fort, marches north with General Virilus' legendary Ninth Legion, under orders to wipe the Picts from the face of the Earth and destroy their leader, Gorlacon.","['Michael Fassbender', 'Andreas Wisniewski', 'Dave Legeno', 'Axelle Carolyn', 'Dominic West']","['Jean Marc Alibert', 'Jon Baker', 'Chris Barnett', 'Craig Barwick', 'Danielle Bennett']",['Neil Marshall'],"['United Kingdom', 'France', 'United States']","['English', 'Scottish Gaelic']","['Pathé Pictures International', 'UK Film Council', 'Warner Bros.', 'Canal+', 'CinéCinéma', 'Celador Films']"
1424797,"Teenager Hubert haughtily regards his mother with contempt, and only sees her tacky sweaters and kitsch decorations. In addition to these irritating surface details, there is also his parent's cherished mechanisms of manipulation and guilt. Confused by this love/hate relationship that obsesses him more and more each day, Hubert drifts through the mysteries of adolescence - artistic discoveries, illicit experiences, the opening-up to friendship, and ostracism. The turbulent relationship between mother and son unfolds with a compelling combination of savage fury and melting affection. The stunning, semi-autobiographical directing debut of 20-year-old actor Xavier Dolan.","['Anne Dorval', 'Xavier Dolan', 'François Arnaud', 'Suzanne Clément', 'Patricia Tulasne']","['Gina Alexandra Arganese', 'Diane Boisvert', 'Francis Choquette', 'Curtis Michael Davey', 'Jocelyn Desrochers']",['Xavier Dolan'],['Canada'],"['French', 'English', 'Latin']",['Mifilifilms']
1020938,"['A look at one year in the life of four babies from around the world, from Mongolia to Namibia to San Francisco to Tokyo.']","['Tarererua', 'Hindere', 'Seiko', 'Fumito', 'Susie']",['Guillaume Lips'],['Thomas Balmès'],['France'],"['English', 'Japanese', 'Mongolian']","['Canal+', 'Chez Wam', 'StudioCanal']"
997152,"For a handsome $1,000-a-day reward, unemployed pacifist Travis decides to take part in a controversial two-week behavioral experiment that will attempt to simulate life within the prison walls. Inside a controlled environment, two hand-picked groups of 20 inmates and six guards must follow a simple set of basic rules while high-tech cameras monitor the entire makeshift jail. However, devoid of their civil rights and their identities, the volunteers soon find themselves dragged into a dangerous and volatile situation as the sadistic warders begin to take extreme pleasure in enforcing their authority. Under those circumstances, Travis, or the rebellious Prisoner #77, needs to explore his limits. How long can he last?","['Adrien Brody', 'Forest Whitaker', 'Cam Gigandet', 'Clifton Collins Jr.', 'Ethan Cohn']","['Cindy Anderson', 'Elizabeth Ballstadt', 'Jo Barnett', 'Alexandra Beem', 'Mark Behar']",['Paul T. Scheuring'],['United States'],['English'],"['Alliance Cinema', 'Magnet Media Productions', 'Adelstein-Parouse Productions', 'Mercator Pictures', 'Natural Selection', 'Westeast Films']"
