imdbId,plot,cast,crew,director,countries,languages,production_companies
114709,"A little boy named Andy loves to be in his room, playing with his toys, especially his doll named ""Woody"". But, what do the toys do when Andy is not with them, they come to life. Woody believes that his life (as a toy) is good. However, he must worry about Andy's family moving, and what Woody does not know is about Andy's birthday party. Woody does not realize that Andy's mother gave him an action figure known as Buzz Lightyear, who does not believe that he is a toy, and quickly becomes Andy's new favorite toy. Woody, who is now consumed with jealousy, tries to get rid of Buzz. Then, both Woody and Buzz are now lost. They must find a way to get back to Andy before he moves without them, but they will have to pass through a ruthless toy killer, Sid Phillips.","['Tom Hanks', 'Tim Allen', 'Don Rickles', 'Jim Varney', 'Wallace Shawn']","['April', 'Ronen Barzel', 'Susan Bradley', 'Andrew Caldwell', 'Martin Caplan']",['John Lasseter'],"['United States', 'Japan']",['English'],"['Walt Disney Pictures', 'Pixar Animation Studios']"
113497,"Jumanji, one of the most unique--and dangerous--board games ever, falls into the hands of the curious teen, Alan Parrish, in 1969. Mysterious and magical, the game strands the unsuspecting boy in the lush, savage forests of a mythical realm. Nearly three decades later, the game releases him before the awed eyes of the young orphaned siblings, Judy and Peter Shepherd. Now, the wild and incessant beat of the jungle's tribal drums is calling for the now-adult Alan and the other hesitant players, as the one who rolls the dice must never leave undone what the roll has started. Has anyone ever escaped from the game and Jumanji's formidable foes?","['Robin Williams', 'Jonathan Hyde', 'Kirsten Dunst', 'Bradley Pierce', 'Bonnie Hunt']","['Mary Arnold', 'Carra Braveman', 'Adam Bryant', 'Ken Cosci', ""William d'Anthony""]",['Joe Johnston'],['United States'],"['English', 'French']","['TriStar Pictures', 'Interscope Communications', 'Teitler Film']"
113228,"Things don't seem to change much in Wabasha County: Max and John are still fighting after 35 years, Grandpa still drinks, smokes, and chases women , and nobody's been able to catch the fabled ""Catfish Hunter"", a gigantic catfish that actually smiles at fishermen who try to snare it. Six months ago John married the new girl in town (Ariel), and people begin to suspect that Max might be missing something similar in his life. The only joy Max claims is left in his life is fishing, but that might change with the new owner of the bait shop.","['Walter Matthau', 'Jack Lemmon', 'Sophia Loren', 'Ann-Margret', 'Burgess Meredith']","['David Bifano', 'Brooke Brooks', 'Jill Carvalho', 'Steven B. Cohen', 'Ayesha Fowler']",['Howard Deutch'],['United States'],"['English', 'Italian', 'German']","['Lancaster Gate', 'Warner Bros.']"
114885,"This story based on the best selling novel by Terry McMillan follows the lives of four African-American women as they try to deal with their very lives. Friendship becomes the strongest bond between these women as men, careers, and families take them in different directions. Often light-hearted this movie speaks about some of the problems and struggles the modern women face in today's world.","['Whitney Houston', 'Angela Bassett', 'Loretta Devine', 'Lela Rochon', 'Gregory Hines']","['R. Elizabeth Aaron', 'Laurie Badami', 'Ryan Stefan Bantu', 'Bill Bennett', 'Gray Beverley']",['Forest Whitaker'],['United States'],['English'],['Twentieth Century Fox']
113041,"In this sequel to ""Father of the Bride"", George Banks must accept the reality of what his daughter's ascension from daughter to wife, and now to mother means when placed into perspective against his own stage of life. As the comfortable family unit starts to unravel in his mind, a rapid progression into mid-life crisis is in his future. His journey to regain his youth acts as a catalyst for a kind of ""rebirth"" of his attitude on life when he and his wife, Nina, find how their lives are about to change as well.","['Steve Martin', 'Diane Keaton', 'Martin Short', 'Kimberly Williams-Paisley', 'George Newbern']","['Dave Ange', 'Roshanna Baron', 'Ronald Castro', 'Almarie Clifford', 'Patricia Clinton']",['Charles Shyer'],['United States'],['English'],"['Touchstone Pictures', 'Sandollar Productions', 'Taylor-Made Productions', 'The Meyers/Shyer Company']"
113277,"Hunters and their prey--Neil and his professional criminal crew hunt to score big money targets (banks, vaults, armored cars) and are, in turn, hunted by Lt. Vincent Hanna and his team of cops in the Robbery/Homicide police division. A botched job puts Hanna onto their trail while they regroup and try to put together one last big 'retirement' score. Neil and Vincent are similar in many ways, including their troubled personal lives. At a crucial moment in his life, Neil disobeys the dictum taught to him long ago by his criminal mentor--'Never have anything in your life that you can't walk out on in thirty seconds flat, if you spot the heat coming around the corner'--as he falls in love. Thus the stage is set for the suspenseful ending....","['Al Pacino', 'Robert De Niro', 'Val Kilmer', 'Jon Voight', 'Tom Sizemore']","['Chuck Adamson', 'Edward Allen', 'Wendy Altman-Cohen', 'Judi Beecher', 'Jeff Berger']",['Michael Mann'],['United States'],"['English', 'Spanish']","['Warner Bros.', 'New Regency Productions', 'Forward Pass', 'Art Linson Productions', 'Monarchy Enterprises B.V.']"
114319,"While she was growing up, Sabrina Fairchild spent more time perched in a tree watching the Larrabee family than she ever did on solid ground. As the chauffeur's daughter on their lavish Long Island estate, Sabrina was invisible behind the branches, but she knew them all below - There is Maude Larrabee, the modern matriarch of the Larrabee Corporation; Linus Larrabee, the serious older son who expanded a successful family business into the world's largest communications company; and David, the handsome, fun-loving Larrabee, who was the center of Sabrina's world until she was shipped off to Paris. After two years on the staff of Vogue magazine, Sabrina has returned to the Larrabee estate but now she has blossomed into a beautiful and sophisticated woman. And she's standing in the way of a billion dollar deal.","['Harrison Ford', 'Julia Ormond', 'Greg Kinnear', 'Nancy Marchand', 'John Wood']","['Noah Ackerman', 'Ray Angelic', 'Christine Bodelot', 'Heather Brown', 'Marcus Canty']",['Sydney Pollack'],"['Germany', 'United States']","['English', 'French']","['Constellation Entertainment', 'Mirage Enterprises', 'Mont Blanc Entertainment GmbH', 'Paramount Pictures', 'Sandollar Productions', 'Scott Rudin Productions', 'Worldwide']"
112302,"Tom Sawyer is a mischievous young boy, growing up in a small US town in the mid-1800s. He finds a friend in Huckleberry Finn, a vagrant and outcast, and the two get up to all sorts of boyish adventures. While on one of these adventures they witness a murder, leaving Tom with a dilemma.","['Jonathan Taylor Thomas', 'Brad Renfro', 'Eric Schweig', 'Charles Rocket', 'Amy Wright']","['Brian Albushies', 'Petra Alexandria', 'Christine Altomari', 'Susan Bradley', 'Hailey Bailey Brown']",['Peter Hewitt'],['United States'],['English'],"['Walt Disney Pictures', 'Painted Fence Productions']"
114576,"Darren McCord takes his two kids to a Pittsburgh Penguins National Hockey League play-off game, unknowing that the sports arena has been taken over by terrorists, who are holding the Vice President of the United States, as well as many other high-ranking officials hostage. Darren later becomes the only one who is aware of the situation. And, the stakes are raised when the terrorists announce that they will blow-up the building at the end of the game. Therefore, Darren must not only subdue the terrorists, but postpone the game and send it to overtime.","['Jean-Claude Van Damme', 'Powers Boothe', 'Raymond J. Barry', 'Whittni Wright', 'Ross Malinger']","['Marty Ball', 'Patrick J. Beggy', 'Kristin Bernstein', 'Robert Betz', 'Bob Black']",['Peter Hyams'],['United States'],['English'],"['Universal Pictures', 'Signature Entertainment', 'Imperial Entertainment', 'Shattered Productions']"
113189,"When a deadly satellite weapon system falls into the wrong hands, only Agent James Bond 007 can save the world from certain disaster. Armed with his license to kill, Bond races to Russia in search of the stolen access codes for ""GoldenEye"", an awesome space weapon that can fire a devastating electromagnetic pulse toward Earth. But 007 is up against an enemy who anticipates his every move: a mastermind motivated by years of simmering hatred. Bond also squares off against Xenia Onatopp, an assassin who uses pleasure as her ultimate weapon.","['Pierce Brosnan', 'Sean Bean', 'Izabella Scorupco', 'Famke Janssen', 'Joe Don Baker']","['Gordon Arnell', 'Jacqueline Benloulou', 'Charles Bodycomb', 'Albert R. Broccoli', 'Christopher Brosnan']",['Martin Campbell'],"['United Kingdom', 'United States']","['English', 'Russian', 'Spanish']","['Eon Productions', 'United Artists']"
112346,"Andrew Shepherd is approaching the end of his first term as President of the United States. He's a widower with a young daughter and has proved to be popular with the public. His election seems assured. That is until he meets Sydney Ellen Wade, a paid political activist working for an environmental lobby group. He's immediately smitten with her and after several amusing attempts, they finally manage to go on a date (which happens to be a State dinner for the visiting President of France). His relationship with Wade opens the door for his prime political opponent, Senator Bob Rumson, to launch an attack on the President's character, something he could not do in the previous election as Shepherd's wife had only recently died.","['Michael Douglas', 'Annette Bening', 'Martin Sheen', 'Michael J. Fox', 'Anna Deavere Smith']","['Geoff Abadee', 'Emidio Antonio', 'Lori Arnold', 'Tim Atzinger', 'Catherine Balsam-Schwaber']",['Rob Reiner'],['United States'],"['English', 'French', 'Spanish']","['Universal Pictures', 'Castle Rock Entertainment', 'Wildwood Enterprises']"
112896,"Another spoof from the mind of Mel Brooks. This time he's out to poke fun at the Dracula myth. Basically, he took ""Bram Stoker's Dracula,"" gave it a new cast and a new script and made a big joke out of it. The usual, rich English are attacked by Dracula and Dr. Van Helsing is brought in to save the day.","['Leslie Nielsen', 'Peter MacNicol', 'Steven Weber', 'Amy Yasbeck', 'Lysette Anthony']","['Mike Anzalone', 'Janet Campolito', 'Michael Cavette', 'Dianne Chadwick', 'Ron Chesney']",['Mel Brooks'],"['France', 'United States']","['English', 'German']","['Gaumont', 'Castle Rock Entertainment', 'Brooksfilms']"
112453,"A half-wolf, half-husky named Balto gets a chance to become a hero when an outbreak of diphtheria threatens the children of Nome, Alaska in the winter of 1925. He leads a dog team on a 600-mile trip across the Alaskan wilderness to get medical supplies. The film is based on a true story which inspired the Iditarod dog sled race.","['Kevin Bacon', 'Bob Hoskins', 'Bridget Fonda', 'Jim Cummings', 'Phil Collins']","['James Bradney', 'Doug Cooper', ""John 'JR' Craigmile"", 'Lem Davis', 'Lou Dellarosa']",['Simon Wells'],"['United States', 'United Kingdom']",['English'],"['Amblimation', 'Amblin Entertainment', 'The Kennedy/Marshall Company', 'Universal Pictures']"
113987,"Writer, Producer, and Director Oliver Stone's exploration of former President Richard Nixon's strict Quaker upbringing, his nascent political strivings in law school, and his strangely self-effacing courtship of his wife, Pat (Joan Allen). The contradictions in his character are revealed early, in the vicious campaign against Helen Gahagan Douglas and the oddly masochistic Checkers speech. His defeat at the hands of the hated and envied John F. Kennedy in the 1960 presidential election, followed by the loss of the 1962 California gubernatorial race, seem to signal the end of his career. Yet, although wholly lacking in charisma, Nixon remains a brilliant political operator, seizing the opportunity provided by the backlash against the antiwar movement to take the Presidency in 1968. It is only when safely in office, running far ahead in the polls for the 1972 Presidential election, that his growing paranoia comes to full flower, triggering the Watergate scandal.","['Anthony Hopkins', 'Joan Allen', 'Powers Boothe', 'Ed Harris', 'Bob Hoskins']","['Jennifer Asaro', 'Jackie Bazan', 'Sashy Bogdanovich', 'Robin Burrell', 'Alexander Butterfield']",['Oliver Stone'],['United States'],"['English', 'Mandarin', 'Russian']","['Hollywood Pictures', 'Illusion Entertainment', 'Cinergi Pictures Entertainment']"
112760,"Morgan Adams and her slave, William Shaw, are on a quest to recover the three portions of a treasure map. Unfortunately, the final portion is held by her murderous uncle, Dawg. Her crew is skeptical of her leadership abilities, so she must complete her quest before they mutiny against her. This is made yet more difficult by the efforts of the British crown to end her piratical raids.","['Geena Davis', 'Matthew Modine', 'Frank Langella', 'Maury Chaykin', 'Patrick Malahide']","['Simon Atherton', 'Winston Azzopardi', 'Tim Bailes', 'Jon Baker', 'Michael Barnes']",['Renny Harlin'],"['United States', 'Italy', 'Germany', 'France']","['English', 'Spanish', 'Latin', 'French']","['Beckner/Gorman Productions', 'Canal+', 'Carolco Pictures', 'Cutthroat Productions', 'Forge', 'Guild', 'Laurence Mark Productions', 'Metro-Goldwyn-Mayer', 'RCS Video', 'Tele-Communications Inc.']"
112641,"This Martin Scorsese film depicts the Janus-like quality of Las Vegas--it has a glittering, glamorous face, as well as a brutal, cruel one. Ace Rothstein and Nicky Santoro, mobsters who move to Las Vegas to make their mark, live and work in this paradoxical world. Seen through their eyes, each as a foil to the other, the details of mob involvement in the casinos of the 1970s and '80s are revealed. Ace is the smooth operator of the Tangiers casino, while Nicky is his boyhood friend and tough strongman, robbing and shaking down the locals. However, they each have a tragic flaw--Ace falls in love with a hustler, Ginger, and Nicky falls into an ever-deepening spiral of drugs and violence.","['Robert De Niro', 'Sharon Stone', 'Joe Pesci', 'James Woods', 'Don Rickles']","['Donna Armstrong', 'Elaine Bass', 'Saul Bass', 'Margaret Bodde', 'Howard Carey']",['Martin Scorsese'],"['United States', 'France']",['English'],"['Universal Pictures', 'Syalis DA', 'Légende Entreprises', 'De Fina-Cappa', 'GGG']"
114388,"When Mr. Dashwood (Tom Wilkinson) dies, he must leave the bulk of his estate to the son by his first marriage, which leaves his second wife and their three daughters Elinor (Dame Emma Thompson), Marianne (Kate Winslet), and Margaret (Emilie François), in straitened circumstances. They are taken in by a kindly cousin, but their lack of fortune affects the marriageability of practical Elinor and romantic Marianne. When Elinor forms an attachment for the wealthy Edward Ferrars (Hugh Grant), his family disapproves and separates them. And though Mrs. Jennings (Elizabeth Spriggs) tries to match the worthy (and rich) Colonel Brandon (Alan Rickman) to her, Marianne finds the dashing and fiery John Willoughby (Greg Wise) more to her taste. Both relationships are sorely tried.","['James Fleet', 'Tom Wilkinson', 'Harriet Walter', 'Kate Winslet', 'Emma Thompson']","['Colin Anderson', 'Mona Benjamin', 'Debbie Brodie', 'Cecile Cabal', 'Paul Caldicott']",['Ang Lee'],"['United States', 'United Kingdom']","['English', 'French']","['Columbia Pictures', 'Mirage Enterprises']"
113101,"This movie features the collaborative directorial efforts of four new filmmakers, each of whom directs a segment of this comedy. It's New Year's Eve at the Mon Signor Hotel, a former grand old Hollywood hotel, now fallen upon hard times. Often using physical comedy and sight gags, this movie chronicles the slapstick misadventures of Ted, the Bellhop. He's on his first night on the job, when he's asked to help out a coven of witches in the Honeymoon Suite. Things only get worse when he delivers ice to the wrong room and ends up in a domestic argument at a really bad time. Next, he foolishly agrees to watch a gangster's kids for him while he's away. Finally, he finishes off the night refereeing a ghastly wager.","['Sammi Davis', 'Amanda De Cadenet', 'Valeria Golino', 'Madonna', 'Ione Skye']","['Canard Emile Barnes', 'Sissy Boyd', 'Eric Brooks', 'Patrice Carbaugh', 'Cathy Cavadini']",['Allison Anders'],['United States'],['English'],"['Miramax', 'A Band Apart']"
112281,"Ace Ventura, emerging from self-imposed exile in a remote Himalayan hideaway, travels to Africa with explorer Fulton Greenwall to find a sacred bat which is told will avert a war between with Wachootoo and Wachati tribes. Of course, when Ace gets involved, all hell breaks loose...","['Jim Carrey', 'Ian McNeice', 'Simon Callow', 'Maynard Eziashi', 'Bob Gunton']","['Michelle Almaz Tadege', 'Bhagavan Antle', 'Colleen Arnaud', 'Holly Atchison', 'Donna Barrish']",['Steve Oedekerk'],['United States'],['English'],"['Morgan Creek Entertainment', 'Morgan Creek Productions', 'O Entertainment']"
113845,"Two foster brothers work as transit cops. While one's life is as good as it gets, the other's is a pit. After losing his job, getting dumped by his brother, and getting the crap kicked out of him by a loan shark for the umpteenth time, He implements his plan to steal the ""money train,"" a train carrying the New York Subway's weekly revenue. But when things go awry, will his brother be able to save him in time?","['Wesley Snipes', 'Woody Harrelson', 'Jennifer Lopez', 'Robert Blake', 'Chris Cooper']","['Wenden K. Baldwin', 'Steve Booth', 'Al Cerullo', 'John DeSimone', 'Anne C. Ford']",['Joseph Ruben'],['United States'],['English'],"['Columbia Pictures', 'Peters Entertainment']"
113161,"Some guys get all the luck, whether they like it or not. Chili Palmer happens to be in Hollywood collecting a gambling debt when he's struck by lightning (not literally). Called a natural for the movie business, he's snagged up by a producer. The rest is history.","['John Travolta', 'Gene Hackman', 'Rene Russo', 'Danny DeVito', 'Dennis Farina']","['Todd J. Adelman', 'Wendy Altman-Cohen', 'Trisha Barnhart', 'Jeffrey Berk', 'David M. Bernstein']",['Barry Sonnenfeld'],['United States'],['English'],"['Metro-Goldwyn-Mayer (MGM)', 'Jersey Films']"
112722,"In San Francisco, the criminal psychologist Helen Hudson is specialized in serial-killers. During a trial, the accused Daryll Lee Cullum kills a police officer and tries to kill her and she becomes agoraphobic. Now Helen lives a reclusive life with her gay friend Andy that helps her. Sometime later, there is a wave of crimes and Detectives M.J. Monahan and Reuben Goetz are investigating the murder cases. Helen identifies that the murderer is copycatting notorious serial-killers and she anonymously contacts the Police Department. After fourteen phone calls, she is identified by the police. Detectives M.J. and Reuben visit her and Helen teams up with them and prepares the profile of the killer that wants to be famous. But soon the copycat killer Peter Foley contacts and stalks Helen and M.J. and Reuben give protection to her. Will they be capable to stop Foley before the next murder?","['Sigourney Weaver', 'Holly Hunter', 'Dermot Mulroney', 'William McNamara', 'Harry Connick Jr.']","['Steve Battaglia', 'Shauna Beal', 'Tina Bennett', 'Amanda Brand', 'Michele Bravo']",['Jon Amiel'],['United States'],['English'],['New Regency Productions']
112401,"Robert Rath is a seasoned hitman who just wants out of the business with no back talk. But, as things go, it ain't so easy. A younger, peppier assassin named Bain is having a field day trying to kill said older assassin. Rath teams up with a computer hacker named Electra to defeat the obsessed Bain.","['Sylvester Stallone', 'Antonio Banderas', 'Julianne Moore', 'Anatoli Davydov', 'Muse Watson']","['Michael D. Baker', 'Raymond W. Beal', 'Denise Blasor', 'Frank Buono', 'Mark Carter']",['Richard Donner'],"['France', 'United States']","['English', 'Dutch', 'Spanish']","['Warner Bros.', 'Silver Pictures', 'Donner/Shuler-Donner Productions', 'Canal+', 'Dino De Laurentiis Company', 'Evansgideon/Lazar']"
114168,"When sheriff Barnum investigates the death of an elderly rural resident, he discovers a teenage grandson living in the basement. Raised by his grandparents, he has experienced the world only through books, never leaving the family farm. He is sent to a state home for boys where he has trouble fitting in socially. His odd appearance and unusual abilities cause the small town residents to fear and ridicule him. However, not all are afraid. Some begin to view his potential and gifts with wonderment.","['Mary Steenburgen', 'Sean Patrick Flanery', 'Lance Henriksen', 'Jeff Goldblum', 'Brandon Smith']","['Peter Austin', 'Kirk Baily', 'Joanne Bloomfield', 'Linda Brattain', 'Anne Carr']",['Victor Salva'],['United States'],['English'],"['Caravan Pictures', 'Daniel Grodnik Productions', 'Hollywood Pictures', 'Itasca Pictures']"
113627,"Because his wife left him and took his son with her, screenwriter Ben Sanderson has started drinking, a lot. He's getting more and more isolated and he troubles women in bars because he wants to have sex with them. When he gets fired, he decides to leave everything behind and move to Las Vegas and drink himself to death. In Las Vegas he meets Sera, a prostitute with some problems as well who he moves in with.","['Nicolas Cage', 'Elisabeth Shue', 'Julian Sands', 'Richard Lewis', 'Steven Weber']","['Kevin Beard', 'Valerie Burnley', 'James Capps', 'Richard Davenport', 'Peter Evangelatos']",['Mike Figgis'],['United States'],"['English', 'Russian']","['Lumiere Pictures', 'Initial Productions']"
114057,"Iago convinces Othello, The Moor of Venice that his wife, Desdemona has been unfaithful. Iago is an evil, manipulative character with his own agenda. A plot of jealousy and rage transpires in this classic Shakespearean tale.","['Laurence Fishburne', 'Irène Jacob', 'Kenneth Branagh', 'Nathaniel Parker', 'Michael Maloney']","['Chris Allies', 'Fabio Bozzetti', 'Rebecca Ciallella', 'Naomi Cohen', 'Maurizio Cusano']",['Oliver Parker'],"['United States', 'United Kingdom']",['English'],"['Castle Rock Entertainment', 'Dakota Films', 'Imminent Film Productions', 'Polyphony Digital']"
114011,"Four childhood friends, who are now in their thirties, are having a reunion. Their lives have gone separate and very different ways. Together again, they reminisce about their younger years, especially the eventful period when they were 12.","['Christina Ricci', ""Rosie O'Donnell"", 'Thora Birch', 'Melanie Griffith', 'Gaby Hoffmann']","['Diana Adams', 'JoJo Adams', 'Newell Alexander', 'Lillian Madere Andrade', 'Alexandra Auder']",['Lesli Linka Glatter'],['United States'],['English'],"['New Line Cinema', 'Moving Pictures', 'First Independent Films']"
114117,"Eight years ago, Anne Elliot rejected Frederick Wentworth, the man she loved, out of a sense of duty and obedience. Now an ignored and faded spinster, she follows her financially stricken family from their home, only to be reintroduced to the now successful and wealthy Captain Frederick Wentworth. With their roles reversed and Captain Wentworth the eligible and wealthy bachelor, Anne navigates the scheming society that still tries to keep them apart.","['Amanda Root', 'Ciarán Hinds', 'Susan Fleetwood', 'Corin Redgrave', 'Fiona Shaw']","['Paul Almond', 'Debbie Brodie', 'Margaret Confoy', 'Jane Hawley', 'Alf Potter']",['Roger Michell'],"['United Kingdom', 'United States', 'France']",['English'],"['BBC Films', 'Millésime Productions', 'WGBH', 'France 2 (FR2)', 'BBC TV', 'BBC Television', 'British Broadcasting Corporation']"
112682,"Set in a dystopian society, someone is kidnapping the children. Krank and his band of clones are using the children to harvest their dreams. Then they kidnap Denree, the brother of One, a fairground strongman. One sets out to find his brother.","['Ron Perlman', 'Daniel Emilfork', 'Judith Vittet', 'Dominique Pinon', 'Jean-Claude Dreyfus']","['Aude Boedec', 'Marc Bruckert', 'Juliette Caron', 'Alexandre Cauderlier', 'Gilles Caussade']",['Marc Caro'],"['France', 'Germany', 'Spain', 'Belgium', 'United States']","['French', 'Cantonese']","['Constellation', 'Lumière Pictures', 'Le Studio Canal+', 'France 3 Cinéma', ""Centre national du cinéma et de l'image animée (CNC)"", 'Cofimage 4', 'Cofimage 5', 'Studio Image Canal', 'Société des Producteurs de Cinéma et de Télévision (Procirep)', 'Elías Querejeta Producciones Cinematográficas', 'Tele München Fernseh Produktionsgesellschaft (TMG)', 'Eurimages', ""Club d'Investissement Média"", 'MEDIA Programme of the European Union']"
